"Speaker Name","Start Time","End Time","Transcript""Unknown","00;26;11;22","00;26;36;25","So there's no closed form solution for the posterior, like there's no clean way how you're going to update your model of the phylogenetic tree given the next new genome that's added in. It's just not something smooth like signal processing might be. So how are you going to deal with that? And that's the big challenge. So it's kind of this rapid Bayesian acceleration from like you're trying to estimate something about the world that's unknown."
"Unknown","00;26;36;28","00;26;58;24","OK, well what's unknown is which model is better? And then the challenges, we want to update our ongoing estimate of what the best model the world is. But there aren't really update rules for how new data coming in should help us update which model it is like night and day, it's clear, more light. It's likely to be daytime."
"Unknown","00;26;59;07","00;27;30;12","But again, think about the phylogenetic or something where as new data comes in, it's really hard to know how exactly to update your models so in that the phylogenetic analysis, if you have new data coming in, literally like you want to add a new branch to your phylogenetic tree, the computation of the way that that's calculated is by switching in and out, in and out, in and out each branch to see the likelihood of the least likely or the the best evidence for that tree."
"Unknown","00;27;30;12","00;28;01;20","That's existence, but it literally makes every single tree and then calculates that which is computationally a really intense and time consuming effort. So that's why Variational Bayes is so neat and swift in comparison yet. Exactly. It's these red and blue on the bottom it's like a continuum of approaches before enter variational, the continuum being we have some simple cases where we have a closed form solution for exactly how to update the model's evidence as new data comes in."
"Unknown","00;28;02;00","00;28;28;11","And then there's sort of this Wild West where you need to use customized schemes and sometimes you have to resort to just extremely costly, like almost brute force, like swapping or doing the Markov chain, Monte Carlo. However, maybe there's another way, which is what brings us to Variational Base and Variational Bayes. As the authors write on the bottom, the trick of Variational Bayes."
"Unknown","00;28;28;11","00;28;57;07","And we're going to come back to the K.L. divergence. But here's the trick up front is consists in letting go of trying to minimize the scale divergence in Equation three, directly shifting the objective to optimizing a different functional, which bounds the model evidence. So what would you say the variational trick is I mean, that's it. So if you found the model evidence, then you like, so you know that the answer can't be outside of these parameters."
"Unknown","00;28;57;15","00;29;24;05","That's like bounding the model evidence. Then you're not calculating or trying to calculate things that are outside of those parameters, I would say, yep. And maybe there's another way to read this equation on three, but the underlined red part d sub k l is the tail divergence. So it's about the divergence between two different distributions. And the double line is like what the two distributions are."
"Unknown","00;29;24;15","00;29;50;25","So that p x given y we saw that back here, that's what we want to calculate. So even though we're kind of accelerated on Bayes, we're still back on Equation one doing inference on the world, but it's going to look more complex now. So we're looking for the difference between that thing that we really want to find out p, x, given Y and then the magical Q distribution that we're in control of."
"Unknown","00;29;51;25","00;30;27;08","And then we want the divergence between those two distributions to be zero and distance is always positive. There's no negative distance. And so we just have to minimize this divergence so that we can get at what we really want. And again, one part we don't know and it's hard and the other part we're totally in control of. So the whole question and trick is going to be can we design a Q so that by reducing the L divergence on Q versus P, we're getting at what we truly want."
"Unknown","00;30;28;05","00;31;09;26","So that is kind of what threads the needle between these two approaches, the red being like the elegant and simple and effective, and then the blue being like the extremely messy and simulation based variational Bayes is elegance and also it helps us potentially deal with complex underlying distributions cool and OK. Now here we return in five, there's D subscale between Q of what we want to know and P of X given Y is at the same as it was on the previous equation three."
"Unknown","00;31;10;23","00;31;30;05","And that is going to be given another equivalency and it's restated as the natural log of P of Y minus big L of X. So what do you think about L of X blue or what did you see here?"
"Unknown","00;31;35;11","00;31;55;21","Or so? No worries. It's OK, guys. I'm like, I'm lost in the math. I was like I was just like thinking, oh, you know, there's two lines that's equal sign. Here's one line is a minus and here's three lines. Yeah. I was I would love that. The three lines like what was that, an equal sign like this? Yeah."
"Unknown","00;31;55;21","00;32;25;01","I'm confused at that three triple line thing. I think three lines can mean that it is defined as like it's strictly defined as or but well, let's find out. I don't want to say anything that's incorrect. Yeah, that's what I was thinking of that like that. I'm opting out of the past. Yeah, but the restatement here is this value that we want to go low, low, low, with the divergence between what we can control and what we can't control."
"Unknown","00;32;25;20","00;32;50;21","We're going to restate it in terms of two different pieces, a sort of log. This is just the likelihood model of the observations so this is just why it's P here. P x given Y was like the true X, given the Y observation, like the true temperature, given the thermometer and here we're just going to have the likelihood of the measurements."
"Unknown","00;32;51;13","00;33;27;02","So this is a lot easier to calculate than X given Y because it's not a conditional. And then we're going to penalize that by big L of X, which is an expectation of Q, what Q thinks is going to be a likely value for X plus a joint distribution of X and Y of P, not the conditional. So it's a little past me y reframing it in each of these nuanced ways helps you do it."
"Unknown","00;33;27;09","00;33;50;04","But I just think of it like mathematical pinball, like you got to like bring some wall down. So that you can go up another ramp and do something different. But let's definitely ask the authors about it. And this the negative is like baffling. Like, I think like the point of when you are getting into the logarithm, the logarithmic scale, like so that you will like eliminate any possibility of a negative and then like they put the negative on the front of it."
"Unknown","00;33;50;04","00;34;19;22","I'm like, that's a little strange to me. Yeah. And then also it's like the, it's like the negative variation of free energy. And so we push on the they are able to say that basically free energy, this is by, by analogy to the variation of free energy. They're going to bring this. That's where they bring in the F the same basically free energy that you might want to minimize."
"Unknown","00;34;19;28","00;34;48;28","We'll get there in a few equations but the free energy function of X, that hidden state of the world, like which model is best or what's the real temperature? It is the negative of this L because here L was defined this way and it's almost like we don't we can separate out L from P at all. So here we had like sort of a hybrid with Qs and Peace and here there's like a P here."
"Unknown","00;34;48;28","00;35;21;23","But now when we get L all alone, now we've kind of encapsulated P in a way where it's like all Q centric I'm not even sure if that's true, so don't go too down the rabbit hole. But now it's framed in a way where we can do our work on. Q But, but, but, but get to where we want to get on P and I think that is the rub."
"Unknown","00;35;22;07","00;35;45;16","That's what the question is about is, OK, it's a approach, and I would love to ask somebody with more variation inference, especially actually on this. I think these are the ones where we were like Blue and I were just like, OK, these are going to raise more questions than we answer. But what does it look like to make the variational version of a model?"
"Unknown","00;35;46;14","00;36;11;14","What do you sit down and do? So that you can calculate this? Or is it all carried out beneath the hood? So I minimizing free energy as defined in this way on the Q, which is the function that we control. The goal is that that will also get us to the right value on P, the function we don't control."
"Unknown","00;36;11;24","00;36;41;13","So I have my internal model of temperature, and I want to be doing inference on that finding what's the most likely the most free energy minimized internal model of temperature. And then if that is attuned properly, that should be accurate in terms of the external as well. So in my limited understanding of making a variational model, I think that these models instead of like using values, they use distributions."
"Unknown","00;36;41;17","00;37;09;13","Right? So, so in that's the kind of the key difference I think between the variational model construction versus the, the non variational variety of a Bayesian model in my limited understanding nice point that previously we were looking at passing a number through a function and then when we're going variational, we're talking about like passing functions for each other."
"Unknown","00;37;11;02","00;37;53;13","This one, we're not going to go into the technical details, but it's about mean field approximate options. And this is a super interesting topic because a lot of statistical models will assume that there's like a homogeneous field or that a gas is well mixed or that all types of a certain interaction are equally likely to happen among all molecules bouncing around but because we're interested in applying free energy principle, not just to the burning candle or to a chemical reaction, but to active inference agents to cybernetic and goal oriented agents, how does the mean field approximation work?"
"Unknown","00;37;53;13","00;38;28;21","Like if we want to explain culture, is there a mean field approximation for culture, or how are we going to apply this to the systems where we know we're kind of extending into analogy land but at the same time, maybe reality is really both high scale. So it's not just an analogy to say like when Chris Field talks about quantum and communication at our scale, not just as bubbling up from electrons and not just as a metaphor, but actually as like a third way that it really was based upon those principles at our scale."
"Unknown","00;38;29;29","00;39;10;03","That's what this makes me think about, like do we need art or will there be mean field approximations at a lower level? And then we're just experiencing a sort of non mean field at our level and OK, 21 and you'll see there blue. So I think like the mean field approximation, I think it's like, I don't know, it's it limits the interactions between different variables."
"Unknown","00;39;10;07","00;39;51;21","So you're interacting with the density instead of each individual variable, interacting with each variable. So it's like, it's like a course. It's of course grading like having this mean field approximation I think. Yep. And we'll return to it when we look at the figures related to first in this paper. But yes, it's related to partitioning variables and yes, now this part I thought was really interesting and kind of like basic statistics, so maybe you'll be familiar to some, but they're seeing it in a new way that the difference between the different relationships that variables can have and we're seeing it here written out with math, but we're actually going to come back to it with"
"Unknown","00;39;51;26","00;40;16;19","figures and so it will potentially be a little bit clearer. But there's a few different situations. The nicest situation for a statistical inference is when you can cleanly separate inference on the two variables. So here it's like P x one and x two, the joint distribution of x one and x two it can be separated very cleanly because they're independent."
"Unknown","00;40;16;24","00;40;45;10","So it's like you flip a coin and you roll a dye the way that you get the probability of ahead. And a four is basically you just multiply that probability of head times, probability of getting a four. And so that's the clean case. And sort of almost by analogy, that's how I understand variational inference. Like it just clean the variables cleanly separate so that you can do restricted optimization on subsets of variables in a little bit more principled way."
"Unknown","00;40;45;18","00;41;17;03","But back to the stats, there's often a time where the joint distribution that you care about is conditionally dependent. So conditional dependance, conditional independence, two sides, the same coin, it's conditionally independent or conditionally dependent on a third variable x three. And so here we're going to separate x one and x two just like we did above. But now we have like x one conditioned on three and x two conditioned on three."
"Unknown","00;41;17;27","00;41;45;18","And there's actually all kinds of situations where we're really interested in these interactor variables. And so there's there's one reason it might be late in cause estimation, like I want to know why is it that some people take this drug and have this side effect and other people don't. Sometimes you want to know all three factors, like how three different nodes of a computer network or a genetic network are related."
"Unknown","00;41;45;18","00;42;17;04","So you actually might be interested in how all three of these nodes are linked. And then other times the mediator might be useful for like a statistical analysis or like an interaction effect in an ANOVA. Like, OK, there's an effect of age and there's effect of height but is there a height by age interaction? So those kinds of questions, they're not the that ANOVA questions, not in the Bayesian framework that's from the frequencies framework, but it's an example of when you want to know about interactor variables."
"Unknown","00;42;17;29","00;43;10;06","But it turns out that this is going to facilitate the variational inference because you can like use this hidden variable three to shield or separate x one from x two and x two from x one. So that's the move of Pearl. And then that's what we're going to dove into from then on. So we went from basically Bayesian states based on models to Variational, Bayes, Variational, Bayes, gives us this free energy minimizing way to work the variational inference contingent on a few assumptions that we would love clarification and education on, and that's going to help us separate out in a way that's tractable different parts of the world model that we care about."
"Unknown","00;43;11;23","00;43;34;11","So an easy way to think about this conditional dependance is, is if you're like thinking about the probability of Mary and Moe both eating at the Frontier Restaurant in Albuquerque, it's independent of one another, right? Like Mary, you know, periodically it's open to restaurants. This is like an independent probability that they go there, whatever. And then they have another friend they go with."
"Unknown","00;43;34;13","00;43;57;12","So Mary and Moe go with Sally. They if Sally is at the Frontier restaurant, then the probability that Mary and Moe will be there together because the other together is, you know, they'll all be there at the same time if Sally's there because then they'll all go together. But they're not independently friends, they're only friends. They only go as a trio when Sally's about that are variables just hanging out with each other."
"Unknown","00;43;57;28","00;44;34;25","So let's take it from doing inference on like one variable states to the variational and everything to two variables. That's with this joint inference. And then here we brought in the third variable. Let's generalize that beyond three because we're not just interested in X one and x two in their relationship or how three influences that we want to be actually open to all graphical relationships and that just means everything you can draw as a network with nodes and edges is graphical or that's a network analysis."
"Unknown","00;44;35;13","00;45;01;27","So they bring in now the notion of a Bayesian network beta and is defined as containing G and P. So G is sub defined with vertices and edges V and D, so g is really like edges and nodes. So G is the network itself and that's kind of the matrix form, the Q space form that we're familiar with."
"Unknown","00;45;02;10","00;45;32;11","And then P is as they write a collection of tables containing dependencies between the variables as a set of matrices with structure. But it's kind of like G is the social network, like who are the people and what are the edges and then P is describing their relationship in a way, and they also then they write the tables P the graph G is often represented by an adjacency matrix."
"Unknown","00;45;32;22","00;46;05;19","So that's, you know, nodes by nodes. And then the cells are whether they're connected or not, and that's exactly what we were getting at with the two spaces. So yeah, it is pretty interesting. And then the tables p contain the factorization for the joint probability distribution over the variables characterized for the directed acyclic graphs, the dog. And so there's an equation that we're going to use to jointly consider like the network nodes and edges G and all the dependencies on the network P."
"Unknown","00;46;06;00","00;46;42;09","And so you can imagine if there was like if you had a matrix of 100 people and these 50 all knew each other like they had dependencies between each other. And then these 50 people all knew each other, they had dependencies between each other. We would want a method that could decompose that matrix into a more factor, sizable, potentially nicer to deal with form OK, so here we visually see it and I think that the circles are all meant to be complete, but they look like like I was wondering if it was a dashed line or something, but I think it's all yeah."
"Unknown","00;46;43;12","00;47;18;09","So here we have a bunch of variables t, w, y, x, u and z and then the authors very helpfully go through a few of the kinds of relationships that can link motifs of three variables. And so here's W and Y and since like notice how W and y are unconnected, but they both have a dependency towards X, so it's like W n y are marginally independent, but only conditionally dependent if X is observed."
"Unknown","00;47;18;27","00;47;52;12","So if you didn't see X, you wouldn't know that W and Y had a dependency. But then when you do observe X, you can see that, oh, x is actually being influenced by both of them. That's called the head to head W and Z marginally dependent because you could tell that potentially through latent interactive variable X, if you had W and Z measured, you could tell that there was an influence but you wouldn't know as much about the influence of W on Z unless you knew about X."
"Unknown","00;47;53;06","00;48;19;03","And then there's X and U, which is kind of like the backwards example of W and Y, because X and you would be correlated in the real world, like you'd be pulling out X's and pulling out use and they'd be correlated. So they're marginally dependent. But then if you measured Y, if you observed Y, you would make them conditionally independent because you'd be able to correct for Y."
"Unknown","00;48;19;19","00;48;52;19","And then as you pulled out, corrected X's in use, they would be conditionally independ and so the Bayesian graphical form allows us to go from that P of T, W, et cetera, et cetera. So think about that. There's six variables that could be six times six variables to consider, like 36 connections, but we can factor it into like the function of Z given X, because that's the only thing that Z is conditioned on."
"Unknown","00;48;53;15","00;49;15;23","X is conditional on W, and why use you as conditioned on Y, and then T is a lone variable. So we've gotten all six variables into a way that is like a lot sparser. It only specifies the parts that we actually need to care about in terms of the dependencies that actually exist. So that's kind of the base network."
"Unknown","00;49;16;02","00;49;39;03","It's just using network thinking to talk about the really nuanced relationships between sets of variables. So this could be like six demographic factors of a person and Z, it could be the health outcome. And so then we can use this analysis to do statistical inference just like we would with any other technique, anything to add on it blue."
"Unknown","00;49;39;15","00;50;09;26","But just the final formula down at the bottom really specify specifies like it's separate out like the Z given X, right? And so and T is independent of everything. So you can really see like the the conditional dependencies down here in this final equation X given W and Y and then you given Y. So yeah, it's almost like there's the graph representation then there's the adjacency matrix representation and then here's an equation representation."
"Unknown","00;50;10;13","00;50;37;26","So it's like a Rosetta Stone. If you could have a technique that works on matrices and then you wanted to apply it to a network, well then you need to connect networks and matrices, but then you could definitely apply it there what about the purple blanket with this cute picture? Yeah. So the Perl blanket is really traditional it's described by the set of nodes that shields a variable."
"Unknown","00;50;37;26","00;51;05;03","So in this case, variable A that's in the middle from the other nodes in the network. So a can't interact with these nodes that are outside of the Perl blanket, which is the represented by this circular blanket. So it can't interact with these other nodes without going through the nodes that are contained in the circle. Yep. And if you notice, it has like the ones that are to the sides of A, it's because all these kinds of relationships are relevant."
"Unknown","00;51;05;29","00;51;28;09","So even the one that A it is not directly connected to A but it still is included within the blanket. That's kind of important to note. All right. So now we're going to get to this figure and it's kind of clever how I think the authors did it because they introduced this in figure two Uncolored and then we're going to talk through some first in simulations and then active inference and figure six."
"Unknown","00;51;28;09","00;51;52;24","And then we're going to return to this in figure seven with a new color scheme that will help really make their point clear. So here they're taking this simple example and they're just giving another example. And here is their their legend. The grays are the observables. So why is observable? Why one, why two? We're observing two things about the world, measuring two things."
"Unknown","00;51;53;05","00;52;22;23","All the axes are hidden states. The arrows are that Bayes net directed acyclic graph representation the dash node is this special node A10 that's like our focal node. And then the thick nodes are the blankets around x10. So here, just like you had a and it was like its neighborhood was the blanket. Here we're going to have the purple blanket as they write."
"Unknown","00;52;23;01","00;52;46;20","Thick lines are used for nodes constituting the purple blanket for selected node x10 depicted here with the dash border. So it's kind of like a legal argument. They're like saying, would you agree that this is the appropriate use of the Perl blanket? Because if you do think that this is a Perl blanket, you might find yourself in a trap in figure seven when they show you what this actually represents."
"Unknown","00;52;46;29","00;53;15;19","So it's like, OK, good, this is what a Perl blanket is. There's no real dissension. This is where we're at with Perl blanket thinking. And we've just specified some arbitrary network. You know, nothing in mind just specified it. And then they also define in 4.1 a little bit about how Perl blankets play a role in active inference. And it's a super fascinating topic."
"Unknown","00;53;15;19","00;53;46;01","That is something we want to return to with the authors but if you notice that this cue distribution, that was the one that we were in control of and then that minimization previously we were looking like F of X, it was free energy minimization on states hypothesis. But here we're also including policies py sequences of action. So now we're doing free energy minimization on policy."
"Unknown","00;53;46;20","00;54;24;22","And so that's what allows us to include the action in the loop with active inference. So active inference isn't like just a two stroke engine where we're going to do inference on states and then action selection in a second step. It's actually a loop that integrates action and inference into functions in a co-equal way. And that's what one of the special pieces of active inference is as they write something that classical formulations of variation, inference in statistics and machine learning do not consider, instead assuming fixed observations or data."
