"Speaker Name","Start Time","End Time","Transcript"
"Unknown","00;00;08;16","00;00;34;16","Hello and welcome to the Active Inference Lab. This is Active Inference live stream number 20.0 on April 15th. 2021. I'm Daniel and I am here with Blue, who will say hello. Hi. I'm Blue Knight. I'm an independent research consultant out of New Mexico. Thanks for being on Blue and looking forward to this conversation. Welcome to the Active Inference Lab, everyone."
"Unknown","00;00;35;06","00;00;57;03","We are a participatory online lab that is communicating, learning and practicing applied active inference. You can find us at the links here on this page. This is a recorded in an archived live stream. So please provide us with feedback so that we can improve on our work. All backgrounds and perspectives are welcome here and we'll be following good video etiquette for livestreams."
"Unknown","00;00;58;11","00;01;28;14","20.0 is a contextualizing stream for the upcoming discussions that will have on April 20th and 27th about this paper. The Emperor's New Markoff Blankets. And we'll have some of the authors join us as well. So this will be an awesome discussion. Here we are in number 20.0. And the goal of this discussion, as stated, is to set the context for the upcoming discussions that will have on number 20 and number 20.1."
"Unknown","00;01;29;10","00;01;55;03","And that is about the paper, The Emperor's New Marcott Blanket by Yellow Berenberg L, and the link is provided here. The video is just an introduction and us kind of working through the paper so that we're ready to interact with the authors and really grasp what they're discussing. And we'll be going through the usual sections of the paper any just overall thoughts before we sort of lead into it."
"Unknown","00;01;55;03","00;02;17;04","Blue just what did you like about it or what drew you to the paper? I liked this paper. I thought it really provided an overarching view of the Marcus Blanket and its use throughout historical use and also throughout the the first in context. And so I thought it was really thorough and it gave a good treatment to all of those topics."
"Unknown","00;02;17;19","00;02;46;23","Nice. Oh, great. So the paper is Emperor's New Marcus Blankets and the links provided here, the aims of the claims of the paper. That's where we're going to start with the aims and the abstract and the roadmap to just see how the authors laid out what they are going to be trying to do. So we're going to evaluate their aims and then see whether the claims they make are valid and whether they support their aims that they laid out and they write all be the first one."
"Unknown","00;02;47;01","00;03;19;01","But the aim of the paper is twofold. First, we want to explain how it has been possible for such an innocuous technical concept as a markup blanket to come to be used in order to settle central debates in the philosophy of biology and cognition. So that's the main key aim here is how did we get here? How did we get to debating a statistical technical concept like the markup blanket and having people talk about consciousness and emotion and motor skills system."
"Unknown","00;03;19;02","00;03;40;07","So how did we get here with the markup it? And then you can go for the second aim and what you thought it meant. They say we will trace the development of markup blankets starting from their standard application in Bayesian networks through the role that they play in variational inference to use the to their use in the literature on active inference, which is what I had said about the paper that I liked."
"Unknown","00;03;41;16","00;04;05;17","Basically, we will argue that in the course of this transition, a new and largely independent theoretical construct has emerged, one that is more closely aligned with the notions of sensory motor loops and the agent environment boundaries. Do you have any thoughts on that? Daniel It's going to be the core distinction that we're going to hit probably 50 times is that there's two ways to talk about boundaries."
"Unknown","00;04;06;16","00;04;29;02","Maybe the ones that really are there and then the ones that we infer, and that's what this paper is about. So here we go to the abstract markup blankets have been used to settle disputes central to philosophy of mind and cognition, their development from a technical concept, invasion inference to a central concept within the free energy principle is analyzed."
"Unknown","00;04;29;15","00;05;08;17","So that's the historical component of the paper. Then there's the sort of distinguishing part of the paper we propose to distinguish between instrumental Perl blankets and realist first and blankets. Perl blankets are substantiated by the empirical literature, but can do limited philosophical work first and blankets can do philosophical work, but requires strong theoretical assumptions. Both are conflated in the current literature on the free energy principle, and then their conclusion is Consequently, we propose that distinguishing between an instrumental and a realist research program will help clarify the literature good."
"Unknown","00;05;09;00","00;05;42;09","Good. On onto the roadmap, which now has a 55 miles per hour speedway on the left side for the rapid run through. They start with introducing Bayesian inference and really walk through it in a nice way that we're going to walk through as well and go from kind of the simplest form of Bayesian inference to surprisingly nuanced forms that introduce networks like Bayesian networks."
"Unknown","00;05;42;09","00;06;12;16","And that's where we get to this concept of a purple blanket. And then it's by tracing the history and the citations and the formalisms around the purple blanket and the markup blanket that we find out where it intersects with active inference, which is where the authors propose that this first hidden blanket concept sort of surreptitiously or without being noticed, starts getting deployed in a way that's sort of sometimes one way, sometimes the other way."
"Unknown","00;06;12;22","00;06;37;28","But it's actually the looseness around the definition that in their opinion, gives rise to uncertainty, which is not what we're about here. And in Section five, they really just provide more examples with walkthroughs and graphs and figures that we're going to walk through today with how is the purple blanket different than the first and blanket sense of the blanket?"
"Unknown","00;06;38;11","00;07;02;09","And then how does that relate to this key distinction at the end between inference with a model versus inference within a model? So kind of like generative models versus generative processes that's going to come back and it's a great paper. So we hope that you listen to these discussions and also read it. Any thoughts on the roadmap nope."
"Unknown","00;07;02;09","00;07;34;01","It's going to go fast. Yes, it's a long paper. Yup. So the title of the paper is an allusion to the story called The Emperor's New Clothes, so people can read through the way that it's written here. But The Emperor's New Clothes is a interesting story. It's a policy story. There are many meetings of it. So what is The Emperor's New Clothes about blue in general, or what is it doing here?"
"Unknown","00;07;34;01","00;07;54;06","The title, and we can definitely ask the authors, but what do you think it's doing here? So in my understanding of the Emperor's New Clothes, it's definitely like without reading the screen, it's a story about an emperor who wants to go to like the best clothes maker in town. There's them all kinds of money and the clothes maker proceeds to make them clothes that are invisible."
"Unknown","00;07;54;06","00;08;18;14","And then when the emperor, he sees essentially maybe what he wants to see in the clothes, like sees this and dresses himself in them, and then goes parading throughout the town naked because the clothes are invisible. So and then the child says, Hey, that guy's naked. Yeah. And then here's what part I had forgotten was although startled, the emperor continues the procession walking more proudly than ever since."
"Unknown","00;08;18;14","00;08;41;14","Like, it's not like, oh, then he was so embarrassed that he stopped doing it. So maybe it's a story we'll keep in mind and we'll ask, who are these characters or what are the authors mean by that? But also at this sort of general level, why? Why does this paper matter? Why are we talking about it? And studying it and discussing the implications?"
"Unknown","00;08;41;29","00;09;13;11","Because it's good to be clear when we're talking about science or philosophy and an unfortunate reality of science is that it's easy to slip in metaphysical claims into so-called facts of the world or even just measurements of the world. And it's not good to slip in ungrounded metaphysical claims. And then also this realism instrumental ism distinction is something that has been dealt with basically in every field."
"Unknown","00;09;13;25","00;09;44;05","Oh, is it the model of language you're talking about, or are you really talking about language or those kinds of differences between systems as they are? And systems as we model them is something that is like a nomadic concept. So to see it appear in active inference is cool, but also it's exciting to be involved with the authors and see how the scientists and the philosophers are actually dealing with this question in a new way and a new timescale because of maybe the way that they're communicating with each other."
"Unknown","00;09;45;18","00;10;07;29","The big questions in the paper, like sort of beyond just what they set out to address would be like, how is physics related to metaphysics? What what can we study about electrons and temperature and mass that would tell us anything about whether a spirit exists or what's really out there beyond Plato's Cave? How is scientific modeling related to reality?"
"Unknown","00;10;08;13","00;10;37;04","And then a big question for a lot of us and a lot of people outside of our active inference community is like, what does the free energy principle and active inference really say about pragmatic concerns? And then totally independently, what do they say about philosophical concerns? And it'd be awesome if they were ten, ten on both. But what is the actual reality of what these frameworks tell us about pragmatic concerns and philosophical questions?"
"Unknown","00;10;37;24","00;11;03;13","What big questions resonated with you? Blue The biggest question really that resonated with me, I think is, is are we using the right tools to study the right things? So I think that when we think about active inference and cognition and statistics, like are these all should these all be represented by a Markov blanket? Like is this the right the right thing to study this with?"
"Unknown","00;11;03;13","00;11;32;22","I don't know. How unified do we want models and systems to be on that? This is sort of the last little general signpost before we plunge into the free energy principle and active inference and everything. It's just a little distinction on maps and territories because realism and instrumental ism, it sounds really philosophical and there's isms and it sounds like a belief system, but it really boils down to this map territory distinction."
"Unknown","00;11;33;05","00;12;00;25","And so the authors wrote, in our view, the free energy principle literature. So whatever it is, even if you've never heard of this idea, it consistently fails to distinguish between the map, a representation of reality and the territory reality itself. This slippage becomes most apparent in their treatment of the concept of a markup blanket. So if we're ever getting lost in the weeds with Freston and Perle and instrumentals and realism, we think like map and territory."
"Unknown","00;12;01;12","00;12;24;29","And then what's really cool about this topic, especially in the act of inference setting, is that two of the papers that are cited in this paper as relevant prior work are Mel Andrews's paper, and also Thomas Fant s in a heavily dose paper and these were on active inference, 14 and 15, and now we're here in number 20."
"Unknown","00;12;25;09","00;13;04;18","So it's kind of like we're going quickly and we're speaking with a lot of the authors. And then also on the left is a paper that I coauthored with RJ and another colleague Michael, and we kind of stepped back even further than active inference and just asked What does it mean to map across systems? And we highlighted that sometimes when mapping across systems and using the complexity science approach, people use Bayesian statistics, networks and predictive and counterfactual approaches those are kind of like three key ideas in making systems similar to each other or comparing different systems."
"Unknown","00;13;05;00","00;13;33;01","And those are citations to the active inference literature, because active inference is drawing together a lot of these different domains that might be seen as different, like Bayesian statistics, network, science, cybernetics, ecological psychology. I mean, there's different words because they're different areas, but we're actually coming at it in a new way, and that is why we're thinking about maps and territories in a new way, because it's not just like cognitive maps, yes or no or maps in the city, yes or no."
"Unknown","00;13;33;09","00;13;54;08","It's a lot of new things coming together, which is why it's good to clarify what adding on to that is. The Fields and Glazebrook paper that we did that mapped the two spaces right from one to the other, like the cat, the category theory. Yes, nice. The mapping. And so and then what if the map is the territory?"
"Unknown","00;13;54;08","00;14;37;19","So let's get to so for this breakdown. Every time in reading a paper, we get to reintroduce the free energy principle because it's always good to start with sort of first pass on what it is, because this video might be someone's first time hearing about free energy principle and also it's a good opportunity to see how the authors frame free energy principle and then use that as a scaffolding for our understanding and our curiosity instead of us trying to get to the best explanation week after week after week, we can develop our understanding week by week, but then always be inspired by the way the authors have phrased it in their writing."
"Unknown","00;14;38;10","00;15;02;19","So on the right side with the colors, I kind of broke down into like almost haiku or just short sentence a little bit what they were saying. And what it comes down to is that the step is a normative mathematical framework. So normative, like it says what should happen like evolution by fitness maximization says that it should be maximizing its fitness."
"Unknown","00;15;02;28","00;15;32;03","That's kind of similar. It's not saying what you should do, but it's saying how systems should be. And it's about systems that are self-organizing and how they fit into their niche. FFP is drawing on physics inspired machine learning approaches, and so part of the appeal and the excitement of the free energy principle is that it brings together machine learning and physics and math with also potentially some qualitative dimensions."
"Unknown","00;15;32;19","00;16;16;05","But even without dipping into the qualitative or the esthetic or the embodied or the inactive, at the very least, from a control theoretic perspective, the free energy principle adds in a lot of features that are absent from other frameworks like network theory alone, Bayesian alone, or predictive systems alone, combining those types of approaches in a really interchangeable way with system properties like learning attention and action, planning is very powerful active inference is a theory that is a corollary to or it's a compatible implementation of systems that are broadly construed under the free energy principle."
"Unknown","00;16;16;22","00;16;37;29","And then they kind of close the authors do with the recognition of a of a claim that you'll see in a lot of places that if we could have a theory of everything or a multi scale system, then it would be great. So that's what motivates people to work on the ATP and why a lot of people are excited about it."
"Unknown","00;16;40;22","00;17;01;13","Anything to add on that blue? OK, it would be great. I'm excited about it. A unifying theory of everything. Let's get to it. Let's get to it now. We want to, just like you said, with are we studying the right systems with the right tools? So this is what the FCP is and very intentionally it appeals to things like control theory and measurement."
"Unknown","00;17;01;21","00;17;23;19","Let's take it into the deep end with metaphysics. So the author's right, the FIP has been applied to metaphysical questions. So these are very different than action planning, learning attention. These are going to be related to questions that are metaphysical, like what are the boundaries of the mind and the citations are in the paper, what are the boundaries of living systems?"
"Unknown","00;17;23;19","00;18;02;01","So what's really there? Ontologically What's the relationship between mind and matter? Like, what is experience? All these kinds of philosophical questions about qualia and even things like Is Gaia real or is there a scientific basis for talking about Gaia or a sort of earth level awareness, or at what level could awareness exist and more? We're probably all curious about a lot of questions, and it's not like we need to a priori classify them into physics or metaphysics but that shouldn't make us think there's no distinction."
"Unknown","00;18;02;01","00;18;28;13","The questions that come to our mind, we're curious probably about a lot of stuff, so we want to be open to questions as they come in, especially ones that are framed in new ways, and then also be trying to approach them rigorously because as they raise here it's a web of formalisms. It's true that it is a web because we're going to walk through it in the order that the authors laid it out, but it is a web of concepts."
"Unknown","00;18;29;03","00;19;15;27","And so even for those who are experienced in the field, but especially those who are new to the area or as they call it, a layperson, not only are there distinctions that are unconventional, but their implications are not always obvious like assumptions or axioms or relationships that have maybe very non-obvious conclusions or implications, especially when combined. And then the two risks here are it might appear to be and actually mathematically unjustified, but at the very least appear to be and that might warrants the unintended smuggling in of of metaphysical assumptions like I have information theory, I can calculate it."
"Unknown","00;19;15;27","00;19;19;21","And here's who's conscious and who's not conscious. I would say that's completely unwarranted."
"Unknown","00;19;22;26","00;19;39;29","What do you see that example? I think I mean, that's like the main critique, right, of it. So I don't know. I think that it's a good example and how can we say who's conscious and who's not when you can't even give consciousness an adequate definition? I think I don't know. But we're solving unanswerable questions. But that's the joy of it."
"Unknown","00;19;41;05","00;20;04;09","Cool. Yet we talked about the consciousness side in some of our other discussions, but suffice to say that there's kind of a distinction between the questions on this slide, which are related to stochastic systems and action in the niche, and then the metaphysics, which are things that you could imagine even robots would debate over like who is really a robot like us or whatever they ask."
"Unknown","00;20;05;06","00;20;43;11","So how does the FSP relate to active inference? They write Active inference is a process theory derived from the application of variational inference to the study of biological and cognitive systems. And we're not going to read this whole piece, but active inference is a process theory, so it specifies how processes play out, which we're going to go into a lot of detail and it sort of takes something that's initially static and it figures out how to take a bunch of equations just there on the page and actually link them in a way where it helps us think about how systems work in their flow."
"Unknown","00;20;43;24","00;21;15;24","So we take a bunch of equations that relate variables like estimates and action states and sensory states that are all happening at once as analytical equations in the ATP. And then active inference is a compatible architecture like a skeleton or a style of model that implements processes compatible with FFP but as you say about that, the I think that you summed it up well."
"Unknown","00;21;16;09","00;21;35;19","I mean, the authors and you have a couple of points here that are highlighted. So the fundamental imperative of active in France is to minimize free energy. So this is the, the free energy principle. And then the other point is that, you know, this is also the the question that I had at the beginning are we using the right tools to study these phenomena?"
"Unknown","00;21;35;20","00;22;02;06","Right. More specifically, we can ask what role the Pearl Blankets might play in active in France so yep. We're going to be seeing how this technical concept entered the discussion of metaphysical questions. And it's almost like active inference as applied to biological creatures is where we see a lot of it coming into play. And yet we talk about active inference throughout."
"Unknown","00;22;02;06","00;22;47;24","So we'll kind of return to it. So now let's that's like the modern stuff, right? FIP and active inference. Let's pull back to base and to Bayesian statistics and build up in a new way how we're going to go from simple base to modern base. So blue, what would you how would you start us off or what do we need to know as we go on this like little base central slide journey so like the one sentence or maybe like this, the short summary that I give about these like Bayesian statistics versus Frequentist statistics and Frequentist statistics, which is like what most people are taught in school, like when you flip flip a coin, the"
"Unknown","00;22;47;24","00;23;18;16","probability of it coming up heads half right. 50% of the time it comes up half. Bayesian statistics accounts for the fact that like the previous 12 flips have all been heads right like so what would you do if you have flipped a coin and you know, it's a fair coin if it's come up heads 12 times in a row, like the next time you flip it, don't you think it's more likely to come up tails like so the Bayesian accounts for what has happened in the past when it's, it's not accounted for in statistics at all."
"Unknown","00;23;19;21","00;23;47;27","Nice and just to go through the notation because we are going to be kind of going through the notation as they write, it's a recipe for calculating the posterior probability. So that's the probability of X given Y and x is the hidden state of the world. Like Let's just say that the hidden state of the world is the true temperature it it's actually a hypothesis about the world."
"Unknown","00;23;48;04","00;24;33;06","That's why Bayes in Bayesian statistics, it's like a hypothesis that you're testing and the observation or data, the measurements is y and this is posterior to data. So like prior and posterior are referring to when new information comes in prior to the new data coming in and then it's updated. And then you have a poster which has been updated by the new data and in very rapid here in this paragraph, they make the move from doing inference, Bayesian inference on a hidden variable like the temperature of the world into this idea of the model evidence with the normalization that keeps things adding up to one."
"Unknown","00;24;33;15","00;25;03;19","So instead of having like an uncertainty distribution of how the temperature might be in the world and then taking in new data and updating that another way might be I have two hypotheses. It's colder than 20 or it's warmer than 20, and then I can always be judging relatively which one of those is more accurate. So even if the temperature distribution is like very gnarly, it's possible sometimes to have a simpler thing that you're trying to hypothesize about the world."
"Unknown","00;25;03;19","00;25;33;20","Like is it over under a certain number that helps you guide action? And then also when you do this model comparison you can keep the relative basically the relative, you can keep models being compared relative to one another and that can sum to one. So you can do probability type estimates on different model classes even without knowing whether any specific model is likely or unlikely."
"Unknown","00;25;34;29","00;26;11;05","So like in phylogenetic which is an area that Blue and I have both worked, you could use Bayesian statistics to relatively evaluate what the most likely tree is for species, but that tree's likelihood might be like super low. But that's not what matters. It's whether it's more likely than other hypotheses so that's kind of what they write a little bit about here, is when you have this types of models that are computationally or analytically intractable."
