"Speaker Name","Start Time","End Time","Transcript""Unknown","00;54;25;00","00;54;50;02","So you read in the big data set, you do the free energy minimization and there's your answer. And then if you get new data, what do these companies do? They rerun the optimization with the new data. But this is actually like real time in the loop and it's also taking action. OK, any thoughts or on figure three, do you want to intro it or what?"
"Unknown","00;54;50;20","00;55;16;12","Yeah. So this figure, I think the papers on the next slide, actually, the the figure that came out of this, it's came out of this first in 2013 paper and there's a set of figures in this paper that were accepted from that paper. And so this is the, it's a primordial soup simulation that was done in the article by first and the larger cyan dots represent the location of each particle."
"Unknown","00;55;16;19","00;55;38;05","And then there are three smaller blue dots associated with each particle representing the electrochemical state of the particle. So this is like on, on how life came to be able to kind of be right. So that's the what's going to happen in the simulation so this is just the first and then we go on into the, into the next figures from the paper."
"Unknown","00;55;38;19","00;56;02;15","Nice. So take this one. Yeah. Yep, yep. So the simulation is just like the cyan. It's kind of like the nucleus of an atom. And then the blue dots, the little ones are like electrons floating around. OK, so just it's not trying to be a physics simulation, but that's kind of what's happening figure for here is and they're electrically charged."
"Unknown","00;56;02;24","00;56;36;18","That's the electrochemical part. Here's what they write. You can take so let's just say each of these scientists had a number, you know, number one through 100 like an Asian based model. Now we're going to element one through 120. I guess you can plot the adjacency matrix A based upon the coupling that is dependencies between the different particles at the final simulation t so you're going to start this simulation, let it run out and then, OK, this one is very closely coupled to that one, and this one is closely coupled with that one."
"Unknown","00;56;36;18","00;57;06;20","So number one, is talking to four and number four is talking to 22. And then you can take that matrix and you can just put a dot where you saw a dependency so if you saw some sort of behavioral dependency between the two, like an adjacency, you can add a dot and then you're going to rearrange the rows and the columns by swapping, which preserves the information, rearrange them so that they're sort of falling out."
"Unknown","00;57;06;21","00;57;41;18","There's actually several layers. There's a pattern that falls out. We see that there's a broad region of interactions over here. And then in the bottom right, there's like another kind of sub area of interaction. And then on the very bottom right is like a very tight area of interaction where you see a bunch of dots over the hundred and 20 so as they write, the adjacency matrix is a representation of the electrochemical interactions between particles because it's drawn because the adjacencies on the simulation, but can be interpreted as an abstract depiction of a Bayesian network."
"Unknown","00;57;42;22","00;58;14;03","And so we're taking the dependencies between these particles as they jostle around. And this is what we're trying to do. We're trying to almost like factories, it separate nature at the joints, you know, mapping the territory OK, there's a border on the map, but is there a border on the territory and then plotted as a matrix and then there's some shading that's going to be suggestive of what role those nodes are hypothesized to be playing."
"Unknown","00;58;14;16","00;58;38;10","Right. So here's what they did just in a little more formal on slide 30. They used spectral. Well, this is I think what first in 2013 did yes. Spectral graph theory was used to identify the eight most densely coupled nodes which are defined as the internal states. So why eight why dense. OK right that's the question. That's what we're discussing."
"Unknown","00;58;38;28","00;59;08;05","And those are going to be defined as internal states. Just to skip to the slide, those are those blue ones right in the middle here. So those are those core states back here. Given those internal states, the Mark Blanket is then found through tracing the parents, children and co-parents of children in the network. Sounds like a preschool as an extra interpretive step and that's part of what this discussion is about."
"Unknown","00;59;08;05","00;59;33;11","How interpretive is this like interpretive dance, interpretive or like interpreter at the UN? The nodes in this marker blanket can be further separated into sensory and active states. The sensory states correspond to the parents of the internal states. So that's incoming info. Not that they burst the internal states, but the sense states are the ones that have an upstream dependency on the internal states."
"Unknown","00;59;34;03","01;00;03;08","And the active states correspond to the children of the internal states and their co-parents. So again, not that the active states are simply birthed by internal states but that they have downward flowing statistical dependency. States that are not internal states or part of the mark of blanket are then called external states. So we're using this partitioning where first you identified dense couplings, then traced out parents and co-parents and children, and then everything that's left is external states."
"Unknown","01;00;03;15","01;00;35;28","And so you recolor that simulation from figure three. Here it is Uncolored. And now we're going to recolor it with this new color code where we've identified the blue, densely coupled nodes and then the active states and then the sensory states, which are sort of on a frontier with the teal states, the cyan, the external. So it's almost like you have the internal, you know, let's just imagine it's like the nervous system and then it's swaddled in the active state."
"Unknown","01;00;36;25","01;00;56;00","And then on the outside of the sense of the active states are the sensory states and those interface directly with the world. So that's kind of the tantalizing nature of this model would be like, wow, if it really just fell out of a simulation that you can get self-organization like that, would that be cool? But what is the issue here?"
"Unknown","01;00;56;00","01;01;32;22","Blue Well, I mean, it's kind of arbitrary. Like you know, they said a third of the of the electrochemical states from the very beginning of the simulation, we're not did not interact. Right. So that establishes this non equilibrium system. And I think that, you know, the issue then comes from assigning these interactions to internal, external, active and sensory states that may or may not have some kind of dependance on one another."
"Unknown","01;01;33;05","01;01;55;21","Exploit. Yes. As they write here, the simulation assumes that by viewing the system through the formalism of the mark, a blanket plus some additional assumptions about the separation of states, the ones that we kind of walk through just a second ago, you can uncover hidden properties of the target system which is then said to, quote, instantiate or possess a mark, a blanket."
"Unknown","01;01;56;07","01;02;25;24","And then this is the map territory. The procedure of attributing to the territory, which is the actual dynamical system, what is a property of the map, which is the scientist doing inference on the dependencies and then cutting it at eight nodes and then using this other approach to make the mark blanket. It's a property of the map and it's a clear example of the Reification fallacy treating something abstract as something concrete without further justification."
"Unknown","01;02;25;24","01;02;45;28","That's not the only way Reification works, but it's one key piece of it. And so in other words, it's like you go in with a mark called Blanket Hammer and your secondary pipeline for identifying parents and children, and then you find it because it's defined just for any system. You're going to be able to get a mark of blanket using that protocol."
"Unknown","01;02;46;11","01;03;25;13","And then look at this. Have you really discovered something about this dynamical system by separating it into this partition when actually all of the particles are doing the same jostling motion? So it's not like we have the influence or nodes here. These are just densely coupled ones. And so they propose in this same paragraph proposed to distinguish between purple blankets to refer to this standard epistemic or like statistical use of the mark called blankets and first in blankets to refer to this new metaphysical construct."
"Unknown","01;03;26;27","01;03;54;26","And they also give a shout out to Martin Beal in the paper. And so we're kind of coming back to this map Territory Distinction. On a map side, we have epistemic pearl blankets, Bayesian statistics, but no philosophical power. And then what they're attributing to the territory would be metaphysics, and it would be the kinds of things that the forest and blanket is making claims about."
"Unknown","01;03;56;00","01;04;30;09","And I think my question was, can we do that action in the loop without metaphysics? Because it seems like there's two innovations in or differences between the purple blanket in a sort of normal statistical use and the way, for instance, using it. First, he separates sense and action, but also he's making metaphysical or ontological claims. So I'm just wondering, like, are the ontological claims separable from taking a control theory perspective on Bayesian statistics?"
"Unknown","01;04;32;14","01;05;01;00","That's what we would like to find out. Yeah. So then Blue, you copied this image over what do you like about it or what did you see in it? So I just thought it was like a nice pictorial representation as opposed to this primordial soup that gets a little bit hairball of what we have as internal states. Which were back in the in the first picture, the central dark blue, most highly connected nodes with the internal states."
"Unknown","01;05;01;00","01;05;26;07","And then the externals states which are separated from these blanket states. And so that's where this pink dashed line is surrounded that that's labeled with this being. So this is like the first in blanket contains the active states and the sensory states that may be interacting with each other. And then this first blanket is what separates the internal states from the external states."
"Unknown","01;05;27;00","01;05;52;14","And they take it in quite a literal sense, like the boundary of a cell and so forth. So separating the internal from the external is the first and linking nice. And let's connect this to figure four and then the kinds of things that we wanted to discover. They're looking at this as a graph of Bayesian variables. It's like active states."
"Unknown","01;05;52;25","01;06;29;04","They influence external states. So this is that coupling. So it's almost like external states. They don't connect to internal states at all. That's kind of like missing a corner on the graph. So we have nodes everywhere. You know, there's cells in your hand and their cells across the wall but how can we separate nature at the joints? Maybe we could make measurements, find the statistical dependencies, and then carve those dependencies into densely connected internal states and then incoming states that are upstream."
"Unknown","01;06;29;18","01;07;09;11","An outgoing states that are downstream. And then we might have a new way to do Bayesian modeling on systems that are on a continuum or as part of a really complex process. And Figure five. Yet we already had that. I guess we put it into ice and yes, 4.3. This is sort of the man's search for meaning why and how have Markov blankets been reified to act as parts of a target system?"
"Unknown","01;07;10;04","01;07;38;10","How did we get here? And where this technical idea became reified so people thinking that their support in the literature saying, oh, yeah, markup blankets, it's in the literature, there's real measurement support for markup blankets. That's reification of delineating spatial temporal boundaries rather than formal tools intended for scientific representation and statistical analysis. When did the map become conflated with the territory?"
"Unknown","01;07;38;28","01;08;04;11","Because like everyone's familiar, how we use linear regression on health care data, but then no one goes back and says, well, then you're a linear regression. So it's a little bit like if somebody were using Markov blankets on health data and then said, Now you're a Markov blanket, or is it not saying it's exactly the same? But that's the rhetoric of what is being put out here."
"Unknown","01;08;05;12","01;08;13;07","It would be like the line delineating the healthy from the sick is a Markov. Like, it's a line. There's actually a line."
"Unknown","01;08;15;08","01;08;40;16","And then they write so again, people should read these papers. They're fun to think about. And there's a lot more that we're not getting to go into in the Stat0, but they write basically. Perhaps surprisingly, many authors in the field are seemingly not aware of this process of Reification. And this has led to the conflation of several different kinds of boundaries in the literature."
"Unknown","01;08;41;05","01;09;11;15","Markov blankets are characterized alternatively as statistical boundaries, causal boundaries spatial boundaries, epistemic boundaries, and auto poetic boundaries. Each characterization is treated as somehow equivalent to and interchangeable with the others. Now, it's rare that someone does the Grand Slam, where they totally conflates all of them. But then there are papers here and there where, Oh, it's causal and it's spatial, then it's spatial and it's epistemic and it's statistical and it's causal."
"Unknown","01;09;11;27","01;09;40;13","And through this web of formalisms, we can get in a tangle to kind of very any fit thoughts about that. But just that the paper itself contains, like many quotes from other papers where they use the markup link or the first in very much like a statistical and instrumentalist sense, and then turn around and use it in a very realist sense."
"Unknown","01;09;40;20","01;10;00;19","So there's many like examples of that illustrated through the paper that trace back through the literature good point. And those are the parts that we didn't quote in this dot zero, but there's many pages. So if someone's reading it and they're like, wait, they don't do that in the literature read the paper because that's where they mention it."
"Unknown","01;10;01;05","01;10;35;20","And this is from the livestream number 15 where we had we were discussing the paper of fairness and happily so, and we introduced this discussion around realism and instrumental ism and what those authors had written was basically realism and incrementalism concerning the models and statistical manipulations that make up the FIP, whether they are thought to be used and manipulated by the systems under scrutiny independent of scientific inquiry, realism, the tree falls in the forest."
"Unknown","01;10;36;10","01;10;57;24","Does it make a sound realism? Yes, there's a real tree. It really did fall. It really did make a sound. Or conversely, whether they are thought to be scientific tools wrought by humans in specific sociocultural environments to study particular systems, instrumental ism. So that's like well know a sound means somebody has to hear it. So you don't know if the tree is real or it really didn't make a sound."
"Unknown","01;10;58;06","01;11;28;18","And the whole question is where does free energy principle? Is it about what systems are doing realism when we don't look or is it about US modeling systems, no matter how they look, that's instrumental ism and that brings us to figure six, where they show a classic sensory motor loop. So it looks like it's an active inference loop, and that's where they're going with this."
"Unknown","01;11;29;02","01;11;56;25","But their whole point is that it although the figure does not use directed edges to signify causal influence, it is not strictly a Bayesian graph as it depicts cyclic sets of circular dependencies, some between pairs and an overall loop component containing all components. Now, this was quite interesting because first off, it points out that, yeah, active inference didn't invent the internal external or the action sense idea."
"Unknown","01;11;57;08","01;12;30;13","We're using different models, we're combining them. But there is this cycle, right? There's also, in active inference, more of an emphasis on the internal states and the external states as they have their own endogenous dynamics but that could be part of these models too. Yeah. And then it's true that it's not a directed acyclic graph. If there are loops, local or global loops but what about implementations that have time steps where you can break these loops?"
"Unknown","01;12;30;19","01;13;00;11","Like if you computed in this order just a thought, like does it really violate or how badly does it violate some of the assumptions of directed acyclic graphs? But I don't know any thoughts or good for seven. I don't know. Yeah, I don't have the answer for you if I did. I mean, I don't know that necessarily putting a blanket over the sensation and the action states the sensory and the active states like putting that in a box."
"Unknown","01;13;00;16","01;13;30;03","Does that break the exclude graph thing? I mean, I don't know that that necessarily breaks it enough to to make it somehow valid either, right? I don't know. It is a cycle, I think. Good question. So now we return to the figure that we saw before and this is where they now strike. So figure to remember it was like surely you agree this is how a Perl blanket would be deployed on this graph."
"Unknown","01;13;30;16","01;13;51;10","Now speak now or forever hold your peace and then now it's going to come back to bite some people who may have not expected where it was going to come. So before they were highlighting that x10 node and now they're going to color according to first in this scheme, they're going to color the nodes. So it's colored like figure five."
"Unknown","01;13;52;15","01;14;25;08","But on the figure that they introduced earlier with extend still as a focal node, but then they're going to show that if you have a different focal node x nine not only are different nodes included, but they're just they're categorized differently, which isn't a problem for the purple blanket because it's like, oh, if you if you're if you measure variable A and B, then this one is the child or the parent, depending on what you measured in that bigger graph."
"Unknown","01;14;26;14","01;14;45;14","And then but if you're going to have a realist interpretation of what these nodes are, you're out of luck because one is going to be an active state for one and the sensory state for another. And then if you are going to say, well, it doesn't matter if it's an active state or a sensory state, like they're all doing it for each other, it's equivalent to the Perl, Perl blanket phrasing."
"Unknown","01;14;46;01","01;15;12;16","So what they write is if you're going to have a sensory motor interpretation, which is not the only option this suggests that the sensory motor blankets are markup blankets applied under specific set of assumptions, and it can't be traced to standard uses of markup blankets and variational inference so basically, depending on what your hidden variable of interest is, you compute a different blanket around it."
"Unknown","01;15;13;05","01;15;36;12","So that is problematic for realist interpretations because depending on what you were doing inference on, you might variously find that the membrane of a cell or a measurement from the membrane of a cell was a sensory state because it was incoming for something else. But it could also be an action state because it's outgoing of something else, but then it would be internal to another set of things."
"Unknown","01;15;36;24","01;16;07;17","And so if we want to make realist claims or interpretations about blanket states, and internal external states, that's an issue so is the issue like that? We haven't figure it figured out how to like mess these models yet. I mean, I think that it makes sense that the outgoing is incoming or another agent. Right, in the model, so that we just haven't figured out the messaging properly yet, appropriately or like that each nest is its own like blanket state."
"Unknown","01;16;08;01","01;16;31;18","I don't know. I agree. I'm an optimist as well. Let's see, this is this is where they really go for it. And this I thought was just very clever and funny. So the delayed figure, you know, with an intermission to convince you lol you now eight. So now they're going to go into a graph that oh total coincidence it looks like the left side."
"Unknown","01;16;32;08","01;16;57;29","So here on the right side, you know we were talking x ten x nine but we never talked about this left one that looks like California. But let's look at it now so California. Yeah, exactly. On the left a Bayesian network where ID and I said P denote the motor intentions of a doctor and the patient respectively. So that's this."
"Unknown","01;16;58;03","01;17;48;16","These ones in the top two H is a medical intervention with a hammer. C is a cortical motor column and S or spinal neurons movement is M and then K is a different way that the leg could have been observed to move like somebody could have moved it or gravity could have changed. So again, and is the movement that's the observable movements, this is the abstract Bayesian that on the left in A, in B is one possible action pattern, which is that the the patient's goes to the cortical motor command, the IP, and then H is the medical intervention with a hammer and then that results in no motor behavior."
"Unknown","01;17;49;15","01;18;11;22","But then here you do have the motor behavior observed, but it comes about a different way rather than h the intervention as a co-parent, you have k this other way like somebody picking up the leg and moving it in the middle and on the right, the same network is partitioned using a naive first blanket with different choice of internal states."
"Unknown","01;18;11;23","01;18;35;18","C and S respectively. So if your internal state is the cortical neurons, you're going to think that the basically active states are the spinal neurons, which is how people talk about it. So it's not like this is like a the theory is blown out or anything. It's like saying the spinal neurons are the active states of the cortical neurons."
"Unknown","01;18;36;01","01;19;00;27","And then the movement is if your focal node internal is the spinal neurons, then the active state is what we would call in realism the real active state. So it's kind of like saying again, depending on what node you're focused on, different nodes are going to be categorized as sense, active, internal and external. I want to say that's how we've been thinking about it."
"Unknown","01;19;01;03","01;19;25;19","The depending on which side of the line you're on, that's going to be internal or external. But the point is it provides problems for realist interpretations of any single mark called blanket because we have to acknowledge that the mark called blankets and especially how the states are classified is conditional so it's like, is the bicep an active state or is this an active state?"
"Unknown","01;19;25;19","01;19;45;18","It's like, well, if you're doing inverse on this, yes, but if you're doing inference on that, no, so it's hard to have a realist interpretation, even though there are times where if you define something internally as something that's truly on the inside of something, it might be that the active states truly line up with what's on the outside of it."
"Unknown","01;19;46;07","01;20;09;26","But that isn't the full generality of this Bayesian network approach. And that's like a broken clock is right twice a day and it doesn't actually get is generals. It could be this makes me think of like the broken knee, like the phantom limb. It takes me back to that. Like what if the sensory neurons are activated for the leg to move, but there is no leg to move."
"Unknown","01;20;10;06","01;20;43;19","Right? Then what? Nice. So, OK, next one. They give a little bit of recent history. So if Twitter's too fast and textbooks are too slow, this is the history speed for you. Bill Pollock and I 2020 questions some of the technical assumptions underlying the use of markup blankets by Freeston. And since then the idea of the first and blanket being understood as a distinct construct has gained traction in literature."
"Unknown","01;20;44;00","01;21;24;24","And we're actually looking forward to having Martin discuss that with us. In about two weeks. So again, it will be really interesting to hear like how did you come to the position where you were getting at these technicalities and critiquing it, and where does action fit in? Where does philosophy fit in? Where do these other things? That first thing is bringing in and any anything to see on this this part or only the question that I raised at the beginning, where does the language present to what what extent is the problem or the issue that's being raised like a function of the language that we're using?"
