"Speaker Name","Start Time","End Time","Transcript""Unknown","01;21;25;25","01;21;56;10","Yes. And in this paragraph, they make another subtle point that shows why when the language is uncertain, there can be a lot of drift underlying. They say in a recent paper, forest and blankets are formalized in terms of constraints on sparse couplings. And then they're identified using read the technical details, the nonzero components of the Hessians, using some other last names, and that is taking it the construct, according to the authors, far away from the Perl blanket origins."
"Unknown","01;21;57;06","01;22;31;10","And so they're saying you wouldn't make that kind of swap in the underlying mechanics unless you were working with the physical domain of what's really there so that's an interesting point. We'll be cool to hear from the authors here on the next slide. Is it kind of a closing remark by the authors? And this is kind of a meta point and the meta point is actually the relationship between action and inference."
"Unknown","01;22;31;21","01;22;57;21","Like if an organism and then scientists it's modeling their world. So it's not the first person who's made that comparison. You know, you got physical foraging, you got information foraging, but they're saying basically there's a lot of similarities between perceptual inference and scientific inference. Both use a previously learned model of the world and set of observations to infer the causal structure of the unobserved outside world."
"Unknown","01;22;58;10","01;23;23;09","And this was like the triple murder is model based. Cognitive neuroscience is in a special place it makes models of how animals model their environments. A cognitive neuroscientist uses both behavioral and neural data to infer the most likely model that the agent's brain implements. There's nothing wrong with this doubling up of modeling relations. As long as one is conceptually careful."
"Unknown","01;23;23;17","01;24;01;22","One needs to distinguish between the properties and the environments, properties of the agent's model of the environment and properties of the scientist model of the agent modeling its environment. And that's the third level. And that's why it's unsurprising actually, almost in retrospect, that FIP arose from cognitive neuroscience and neuroimaging with EEG and fMRI because it doesn't come from we're going to use physics to find the grand unifying theory it actually came from a we're making measurements about how agents reduce their uncertainty about their model of the world."
"Unknown","01;24;02;20","01;24;23;11","And it's that that gives you the triple loop, which I think is like quite interesting about how it's nested. And here we are adding like another layer to the list, like thinking about how like trying to, you know, criticizing the model with which the scientists are using to model the agents. It's just models all the way down yep."
"Unknown","01;24;23;25","01;24;51;26","So what are the implications for cognitive science in humans? And this part right here, properties of how the scientists model their agent modeling their environment. You could replace a scientist with researcher or data scientist or machine learning algorithm this really matters what people take into account when they design their algorithms and when they make algorithms about other cognitive agents."
"Unknown","01;24;53;06","01;25;18;11","Because that constrains in ways that are sometimes obvious and sometimes not obvious. You know, if you only had one variable for a user on your website, how likely they are to buy something that was your variable, you're going to set up a different algorithm. So it's the properties of how the scientists models the situation that really matter. And it has implications for cognitive science."
"Unknown","01;25;19;02","01;25;43;29","When we're studying humans and non-humans and non animals and blues. Big question is that really the big question that the all bring? So they asked in the paper if Bayesian networks and Markov blankets are the right kinds of conceptual tools to delineate the sensorimotor boundaries of agents and living organisms. So the authors brought this up within the paper."
"Unknown","01;25;44;09","01;26;04;21","I thought it was just important to highlight that because I don't know, I think like if we're, you know, if you go out to a scale, like if you have an image and you start to screen that image in a building, representations of the image building, representations of the representations of the representations of the representations, eventually you can't see the picture anywhere at all."
"Unknown","01;26;04;29","01;26;37;07","And the point is to make it easier to understand, not to make it so blurry that nobody understands it at all. I think too, this is what brings them to the distinction of inference with weight is that even the right? It's. Yeah, yeah. Inference with an inference within. I was thinking I was getting really, you know, inference of a model, but inference with a model the distinction between the two blanket constructs as they're positing them will shrink a little bit."
"Unknown","01;26;37;07","01;27;02;00","You can only easily identified once we look at who appears to be performing the inference and what system that inference is performed on. So they go through four kinds of networks. We're not going to go through it here. But if people are interested in the technicalities here, it's really worth thinking about. What's the difference between the generative model and the generative process?"
"Unknown","01;27;02;19","01;27;44;17","So like I can have a generative model of blue in my head. So when she's speaking, I'm doing generative inference on her syntax, but then that's not the generative process, which is the actual underlying person. So this is just a nice very, very rigorous way to break down when we're doing inference on a model versus inference on a, on a process and OK, 42 all this points towards a fundamental dilemma for anyone wanting to use Markov blankets to make substantial philosophical claims about biological and cognitive systems, which is what we take proponents of free energy principle to be wanting to do."
"Unknown","01;27;45;13","01;28;08;07","So, agree or disagree you know, if you disagree, you can write a paper or you can come on active stream, but that's the claim of the authors. And so that is what we kind of got excited to learn about. And they then come back to this with versus within. And they say basically in inference with a model, the graphical model is an epistemic tool."
"Unknown","01;28;08;24","01;28;32;06","So that's like I'm going out to the forest with my machete. I'm going to use it as a tool as I go out versus inference within a model, the scientist disappears from the scene, becoming a mere spectator of the unraveling inference show before their eyes. The way that's written makes the authors sound a little bit sort of dismissive of that being a likely approach."
"Unknown","01;28;32;15","01;28;55;08","It's almost like, well, we would want that to happen, or it can't happen. So scientists can only do inference with models. Now, the scientist as the body is the inference within a model, like the inference is happening within the science body or within the scientists of cortex or within their community. But that's very different when you're talking about the real system."
"Unknown","01;28;55;08","01;29;29;22","The scientist at the desk, that's the system that is doing inference, but inference where the model is the instrumentalist take OK, and this is just a final slide that just gives some closing thoughts. And this was interesting because they mentioned that there are there are simulations like the game of life which have been enormously productive in many domains."
"Unknown","01;29;30;19","01;29;55;28","And so basically they say that it might be an interesting way of modeling emergent processes and complex systems, but it won't support any metaphysical claims about forest and blankets. And then they say we will not pursue this idea any further here, but offer it as a more modest, perhaps instrumental interpretation that some proponents of the FIP and active inference might be inclined to adopt in order to avoid any stronger commitments."
"Unknown","01;29;57;14","01;30;34;12","So that's in some ways where we feel like we're sitting, which is we're approaching active inference instrumentally, and then we'll see what happens with the other claims. But it seems like we can pursue it instrumentally, and I guess that's a modest proposal and then they just summarize. So overall, nice paper, relatively good lengths, a lot of figures, clear arguments, rigorous philosophy and math."
"Unknown","01;30;34;26","01;31;11;27","So it was good times and like a good coverage of the literature and you know, trace through the history of the the methods underlying is good do you have any other closing thoughts? Only that maybe inference within a model is actually possible if you're using a robot that's programed to do inference. I like the inference if the if the or if the action is to do inference, if that's how it works, then, then that's inference within a model possible cool."
"Unknown","01;31;12;06","01;31;40;15","Well, it will definitely be really interesting to hear from the authors here, from everybody who wants to join on the stream. So Blue, thanks a lot for joining. This was a great discussion. Thanks everyone for watching and we'll see you later. Bye bye. Thank you. Bye bye. Buy, buy, buy, buy, buy, buy, buy, buy, buy, buy, buy, buy, buy, buy."
"Unknown","01;31;40;15","01;31;41;17","Thank you. Buy."
