4517587	4519325	A	0.8624383807182312	Do you have a thought on this?
4520737	4521942	B	0.7123621106147766	It's attention?
4522002	4522672	B	0.46103888750076294	Yes.
4522855	4551137	B	0.9094850420951843	I think it's related to the usual formulation of home DP architecture and active inference concept in the sense that our decision or policy in the usual setting modify the state transition matrix b matrix.
4553662	4560472	B	0.8328380584716797	Here, delta is an alternative of policy of agent.
4560580	4573025	B	0.9080176949501038	So basically the director indicates stated transition metrics under a particular decision which agent made.
4573987	4582152	B	0.81220942735672	In that sense, what the agent changes is state transition metrics, not state itself directly.
4582332	4587062	B	0.7678238153457642	That's why we use this illustration.
4589362	4590125	A	0.9184247851371765	Awesome.
4591387	4600487	A	0.548354983329773	Very subtle but important point, which is when we look at the classical POMDP formulation.
4600837	4604167	A	0.9177669286727905	So here we'll look at a version shown in figure two.
4604215	4606550	A	0.8441991209983826	I'll just bring just figure two in.
4609312	4623287	A	0.9159209132194519	Could you describe what you just did about the role of the B matrix in influencing how hidden states change and how that is where our policies have impact?
4623637	4629500	A	0.8564046025276184	And also please, how do the top and the bottom of figure two differ?
4633087	4644432	B	0.887744665145874	Okay, so in the usual correlation under active inference with palm DB structure.
4644522	4673537	B	0.8945459127426147	So we for us to consider the prior inference and depending on the prior preference, we compute the expect free energy and its minimization provide the policy and the policy moderate state transition.
4674187	4686425	B	0.8906983733177185	So now in the upper Brea, we instead use the builder which is the option of the agent.
4687162	4712032	B	0.9037054777145386	So here option or decision was made for each timestep so that unlike the conventional formation, we have a sequence of delta and for each time step delta moderates active states cognition matrix B.
4712185	4730462	B	0.9114028215408325	So B is a matrix that transformed hidden state in the previous step to the current time step and its moderation indicate that under a specific decision rule.
4731637	4744250	B	0.8895480632781982	For example, if this F indicates our cognition in the virtual environment with the Gold decision move forward.
4745287	4751877	B	0.8330151438713074	But if we choose the no go decision, then it unchanged.
4751982	4770950	B	0.8928296566009521	So such a moderation of state transition was made by choosing debuta and the lower part correspond to Beijing inference made by Bayesian agent.
4771687	4801475	B	0.640707790851593	So basically there is a symmetry between a third part and roar part because we assume that this Beijing agent has a plausible guarantee model which nicely correspond to given environment defined in the above upper part in this figure.
4802062	4844087	B	0.6337830424308777	But one interesting thing asymmetry is that to model this particular canonical neural network, we don't consider an arrow or link from delta posteria to S posteria which is in the environment data moderate S in the next step through P matrix moderation.
4845187	4873037	B	0.7995629906654358	In this particular Bay jets which formally correspond to a canonical neural network, we don't consider that it is correspond to an absence of the projection from output layer to the middle layer.
4879087	4879850	B	0.584351658821106	Okay.
4885837	4896162	A	0.8825401067733765	This is from the 2020 paper, but it shows the neural network architectures, the two layer architectures.
4896312	4914737	A	0.8877468705177307	So could you restate the top and the bottom of figure two in the 22 paper and connect it to why it's important that you're studying two layer neural network models?
4915837	4917050	B	0.4783906638622284	I miss you.
4918162	4934387	A	0.8550167083740234	Yeah, can you just connect the asymmetry between the top and the bottom on figure two with the two layer neural network architectures?
4935337	4940375	A	0.5998576283454895	You said that the asymmetry, there's no direct link between.
4947475	4949437	B	0.7625042200088501	This is another story.
4949800	4972125	B	0.890859067440033	So in the previous paper there is only output or concept layer because we basically consider a single layer feedforward network.
4972200	4983145	B	0.5699732303619385	So my apologies for some confusion about the network architectures in the 2020 paper.
4983222	5000675	B	0.8885048627853394	So now upper part of this network architectures correspond to environmental generative process and only a lower part correspond to single foot feed for neural network architectures.
5001400	5012965	B	0.7500959634780884	So now this part is identical to a map from O to S.
5013057	5017625	B	0.8218392133712769	OSS area in the 2022 papers.
5023225	5031187	A	0.8923178911209106	Okay, so on the top of figure two is the actual generative process.
5032000	5047925	A	0.8798792958259583	It's the true structure of causation in the environment, which is to say that actions delta actually influence how states change through time via B delta.
5049625	5057150	A	0.8652575612068176	The generative process through the A matrix emits observations, sequences of observations.
5058100	5070125	A	0.8812516331672668	And here on the bottom with a mirrored structure is the generative model of the entity.
5070625	5078887	A	0.9000087380409241	So what's the relevance of the arrows and the more force factor graph structure on the bottom?
5080675	5088275	B	0.858893096446991	The arrow indicates active inference.
5090425	5111680	B	0.9033619165420532	So it's a flow of the information in the sense that to calculate in the step two, we use the information of step two conversation and step one's posterior expectation about hidden states.
5111802	5117900	B	0.8373386263847351	So those two determine the s two's expectation.
5118625	5135880	B	0.9210317730903625	Usually in the following graph, we consider retrospective arrow so in the sense that s three also affect the s two inference.
5135940	5151555	B	0.5588024854660034	But this corresponds to Bayesian smoother in the sense that we update every time step simultaneously to better inference.
5151690	5171230	B	0.889107346534729	However, what we consider here is more filtering approach in the sense that for each step we compute the latest hidden states and then we don't change any other states in the past.
5171427	5178712	B	0.5336402654647827	So that's why we don't consider the arrow from future to the past.
5182337	5183012	A	0.9184247851371765	Awesome.
5183150	5183492	A	0.5491447448730469	Yeah.
5183540	5206587	A	0.6084095239639282	Just to highlight that in the Bayesian smoothing approach, it's kind of like fitting a spline because it takes the whole time series and it fits the smoothest possible line or the line whose smoothness is on the AIC BIC frontier.
5207612	5227362	A	0.7598077654838562	But here on the bottom with the almost pseudocode implementation provided by the Force Factor graph, which was demonstrated to be equivalent with the Bayesian graph in the 2017 work with Friston, Par and de Vries.
5228237	5253150	A	0.8719705939292908	This architectures is reflecting a filtering scheme like a common filter or just generalized Bayesian filtering through time, where estimates are being carried forward and changed time point to time point, such that the decision rules, or the updates perhaps more accurately, are defined between time points.
5253662	5261567	A	0.797831654548645	And the total time series does not have to be loaded into memory or remembered at once.
5261765	5272362	A	0.8627719283103943	And then the Bayesian filtering approach has the asymmetry with a different consideration of action.
5273987	5287875	A	0.5827471613883972	So why again is it that action is considered differently in the Bayesian filtering approach on the bottom of the generative models than the consideration of action in the generative process.
5291162	5302125	B	0.5581706166267395	That correspond to lack of cognition from Y to X in the figure one?
5303387	5312100	B	0.6406744122505188	Or probably a figure four is helpful to that relationship.
5317487	5318250	A	0.6727579832077026	Four?
5318762	5319392	B	0.5491447448730469	Yeah.
5319515	5327237	B	0.8971371054649353	This is an example network architecture comprising input Brea, output Brea.
5327375	5340907	B	0.9110991358757019	What we consider is information flow from sensory to middle Brea and middle area have a self connection, recurrent connection and middle area project to output layer.
5341072	5347812	B	0.6103971600532532	So there is no connection from all output layer to middle layer.
5348387	5349150	B	0.5664745569229126	Right.
5350412	5365362	B	0.5428928732872009	So that's why we don't consider the link from data in the bottom layer of the figure to posterior.
5367062	5374662	B	0.6728655695915222	So this is different from true generative process in the environment.
5377975	5380500	B	0.6590452194213867	This is a kind of simplification.
5380650	5394650	B	0.8409977555274963	So because our purpose is identifying the plausible Bayesian model which correspond to this type of neural network canonical network.
5396200	5417300	B	0.9039918780326843	So in other words, this neural network uses approximation about that point or use limited form of palm DP scheme.
5423700	5424555	A	0.6283750534057617	Thanks.
5424752	5433170	A	0.9067398905754089	So could you describe W-V-K and Gamma?
5433335	5439925	A	0.8654643297195435	Just what is the biological or functional interpretation of those variables?
5440800	5445837	A	0.8257004618644714	What brain regions or what processes or pathologies do they map to?
5447025	5459862	B	0.8678262233734131	Okay, so basically, WVK, synaptic strength is in the form of matrix and active inference.
5464875	5493215	B	0.9094690680503845	They represent connection in the different layer or different architectures in the sense that W means forward connectivity from sensory Laje to middle Laje, k correspond to recurrent network recurrent connectivity and V correspond to projection from middle Brea to output layer.
5493395	5534200	B	0.8060925006866455	So in this paper, we don't discuss the relation to brain anatomy in detail, but what one can consider analogy, for example, say x corresponds to several cortex activity and Y, for example correspond to cerebral wrong in the sense that it determines the action.
5534625	5542820	B	0.9119424223899841	So it is considered that in the cerebrum there is a signal that represents choice.
5542910	5549200	B	0.8738073110580444	This is joined for examples goal no go decision made in cergram.
5551575	5557550	B	0.832018256187439	It's analogous to this particular architectures.
5557700	5582615	B	0.8866313695907593	On the other hand, in the several cortex we compute the sensory information to generate some inference, prediction and planning the way it is computer by this recurrent network.
5582720	5626750	B	0.6216258406639099	In this particular modeling, although we don't separate brain region in detail, but this recurrent network is sufficient this graph of recurrent network is sufficient to characterize any type brain architecture in the sense that we can design any higher car or mutually connected architecture using a generic crossover recurrent network by changing weight.
5634750	5635470	A	0.9184247851371765	Awesome.
5635622	5642187	A	0.8977538347244263	So the middle layer we can think of as like the cognition stuff.
5642625	5656300	A	0.8763316869735718	It's the internal states when we talk about perception, cognition, action in the active scheme or even in the sandwich model of cognition, perception, cognition action.
5657250	5678100	A	0.9022550582885742	So W is describing how those sensory inputs either in one step or composably in multiple steps become processed to these internal representation of hidden external causes inferred external states.
5678162	5688240	A	0.8767582178115845	And so these are the states that have that sigma relationship and a generalized synchrony with external states.
5688407	5706550	A	0.8520497679710388	The sigma and the generalized synchrony are not discussed in your paper, but it connects to other work and the recurrent connections are facilitating attention or waiting of the stimuli.
5708250	5716450	A	0.881449818611145	This is the recurrent learning loop and the relationship of the A between observations and hidden state estimates.
5718225	5729645	A	0.8607588410377502	And then a different kind of modulation comes Hinton play between the hidden state estimate of the internal states state and the action selection.
5729810	5734410	A	0.86183762550354	So what is gamma corresponding to?
5734442	5746812	A	0.7961727380752563	And why is the gamma modulation between layers two and three differing functionally from the k synaptic modulation of one and two?
5747850	5758490	B	0.9023073315620422	Yeah, so K matrix basically formally correspond to B matrix in the Bayesian information.
5758595	5774037	B	0.911096453666687	So we rotate the information about the prediction, right, our narrator or our expectation about the next state based on the previous state.
5774775	5782550	B	0.8209996223449707	On the other hand, Laurel gamma is quite different from such a computation.
5782625	5796330	B	0.8574314713478088	Gamma basically means risk function, which is in principle can we use arbitrary risk function.
5796452	5833587	B	0.8943491578102112	So this is a part of generative models we designed and the rule of risk function in generative model formulation is attention form of generative models depending on that value of gamma which examples retrospective moderation of evaluation of task decisions given an outcome in the future.
5835225	5841485	B	0.8876855373382568	In terms of neural network, of course it corresponds to some neural modulation.
5841605	5854580	B	0.5981672406196594	For example, Dopaminergic moderation is famous in the literature which moderates the activity and fluxicity of various brain vision.
5854640	5870950	B	0.9041245579719543	But we particularly focus on Dopaminergic or any kind of neuromoduration of cyanogic prosthesis in the output trigger which may correspond to Cergram.
5871525	5905362	B	0.9018924236297607	So in the Serbram neural activity or processes moderated by Dopaminergic, input from is used as the optimization action rule, decision rule or sometimes attention help us.
5909212	5909797	A	0.9184247851371765	Awesome.
5909905	5925817	A	0.7188023328781128	Very interesting because in some previous papers and models that we've looked at, attention is dealt with as policy selection on mental states.
5926015	5936012	A	0.8787127137184143	So internal action selection, it's an action like variable describing attention and awareness and even metacognition.
5936737	5967962	A	0.5501455068588257	And so that connects the role of Dopamine in motor decision making seen in many Dyskinesias but also with the role of Dopamine in seemingly nonmotor based decisionmaking like gambling or investing where it doesn't seem to immediately translate to a given motor sequence.
5968912	5990877	A	0.7124358415603638	Yet it has analogous computational characteristics and the comorbidities and the side effects of different drugs that affect the Dopamine neurophysiology are known to have carryover in terms of like the rigidity or excessivity of motor and decision making aspects.
5990907	6019337	A	0.529427170753479	So it's like interesting that Dopamine has long been understood to have that parallel role in attention as cognitive action and motor action and that was established empirically through modifications of Dopamine signaling and also had been modeled analogously with computational neuroscience.
6019687	6035900	A	0.7596100568771362	And this is providing again a slightly different interpretation of that very well studied Dofaminergic modulation of attention and policy.
6040837	6041600	B	0.46103888750076294	Yes.
6043462	6051887	B	0.5904572010040283	In addition to that, I believe another important aspects is correlation of scientific processing by document.
6075850	6078937	A	0.8277719616889954	Do you want to show something or yeah.
6080875	6085387	B	0.8644910454750061	Can you see this paper?
6087475	6091325	B	0.8261170983314514	I sent you a chat.
6092275	6096275	B	0.7235491871833801	If you can't, I'll send you a PDF.
6097450	6099037	A	0.6621345281600952	Okay, let me see.
6100300	6102412	A	0.7972273826599121	I'll look at it up now.
6107425	6107980	A	0.4896697998046875	All right.
6108027	6122460	A	0.8873566389083862	The paper is a critical time window for Dopamine actions on the structural plasticity of dendritic spines from 2014 byagasha.
6122580	6125155	A	0.9392553567886353	So what is interesting about this paper.
6125352	6154395	B	0.5317803621292114	Yeah, it basically explained conversation of plasticity by Dopamine, which is common but crucial point of this paper is that it shows that it proved that Dopaminezic input can moderate after hebion prosthesis is established.
6154485	6170190	B	0.8578988909721375	So this paper showed that they add domain logic input for about 2 seconds after or several seconds after the Hebbian process is established.
6170220	6194520	B	0.8734358549118042	But such a post hoc moderation, post hoc introduction of heterotopamagic Impetu is sufficient to change the past capacity which may be associated with the Costa hoc evolution of our past decisions.
6194610	6205180	B	0.9141200184822083	So by decision making we of course changes the changes the weight matrix by through trust 50.
6205377	6221000	B	0.7210248708724976	But to evaluate the goodness or badness of our decision, we need to see observe the future outcome which is propagated by for example, Dopamine.
6221425	6245437	B	0.8160250782966614	And this paper nicely show empirically that Dopamine actually can change the past evaluation, maybe after such a psychic level, very local level, ecoscopic level.
6252250	6263520	A	0.8308271765708923	So there's a short term window, the critical time window that they're describing.
6263610	6265935	A	0.7067142724990845	But there's some window.
6266130	6278605	A	0.7826635241508484	Yeah, some window by which dopamine potentially unrelated to the initial heavy and plasticity events, right.
6278727	6302662	A	0.8481422662734985	Where secondary dopamine signaling or not secondary just after the initial fact, potentially of a different valence or the same valence can synergize or cancel the plasticity formed in the moment.
6303100	6303862	B	0.5662814974784851	Exactly.
6305425	6312862	B	0.8117495179176331	And this is not limited to Dopamine, but other neuro moderator can also do this.
6318250	6325110	A	0.6647605299949646	Well, on one hand, how does this change our understanding of animal neurophysiology?
6325305	6333575	A	0.7934632897377014	And then I guess, on the other hand, how does this influence how we would design sentient artifacts.
6342625	6351112	B	0.6030767560005188	For both animals and artificial agent?
6353350	6357820	B	0.521881639957428	One important message I free with us.
6357972	6366275	B	0.598333477973938	So this tells us possible simple architectures to make learning.
6367900	6396037	B	0.8478472828865051	This is association between past decision and future reward or any risk factors, which is otherwise computed by computing forward prediction by iterating some computational, this is a usual way to predict the future event and then select the option.
6396475	6415100	B	0.6673157811164856	But using this property, biological property, which is observed in experiment, we can design, we can imagine other simpler architecture to make a planning.
6417250	6440600	B	0.8275951743125916	So for both animals and synthetic Bayesian agent, it provides an alternative explanation about the association between our past decision and the future risk and the optimization of our decision to maximize, reward or minimize risk.
6445075	6457335	A	0.7037177085876465	Well, one interesting note is we spoke earlier about the difference between the Bayesian smoothing all at once approach and the Bayesian filtering step by step approach.
6457530	6466120	A	0.5765283703804016	Now, if one had infinite knowledge and computational resources, the Bayesian smoothing approach is the way to go.
6466272	6469455	A	0.6117194294929504	Like, you don't want the decision rule for investment.
6469590	6476940	A	0.5632453560829163	You want to look at the whole time series past, present and future, and know the best moments to have made the trades.
6477045	6478500	A	0.6546281576156616	I mean, there's no comparison.
6478575	6481515	A	0.7041006684303284	You're going to do better with the Bayesian smoothing.
6481695	6489640	A	0.7955893278121948	However, it's just implausible computationally and because it requires total memory of the past and knowledge of the future.
6489807	6501037	A	0.5489904284477234	So that's what motivates the development of Bayesian filtering approaches, which are tractable and calculable through time.
6501775	6505625	A	0.4944218397140503	Yet with this time delayed modulation.
6507400	6507895	B	0.5885526537895203	Part.
6507972	6512662	A	0.8623244762420654	Of the Bayesian smoothing strength comma back into play.
6513850	6523537	A	0.5737380385398865	It doesn't enable true anticipation of future states, but that's what the expected free energy does.
6524650	6531712	A	0.8097062110900879	However, the delayed neuromodulation allows for reconsideration of a window of past states.
6532525	6548900	A	0.896230936050415	And so in that way it corresponds to like a slightly deeper filter, not just a filter of a time step of one, but a filter of like a rolling window of five or with some decay.
6549550	6562837	A	0.5592350363731384	And you don't want that window to be too big because if the window were ten minutes, then too many contrasting stimuli would get piled together.
6563350	6567050	A	0.785103440284729	The Dopamine level would just converge to a mean field average.
6567400	6582412	A	0.8510470390319824	But there's some time decay or time constant on the post hoc modulation where that neuromodulatory signal is actually a parameter of interest.
6583000	6591787	A	0.729786217212677	And that's not an infinitely long or infinitely short window, but it's some niche dependent amount of time.
6592450	6610920	A	0.6136233806610107	And that's a very interpretable and first principles interpretation of the computational role of neuromodulators in a way that is also consistent with all these other concordances we've been exploring.
6611085	6622400	A	0.976565420627594	So it's quite an interesting connection back, I guess, in our final minutes of this discussion.
6626850	6627987	A	0.759223997592926	What are you?
6628725	6653800	A	0.7958566546440125	Well, maybe go to the beginning at the end, which I meant to ask earlier, but it's a good way that we can sort of close today and look forward, which is how did you come to this line of research specifically studying neural networks in this way with Karl Friston and your colleagues?
6658275	6677915	B	0.5597987174987793	So, yes, so my interest was the characterization of Barricade network.
6678095	6687155	B	0.4923993647098541	So my first motivation is to make biologically plausible artificial intelligence.
6687215	6695725	B	0.8485372066497803	But to achieve that, we need to know about biological brain or biological neural networking.
6701100	6716725	B	0.8715739250183105	In these several years, I collaborated with the doctor professor Californiston to study about his salary principal after doing forest.
6721125	6749390	B	0.8766372799873352	My question during that period was the priority principle, is everything about the biological possible neural network or is there another aspect that can characterize the virus car neural network?
6749495	6752350	B	0.5330686569213867	So it is non trivial.
6753150	6755015	B	0.5706772208213806	It was non trivial.
6755195	6767130	B	0.84393310546875	So that's why I tried to start from characterizing the neural network first.
6767327	6796887	B	0.8193053007125854	So our strategy is not considering the way of implementing any Bayesian algorithm as the brain architectures, but my interest is rather characterization of a given vertical network in terms of some other things.
6797400	6803200	B	0.8519021272659302	One possible way is of course based on inference free energy transplant reinforce.
6803550	6809425	B	0.8904638290405273	So that's why I start from characterizing power's network.
6810675	6818575	B	0.5872383117675781	But just defining neural network architecture is insufficient.
6821625	6833675	B	0.797863245010376	It is not tractable, it is far beyond the computational tractability as the mathematical analysis.
6833750	6843400	B	0.805845320224762	And we need some assumptions or some trick to increase the tractability.
6844500	6865580	B	0.540503740310669	One day I came up with an idea that in which we consider that both new activity and fastest follow the same cost function gradient.
6865715	6877295	B	0.6391971707344055	This is very much an allergy with physical system like Lagrangian information geometry, Hamiltonian formation.
6877385	6899435	B	0.9145013093948364	So usually we consider some energy landscape and design plausible trajectory as the evolution of some principle of minimum action or restruction.
