6899630	6929575	B	0.8626276850700378	So we imagine that what if we applied such idea to computational neural network or biological neural networks to characterize their dynamics in the first principle, that's the first computational step to come up with this framework.
6931425	6958335	B	0.5434722900390625	And finally we noticed that it is not easy to connect the Newtonian dynamics with this type of neural activity study because neural activification not necessary to be a second order differential equation, but rather it is fast order and considering many things.
6958442	7003675	B	0.7210469841957092	Then we finally use a Costa function proposal in the papers, which is not necessary to have a former identity with the so called lavalier in the Newtonian physics, but it is rather plausible as the rule or underlying mechanism of such type of network.
7011800	7012562	A	0.9184247851371765	Awesome.
7013525	7019810	A	0.9439004063606262	Well, it has been quite an interesting dot one.
7019992	7024487	A	0.9860720038414001	I really appreciate everything you've shared today.
7025075	7027280	A	0.902848482131958	Is there anything else you want to add at this point?
7027327	7028912	A	0.7310769557952881	Otherwise we'll talk again.
7030325	7036050	B	0.8209488391876221	Yeah, I already speak a role.
7037675	7038485	A	0.8529649376869202	Thank you.
7038592	7040675	A	0.7564576864242554	Alright, talk to you later.
7040737	7041450	A	0.5137446522712708	Bye.
7042325	7044400	B	0.9887828230857849	Thank you very much for a nice discussion.
