"Speaker Name","Start Time","End Time","Transcript""Unknown","00;30;05;05","00;30;30;23","And so that's the that's how active inference might fit in in the community as a whole. But you could imagine that any you could focus in on any individual part of this stay just the principal business and the principal businesses. The principal business could also be thinking about its cognition in terms of active inference. If to gathers information, then makes makes adjustments and learns and chooses that actions."
"Unknown","00;30;31;20","00;31;04;28","And then another example is the crowd based financial system itself. This is a decision making organization structure, and that whole structure could be modeled using ideas from active inference pool. It's interesting how you developed the idea and applied basically the evolution of computational modeling to it and that helped a few things maybe come out into relief, like that's that multi scale aspect."
"Unknown","00;31;04;28","00;31;27;04","And then also the fact that you're pursuing not the maximum GDP you know, not the, the, the total divided by the number of people which you're maybe going to get a higher average with one billionaire and everyone else had zero. But that's not the pursuit. It's actually a uncertainty minimizing trajectory policy sequence that's starting to sound a lot like active inference."
"Unknown","00;31;27;04","00;31;50;23","So it's kind of cool how it dovetailed together. Right, right. This is these are, these are, you know, these are probabilistic. You can say the community is developing a probabilistic model of what will happen next, what will happen to me. And and that fits in very well with the active inference scheme. Individuals in the community are developing a generative model of of how I see the world and what will happen next."
"Unknown","00;31;51;05","00;32;19;28","And as a matter of fact, in a sense, the that sense is so important since anticipation is so important in cognition that individuals in the community, individual organizations such as businesses and the community as a whole would be developing anticipatory models, whether those are formal models and, you know, in computers or whether they're informal models in their in their minds about how how I see the world and how I see what will happen next if A, B and C happens."
"Unknown","00;32;20;14","00;33;08;17","So all of that information, that full anticipatory capacity of individuals and organizations and the communities as a whole can be taken or taken into account in the leader can be used in the leader for for its own good all right. Amber Slide eight. Yep. There. OK, all right. So this this image on the right really captures much of the much of the simulation and much of the idea of the leader as far as the token exchange system goes and and before I describe it, I just want to emphasize once again that the token exchange system is just one part of Lolita."
"Unknown","00;33;09;10","00;33;57;21","And there's other parts that are not not in the simulation at all. For example, the governance governance system is not in the simulation. So this just flows of currency and this figure one on the right describes how that works to to simplify this a little bit. And let's just look at the arrows and blue and the arrows and blue are both tokens and dollars that float together and we can start and organizations this these are the agents of the model organism, the five agents, organizations, persons, CDF force, rest of counties, which is the rest of the world and government which is local government just looking at the blue lines, we see there's kind of a"
"Unknown","00;33;57;21","00;34;37;00","circle being made between organizations, persons, CP, CBS and then again two organizations. And that's essentially how how, how, how things float organizations persons are employed at organizations and organizations pay wages to persons. Persons spend money back into organizations when they buy goods and services persons support the CBC with contributions and the CBF FC supports persons in particular, not in workforce persons with what I call nurture support the CD first."
"Unknown","00;34;37;21","00;35;11;15","So also provides loan subsidies and donations to organizations and the organizations pay back the loan principal. I might add that the concept of loans here is is the token itself is designed to be a noninflationary currency and loans are offered interest free. So what you don't see here in this circle I just described, what you don't see is investment for profit."
"Unknown","00;35;11;23","00;35;41;10","That does not occur in the system and especially with relation to principal of businesses, that does occur and obviously doesn't occur with nonprofits because nonprofits are by definition not for profit so. So if I'm a person, I receive wages from my employer or maybe I'm self-employed, I sell things to the other persons and I have to contribute a certain fraction of my income to CBS."
"Unknown","00;35;42;05","00;36;12;28","And once it's in the CBS I can organizations, organizations will apply to the CDF for loans or subsidies or domain missions and I along with my fellow colleagues in the CBS, I have a pool, I have an account there and I can decide I like I like that idea that this new business wants to do. They're going to make a new light bulb or they're going to make a and this is funding for a small organic farm or whatever the situation might be."
"Unknown","00;36;13;19","00;36;34;26","I might like what they're doing and I might see value in it for the community and the again, this is the investments are not related to profit. So I'm not I'm not thinking the way I would think in today's world, in the native economy, if I have money in the native economy, I'm thinking, where can I put my money?"
"Unknown","00;36;34;26","00;37;08;22","That will return to me the greatest gain, personal, personal gain and finances in this system. I'm asking since since personal profit is not part of the picture. I'm asking where can I put my money that will receive the greatest gain in terms of fitness scores and community well-being and quality of life for myself and my children. So those are the kinds of topics that become pertinent then when when the personal profit motive is taken up."
"Unknown","00;37;10;07","00;37;40;01","So and so again, in relation to the native economy, the need of the government the say, the US government also makes subsidies to various businesses but here all these choices are deeply democratic. You know that given that incomes are more or less equal, everyone has more or less the same amount of money in the same amount, want a currency."
"Unknown","00;37;40;14","00;38;17;27","So everyone has is essentially equal say in which which businesses get funded, which businesses, whether they get subsidies or whether they get donations or whether they get loans. And the reason for subsidies rather than loans and donations might be that well, that for one thing, you have to pay back a loan so if you if a community wanted to support, say, a bakery and they thought that this bakery is really great they don't they're not making a lot of money, so they're not going to be able to really pay back loans very well."
"Unknown","00;38;17;27","00;38;47;14","But they're the maybe even they're operating at a loss. But there's just such a great community resource. And we just love this little bakery so much that we would like to give this bakery a subsidy so that it can continue to operate, even though it's losing money every year. That would be one example of a subsidy. Or there might be we want to subsidize a hospital or we want to slice any any operation that perhaps is not actually making money and couldn't pay back a loan."
"Unknown","00;38;47;24","00;39;23;20","On the other hand, maybe a business is doing well and we would be willing to support it, but we want to give it a loan instead of subsidy. Donations really apply more to nonprofits and subsidies really apply more to businesses. Don't give a thought on that. All right. Yeah, yeah. It's like if a person who's granting money has $10,000 and they're deciding whether they want to be the one who gets to decide where the 10,000 go or whether they're going to give it to the cafe, who's going to spend it potentially at other local businesses and allocate it a different way."
"Unknown","00;39;23;28","00;39;58;25","And the employees are already taken care of, and it's going to contribute to a public good, especially a locally defined one. And so it's like yeah, I'll let them spend my $10,000 that I was just going to give away anyway. Right, right, right. Yeah. So, so that raises a really good point that I wanted to make is that what's really happening here, even though it's currency that's circulating, what's really happening here is just it's just a way to ensure that everyone gets the same amount of votes in this economic arena."
"Unknown","00;40;00;00","00;40;18;28","And what people are voting for is not so much money. If money isn't the resource that this has, especially in a mature leader, the money is circulating the as whole as opposed to later. So it's so it's not really a shortage of money, like how will we get the money for this or where would the money come from?"
"Unknown","00;40;18;28","00;40;48;16","It's not that it's using money as a voting tool to allocate other resources. Like if I give a if I support a bakery, say, with with a loan or a subset today, what I'm saying is I'm I'm voting for human resources of the community to be spent you know, in this bakery, I want this bakery to employ these people and I want the bakery to provide this service to the community."
"Unknown","00;40;48;26","00;41;16;13","So I'm voting for the service and the allocation of resources that are embodied in this bakery. Or it could be a hospital, or it could be a it could be anything but that's what we're really voting for is how we spend our time. What do we what do the humans in this what are the members there in their life and their 24 hours a day and seven days a week or whatever in their year, how do they spend their time?"
"Unknown","00;41;16;13","00;41;47;00","How do we want to spend our own time, which are hubs? Do we want to work in as a community? How do we want to spend our time? Do we want to be employed by nonprofits? Do we want to be employed by regular businesses? Do we want to be employed by principle businesses? This is the the evolution of this economy is that is the decision making process of a community to decide how it wants to spend its time and where it wants to put its focus and how, how, what kind of conditions it wants to operate in."
"Unknown","00;41;48;06","00;42;18;21","Yeah, all right. So that's a little bit of introduction to the flow of cookies and dollars together and maybe I will say one more thing before we get off this is that suppose that and this might be obvious from things I've already said, but I just want to emphasize it. But suppose that me suppose that me and an a group of people in the city I've asked this, I'd like a would be really cool to have a bicycle manufacturer in our town."
"Unknown","00;42;19;04","00;42;41;17","So, so together, you know, the 12 of us or the 15 of us or the 100 of us decide like, yeah, let's support this bicycle business now every it's natural that not all businesses are going to make it, you know, some are going to fail and that's natural and good at a community would want to take some choice, some chances and fund some things that maybe even you know, a reasonable chance it will fail."
"Unknown","00;42;41;17","00;43;09;04","But if it doesn't fail, it'd be great. So so we fund a bicycle business and it fails after a few years. OK, fine. The same money is still circulate in the community. Nothing's really changed now what has changed, however, is the that allocation of human resources that were allocated to the bicycle business now can be allocated someplace else because the bicycle business doesn't exist."
"Unknown","00;43;09;21","00;43;36;22","And in the meantime, those employees might become then not in workforce members that maybe don't have a job for a short period. So they go from the unemployed category in the person's work persons box to the unemployed and not in workforce box and find that their income doesn't really change. So they were, you know, they're not out in the street and neither is the business owner, the guy who did the whole thing."
"Unknown","00;43;36;22","00;43;58;06","He's not out in the street. He's his income hasn't really changed too much, especially if he's a principal business. So he's fine. The employees are fine. Everybody's taking care of the community took a chance. They said, hey, this would be a good experiment. Let's have a bicycle shop. It didn't work out, but now we'll just really get those responses to something else."
"Unknown","00;43;58;06","00;44;30;23","Some of the decision so, you know, funny, when I tried to explain this to people, the and I'm using terms money and currency, it's really it's difficult for some folks to get past their interpretation. The common interpretation of what money and investment and currency means. And this is, as I said earlier, this is a leader economy, but it's not like any kind of economy that we're we we think of."
"Unknown","00;44;31;17","00;44;55;07","This is really just a decision. This is a cognitive system. In short, this is the description of a cognitive system that a certain flow of that is uses what I call currency. If I can make a point that John, it's like if you use the metaphor of money, a lot of times people debate characteristics like fungibility or store value or transfer value."
"Unknown","00;44;55;13","00;45;19;02","But if we think organismal and we think about, let's say, blood flow or neural information or hormonal signaling, like the goal of the muscle cell is not to accumulate insulin. It's to use it as a cue, right. To know when to change and so if you think about infants with low blood flow, no cell needs to hang on to the red blood cells and capture things around it because it's part of a bigger plan."
"Unknown","00;45;19;15","00;45;46;09","So I think that that's a really nice attribute you captured. Yeah, excellent analogy. And that's very much what the leader is like. It's kind of like a body kind of like an organism that requires the different cells in that organism to receive blood and food and information and other things like that. So and also on that point, when I say money is used as a voting tool and even more broadly it's used as an information tool."
"Unknown","00;45;46;09","00;46;21;22","So the community is exchanging information when they exchange money still on Slide eight, I've explained now the blue lines, the token and dollar flows, but I haven't explained the green lines. So this this the new club in this model is as an old models for new clubs. The community remains part of the larger world. It's there's no the club is not segregated from the rest of the world apart apart from the rest of the world."
"Unknown","00;46;21;24","00;46;43;28","It is engaging in all the normal stuff it's paying taxes to a government. It's purchasing products from member member organizations but also from member organizations. Amazon.com or whoever. So, you know, it's it's participating in the normal way. And this leader framework or the club framework is another layer of organization on top of the normal world."
"Unknown","00;46;46;01","00;47;15;09","So these green lines are showing how those dollars are flowing. And again, this is a simplification of the real world, but it gives the idea of still so persons are paying the dollars in taxes, paying the taxes in dollars, I should say. And the government is also giving some income support to unemployed persons. But also happens the government is giving dollars in the form of grants and subsidies and contracts to local organizations and local organizations."
"Unknown","00;47;16;14","00;47;45;21","And I created this as a kind of a simplification. But local organizations are exchanging goods and services with the rest of the world. So dollars leave the community when the local organization, for example, purchases supplies from some far distant business and at the same time organizations outside of the club, outside of the county are purchasing things from the member organizations to so."
"Unknown","00;47;48;07","00;48;12;18","Yeah, so that's that's a simplified version of how dollars are flowing and obviously now we got a problem because as you know, we have our first challenge. Maybe you could say one challenge is to somehow design this system. So to reach the aim in number three there, that income is becomes more equal over time. But now we have the problem."
"Unknown","00;48;12;24","00;48;49;28","We've created this this local currency, the token, and we have to pay taxes on income to the government and we can't pay taxes in tokens. The government's not going to take it. So we got a media challenge of like how do we make this thing work so that every individual has enough dollars to pay? It's the taxes that needs to pay and organizations have enough dollars so they can purchase goods outside the county in dollars and yet and yet the whole thing can grow and and then reach the desired ends."
"Unknown","00;48;49;28","00;49;16;28","So how does that happen? Another question, design question is how do you make this thing good enough that anyone wants to join? Like, I don't try and run this picture here of, you know, conceptually how it works. But if I if I don't receive anything materially from joining, why would I join? And now there in actuality, there might be lots of soft reasons to join."
"Unknown","00;49;16;28","00;49;49;14","I might feel like I'm more part of the community or I might feel like my voice is heard more or it might feel that you know, by joining, we're able to make better decisions together about things. But in this simulation, I wanted something a little more substantial than that. So so in the simulation, I made the rule that a person will draw in, a family will join this if it increases their income and they won't join in if their income doesn't go up."
"Unknown","00;49;50;29","00;50;14;13","So that's the graph that becomes the challenge. Then how do you inject enough tokens and get a good enough circulation of tokens and dollars in the in this membership, such that my income goes up from joining where at least most people's income, everyone that joins their income goes up and how then how many people have to join to make this thing work."
"Unknown","00;50;15;27","00;50;42;18","But 2% of the population in 30 years or 50% of the population or 90% of the population like what does it take. So these are all the questions that we're going to dove into next but first a few assumptions just to just explain a little bit how this whole thing works the not in workforce population is static. I think it's whatever it is."
"Unknown","00;50;42;18","00;51;07;24","36% or something like that. You know there's just a big as in the normal world, a big chunk of people don't participate in the workforce. They're either they're disabled or they're stay at home. They just stay home and don't work or whatever reason I chose a 7% unless you think it's I think the unemployment rate starts at about 7%, something like that."
"Unknown","00;51;09;26","00;51;40;05","Every one in the county is adults and grouped into two person families just for simplicity. So household income and family are synonymous. The purchasing power of the token is taken to be equal to the dollar. So when you hear token, think value of about a dollar and structural unemployment is 1%. So, you know, you can't get much below that that no matter what you do and all employed persons work full time, you know, just a few assumptions to make the simulation simple."
"Unknown","00;51;40;19","00;52;05;24","And again later, some simulations could be more complicated. All right. Give a thought there, John. Yeah, there's almost two extremes for the token. One is actually something that was tried in my little town of Davis California with the Davis dollar, which was a one to 1 USD. It was a stable coin before there were stable coins. And so then they pegged the local currency."
"Unknown","00;52;06;03","00;52;25;12","It didn't end up continuing. It's not active to this day, but it was a pegged coin. And then the other alternative would be like a token that essentially people could they could make an NFT out of it or they could go full crypto and they could inflated and speculate on it, do all sorts of leveraging if it was really being traded on the open market."
"Unknown","00;52;25;12","00;52;50;01","So there's kind of a continuum between a total protected in-group currency. Something was pegged to a national currency, all these other options for the token omics. So it's really it's a it's an interesting starting point. But I hope others, when they're viewing this, see that there's a lot of space for experimentation. Yeah, there's a great points and yes, there's a tremendous amount of space for experimentation."
"Unknown","00;52;51;06","00;53;19;19","And on that note, I want to emphasize that I'm thinking of this as kind of a prototype concept is just to generate ideas. Just to give an example, the goal of the of the R&D program, if it were funded is that it would it would evaluate and help to evaluate, evaluate, facilitate the evaluation of any number of designs and any number of design components that maybe are interchangeable or can be mixed or matched."
"Unknown","00;53;20;05","00;53;50;06","So this is just one concept, and I would hope that over a period of years, many concepts are are tested, you know, obviously tested first in simulations and in bench scale studies and things like that. And then if the ideas are really good, then also in field trials and real communities. Now, having said that, though, I do want to emphasize that again, this is a science based, evidence driven program."
"Unknown","00;53;50;19","00;54;16;21","So so it's not just a question of, hey, what do you guys want to do? Well, we want to do this and what do you guys want to do? What we want to do, this is there you actually have to show that your design is good or better than others or how it completion. Or at least describe how this design compares to another design in terms of the fitness metrics, the terms of fulfilling the purpose of a system."
"Unknown","00;54;17;03","00;54;44;17","So there's a general general agreed upon the concept of system, fitness and system and fitness metrics, how to there's a generally agreed upon path to assess a system. And then any design that is that is that is good relative to the fitness metrics and in fulfilling its purpose, then, you know, this is that's the idea. Like any conceivable design that improves fitness is a good one."
"Unknown","00;54;46;18","00;55;11;10","That's one point. Now, you also just on the currency, I wasn't actually going to talk about this, but like you brought it up. So here we go. You I think you mentioned to kinds of currencies one is kind of potentially a speculative currency like Bitcoin. Another is a currency backed by the say, the US dollar or something. You know, like you have everyone has to put in a dollar and then they get a dollar out of local currency."
"Unknown","00;55;12;02","00;55;40;12","My concept for the leader is neither of those so the concept here is that the leader is is in there's a word for that's escaping me right now it is just simply created out of thin air. It's an accounting system. So in the same crypto. Thank you. Also crypto is by fiat too. It's by computational fiat. Yeah. Yeah."
"Unknown","00;55;40;21","00;56;04;18","So this is by no computation. No, this is just fiat by because we need more kirtan. We need more tokens. So this is an accounting system and obviously there's a limit to how much tokens you can create because the the concept here is that the token holds the value of about a dollar. So if you created 10 billion tokens and flooded a community on day one, the token would be worthless."
"Unknown","00;56;05;08","00;56;31;10","Right? It can only be created to the degree that it can be engaged with and employed in the circulation. It's all about circulation in particular. It's not speculative. So you cannot sell in this system. You cannot sell your tokens to anyone else. That's because I would in this system, I wanted people to be, you know, engaged. You know, this is like a voting system."
"Unknown","00;56;31;10","00;56;57;24","I wanted people to be engaged in the voting or community choices. And it just wouldn't be right if I sold my votes to some other third party and gave them a whole bunch. That just would mean I can't entrust like in the CB's, for example, there might be a there might be a community organization that says like an investment group in a sense, a social investment group that says, hey, we've been watching."
"Unknown","00;56;57;24","00;57;25;23","You know, we pay a lot of attention. We we model the success of businesses and the needs of the community. And if you entrust tokens to us and dollars to us, we will choose good investments for them that we feel are best and, you know, improve the community. Well, you can do that. That's fine. You know, that's all great, but you can't sell your tokens to anybody and obviously then they're not backed by any resource dollar or otherwise."
