"Speaker Name","Start Time","End Time","Transcript"
"Speaker 1","00;00;08;27","00;00;43;13","Hello, everyone. Welcome. Thanks for joining active lab. This is live stream number 21.2, I think. And this is our sixth discussion with John. The first four were background discussions where John and I worked through these Jamba boards and through the three part series that John had written, Science Driven Societal Transformation and now here we are today on May 11th, 20, 21 in our second participatory group discussion."
"Speaker 1","00;00;43;13","00;01;07;05","So this is going to be an unpacking and an extension and an opportunity to share perspectives and asked John questions. So thanks to all who have joined live and who will be joining live. And also if you're watching on YouTube, feel free to leave a question in the chat and we will relay that to you. So we're just going to go around with a quick round of introductions."
"Speaker 1","00;01;07;05","00;01;24;20","Maybe each of us could just say hello and something that they're thinking of or something that they're excited to talk about today. And then we will pass back to John and just start off on this road together. So I'm Daniel and I'm in California. I will pass to Lee."
"Speaker 2","00;01;26;29","00;01;54;02","I am Lee. I'm in I'm in London at the minute. And although I'm a Ph.D. researcher at the University of York, John, I'm today, I'm interested to talk about maybe minimum viable prototypes for one of the clubs and also a little bit around the metaphor of the super organism as well. If we have time and I'll pass to Scott, Scott I think."
"Speaker 3","00;01;55;09","00;02;27;13","Thank you. My name is Scott David. I'm at the University of Washington Applied Physics Lab, where I'm the director of the Information Risk and Synthetic Intelligence Research Initiative. Delighted to be here today. And I'm also very, very interested in chatting about the scale scale independent variables and how the interventions at one scale can help to alter system performances at other scales."
"Speaker 3","00;02;27;13","00;02;34;20","Do the fractal nature of some of the affordances we're talking about be of great interest? To me, and I'll pass it to Dave."
"Speaker 2","00;02;35;23","00;03;03;28","Dave Douglas, I'm in the Philippines, 120 miles north of Manila, where it's cool because the Mile High City and I just came across the answer to a question What is the state in the parcels and particles paper? Dr. Frist and says a state is a particle so yes it really, really is monads not only all the way up but all the way down to and who's left."
"Speaker 2","00;03;03;28","00;03;06;11","Daniel, you've already we already know you."
"Speaker 1","00;03;07;10","00;03;11;04","We'll go to we'll go to John. Thanks for the spicy introduction."
"Speaker 4","00;03;11;04","00;03;50;17","Dave John Boik mean, Daniel, if you go to sir set to slide one, add this this series, this these numerous talks are on the topic of science driven societal transformation. That's the title of a three part series that I recently published in the journal Sustainability Part one is Worldview. Part two is motivation and strategy and part 33 is design and looking at societal transformation through a particular lens in this series."
"Speaker 4","00;03;51;03","00;04;04;16","And that lens is the de novo development of fundamentally new systems so when I say systems, I'm talking about economic systems, governance systems, legal systems, et cetera."
"Speaker 4","00;04;06;22","00;04;39;16","The we're going to focus today, I think, on maybe some of the practical aspects, like how would this be done? And I would like to just start by saying just a few words about this. The kind of theory of change that I talk about, especially in people remember to be if I were brilliant, which I'm not, and I came up with this amazing new design for societal systems, new governance systems, et cetera, if there were no way to actually practically implement that, then it would have just been an academic exercise."
"Speaker 4","00;04;40;06","00;05;12;03","So part of the series is arguing that there actually is a reasonable way to move forward and a viable path to move forward that is doable, that that actually could be put into into implementation so this the series is is itself is is essentially outlining an R&D program for the development of this framework to study and create and develop and test new integrated systems."
"Speaker 4","00;05;12;24","00;05;36;04","And that happens at according to this theory of change that happens at the at the local level. So the concept is, is that this R&D program is a is a collaboration between the global science community and local communities. And the new systems are implemented at the local level on a volunteer basis in what I call a club model."
"Speaker 4","00;05;36;22","00;06;03;20","So the the concept there is that the scientific community would have developed the tools and technologies and resource some things necessary to make these new systems work well. And they the local communities and volunteer local communities somewhere in the world would, would look at the results of all the computer simulations and all the studies that have been done and say that looks interesting."
"Speaker 4","00;06;04;07","00;06;28;01","Gee, it looks like our community might really benefit from this let's give it a field trail, let's give it a try it. And so that's the partnership and then the community itself. Now, this could be I don't mean a city I don't mean a nation. I really mean like perhaps a subset of a city. So say just a thousand people or something like that might be enough to start a club."
"Speaker 4","00;06;28;27","00;06;57;07","And the club would function. Everyone in the club would function as normal in society, except that on top of on top of this, another layer of organization, on top of the normal layer of organization, and that's this club level. So civic club, you can you can think of it as a civic club and the civic club has all these, you know, ways that they go by decision making and exchanging currencies."
"Speaker 4","00;06;57;07","00;07;20;21","And various things that allow them then to test out these new frameworks of, of societal systems. So that's the gist of it. And I just want to say a few things about this club model before we really could go into so we're kind of all on the same page on that but just before I do that, maybe go to slide two of that same deck."
"Speaker 4","00;07;21;10","00;07;55;03","I'll point people to principle societies project dot org. If they're looking for more information on this. The all of our videos are posted there and the papers are posted there and some other materials posted there. So for for information, go to PSP and let's go to slide 17 OK, oh, that is not the right book. Quite the right one."
"Speaker 4","00;07;55;03","00;08;01;02","I wanted the theory of change you want and that's not it."
"Speaker 1","00;08;02;09","00;08;03;13","There are different strategies."
"Speaker 4","00;08;05;28","00;08;07;02","Which slide that you're looking at."
"Speaker 1","00;08;07;12","00;08;08;27","17 on."
"Speaker 4","00;08;09;15","00;08;09;20","To."
"Speaker 2","00;08;10;00","00;08;10;09","Yep."
"Speaker 4","00;08;13;04","00;08;35;10","Theory of change. Well that's somehow I'm. Oh there we go yes things change and strategy so this is just kind of capturing what I just said. The idea is to implement new fundamentally new systems at the club level."
"Speaker 4","00;08;37;10","00;09;01;02","I'll call the club community, but this community could be relatively small and just a portion of the city. And the reason and one of the reasons I'm looking at the club level is because I see it as kind of the Goldilocks level. It's the it's the smallest size organization of a community that could make the club a able to replicate."
"Speaker 4","00;09;01;08","00;09;32;07","Right. And function. So if that if we were instead just looking at, say, an individual business that business like I say, say I was promoting a cooperative business model or something like that, that business would have to function within the wider set of businesses and would have to compete in the normal market for the consumers attention. And it would have a hard time doing that because it's operating according to some different set of rules than a normal business."
"Speaker 4","00;09;33;07","00;09;51;20","So at the club level, I see that as just large enough that all of these new functional systems can be tested and and it's large enough that that the organization, the community can be self-replicating, the club model can be self-replicating, it can grow in a local area and the idea can spread to other local areas."
"Speaker 4","00;09;55;27","00;09;58;14","Right now. Slide 19, please."
"Speaker 1","00;09;59;04","00;10;05;04","Can we just go in just completely and then, Scott, just because we're getting hands raised on each of these slides. So yeah. So then Scott."
"Speaker 2","00;10;05;07","00;10;05;19","Sure."
"Speaker 2","00;10;07;22","00;10;19;08","That's. John. What are the in order to start a club, what are the minimum requirements that are needed? Does it need any funding or there are the set of conditions that it might need."
"Speaker 4","00;10;21;27","00;10;47;12","Ideally there wouldn't be any requirements. Ideally, there would be support from the from the, you know, the global community to start a club. But but but the but the clubs are designed such or at least I would later we'll see. Today, we'll talk about a simulation I did of a book club model. The particular framework I called the leader framework, but I designed that so that it could bootstrap its own growth."
"Speaker 4","00;10;47;15","00;11;13;23","So there was no that was not necessary to you know, for for to have millions of dollars, say to start the club or anything like that. It really just grew step by step exponentially faster. So in the first few years, hardly anything was happening. And then it started to grow very rapidly after that. So, you know, what would be necessary?"
"Speaker 4","00;11;13;23","00;11;36;05","Mostly just individuals that are that look at the that by the time I feel trial would ever be started, there would have been, you know, let's say hundreds of papers, scientific papers on simulations and all other aspects of this. So everyone would know what they're getting into. This would be very clear what the what the you know, what the new systems are and what they do, how they function."
"Speaker 4","00;11;37;11","00;11;55;27","And then at that point, all it would really be necessary is for some entity, somewhere in the world to say, well, it looks really interesting. Let's do a field trip you know, here's we have a thousand people in our little in our community that are interested in this and let's give it a shot. So that's the main thing. I mean, maybe a little bit of funding would be necessary, but not an extreme amount."
"Speaker 1","00;11;56;17","00;12;17;09","So it sounds it sounds almost like there's a prelude phase, which is the what we're in. And then the stage will be set for proper emergence for a community to then take that next step. But it's a really interesting question about the viable system. So I hope that we pursue that line as well. Yeah. John, anything else?"
"Speaker 4","00;12;17;19","00;12;40;02","And I just maybe will add that by the time the first field trial ever starts, there really should be no surprises about any of this. I mean, the community would, you know, conduct the trial, but it should be a foregone conclusion what's going to happen as far as how it works and what the benefits are, because this should have been worked out very well already."
"Speaker 4","00;12;40;02","00;13;04;26","So, you know, it shouldn't be it's not like here's a you know, here here's a new here's a new machine tractor or something. Now see if you can drive it. It's not quite like that because there would be, you know, training involved. We would realize what the purpose of the tractor is, what we're going to accomplish with the tractor, how how it works how you repair it."
"Speaker 4","00;13;05;12","00;13;25;26","You know, like there would be a again, there's just it'll be very few surprises by the time the first field trials gets. That doesn't mean the community wouldn't be able to make decisions on how it what it funds and how it functions. Of course, the community would make decisions about how about its the kinds of jobs it creates and things like that."
"Speaker 4","00;13;26;26","00;13;32;03","But the fundamental mechanics mechanics of the system should be pretty well worked at."
"Speaker 1","00;13;32;29","00;13;34;28","Daily any other. It's also not just."
"Speaker 2","00;13;36;04","00;13;48;05","It just very quickly, you know, so if the it's a particular community. So you've got this prelude phase where you're kind of working out all the details of that, you know, the design, is that done with the community? Oh, certainly."
"Speaker 4","00;13;48;06","00;14;16;11","I mean, that would be with any communities like globally. In a sense, the prelude part is the global science community and any the vigils or communities anywhere in the world that want to participate, provide feedback, do user testing, you know, so all of the little parts of the systems would be also tested in various groups. And there would be, you know, like really just a ton of testing that would occur before the before the first formal field trial ever started."
"Speaker 4","00;14;17;09","00;14;52;06","And and that particular community would could have input on, you know, what kind of particular design elements it might want in its system. So and that's actually a good point. I'm glad you said that, because I also wanted to say that the the purpose of this R&D program is not to build one system that fits all. It's to build it's an ongoing exploration of the you know, different pieces and approaches and ways you might create systems such that they fulfill their purpose."
"Speaker 4","00;14;52;19","00;15;20;05","So there could be a wide variety of, you know, parts to choose from or ways to do things or, you know, hopefully there would be numerous kinds and types and pieces of systems that would be tested over time that communities could, you know, implement them. And all with the purpose of you know, fit for purpose, you know, always with the concept of fit, fit for purpose behind this."
"Speaker 1","00;15;21;19","00;15;23;23","Scott And then anyone else who raises their hands."
"Speaker 3","00;15;25;18","00;15;44;16","I just wanted to go back. You were talking a little bit about the size of groups in the clubs. It's the optimization is going to be really interesting because you might have an Dunbar's number involved there, that Dunbar's number concept being the most people you can have as your friend kind of idea. So whatever is 120 or something."
"Speaker 3","00;15;44;16","00;16;05;13","But one of the things that's interesting also you have the internal voice dynamics of the club plus the external voice dynamics of the club. So as the club cohere as an internal voice, it will have a more coherent external voice which will allow it to in train and harmonically couple other systems more effectively. Right because it be more coherent."
"Speaker 3","00;16;05;25","00;16;33;12","One of the things that I'd like to get into later in the conversation is we have some ideas we've been working on, on scaling how legislative, judicial and executive function. The three functions of all governance systems have rule making enforcement of the rules and operation of the rules. How those naturally later on, just as a function of scale, as you increase in scale from rulemaking, you have to go into different abstractions for enforcement and operation under those rules."
"Speaker 3","00;16;34;02","00;17;08;29","And so that's it would be very interesting to look at the dynamics of club growth as an internal process of internal voice and a recognition of the layering on of governance that occurs internally, and then how that governance then needs to expand into the external environment in order to be more effective. The bottom line is if you have a system, a club where we say we are the Free Speech Club, we have the rights to free speech and there's no other club that has a duty to respect that, then you don't have a right to free speech outside of the club."
"Speaker 3","00;17;10;09","00;17;20;05","Right. And so how do you iterate this story outside of the club so that it becomes a reality that's shared so it can be enjoyed? Right, right. I but to talk about that."
"Speaker 4","00;17;20;17","00;17;48;16","Yeah, you know, there's there's a there's a ton there that we can go through. I have this concept in mind as I was designing these systems or designing the framework. So all good points. Just a little bit on size. I'll try to talk about a couple of things briefly that you raised a little bit on size so so in our brains, we have a community of neurons that are that are functioning to help the body make decisions."
"Speaker 4","00;17;48;16","00;18;23;23","And that that community of neurons is very much connected with the rest of the body, also feet and the liver and the heart and everything else. So how does all of that you know, how does how do all those cells and tissues and organisms cooperate right together to make the body function the way the body functions? One thing that happens is there's a very rich stream of communication that is passing between all these different cells and tissues and things or signals or small molecule signals and blood is circulating."
"Speaker 4","00;18;23;23","00;19;02;11","And there's all these this awash in signals of communication. So communication is one of the prerequisites for any kind of large organized, you know, set of individuals, whether they're cells or whether they're people to function together. So one of the questions that we can talk about today is what kinds of tools are necessary to allow for rich communication to occur in, say, a group of, let's just say, 10,000 people or 100,000 people or a million people?"
"Speaker 4","00;19;02;19","00;19;30;27","How do how does a large group of people come together richly communicate their narrative their story? They're they're both you know, I want to tell I want to tell my group what is happening for me, what I anticipate will happen if we choose A over B, over C, where this might lead and the short run where this might lead in the long run, how this fits into other issues, issues D and E and F."
"Speaker 4","00;19;31;08","00;20;09;17","I mean, you know, I'm an intelligent person that everyone else has intelligence and that intelligence can be used in the group, the cognitive, you know, the group cognition in order for the group to make wise choices about, you know, actions and and where they want to put their attention. So so the tool question is a big one. And I would say that that currently there are no tools that allow a large group of individuals to come together to collaborate and to be a rich communication and rich storytelling."
"Speaker 4","00;20;09;29","00;20;31;28","Right. It doesn't exist yet, I would say, and I have ideas on how we might create that. But that's one of the that's one of the one of the tasks that would have to happen over the over the first several years of the program is addressing that particular problem. Of how does a group richly communicate and collaborate in making decisions."
"Speaker 4","00;20;32;17","00;20;49;27","So so if we're just talking to get to your point now, if we just have a small group and we're just talking, we're working out things, we're making decisions together, well, maybe that group can't be more than a few people before it starts to fall apart or, you know, maybe it can't be more than ten or 20 or 100 people or something."
"Speaker 4","00;20;51;09","00;21;11;28","But if we have some way to richly communicate, then maybe we can scale that, you know, we can scale that communication to a larger group, to thousands or ten thousands. And still there might be some limit beyond what a club wouldn't, you know, like maybe a club should never be more than a hundred thousand or never. More than a million are never more than 10,000, you know, who knows?"
"Speaker 4","00;21;12;17","00;21;37;27","And so that's between lots of individuals in a club and then there should be similar communication between clubs that must happen and that's getting to a that's touching. Another point that you raised is how do how does a club reach reach the, you know, interact with the wider world and the, the both in the my framing both with other clubs."
"Speaker 4","00;21;38;13","00;21;47;06","How how does decision making occur between clubs? How does communication happen between clubs? And then also how does communication happen with the rest of the world."
"Speaker 1","00;21;47;15","00;21;55;25","Right. And Sean, Stephen and then Scot and then anyone else who raises their hand yeah."
"Speaker 5","00;21;55;25","00;22;42;09","Thanks. I think I'm interested by this the word purpose. You know, we think about purpose and we're this and clubs tend to have a particular focus or purpose, as you're mentioning and think it's interesting you're bringing in the science intentionality, you know, the intentionality of the science community to enable sort of seeding. So I'm wondering how that might you might think about that sitting alongside, say, community organizations or like community hubs, for instance, or multi-service agencies in the community or nodes of support, those types of things."
"Speaker 5","00;22;43;21","00;23;02;27","This might be something which could fit in there and give this kind of lab purpose that might complement or is it different, similar to some of those types of service provisions that exist out in the towns and cities."
"Speaker 4","00;23;03;24","00;23;34;12","I'm not exactly sure the question you're pointing to, but let me say a few things and maybe I'm going to touch on it. Uh, so, so kind of in the, in the abstract, the, the, you know, the concept behind this whole program is that, um, that, that an organism has an intrinsic purpose and that intrinsic purpose is to thrive both now and in the future."
"Speaker 4","00;23;34;12","00;23;59;00","So expected, thriving and it in order to do that, it uses cognition, right? And via cognition. And we've talked about how active inference fits in to that whole picture, the cognition. It really reduces the uncertainty about its capacity to thrive. It's the essential variables that, you know, that it that it needs, that it functions, the world it functions in."
"Speaker 4","00;23;59;00","00;24;35;04","And whether it's need true needs will be met. Right? So that's an organism. And I'm viewing a society as an organism, right? So in the sort of the larger picture, the abstract, the little abstract, the, the question is, you know, is, is a community functioning in a way, is a new system functioning in a way that is reducing uncertainty about the capacity to thrive so that's that's that would be that would be, you know, implemented in a way via some kind of fitness metrics."
"Speaker 4","00;24;35;19","00;24;54;13","So just like a normal society and regular society, we have, say, BP and other various types of, you know, information we gather and metrics that we use. There would be a set of metrics that would go along with this whole program so that a community would know how it's doing and how it would how it can expect to be doing."
"Speaker 4","00;24;54;20","00;25;45;16","Two years from now and five years from now, ten years from now, you know, maybe even 20 years from now. So so there may be many subgroups within say that say that there's a club and the club has 10,000 people, for example. Clearly there would be subgroups within that club that would be interested in various aspects of, you know, of topics or ways of doing things where various kinds of communication and you know, maybe some, some subgroups are really focused on the social components, the community components, the, the, you know, maybe emotional components, social components, and then other groups are interested in technical components and modeling or whatever."
"Speaker 4","00;25;45;16","00;26;08;20","You know, other groups are interested in the environmental components. For example, well, that's great. That's, you know, association between groups is a part of cognition. Our neurons associate in in ways that allows for cognition of the whole. And in the same way, a, you know, a club and a community would do the same. So there could be all kinds of subgroups that are all functioning."
"Speaker 4","00;26;08;20","00;26;49;23","But the umbrella purpose, would it be present? Right. Because it would be reported daily, say, or even hourly or weekly, you know, there would be everyone would know how how we're doing as a whole and that we're all in this together to raise our our joint capacity to thrive and maintain or maintain our ability to thrive. So, yes, it would be all kinds of groups that would focus on different aspects of this and of the umbrella you know, recording and collecting of information would be happening still across groups across the community so that there would be some sense of how are we doing and what's going to happen next."
