"Speaker Name","Start Time","End Time","Transcript""Unknown","01;24;46;01","01;25;12;21","The green dotted line is the token share of income target. So in the early years, that's very low fraction. Most of the income is in dollars and that it raises over it rises over the years to eventually reach about 35%. So at the end of the simulation, about 35% of income is in tokens and the rest is not and then the fun starts with the bottom right graph."
"Unknown","01;25;13;00","01;25;43;09","This says the average family income starts at about 40,000 that is you know from this from the census data and starts at about 40,000. And you can see what happens with the blue line over the period of 15 years it more than doubles so family income more than couples reaches the 90th percentile of start income. The red dotted line is showing the similar thing all leads including the money that people have in their savings account in the in the CBF."
"Unknown","01;25;43;13","01;26;12;01","So there's a two person family each has contributed the maximum of 30,000 to the savings account. So on top of this high income families also have $60,000 in savings in the in the CBS you might notice that you know the the the all the growth is happening during the first 15 years but you can tell from the blue line the family income line at the bottom graph that there's a little bit of a lag."
"Unknown","01;26;12;01","01;26;43;04","It takes a little bit of time for the whole thing to actually reach its maximum family income and that happens about your 28 or so. I might also mention too that these I'm just tried in the simulation I was just trying to find kind of reasonable parameters and a growth period and things like that such that it would all make sense and would work and we're not asking it, we're not expecting the community to change in year one."
"Unknown","01;26;43;04","01;27;03;23","Suddenly everything changes. It wouldn't be like that. It would tend to grow slower. But having said that you can think of the simulation is what might happen in the first leader. But imagine that there's already 100 leaders or 200 or 500 leaders around. It's really clear how these things work. There's lots of data coming in from leaders all over."
"Unknown","01;27;03;29","01;27;25;10","It's clear that incomes are rising and the interest by the general population is, you know, growing very rapidly. Like suddenly it's the new thing and everyone wants to join because everyone's income goes up and their empowerment goes up and their sense of community goes up and there and they're lining their purpose with some greater good. It's it feels good."
"Unknown","01;27;26;01","01;27;52;27","You know, there's a whole variety of benefits that come from being a member. So so now a new so someone wants to start a club in another city and suddenly there's a tremendous interest on day one. Well, then all of this would go a lot faster. It wouldn't necessarily take 15 years. It might go in half that time or whatever On slide 16 on the left is the unemployment rate."
"Unknown","01;27;52;27","01;28;22;21","As I mentioned, it starts at about 7% in the county. And you can see that after about 15 years, the county achieves full employment so that all works well. The lead is generating jobs, and whether they're nonprofit jobs in the nonprofit sector or for profit sector, the unemployment rate, everyone's being engaged that wants to be engaged. Now, keep in mind that a certain percent stay out of the workforce and it just shows a typical percent, whatever that was."
"Unknown","01;28;22;21","01;28;49;18","36% or something. So not everyone is working. Some people are doing other things in non-formal jobs or whatever term you might want to use that, you know, everyone's engaged somehow. People are actively engaged in their lives and in their community. But some people who are in the workforce, the employment rate is very low. And the unemployment rate in the club itself reaches its lowest level after ten years."
"Unknown","01;28;49;18","01;29;12;15","It just takes a little while for the rest of the country to catch up on the left, this is this is the before and after snapshot of what family incomes are. The upper graph shows the distribution from the census data on day one or day zero. And the bottom graph shows the same thing on the 28th year of the simulation."
"Unknown","01;29;12;24","01;29;32;28","And you can see that essentially everyone in the county, 90% of the people in the county are making the income target which is just over 100,000. So so it goes from a highly unequal income to a almost completely equal income over the period of 28 years."
"Unknown","01;29;35;17","01;30;24;15","Me Let me ask a question John. So I still see that between 350 and 400 there's still the 10% who don't join ostensibly because they would stand to those goals. Right. So how do you take this group. They don't, they wouldn't join a big just how do you take the other 90% and make their average value something with fewer people working productive jobs having a higher average than 80% that's below 100 K in the top graph if I understood the question it's kind of what do you do with the nine with a 10% who don't join and is there some kind of to their income somehow equalize over time or no like what happens."
"Unknown","01;30;25;00","01;30;56;00","Well let me just ask you again because they don't change so ignoring the 10% whose income does not change how do you take the belt the bell curve you know right side here which has an average below 100,000 and then by reducing the variance also increase the mean while potentially having fewer people with income generating jobs. Just how does the extra USD per year come into this system oh OK."
"Unknown","01;30;56;05","01;31;19;12","And again I'm not sure if I understand the question, but how does the extra USDA US dollars come into the system that's true balancing of the trade deficit. So that's how that new dollars come in that weren't there before. Right? So what, what the what this club is doing essentially is adjusting its trade balance with the rest of the world such that it's getting its fair share of dollars."
"Unknown","01;31;19;21","01;31;50;12","And the dollar income of the club equals the average dollar income of the of the US at the end of the simulation. Did that answer your question so it's predicated on basically locally positive economy that's generating a trade excess to get more USD because you need more USD to pay that number of people 100,000 versus between zero and a hundred thousand."
"Unknown","01;31;50;26","01;32;15;10","And so even though you are making potentially productive jobs, fewer are not in the workforce. There's so many more USD coming in that we can raise the income for them and everyone else. I'm just saying that that that's built in right that's built in. Yep. That's all of them. Yep. Yep. Now you're not what I thought you were originally asking is what do you do with the other 10%, what happens to them we'll talk about that in a moment."
"Unknown","01;32;15;10","01;32;45;10","But I'm going to argue that their incomes actually fall towards this, this plateau of around 110 two and I think social pressure and social pressure would ensure that that would be one, that would be one thing. And there's some other reasons to well we might as well talk about it now since we're on the topic. So so whose so so let's suppose that I own some corporate I own a franchise of a corporate mission and let's say McDonald's or something could be anything."
"Unknown","01;32;45;28","01;33;09;25","And I'm, you know, I take in money from the local community. They spend money to buy my food, but then I sending money outside of the community because I'm paying, you know, franchise fees and other things, corporate fees and other things. So some of my money is leaving the community. I'm paying low wage workers. And that's what makes this whole model work, is that I can get low wage workers to, you know, sit behind the counter and make hamburgers or whatever."
"Unknown","01;33;10;22","01;33;29;10","Now, what happens when there's no low wage workers to choose from? Like everyone's joined the leader. Everyone who I would have paid 30,000 a year or 40,000 a year is now making 110,000 a year. Where does my workforce come from? How is my business model? Can I even function if I don't have a low, low income pool to draw from?"
"Unknown","01;33;30;08","01;33;56;20","So I'm going and my business model is going to be strained to say the least. It won't work very well. It's changing the game, it's changing the foundations of how the normal business works in the world. So not only not only would people not be relevant because because the leader would be paying higher incomes, higher wages. But, but those people should be enjoying their jobs a whole lot more."
"Unknown","01;33;56;20","01;34;22;24","They would be they would understand that they're helping the community by working in the bakery or wherever they're working. It's part of a community effort to raise the fitness of the community. Right. Like we're all in this together and it's and it's and I'm getting a voice of decision making by becoming a member. So there's lots of reasons I would want to be a member and very few reasons I would want to be a low paid worker at McDonald's or anywhere else."
"Unknown","01;34;24;03","01;34;49;23","And that's that's another reason. And the third reason is there's the IP, the commons that I mentioned earlier. And so there's all these, you know, the leader has now funded all of these new businesses. Some are technical businesses, some other businesses. But there's all kinds of property being generated, in particular intellectual property that that is shared among the membership among the club and maybe even between clubs."
"Unknown","01;34;50;13","01;35;18;28","So suddenly there's this enormous advantage to to principal business or to a to a member businesses to becoming members, because you get this, you know, this volume of free intellectual property and the standard businesses that are outside of this do not have access to that. You know, they have to pay pay royalties to get that, you know, IP stuff."
"Unknown","01;35;19;14","01;35;44;08","So that's another reason. And I think there's actually still one more reason that I can that I had heard. I want to talk about well, a successful overcome to be a successful community would have many leverage points and many ways to draw income in. And an unsuccessful a community would have no one wanting to help them except for the U.S. government paying USD, which I also saw in the model right."
"Unknown","01;35;44;09","01;36;17;17","That the USD is providing by the government. So it's like welfare at the country level and also at the community level. Yeah. Yeah. So imagine that's a good point and imagine that in affects, say, a county, you go over the county level governance or state level governance or even federal governance what if it didn't have to pay it like all this unemployment insurance and all these other things, the fees that the government has to pay, you know, when people are when people need help, right?"
"Unknown","01;36;17;20","01;36;40;29","All these programs and the and all of it is being taken care of at the community level by by leaders and clubs like leaders. So the so there would be actually like in that sense, you would expect that local, state and national governments might actually like this concept, you know, because it's reducing their liabilities. You know, that's especially at local government."
"Unknown","01;36;40;29","01;36;58;07","The local as I said, local tax revenues are double in this in this simulation. So, you know, the county government might go like, hey, good idea. This is this could work. This is a great idea. And then the individuals might say, hey, this work, this is a great idea. I'm on it. My income is going to double great."
"Unknown","01;36;58;07","01;37;19;17","Fantastic. I'm just a bit of an income obviously with this. The lower your starting income, the more you benefit from that. So if you happen to be someone that they zero where your family income is fairly low, your ERs is going to have the greatest rise compared to someone who's already making say mid level income or something. But it doesn't matter."
"Unknown","01;37;19;18","01;37;48;25","It is like the rising boat catches everybody by the time it gets up to the up to the plateau after 15 years similar results on slide 17. On the upper left hand corner, you can see how much money is circulating in this Sebas. And I want to emphasize again and that this is a community of 100,000 people. This is a small community, right?"
"Unknown","01;37;48;26","01;38;12;22","So this small community is now circulating 6 billion in currency annually. That's 6 billion that it has to choose about like what jobs to Ukraine. What, what what nonprofits do we support? What do we want, what kind of parks do we want? What is the road quality? How is our hospital system? Whatever decisions this community needs to make, it's got 6 billion in currency to play with."
"Unknown","01;38;13;05","01;38;24;16","So an enormous amount and that should be enough for the community to make whatever choices it wants. As far as what are we going to do? How are we going to get there? Are we going to improve our quality of life?"
"Unknown","01;38;29;09","01;39;01;01","And maybe just off note, I would mention again, we've already said this, but there's no club that's a that's an entity in and of itself as clubs start to form and and develop, that would also be along with the networks of clubs that are forming and developing that are also a cognitive system. So the cognitive system is playing that cognitive architecture is playing out at the local level, at a club, and it's playing out between clubs as clubs need to make decisions about how they're going to solve larger problems."
"Unknown","01;39;01;01","01;39;12;26","Right. So so again, no club is in this for its own good and only its own good. There's this is a you know, clubs are connected. This is a greater good project."
"Unknown","01;39;14;29","01;39;49;22","The bottom left, these are how the workforce gets divided over time. So on day zero, most of the workforce is in the regular state businesses almost 1990 7% is in a regular standard business. A little bit is in the nonprofit sector and obviously zero is in the principal business sector. But after after the period of 28 years it achieved some different amounts of its workforce and I just want to say again that whatever balance there is, it's a balance that the community chooses in advance, right?"
"Unknown","01;39;49;22","01;40;20;24","So this just didn't play out by itself. These are baseball these are all based on community decisions all along the way. Like we want this community wants to achieve a 50% to split its workforce 50% into the nonprofit sector or 40% or 80% or 90% or whatever it wants upper right grab or the donations made to nonprofits. These are dollar donations apart from CVS and just using a like a fraction of income goes to donations like a general fraction."
"Unknown","01;40;21;04","01;40;42;24","And you can see that donations to local nonprofits more than double. So you know, this at least in theory, this whole system is like a boon for county governments. It's a boon for the nonprofit sector, it's a boon for the education sector. And then everyone else's income is going up and unemployment's going down too. So like who loses?"
"Unknown","01;40;43;01","01;41;23;08","The only people that are losing from this whole thing are the people who hold hold enormous economic power on day zero. You know, like those people aren't really gaining from this. And if lots and lots of clubs were to have, you know, lots and lots of cities were to implement clubs and this actually happened in scale, you know, distributed at scale, then the real losers in a sense would be those who are, of quite, you know, quite wealthy to begin with, like billionaires or multimillionaires, because their income, their incomes would probably drop, as I've mentioned, over time, only because of social pressures and because they can't get people to work in their businesses and things"
"Unknown","01;41;23;08","01;41;47;15","like that. But at the same time, everyone's well-being increases. So it's not like anyone loses. Everyone wins here, like the truth. The world is you know, all communities are more empowered to solve their real problems that matter. This is the cognitive system aimed at achieving sustainability and thriving into the future. So there really isn't anybody that loses from this."
"Unknown","01;41;47;15","01;42;10;24","There's just some apparently losers, you know, and not very many of them at that the lower graph on this, I won't say too much. I'll just explain the blue line there. This is the number of tokens that are generated by the community. So obviously in the early years, for the first 15 years, you're generating tokens because you're growing in this growth period."
"Unknown","01;42;10;24","01;42;33;14","And then after that you have the tokens are just circulating and importantly, they don't circulate outside of the membership. So if I'm a standard business, there's no one can say, oh, that's the other reason why why my clubs would and club businesses would grow is that if you're not a part of the club, people can't spend their tokens at your establishment."
"Unknown","01;42;33;23","01;42;54;15","So I might be a local business and I don't want to participate in this. Fine. If all goes as it goes. But everyone else is. Incomes are increasing. Part of that income is in tokens and those people can't spend their tokens. At my establishment. The only way they can is if I join the buy, join the club, then they can spend their tokens at my establishment."
"Unknown","01;42;57;22","01;43;22;15","Uh, page 18. And I think this is the last of the results I was going to show. This is the results just for the local government. This is tax revenues for the local government. The red is the tax receipts. So for this for this Lane County, it is estimated that it starts at about $1,000,000,000 annually in revenues and it does more than doubles by the end of the simulation."
"Unknown","01;43;22;15","01;43;40;02","So their tax revenues go way up. And you can imagine what counties would want to do with their revenues. Tax revenues double. And you can imagine they could put that to very good use uh, OK, then just some final remarks on these last two slides."
"Unknown","01;43;42;06","01;44;20;02","And this this first one is something that we just we're touching on what happens to the other 90% that don't join the leader. So I would argue that in the long run, even that 10% that has very high incomes would see their incomes move closer to the two, the income of the the target income for the leaders. And that's for all the reasons that we just said that the business owners don't receive the benefit of tokens because they can't accept tokens, their social pressures to belong to the club because it's in everyone's benefit for people to belong to the club."
"Unknown","01;44;20;19","01;44;42;07","And so the IP is there's an output by people that people have access to if they join the club. And so like a number of reasons, maybe there was one other we talked about. So you would think that, you know, this is the new, you know, like if this is happening then it's it's like who who uses a typewriter anymore, right?"
"Unknown","01;44;42;21","01;45;05;26","Hardly anybody. It's because computers work better for typesetting and this is a technology to marry. And it's another way to say that this is a technology, this is a decision making technology, and it's both a soft and a hard technology. Education is part of it. There's you know, there's all these components to it, but it's technology. And, you know, that's what happens in the world."
"Unknown","01;45;05;26","01;45;36;10","And new technology springs up. It's it's far better than the old one. And then suddenly the old one is toast. Well, the old one comes into conflict at a higher level. So you could have different chains that are competing. So the idea that still one part for me is that just thinking about evolutionary transitions and individuality, it raises the level of conflict to another level up from what we've seen before with everything that politically and game theoretically would come with that."
"Unknown","01;45;36;18","01;46;03;05","And the second piece is I don't update my priors based upon models without parameter sweeps. So it's hard to look at a given layout and imagined, but it's something that we actually use as a North Star for people who are on that political journey. They might see that as beneficial. But as you're pointing out, people who don't see it as beneficial are not going to join until the incentive structures are restructured for them or that will happen."
"Unknown","01;46;03;26","01;46;23;25","Yeah, absolutely. And everyone's learning from this. So, you know, the communities, the world is learning from this, right? And the world is learning over time. Whether this is even a better idea or not is this whole system work? And obviously if it doesn't work, if it doesn't produce these benefits that are that are that are expected in advance, if it doesn't do that, then it doesn't work."
"Unknown","01;46;23;25","01;46;48;02","And then no one would join because it's a stupid system. Right. Or has flaws that need to be fixed or something. So, yeah, everyone's learning together and and there could be numerous trials going on of different systems at the same time. And, you know, try it for the world. Everyone can be trying to figure out what works best in this, what kind of systems work best and yeah, all of that's happening."
"Unknown","01;46;48;02","01;47;13;22","It's evolving as as we know it's evolving. But the important thing is, is that this is a framework to facilitate societal cognition, you know, at the local level, at the club level. And if we think of our societal systems as cognitive systems, then it's a perfectly reasonable question to ask what kinds of system designs work best? And that's what this whole R&D program is aimed at."
"Unknown","01;47;13;22","01;47;41;25","Just asking the question of all conceivable designs, which kinds of the designs might most facilitate title cognition and therefore achieve the intrinsic purpose of a of a society which is to thrive now and in the future. So what this means and you can imagine all kinds of trials to get help answer that question next slide and this is the last one, just a few remarks."
"Unknown","01;47;41;28","01;48;02;13","I've touched on this already, but but an organism is agile right to like I have. Among other things. I have legs. I can run from danger. I can do things, I can change my behavior as a community. We can we can change our behaviors. We can we can do whatever we need to do to achieve whatever task is in front of us, or at least achieve most tasks."
"Unknown","01;48;03;03","01;48;25;06","But in particular, a leader is agile like it is flexible. It can choose what jobs it funds. And suppose that, you know, ten years into a into a new club, some big thing happens or some new challenge that wasn't anticipated it just arose. Well, this is decision making under uncertainty. That's the whole concept of this. Like this whole system facilitates decision making under uncertainty."
"Unknown","01;48;25;15","01;48;52;17","Something new has happened. Now it has to the community has to respond to this new set of conditions. It can change its makeup of what businesses it funds, what organizations it funds, who does what they can. You know, it can change the how many people work in the nonprofit sector versus for profit sector. It can essentially use it can vote to to focus its attention and its resources, human and otherwise, on whatever problem it needs to focus its attention on."
"Unknown","01;48;52;17","01;49;16;14","So it's agile by design and part of that by the way, is is having fairly equal income. So in our native system, if I'm a billionaire, it is really hard for the society to allocate my billions of dollars for some worthwhile project. Right. Because because of the, you know, the private property laws, that's my private property. And you can't use it."
"Unknown","01;49;16;14","01;49;52;19","Right. But if everyone's income is equal, then then everyone is participating in that redistribution of attention and resource is to whatever problem is important to the community. So the community empowers businesses with with funding, for example. And it's important that it can retract that support when necessary. So the the design of this whole system is such that there that things can change rapidly if need be, and the community can redirect its attention to whatever problem it needs to address."
"Unknown","01;49;53;28","01;50;28;21","Again, the next one there is that the main resource is not money, it's human, it's human attention and energy. And also, to some degree, natural resources. But the real purpose of money is simply to to allocate human attention and human energy and resources into those problems that actually matter and then lastly, again, the leader can because of its agility, because the members are choosing what kinds of jobs to make, what what sorts of businesses what sorts of right, what sorts of the autonomy it wants."
