"Speaker Name","Start Time","End Time","Transcript""Speaker 4","01;18;31;22","01;19;00;20","And then, you know, culture is really useful. Cultural norms are really useful or can be useful. They can draw our attention to things in the world that are most important and help us to avoid danger. And, you know, a healthy culture is is a part of cognition. It's a way to offload my cognitive burden onto the, you know, the history of this culture that has learned as it has gone through life what works and what doesn't work."
"Speaker 4","01;19;00;20","01;19;31;20","You know, so so so all you know, it is good that that it say we had a large club with cultural multiple subsets of cultural subsets in it. The the again, the purpose of the club is societal cognition. Right. And we should have ways to measure if that's functional or dysfunctional both in are we achieving equality of high quality of life."
"Speaker 4","01;19;31;20","01;19;55;05","Are we, you know, are we are we is our uncertainty about the future high or low or how are we doing and so so part of that is in engaging with cultural groups of subsets, you know, within a within a club or within a community. Right. The idea of all of this, what, you know, like what is the idea of cognition?"
"Speaker 4","01;19;55;05","01;20;26;28","Well, cognition requires communication. You know, there's no that cells in the brain don't function if there is not communication that's going back and forth. Rich, rich communication, right. So we can beside as a as a as a group, you know, we can we can we can we can study different kind of designs for systems. We can measure their success we can you know, we can we can apply a kind of a scientific method to come up with good ways to ensure that we're we can all thrive."
"Speaker 4","01;20;27;12","01;21;03;08","But part of that is also in allowing for and providing for and facilitating the communication between group associations that are subsets of any club or any society. Right. I mean, the idea has to be communication and in a cooperative sense. Right? Or else there's no cognition to begin with, you know, then you just have rules and it's who get God knows who made those rules in the first place, you know, so we're just all we're doing is just, just let's just look at how cognition works and let's be honest about it."
"Speaker 4","01;21;03;08","01;21;39;03","Let's be transparent about it. Let's, you know, let's just peel back the covers and see how social cognition works and see how cognition works in, in biology and learn what we can learn from it. And let's bring the richness of that out and make it all transparent and fair. So that allows for subgroups to have cultural differences then that's important because cultural, you know, cultural subgroups will have a different perspective on how to do things or what's important to where we should focus our attention."
"Speaker 4","01;21;39;03","01;22;01;09","You know, that's all good, right? As long as as long as it's set up such that we're all able to openly communicate and tell our story and tell our narrative, whether that's as an individual or whether that's as a cultural subgroup. You know, there's a narrative to expressed. There's concerns there's desires, there's needs. You know, again, humans are very complex organisms."
"Speaker 4","01;22;01;09","01;22;30;13","We have very complex needs. And all of those, you know, all the core needs need to be fulfilled. Then we're ever a healthy society. We build, you know, the need for association, the need for love, the need for helping each other. Like we, you know, we want to help each other. We have to address all of that. And it just has to be open and transparent and openly discussed about what we're doing and how this works and how people, you know, how these tools and approaches facilitate cooperation and cognition or hinder it."
"Speaker 4","01;22;30;22","01;22;32;15","You know, that's the experiment."
"Speaker 1","01;22;34;00","01;22;40;08","Thanks, John Lee. And then anyone else with the question yeah."
"Speaker 2","01;22;40;08","01;23;15;14","I think this is a related question. I'm just going to read out just one thing from your paper, actually. So in this paragraph, you you say in a second order approach to actually print and emphasize if a society understands itself as a cognitive organism, if it understands its cognitive processes, reducing uncertainty for the purpose of achieving a sustainably maintaining vitality and understand its social systems of the cognitive architecture, then given those beliefs, what kind of societal systems might it develop and employ?"
"Speaker 2","01;23;16;06","01;23;33;27","And so that got me thinking, is that all those beliefs prerequisite for everybody in the club. Does it need to be that level of shared understanding or can it be just held within a kind of a subsystem? You know, is that something that perhaps the the scientists who are doing the simulation?"
"Speaker 4","01;23;33;27","01;23;58;01","It's actually a good question. Now, I think we should allow that if this R&D program were to go forward, that, you know, it might start small and focused and it might be a focus group involved of those people who are interested in this kind of thing. Right. And if it started to work and, you know, proved to be beneficial to communities, then it might grow and other people would get involved."
"Speaker 4","01;23;58;01","01;24;21;15","And so we can think of this whole thing as progression. I think that's fair. That's the way it would naturally play out. And the you know, if the scientific community is involved in this and if the scientific community is involved in creating and helping to, you know, designing new systems, well, then there's going to certainly be a focus on the scientific viewpoint in order to do that."
"Speaker 4","01;24;22;10","01;24;47;08","Communities obviously would have their input into the R&D program. And, you know, it would be between the two, between the two, it would move forward. But I would guess, though, that early participants and early efforts would be focused, you know, would more or less align with what I have in the worldview paper, or else they why would they be interested in participating in the first place?"
"Speaker 4","01;24;47;08","01;25;09;01","You know, like they would maybe only be interested because they they can see some alignment with the goals of the program and the way the program is oriented and what it's trying to achieve. Right. So quite likely the early participants in this whole thing, whether they're scientists or community members, might be kind of more or less aligned with ideas in the world of your paper."
"Speaker 4","01;25;09;01","01;25;32;20","And and especially the purpose of, you know, the purpose of the club or the purpose of societal cognition. Now, suppose down the road, you know, 20 years from now, I live in Los Angeles, and there, you know, like I don't, I don't care at all about any of that stuff. I just want to live my life and, you know, make sure my I have a roof over my head and stuff."
"Speaker 4","01;25;32;27","01;25;53;23","But this club is up and going and is doing well and they're all there, you know, they're actually doing well. My neighbor is a part of it and his life is improved in some way. So like, I don't really I don't really, you know, like I don't I don't care about any of that purpose stuff too much, but I like what's happening, you know, like they got a nice scene going on there that's beneficial."
"Speaker 4","01;25;54;00","01;26;11;28","So I'm going to join anyway, you know? And so to a degree, the culture of it would change, it would evolve, but hopefully that would be it would start with a certain kind of it would start in a healthy, functional way, you know, aligned with the purpose of the whole project. And then it would evolve the way it evolves."
"Speaker 4","01;26;11;28","01;26;37;14","You know, I would, I would guess that if it's beneficial, those beneficial ideas would continue to be the, you know, at its core somehow but how would exactly it evolves, you know, as as decades goes on and is, you know, 100 years from now, it's maybe, maybe, you know, if this exists 100 years from now and if it's spread widely, maybe we're using very different language to talk about it."
"Speaker 4","01;26;37;14","01;26;38;26","And we see it differently."
"Speaker 1","01;26;38;26","01;26;49;00","Perhaps Thanks, John. Now, as the author, it is up to you. Would you like to shift the second slide for today?"
"Speaker 4","01;26;49;24","01;26;51;29","Oh, these are awesome. OK."
"Speaker 1","01;26;53;05","01;27;12;03","Thanks to everyone in the chat and for participating because it's a conversation and John's initial inroads are tripartite and very provocative and we're seeing that play out. And so it's a great beginning to a discussion, even though it's our dot two video so job, where would you like to take it for the last session?"
"Speaker 4","01;27;13;20","01;27;36;16","Yeah, obviously there's a lot of ideas in this whole series. There's just a ton of ideas, both both superficial and deep. And if this goes forward, it's going to take a lot of discussion and it's going to take a lot of people involved to bring different perspectives to kind of bring this whole concept to fruition. Right? So we're just scratching the surface."
"Speaker 4","01;27;36;16","01;27;58;00","That's all we're doing and we're just putting out some of the big ideas. And then, you know, there's a ton of work that has to happen to make this real. So can you go to space for number four, four of some of the slides maybe and maybe slide 76."
"Speaker 1","01;27;58;26","01;28;01;18","View seven integrated components on slide six."
"Speaker 4","01;28;02;18","01;28;04;23","Six. Yep, yep. Seven Unbreakable."
"Speaker 1","01;28;05;03","01;28;05;16","Awesome."
"Speaker 4","01;28;05;18","01;28;32;17","OK, so maybe in the last little remaining time we'll just touch on this little framework of the simulation model that I put out. It's really the the idea of the leader is more than just an economic system. It is actually the idea of it is put out in the Bay. And in my book Economic Direct Democracy talks about the whole picture, the larger picture."
"Speaker 4","01;28;32;18","01;28;58;05","But there is as you can see from the slide, there's seven components to that. And and they really touch on all six overarching systems that I talk about in the series. So economic governance, legal and political education and health, it's all in there somewhere. So the idea of the leader that's local economic, direct democracy association the idea of the leader leader is an integrated framework of cognitive systems."
"Speaker 4","01;28;59;23","01;29;37;28","The simulation really focuses more just on the economic aspect because that was the it really was just the easiest piece to pick up. First and that the value in particular focuses on what I call the token exchange system, which is the first three in the list. So there's a talk token is a is a local digital currency so that the community creates and uses there's the token monetary system, there's what I call the crowd based financial system, and there's market system, local markets, people sell, you know, traded goods and sell them in local markets."
"Speaker 4","01;29;37;28","01;29;59;29","They also obviously sell distantly to people who are either in the local area, but not a part of the club, but also far distant that are not a part of the club. So those first three things constitute the token exchange system. And we'll just maybe talk a little bit about the same relation and some of the results and how that works."
"Speaker 4","01;30;04;00","01;30;37;11","Maybe Slide eight. Yeah. Yep. So in the simulation, there's five aggregate agents. There is organizations, persons, crowd based financial system, local government, and then the rest of the world, which I call rest of counties, that the data for the simulation, the initial data was from the US Census for Eugene, Oregon, relatively small community, small county, population, 100,000 or something like that."
"Speaker 4","01;30;38;04","01;31;09;12","And and I used starting income values from the census data for Eugene County and from 2014 or something like that. This paper was published I believe in 2014. So I probably used a little earlier data to get things rolling OK, so the, the simulation just really illustrate it. It doesn't, it doesn't predict how this system would work. It just illustrates my thinking about how a system could work."
"Speaker 4","01;31;10;01","01;31;39;18","And in particular, I wanted to, I wanted to design a system that would, that could bootstrap itself up without a large influx of cash or other things from outside. So that was part of the idea of how can a system bootstrap itself up, start with very little and grow from there. And the second was I wanted to create an economic system for the for the club model where over time incomes became equal, income, income and wealth equalized."
"Speaker 4","01;31;40;05","01;32;22;27","And the the thinking there is that money and in the and, you know, the whole economic and financial aspects of that really is part of the cognitive community's cognitive system. So we're using money as a very transparent voting tool. It's like votes in for patients carrying information about people's desires and fears and everything and uh, yeah, so that's, that's I wanted to show that using a stock flow consistent model agent based or stock flow consistent model, I just wanted to show that the numbers add up correctly, right?"
"Speaker 4","01;32;23;10","01;32;44;09","Like, I'm not, I'm not, I'm not creating dollars out of nowhere. There's like there's a logical way this plays out and all the numbers add up there. If there's a flow from one agent, one of these major agents, there's a, you know, there's any flow from one agent, go somewhere just doesn't disappear."
"Speaker 4","01;32;46;15","01;33;11;10","So very briefly, the the lines in blue are the flow of tokens and dollars so a community is creating tokens as it grows. As it grows, it creates more tokens. The concept is that the value of a token would be sort of it's sort of equivalent to the value of a dollar and it's made to be done inflation inflationary."
"Speaker 4","01;33;11;10","01;33;35;11","So let's just just say for 2014 it was the value of a token is the value of a dollar purchasing power of a token is that of a dollar in 2014 and the community would create tokens a little bit the first year or little bit more of the second year. More people get engaged as more use for tokens as is more ways to use them in in the local markets."
"Speaker 4","01;33;35;11","01;34;04;03","Then there would be more tickets tokens created and and the and the and the volume of tokens in the local community would grow and salary for those who are members of the club salaries would be paid both in tokens and dollars. So maybe in the first year you would just get a few top tenants and then over time your share of tokens in your wages would go up and the same would be true."
"Speaker 4","01;34;04;03","01;34;25;18","Even if you're just say you yourself on the business, you know, people you would sell your if you're a member of the community would sell things to other members of the community and they would pay you in both dollars and tokens. I'm using dollar as the national currency. So organizations just to look at the blue lines again, organizations pay wages to persons."
"Speaker 4","01;34;25;18","01;34;52;27","The persons might be employed or unemployed. I also call the unemployed not that there's some people who are unemployed or not in the workforce. That's what the work stands for. And people who are members who receive dollars and tokens as part of their wages and part of their income would naturally they would have to contribute a certain fraction to the crowd based financial system."
"Speaker 4","01;34;53;27","01;35;16;01","And that's the blue line for contributions to the CBC and the scene from the CBC. If I'm an organization or I'm an individual and I have some idea to start a business, or I need I need loans for my business or I'm a nonprofit and I want grants, I can go to the CBS and apply for a grant or or a subsidy or donation."
"Speaker 4","01;35;16;24","01;35;42;05","And once as a person, once my once some of my currency is in the DFS, I more or less get to decide how that money is used. Like I want to support schools or I like this idea of a new light bulb. I like that. I like that this business idea that this person came up with, I'd like to give them a subsidy or I'd like to give them a loan or a donation or something like that."
"Speaker 4","01;35;43;04","01;36;13;24","Again, this is all very transparent. And again, as time goes on, incomes become more equal so that when because incomes become more equal, everyone has equal amount of power. And the CDF asked to direct how the community spends its money the green line ends in this figure. Our dollars and obviously you have to pay taxes in dollars. The government's not going to accept tokens."
"Speaker 4","01;36;13;24","01;36;43;05","So you pay taxes in dollars. The government also provides some income support for people who are unemployed. That's natural normal. The government also provides some grants and contracts and subsidy is to organizations. That's quite normal. And organic organizations that are members also have to deal with the outside world. They have to sell their goods and exchange goods and services using dollars."
"Speaker 4","01;36;43;06","01;37;08;23","So there's the green lines so that's how the basic system works. And then I and then as this, this the system evolves over a period of 28 years in the simulation and I'll show you what the results are as this everything goes round and round. We're not going to have, we only have a few minutes left. So I'm going to kind of have to just get to the point here there's some options on the next slide, which I can ask."
"Speaker 1","01;37;09;23","01;37;17;06","Which of these agents are active inference agents or where does active inference come into play? Or could come into play with later versions of this simulation?"
"Speaker 4","01;37;19;24","01;37;56;09","OK, so again, the the the leader framework is an integrated system that has a governance component. The governance component has a legislative component, and all the major six overarching systems are addressed in some way. I'm only simulating the economic part right. So so if you were in a real club and a real club looked anything like the leader, there would be a governance system that you would be participating in some kind of collaborative governance system to help decide what should happen in the community, the building legislative system and legal system and so on."
"Speaker 4","01;37;57;04","01;38;28;14","Education system and everything so that's one way that active inference would be involved just in the process of decision making under uncertainty and in the in this particular simulation, you know, obviously businesses are having to make decisions and choose choose what they do with their resources. So that's another way that cognition is happening. And then the maybe the main in this economic picture, maybe the main agent is the CVS."
"Speaker 4","01;38;28;26","01;38;53;17","That's a that's a financial system where everyone is able to participate in a transparent and democratic way to fund those things that they think are useful to their community that create the kind of jobs that they want to create, you know, do as a community. Do we want lots of nonprofit jobs? Do we want for profit jobs? Do we want jobs in the manufacturing center?"
"Speaker 4","01;38;53;17","01;39;20;09","Do we create manufacturing sector do we want like do we want to support this kind of business? Do we want to support that kind of business? These are all decisions that the community makes through the CVS. And then you know, if if the community decides like, yeah, we want this bakery, this would be great, or this bookstore or this soup farm or whatever it is, then the community can, you know, associate within the CBN first and say, OK, here's a thousand of us."
"Speaker 4","01;39;20;09","01;39;29;17","We like this idea for this farm. Here's funding for it. So, you know, go for it. So active inference particularly would be happen in the CVS."
"Speaker 1","01;39;31;04","01;39;33;17","Yes, even a question. And then anyone else with a question."
"Speaker 5","01;39;35;29","01;40;04;15","I suppose in a way you've seen a mix here between like in the in the red boxes, you can have active inference that dynamic or non-linear systems of inference. And then you've got this message passing, which to some extent is that in the aggregated system, the sort of steady equilibrium system, ie the pile of money or the spreadsheet and a message passing where data goes from one to another."
"Speaker 5","01;40;04;15","01;40;27;06","But then within that, there may have to be another process of inference that happens assuming people have any agency and it's not just all automated. So it's like to me, that's probably where you've got system dynamics in that diagram. And then you've got these inside that nonlinear dynamical systems, i.e. the inference processes embedded in inside. Yeah."
"Speaker 4","01;40;27;23","01;40;45;08","There obviously is a lot going on there that we're not going to have time to talk about because we have like 5 minutes left or 10 minutes left. But but just to give you one example of that, suppose that a group in the community wants to create some kind of business and they want to produce some kind of product, right?"
"Speaker 4","01;40;45;29","01;41;05;15","So they come to the city and say, Hey, we want to make this new thing. Well, a lot of information has to go back and forth right this is an information rich system. So so I want to if I'm going to, if I'm going to support this with my resources in the city events, I want to know where you get what you know, where are you getting the raw materials?"
"Speaker 4","01;41;05;22","01;41;27;08","How is that impacting the environment and how is your product going to improve or harm? My sense of community or any one of the metrics that we're measuring, how is that going to is there any pollution? How are you going to deal with your ways? How much energy do you need? Do we have that level of energy like electricity or whatever as a community?"
"Speaker 4","01;41;27;08","01;41;47;18","Do we have that resource? I mean, there is an enormous amount of discussion and information has to flow between these different parties in order to make the kind of decisions that, you know, intelligent decisions that you would want to make in the CBN. That's OK. So in the few minutes time we have remaining, we could turn to slide 15, please."
"Speaker 1","01;41;48;12","01;41;49;05","All right. Go for it."
"Speaker 4","01;41;50;02","01;42;22;19","So these are some of the results that I should say that some of the right at the get go as a community is forming, as a club is forming, you know, they would be choosing their trajectory. They would be and in this upper left hand corner, as an example of that, they would be choosing that they want income to rise to a certain level over time, that they want participation to happen in this club at a certain rate over time."
"Speaker 4","01;42;23;09","01;42;45;06","They want to they want in particularly the lower lower left there, they want the income target to rise at a certain rate over time. And obviously, you can't you know, like you can't just flood a community with money on day one and expect that to work because there's no the same whatsoever to say with digital currency because there's not a place to spend it."
"Speaker 4","01;42;45;10","01;43;09;24","Like there's, you know, it's a tool for voting. And if there's no place to vote, the tool is useless, right? So that's partly why things grow slowly over time so that there becomes outlets for using the currency. You know, to create the kind of economy and economic system that the community wants. So some of these things would be decided ahead of time."
"Speaker 4","01;43;09;24","01;43;29;17","But here's what we want is a trajectory. Here's what we're here's what we're doing as a community using the system. This is where we're going. This is what we're going to do. This is how it works. And if we all cooperate in this way, that's exactly how it's going to happen. You know, that's that's the concept is so it's not just here's a system use it however you want."
"Speaker 4","01;43;29;17","01;43;50;15","Let's see how it goes. It's really more you know, we we're a community that we have a goal and here is how we intend to reach our goal. We want, say, for example, we want incomes to rise to a certain level over time. And this is, you know, can this system do that? And if the answer is yes, well, then here's how we're going to do it."
"Speaker 4","01;43;50;15","01;44;06;21","We're going to increase it a certain amount every year and it's all going to work out. And so in that sense, some of this should be no there should be no surprises for the community as they do a field trial. It should be working exactly the way they intended it to work, bringing them where they want to go."
"Speaker 4","01;44;07;02","01;44;28;07","For example, when you drive a car on a trip, you know where you want to go. If you're halfway there, if it's a two day trip and on day one, you're halfway there, then you know your moving in the right direction. It's all going just where you intended to go. OK, so on this slide, I may be on the lower right hand corner."
