"Speaker Name","Start Time","End Time","Transcript"
"Unknown","00;00;10;06","00;00;41;29","Hello and welcome. Welcome to Active Live. We're in livestream number 21.04 on April 27th 2021. And today we are in the fourth of a series of conversations with John Blake so John, it's been really awesome to get to know about you and your ideas and work with you on these jam boards. So as I sort of set things up for a second and share the jam board, link with the live chat, go ahead and just recap us up and then I'll meet you on the first slide in just a minute."
"Unknown","00;00;43;16","00;01;07;19","OK, sounds good. Thanks. Selma. My name is John Blake. I'm a courtesy faculty at Oregon State University, and the series of discussions that we've been having is on the is on a paper, a series of papers that are just published in the journal Sustainability. It's a three part series. The topic is, well, the title is Science Driven Societal Transformation."
"Unknown","00;01;07;22","00;01;37;19","Parts one, two and three. So we've this is our fourth get together here, and we're just finishing up our discussion of the last in that series, part three, which is the subtitle design. And we we covered quite a bit in that in that paper, part three. But now today we're going to focus on just one aspect of that, which is the leader framework Local Economic Direct Democracy Association framework."
"Unknown","00;01;38;02","00;02;07;24","This is a I'm I'm a prototype of design for a new societal systems and as a reminder to listeners, we're talking about the deep, the de novo design of new system systems, specifically through using a club model. So the societal systems for a club, the club is a is a small community somewhere something larger than, say, a thousand volunteer participants."
"Unknown","00;02;08;22","00;02;56;14","That's how the in the series itself proposes an R&D program and that's the strategy for change. And the R&D program is new systems are tested at the club level, the community level in cooperation with the global scientific community is working on the technical aspects, and then field trials occur at the club level. And if the if the new systems deliver as promised and they promise substantial improvement in social and environmental quality, economic security and various things like that, then the the idea is that the club model would grow and spread and spread to new locations and new testing and new trials and eventually would spread spread near on a near global basis."
"Unknown","00;02;58;03","00;03;42;28","So are we on slide one yet? We're ready on slide one. OK, so that's our that's just our list of discussions we've had. You can check out the links there for the previous YouTube videos and slide two if you would go there yep. Is that just where or just where to go for more information? So the my website for this project is called Principal Society's Project Dot org and it lists the gives links to the series, get some background information actually has a on there is a live or interactive model of the leader framework."
"Unknown","00;03;42;28","00;04;10;29","So so part of what will be a big part of what we'll be talking about today is actually on the website if you want to run them out yourself. So there you go there for more information and then third slide So today's topic again is the Leader Framework, Global Economic Director Accuracy Association. These are ideas from my 24 2014 book called Economic Direct Democracy."
"Unknown","00;04;11;27","00;04;52;03","That book is available for free on the website or if you want to spend money you can go to Amazon to buy it. There and along with that book, I published a simulation model of later framework or at least parts of the leader framework and that is in the Internet Film Term Journal of Community Currency Research. So it links are there for that and again all of these links are available on the Principle Project website OK, so now why would I want to discuss this slide four?"
"Unknown","00;04;52;15","00;05;29;13","Why would I want to discuss the leader framework in this three part series? A few reasons. One is that the leader, the design of the leader framework, maybe I should say that the leader framework is intended as an integrated societal systems architecture or what I've been calling it, cognitive architecture. The the idea behind this whole series, behind this work is that a society large or small is a cognitive organism, and it's societal systems which for example, economics systems, legal systems, governance systems, et cetera, act as a cognitive architecture."
"Unknown","00;05;29;15","00;06;07;12","So so when discussing the idea of societal transformation, my focus here is on creating new societal systems versus societal systems, innovate, design, so that they function as cognitive systems. They facilitate society, cognition, and this is the fitness based, evidence based R&D project. So the idea would be that you could assess how well some one how well one design is doing over another design."
"Unknown","00;06;07;26","00;06;35;09","And eventually communities could choose designs that function very well and are fit for purpose. All right. So the LEDA framework embodies the cognitive viewpoint. It also was designed to be implemented via the cloud model, which I talk about in part two of the series. That's the strategy for change. Number three is here. The reason is that it involves integrated systems."
"Unknown","00;06;35;15","00;07;05;18","So there's in the in the series, I talk about six overarching systems, legal governance, et cetera. And the legal framework integrates most of them. And finally, there's a published simulation model available, at least for the economic some economic aspects of the framework. And at the time, and I think that still might be true. This is the first semi realistic simulation of de novo system, a de novo economic system."
"Unknown","00;07;06;09","00;07;38;14","But I'm aware of number five all right. So I'll get into the summit. We'll talk a lot about the simulation today and a little bit about the, you know, the structure of the leader but let me just offer a few warm up thoughts the the lead economy is not like what we face in normal economy. It's it's it's fundamentally different."
"Unknown","00;07;39;10","00;08;10;18","And in particular, it is a democratic it is a cognitive architecture, as I've said, and it is deeply democratic and transparent. So in the in the lead economy money, there is money in both the national currency and in America, the dollar and a local digital currency that I call the token. So those two current forces are used as a voting tool in a highly transparent, fair and deeply democratic process."
"Unknown","00;08;11;10","00;08;35;25","And as we talked about last time, money is already used as a voting tool in our world. It's just that it is a non transparent, nondemocratic voting tool for the most part. Some people have billions of votes in the economic system and then other people have just, you know, a small number of votes. So the leader framework makes their voting function explicit and fair."
"Unknown","00;08;35;25","00;09;12;00","And democratic. The emphasis of the simulation we'll be talking about in a moment is on the economic system. But as I mentioned, the leader framework and compasses all or almost all six overarching systems, I know this this simulation is intended as a first step, and it is in Spain. It could be made more sophisticated and this so this first one simply looks at the economic aspects, aspects, because that was the simplest to do for me."
"Unknown","00;09;12;07","00;09;37;17","But so money is used as a voting tool and it's and voting occurs in two arenas. It occurs in local markets. So I buy some product from a from a local store, for example, local business. And it also occurs and in the financial system, what I call the crowd based financial system, and we'll talk a lot about that."
"Unknown","00;09;37;17","00;10;09;14","But essentially individuals contribute a certain amount of their income to the broad based financial system. And then once their money is in the crowd based financial system the CFPB offers, then they have they get to choose how that money is used. So in a sense, they get to vote for they get and offer their votes for how the community is what the community wants, what the community wants to fund, what kind of jobs the community wants to fund, and so on."
"Unknown","00;10;12;23","00;10;33;06","So if you had a if you had an economic system in which money was used as a voting tool, well, it would be fairly undemocratic unless incomes and wealth were somehow equal. So over time, the effect of the leader is to equalize income."
"Unknown","00;10;35;10","00;11;07;01","And I'll show you the results of that in a minute. The latest simulation runs 28 years. And as you'll see at the end of that 20 year period, everyone who has joined the club is enjoying an equal level of equal and higher level of income wealth. And lastly, the leader framework is designed to focus on motivations. But is there any new system developed in this R&D program?"
"Unknown","00;11;07;26","00;11;37;04","The goal is to have that system be fit for purpose. And as we've talked about the purpose of arts of society, the purpose of societal cognition, of the purpose of I should say, the implicit purpose of societal systems is to facilitate societal cognition and to and thus to ensure that the organism, the society maintain, achieves and maintains a high degree of vitality."
"Unknown","00;11;37;28","00;12;09;19","So so the any new systems developed should be fit for purpose. And, and if they're fit for purpose, almost by definition, they will facilitate cooperation, because cooperation and communication is a part of cognition. So the leader framework and what rewards barriers to cooperation and with the idea of that, that it makes cooperation so easy, that cooperation becomes the default behavior and it also focuses on motivations."
"Unknown","00;12;09;21","00;12;45;01","It does not reward people for non-cooperative behavior, for example, and that is in contrast to our existing systems, which which I call native systems in the series. But I in Native Systems, I and for paying my worker very often take advantage of new workers like the society would reward me greatly for that. And that doesn't occur in the leader framework."
"Unknown","00;12;45;15","00;13;15;25","Partly because income and wealth are equalized over time. That's the the part the motivation to participate in the economic system of a leader or call we can also call the club model is not personal gain, but community wellbeing, wellbeing of the larger organism financial support. Slide six there are these are the members of a club. Are you thinking spatially co-located?"
"Unknown","00;13;15;25","00;13;56;06","Are they remotely located? Yes. Locally in space. And it is it is perhaps possible to have a club that is distributed over over space. But I didn't start that way. I mean, that maybe could be something that's added later. But I'm focusing now. It's the easiest thing for me has been the easiest thing can be for me to focus on the local market, local area, but there's reasons why that the local you is important because many decisions are local, like who will pick up my garbage and where will that garbage go is a local decision."
"Unknown","00;13;56;06","00;14;26;24","You know, many of the decisions, many of the our quality of life is largely a local issue for example are my economic security is largely a local issue. And obviously being a speck close in space allows a greater opportunity for community building and gathering and seeing face to face and community communicating face to face and getting to know each other and building a deep sense of friendship and community that way."
"Unknown","00;14;28;04","00;15;00;18","But yes, in the future, communities might be extended in some way. And as a matter of fact, of the idea with the leader framework or the idea with the club model is that that the initial focus would be on developing the tools and systems for clubs for the project, and then that would land systems for club parks. So that would be by definition non-local, you know, non-local engagement because clubs might be in different areas of the world."
"Unknown","00;15;03;25","00;15;37;19","OK, so but right so there's in the bottom left of that slide over in the bottom left in that slide, I'm listing the six overarching system things that I talk about in the, in the series. And you can see you will see that all but is the leader. So I would, I would imagine that if this were developed further, that health would also be included but just having included it yet."
"Unknown","00;15;39;06","00;16;16;05","So very briefly to say this seven integrated components the first three I'm calling I call them collectively the token exchange system again the token is the local currency and it and it travels in parallel with the national currency with the dollar locally there's a token monetary system that creates and destroys token then is the crowd based financial system which I mentioned already that that to declare that CBS handles both the national currency and the token it it issues to local businesses and nonprofits."
"Unknown","00;16;16;25","00;16;44;18","It issues donations, interest free loans and subsidies. And these are all transparent through democratic decision making. And it also has a nurture arm that people contribute to and members contribute to and that nurture and provides income for not what I call not in workforce numbers. So when I say that the leader achieves income equality over time, I mean for every single member."
"Unknown","00;16;44;22","00;17;09;02","So you can think of it as every member family or however you want to think of it. But regardless of whether that person is in the workforce, not in the workforce, ill not ill employed, not employed in that sense, it's it's a little bit like a universal income only. It's very high income, same income that everyone is enjoying."
"Unknown","00;17;09;21","00;17;40;04","I'll show you that in just a minute. And then number three in the entity as a token exchange system is the market system. So these would be local, most local markets that are members and part of some of the new businesses that are developed by the leader would are called principal businesses, principal businesses. And that's a very special business model unique to the leader, kind of like a nonprofit, kind of like a hybrid between a nonprofit and a regular for profit business."
"Unknown","00;17;41;08","00;18;08;02","But number four, there's a property rights system that goes along with this. For example, a club, a leader would have an IP pool for intellectual property. And the and the club could also manage other properties, could manage real estate properties, for example, or any kind of property. So it would be Democratic decision making, you know, for property management."
"Unknown","00;18;08;02","00;18;32;11","Also, there'd be some restrictions on the sale of principal businesses kind of similar to non-profits, and that would be high transparency throughout. So the community would know if the community is using money as a voting tool, community would need to know where their what's happening with their votes, what's what was the you know, what are the choices that community is making with with money."
"Unknown","00;18;32;28","00;18;37;03","And so the flow of money would be highly transparent compared to today."
"Unknown","00;18;39;16","00;19;03;26","Number five is an information and incentive system. This would include, for example, village education programs, reputation system, the fitness and indexes that we've talked about which allow the community to understand itself how it is doing, what's going to happen next, how, how, what is the quality of the design that we're using? Could we improve our design? And along with fitness index is the last one."
"Unknown","00;19;03;26","00;19;28;06","There's computer and other kinds of forecasting and assessment methods that would help a community to understand what are the trends and how is the system working and how are we doing number six of the collaborative governance system, and that has three branches administrative, legislative and judicial. So that then covers the legal system. And finally, number seven is purpose."
"Unknown","00;19;28;06","00;20;11;11","And we've already talked in each of these discussions. We've talked about the the importance of purpose and how purpose the purpose follows worldview and an end to end design and metrics follow from purpose OK, so next OK. All right. So now we'll we'll spend most of the rest in this discussion on the simulation model. Because I think that that'll be most that will make the description of the different quotes clear."
"Unknown","00;20;11;20","00;21;07;20","And again, the, the, this is this is a first simulation and it's it's intended to introduce the, the legal framework and also this to describe some general concepts of token dollar use dollar as the national currency, if you don't mind token dollar flow. And, and it's the third aim of this on the left paragraph there is to demonstrate at least, you know, conceptually that income equality can be achieved, that there's some privatization of this model of you and some you can choose parameters such that this goal of income equality can be achieved at the end of the simulation that the simulation lasts for about 228 years I believe."
"Unknown","00;21;08;26","00;21;45;24","So this is not a this is not you know this the the concept behind the leader is that it bootstraps it's success that starts small it grows from there it injects like in the very first year maybe just a few members will will join and the leader injects a small amount of tokens as the as local currency into the economy and make some very small changes and then the next year there's another few people join it, make some bigger changes the next year makes another few people join and make some bigger changes still."
"Unknown","00;21;45;24","00;22;32;10","And the the growth of the leader occurs exponentially fast. So I would I would like to say that that the functions of the leader, how it how it works, how it achieves these aims, how it achieves income equality, for example. This would all be worked out far in advance before any real trial ever occurred. So what would actually happen is there would be, say, you know, who knows, hundreds or more of simulations or papers or at least, let's say a large number of simulation and papers on a variety of topics would be finished before any community was ever asked to participate in this so once that body of knowledge is developed, then perhaps the the"
"Unknown","00;22;32;26","00;22;56;27","the program would say, OK, what is there are there any communities in the world that would be interested in participating in a field trial? And if you did participate, here's the list of benefits that you might expect over say, a two year field trial. Income levels will increase. This is what's going to happen. This is this is how participation will increase."
"Unknown","00;22;57;01","00;23;18;16","This is you know, this the trajectory would be laid out through a variety of simulations. So everyone should know what they're getting involved in, what they expect from this. And and there should be no surprises from the field trials. Now, it doesn't mean that the community has no choice in their behaviors and what they do with the system."
"Unknown","00;23;18;17","00;23;46;15","They the community drives the system, but the system is designed such to achieve its purpose, right. Fit for purpose and. All right. So on the left there, I just want to emphasize this, that this simulation conveys broad, low level, low resolution design, good intentions, for an actual token exchange system. So I'm not predicting that a token exchange system would work like this."
"Unknown","00;23;46;24","00;24;20;05","This is rather a an illustration of the concept of the token exchange system in the legal framework. And obviously, this simulation can and hopefully will be followed by a large number of other simulations that are progressively more sophisticated. This is a but in many respects a fairly simple simulation and there is tremendous room to expand it and improve it but it's still useful."
"Unknown","00;24;20;15","00;25;07;29","And in particular, that's because I made the simulations stock flow consistent, which means that no no money is come out of thin air. It's all, all, you know, if money leaves one agent and then another agent receives it. So all the flows of money are accounted for. And just that alone allows one to say that, OK, logically, you know, logic, mathematically, this all adds up and I would lastly, I would say that this is a what I call a semi realistic simulation that is income level starting income levels resemble real income levels, tax levels, tax rates resemble real tax rates that's the initial conditions or some silly realistic."
"Unknown","00;25;08;28","00;25;43;21","But but again, the simulation is very simple. So I start with a semi realistic initial setting and then certain things don't change over the years, which is sort of the only thing that actually changes is just what is pertains to the lead itself. The members themselves. So if you don't join me in this in the simulation, if you don't join the leader over a period of years, then your income stays just what it was and that nothing really changes for you if you keep the same job and keep the same family and things just move ahead all right."
"Unknown","00;25;44;00","00;25;57;25","Yeah, yeah, please. OK, you can address it now or later, but what is the relationship between your simulation and game theory and what is the relationship between your simulation and active inference?"
"Unknown","00;25;59;25","00;26;49;21","OK, OK, so in a this is an agent based model, so that means you know, between the lines, that means that there are individual agents that make decisions of what they want to do. And that determines how the the history of the simulation goes in a highly sophisticated agent based models. The agents themselves might be very complex and they might make decisions about complex situations and since this is a just a simple introductory model, the agents are relatively simple like, for example, a family, and they make fairly simple decisions."
"Unknown","00;26;49;21","00;27;16;07","And the main decision they make in this situation is whether or not to become members in any given year. Does a family want to become a member? Secondly, they'll make a decision on how they what they choose a wage option which is constructed. I'll talk about it. So there's not very many decisions that the individual to make here so it is like a game theory, but it's a very simple game."
"Unknown","00;27;17;12","00;27;45;13","And later simulations could be made much more sophisticated. And in relation to active inference, I wish I might say that I created these the book and the simulation model long before I was aware or active inference ones. So what the book, neither the book nor the simulation model mentions the cognitive aspects. And that came a little bit later in my in my development and as the project developed in my mind."
"Unknown","00;27;46;20","00;28;39;29","But but one could easily imagine how active in what inference would fit into this. For example, you know, as I said, a community is considered to be a organism. It's understood as an organism, a cognitive organism. So just like every organism, it has to fulfill its intrinsic purpose, which is to maintain and achieve vitality and it and fit in the act of inference scheme it, it, assess it, it receives information from its world through it sense this, it updates its models, it chooses actions that changes the world and then it receives nuisance nations based on the changed world and perhaps updates its model further or chooses a different set of actions or continues with the"
"Unknown","00;28;39;29","00;29;03;09","same action. But, but that's how active inference works for an organism. But that's how active inference would work for a community to the community. Census information. It decides, you know, it learns what it can learn from the current sensations and it makes decisions about what it will do next in a variety of ways. What will it do with its solid waste wood?"
"Unknown","00;29;03;09","00;29;36;00","Where how will it generate energy? What will it fund next? What what businesses will it fund? What nonprofits will fund? What is it? What is its targets? Does it a justice targets? So these are all decisions that are that the organism of a community would make as it tries to achieve and maintain in vitality. And fortunately, since this is a fitness based, evidence based program, the community would know at every moment how it's doing, what it's what its indexes are."
"Unknown","00;29;36;00","00;30;03;29","It's, you know, it's indexes for vitality, for example, or it's or it's indexes for uncertainty about the future. So as it tries as the community tries to reduce uncertainty about its essential variables, then it would have an immediate feedback as far as the scores about how it's doing and those scores. And that information could help it then to update its models or and choose the same or different actions."
