"Speaker Name","Start Time","End Time","Transcript""Speaker 5","00;26;50;22","00;27;36;02","Got you. Can I just reply slightly to that? Yeah, just focusing on that. Just that's really interesting. It sounds as well this could tie in with the kind of another type of evaluative capacity or ongoing role in evaluative capacity. But with an agent based or active inference based engine, so to speak, so that it's giving this update to communities around how they are progressing, so to speak, when that may help them in other areas, some of which may be outside of the club, more bounded area, you know, gets into the nation complexity."
"Speaker 5","00;27;36;17","00;27;49;15","So the interesting if you thought about this might be how this might link in with some of the new developments in evaluative evaluation going on. And that might be quite a good avenue."
"Speaker 4","00;27;50;02","00;28;07;14","Yeah, there would be. I mean, if you were going to collect information and and assess how we're doing and what's going to happen next, there would be all kinds of evaluation that would have to occur not just on the simple things like you could think of some simple things right off the bat, like do we have enough food?"
"Speaker 4","00;28;07;18","00;28;37;17","Do we have enough water? Well, fine. But humans are complex organisms. We have complex needs, social needs, you know, emotional needs. You know, like physical needs. You know, we and all of those needs should be taken into account in some kind of, you know, comprehensive evaluation of how are we doing then what's going to happen next? And and obviously, every any organism has to know that, you know, every organism wants to know it needs to assess its status."
"Speaker 4","00;28;37;17","00;28;49;13","Like how am I, how am I doing? Am I too cold? Am I too hot, am I happy, unhappy? Am I happy that, like, every organism needs to do that? And a community a community as an organism needs to do that."
"Speaker 1","00;28;51;10","00;29;16;25","Too. Thanks, John. Also, welcome, Blue. And on the Goldilocks note and this narrative note, I really like what Scott had said about the internal and external communications and as internal communications become structured from a connections perspective, but also from a narrative perspective, the external interfaces and narratives can be structured. So Goldilocks doesn't just evoke the sort of upside down U-curve."
"Speaker 1","00;29;16;26","00;29;38;27","I mean, this is something that we know from pharmacology, from temperature everything. There's too much and there's too little, and there's a failure mode on either side, just like a bowling alley. And of course, the middle solution is going to be better. It just wears the middle. But Goldilocks also reminds us that that middle solution has to be more like a child's story rather than some sort of abstruse optimization problem."
"Speaker 1","00;29;39;06","00;29;49;01","So it's kind of a fun reference that it should be comprehensible internally and also externally in order to be functional right."
"Speaker 4","00;29;49;07","00;30;24;20","Right, right. That's so, yeah. And maybe just a touch on that. You know, from this to say the scientific viewpoint, one might think about fitness, you know, in terms of metrics and statistics and things like that. But other people won't relate maybe some much to that. Kind of assessment. So everyone who's involved has to there has to be the way to communicate the ideas of how are we doing and, you know, what is our status in ways that are meaningful to everyone involved or else if it's not meaningful, it really won't work."
"Speaker 4","00;30;24;20","00;30;59;17","Right. So so some some people might might discuss in status in very technical terms and other people might discuss status and more, say, emotional terms or social terms or something like that. But but the general sense, the general the general purpose has to make sense to everyone else. Why you're part of this, one of the thing on the Goldilocks is the question is it to be clear, it's not my intent that a club say a club started in Houston, Texas with a thousand people."
"Speaker 4","00;30;59;24","00;31;36;28","It's not my intent that the club would stay at a thousand people. It would grow. If the whole concept of this is that if this this new model, this new club model these new frameworks actually work, if they actually empower a community to do better, to to be more secure or to have a higher quality of life, to have economic security, to, you know, in numerous ways, if if these clubs benefit the population the way I think it would then they would grow because it's kind of like the you know, why don't we use typewriters anymore?"
"Speaker 4","00;31;36;28","00;32;06;23","Because we have computers does that work so much better? I mean, they're just so much better. Who would want to use a typewriter, you know, that kind of thing. So that's the concept of this. It should be so easy to join a club it's so easy to participate in that, that, like, why not? Like, it would be better if I participate in the club and if that's if that comes true, if it really works as advertised, then clubs will grow and the club model will spread to other places."
"Speaker 4","00;32;06;23","00;32;31;05","And then instead of having a club of 10,000 or 1000, you have a club of 100,000 and every city has a club. And pretty soon the, you know, much of the world is starting to function along these, you know, with these, with this, along with these new systems, much of the world is engaging with them or enough of the world is engaging with them that the ideas behind them suddenly become the start to become the dominant ideas."
"Speaker 4","00;32;32;17","00;32;39;23","So the goal is not to help the community so much. The goal is to actually transform globally society or at least semi globally."
"Speaker 1","00;32;40;21","00;32;59;29","Thanks, John. I'm going to ask a question from the chat and then Stephen and Lee. So in the chat, Natalia writes, I read in the paper, thanks for reading the paper, Natalia, that people would keep their income when not working. I'm curious what role motivation plays in the success of the system and what kinds of structures are in place to manage that?"
"Speaker 1","00;32;59;29","00;33;11;08","So agents level motivations and how do we design incentive structures and ecosystems for participation that are able to incentivize various kinds of participants?"
"Speaker 4","00;33;12;03","00;33;34;05","All right. OK, so so what what you know, what motivates us today in our economy you know, a variety of things. We're complex organisms were motivated by a variety of things, but largely because of the way the system is designed is that if you don't participate, if you don't go out there and get some kind of jobs, you're going to be in the street."
"Speaker 4","00;33;34;11","00;34;01;22","You know, there's this like this kind of, you know, you're forced to participate. And if you don't and if you don't, you're going to be in trouble. Well well, that's not very useful. For many reasons. Our more useful is to offer people what they actually really want, what what humans tend to really want, which is a variety of things."
"Speaker 4","00;34;01;22","00;34;23;13","They want to help each other. They want to be part of a community. They want to learn. They want to develop skills. They want to do any number of things that engage them with each other. And they want to solve problems. They want to be a part of a problem solving process. They want they want to you know, cooperate."
"Speaker 4","00;34;23;27","00;34;53;12","It makes us happy to cooperate. And all of nature is cooperating like this. Cooperation is the rule rather than the the exception in nature. So how can we build a system that just allows us to really be ourselves, to really get to what we want most work, right? Like I want to be in a in a kind and cooperative and full missional setting a group."
"Speaker 4","00;34;53;12","00;35;15;00","I want to work with each other. I want to work with the people around me and help each other and they want to help me. And so how do we make that happen at scale? Right. That's the question. And so the motivation isn't to get rich. I mean, we'll talk about the leader framework in a little while. And that's just one example of a way to organize an economic system."
"Speaker 4","00;35;15;00","00;35;39;24","But but that particular system actually achieves income equality over time. So clearly the motivation isn't to make money. Like, that's not why you're engaged in the economic system. The economic system is only a it's really a it's a cognitive system, not a not a money system. Money is just a tool that's used as a as a way to share information."
"Speaker 4","00;35;39;24","00;35;52;07","Right. So in the in the lead a framework, incomes equalize over time. And the motivation to engage is to be to fulfill all these deeper human needs that we all have."
"Speaker 1","00;35;54;13","00;35;57;12","Thanks for the response, John. So Stephen and then Lee."
"Speaker 5","00;36;01;02","00;36;27;21","Yeah, I'll just sort of carrying on a bit from what you're just saying there with this the community getting involved and the benefits to the purpose and to their motivation at the community level, that is a missing link at the moment in terms of and it probably was much more present even 100 years ago. 80 years ago, you'd have had the Women's Institute and you had all sorts of different."
"Speaker 5","00;36;27;29","00;37;06;24","So we professionalize an awful lot of roles and you see that with nursing in all sorts of professions where they've increasingly professionalized and trained so the question I've got there is how do you bring in the motivations of the professionals who have another niche that they're trying to optimize around, maybe writing papers, getting the career and things like this and do they have to be humble in some way to honor the input from this community?"
"Speaker 5","00;37;07;16","00;37;33;24","Because obviously you're trying to invert some of the assumptions about where everything should be located, i.e., it doesn't need to all be driven by professions just keep driving more and more professions that you can bring in community input and wisdom to also be part of that in these clubs. But how do you marry the types of niches that people are in and the competition for their time and."
"Speaker 4","00;37;37;01","00;38;07;29","I don't I don't actually see that as too much of a problem. Let's just let's just pick a profession, say nursing or something like that. And the question becomes, well, let's say that I live in Houston and the club has started. Then why would I want you? I'm a professional I make a reasonable salary, let's say, why would I want to participate in a club well, there might be numerous reasons why I might see I might understand the potential of the club."
"Speaker 4","00;38;07;29","00;38;31;19","I mean, you know, there's this whole body of literature now, these simulations and other literature that suggests that this club model might actually empower the people who belong to a club to make better decisions to achieve, you know, higher environmental quality and higher social quality. So I might be interested just to join for that reason, because I see it as a beneficial thing for the larger community."
"Speaker 4","00;38;31;28","00;38;58;01","I can engage with these people and make decisions, and together we can, you know, make beautiful things happen. But let's now let's focus just on the economic aspect. And again, you know, there might be any number of ways to design any of these systems, economic systems, governance systems, you know, there could be all kinds of concepts that we that that the R&D program could assess and try and test out."
"Speaker 4","00;38;58;01","00;39;29;10","Right. But all of that in the lead a framework the kind of prototypical economic system that we hopefully be talking about here and the question becomes how do we get from here to there? Like how do we get from today's society and incomes and structure to some other structure, you know, down the road? Right. So I try to show that in this simulation, that model that I published it goes over a 30 year period."
"Speaker 4","00;39;29;10","00;39;59;06","So so again, that kind of the expansion of the club and its activities is exponential. So maybe in the first few years there's not a whole lot happening as people join, but you know, there's not big effects. But then these bootstraps itself economically and otherwise, and then they're starting to be bigger effects. So, you know, just kind of jumping to the chase a little bit in the lead a framework, it's designed so that incomes rise over time."
"Speaker 4","00;39;59;10","00;40;26;24","Right. And the and the the people in the simulation, people only join if they're going to be better off economically. Otherwise, there's no reason to join in this election. So I, I, let's say I'm a nurse I have a pretty good income. Why would I join? Well, if I join at any point, it's I will get a pay like again and my income is high."
"Speaker 4","00;40;26;24","00;40;50;29","The, let's say the in the lowest the target income is rising, but my income is still higher than that. I can still join and I'll get a kind of a I'll get a small a small bonus. That's not the word I used in the paper, but it's kind of like that I'll get I'll get a say what. Let's just say $1,000 a year for joining."
"Speaker 4","00;40;51;03","00;41;13;06","Well that's $1,000 a year that I didn't have otherwise. So even I get even though my income is high relative to where this income target is growing, I still get a benefit from it. And then I get to use that money and that, you know, part of it is a is a local currency. So I get to use the dollar, dollar currency, the national currency and this local currency and the decision making process."
"Speaker 4","00;41;13;06","00;41;31;23","And I'm engaged in I have I have some skin in the game now. And then as that income rises, at some point it's likely to reach mine or go above what my current income is. And then for sure, I want to join because if I join my income, you know, like my annual income is going to rise maybe substantially."
"Speaker 4","00;41;32;15","00;42;09;08","So in the in the simulation, the income target rises up to about somewhere around 100 and the equivalent of about $110,000 per year. Per family. So, you know, that's more than some nurses make, and especially for those nurses that are at the bottom level, bottom economic level or teachers or firemen or police or whatever, you know, the there would be motivation to join because your income is going to not only increase but become stable like you don't have to work if you lose your job, there's no work."
"Speaker 4","00;42;09;11","00;42;18;29","And so you're going to be taken care of. The system is circulating currency in such a way that once you're in, you're OK. Doesn't matter if you're working or not."
"Speaker 1","00;42;20;03","00;42;37;25","It it's John, it's a way to rethink this driven by money versus not driven by money because you've really set it both ways. You've said people are not motivated by money, yet you've repeatedly appealed to the idea that every person will gain more money and implicitly that that's what is important. And so it's actually just it is what it is."
"Speaker 1","00;42;38;05","00;42;54;14","And that's where active inference and all these other techniques and extended cognition come into play. Because there'll be a variety of narratives for people who are in different positions. So we'll go to Lee and then Scott, and then I'll ask a question in the chat yeah."
"Speaker 2","00;42;54;14","00;43;16;25","So it's kind of a related point actually. So in the paper, I remember you were reading that at one point. You're talking about, you know, effectively that, you know, those systems start to outcompete the native system. You know, there are going to be winners and losers effectively. So, you know, if you're a franchise owner of a McDonald's or something, you know, your neighbor disappeared."
"Speaker 2","00;43;17;16","00;43;38;22","So on a larger scale, right. That means that you know that and. Well, I guess what I'm what I'm I'm asking is, do you anticipate that ultimately the current system, you know, with lots of vested interest to remain the way it is, it's going to start pushing back once you realize that this kind of club model is potentially a threat to it?"
"Speaker 4","00;43;39;14","00;44;05;13","Yeah. So right. So it's true. There's winners and losers in this. And the and in a sense, if if if you're measuring winners and losers, why does this civilization survive and thrive? Well, then there's hardly any losers because you know that. Yeah, the whole concept of this is so that societies and civilization can thrive into the future. Right."
"Speaker 4","00;44;05;25","00;44;29;13","And that's not and you know, just as a counterpoint, that's not our current system. You know, we're our current system is essentially on a suicide route, you know, trajectory of destroying life on the planet. So the current system is not working. You know, it's not working in the sense of insecurity about will we even be here in 100 years?"
"Speaker 4","00;44;29;13","00;44;53;08","Is is quite high. Right? So but but in a in another sense, yes, there will be losers and winners. So the idea is that that this R&D program is creating testing new ways of organizing society that really do that really function well. And any organism that functions well is going to outcompete other organisms, you know, that are not functioning well in that sense."
"Speaker 4","00;44;53;19","00;45;23;24","So a community say that is using these tools and using these systems and it's really flourishing it probably will be doing flourishing more than other communities that are. And that's the reason that other communities might say, hey, that looks good, but let's do that. Now you have a subset of, say, you know, multi-millionaires and billionaires, and at least on some perspective, they will be losers because you know that that's not going to work."
"Speaker 4","00;45;23;24","00;45;47;22","That's not going to be compatible with this new way of doing things. And you raised one of the reasons why it wouldn't be compatible is that where are they going to get their low wage workers to work in, you know, work in their factories and stuff? Where are they going to come from if all the other folks are having high wage jobs in these new you know, these new systems."
"Speaker 4","00;45;47;22","00;46;11;18","Right. These new frameworks. So the the the business model will start to falter. The conventional business model will start to start to falter. And as it should, because, you know, what what are we what are we doing here? What is the what are we doing in society? Right. Don't we want to flourish? Don't we want systems that help us to to reduce our uncertainty and flourish into the future?"
"Speaker 4","00;46;11;18","00;46;50;19","Well, I would think we do overall. Right. So systems that don't do that really have to fall by the wayside or transform themselves into into new systems that do function better. And the the long term aim of this R&D program isn't necessarily that the world will be using these kinds of systems. It's another option. Other, you know, control future is that current governance systems current legal systems, current financial systems, you know, all of our current systems might learn from these experience, these experiments everywhere and go, you know what, that's that's actually a good idea."
"Speaker 4","00;46;50;19","00;47;10;09","That works well. Let's incorporate that into our structure and you know, we'll be better off. Everyone will be better off. So that would be fun. Maybe that maybe the clubs grow to a point around the world and they just the ideas just assimilate out into the larger world that are taken up and then everyone is still doing better."
"Speaker 4","00;47;10;09","00;47;32;03","And so that would be great. Or maybe it doesn't go that way. Maybe, maybe it becomes, you know, like us against them in a sense. There's the clubs that are growing the the native systems, the current systems are not doing well. They refuse to learn from these experienced experiments. They're not interested in change. Well, then they probably will be dinosaurs, you know?"
"Speaker 2","00;47;33;04","00;47;55;11","I mean, I'm just thinking about, you know, so there are examples of a community energy generation for example. So those connections start to exist. You know, then there are examples of the vested interests where they kind of see that as a potential threat, a move to outlaw them. So, I mean, it's just those kind of, you know, if they kind of conflict around wondering where they might be."
"Speaker 4","00;47;55;20","00;48;22;25","And, you know, of course, those kinds of conflicts will happen. And the and the R&D program and the people involved in trading this whole system have to think these things through carefully to try to avoid, you know, problems that might be foreseen. Right. Obviously. So these are very important questions. And and we would have to give a lot of thought as to how we, you know, skirt past these problems."
"Speaker 4","00;48;23;06","00;48;43;18","Well, now, you know, and I you know, I don't that's to be done. That's work to be done. Right. I have a few ideas and that's an eye. And I can say that's one of the reasons I wanted the global science community as a kind of, you know, a co-leader in this whole process, because it is for one thing, it's global, right?"
"Speaker 4","00;48;43;18","00;49;05;19","It's not limited to the laws of a particular nation. So and it's authoritative in the sense that we can write papers and we can do simulations and we can talk with some authority of would this be a good you know, do these things help humans? Would this be good for human societies and civilization? You know, we can we can we can do that."
"Speaker 4","00;49;05;19","00;49;28;04","We can we're independent of any particular nation. And that's and and then suppose that there's a nation that says, no way, this is against the law. You can't do it here. Well, OK, we can't do it there. But there will be other nations that have those rules. And this club model can thrive wherever it's allowed to thrive. Right."
"Speaker 4","00;49;28;08","00;49;58;01","And you would think that there would be some nation somewhere in this world where there might be some allowance for these kinds of social experiments to occur. And once it works, that's the thing that's the concept is that once it's shown to work, you know, first in one community, say, and then maybe in two and then four in the need to, you know, once it's once it looks like this actually works then there's a whole other slew of of papers and simulations showing, you know, like we're assessing that."
"Speaker 4","00;49;58;13","00;50;15;01","And that information is broadcast to the world and, you know, at some point it becomes harder and harder for a society to to keep it out because, you know, no no no country uses typewriters anymore, you know."
"Speaker 1","00;50;16;22","00;50;18;15","Except the hipster countries."
"Speaker 4","00;50;19;08","00;50;23;15","So we have except the accept the accept the hipsters."
"Speaker 1","00;50;23;29","00;50;29;23","They'll say, I want that good old fashioned government. So Scott and then a question from chat and then Dave."
"Speaker 3","00;50;32;06","00;50;56;22","So great conversation. Thank you. This is so fascinating. So the couple of book references and the things we want to talk a little bit about money and risk here. So going back to what we were talking about a little while ago and that moved from money and prosperity, you know, there's a book by I think it's has been called Doing Money where the author suggests that money is a universal risk consolidator."
"Speaker 3","00;50;57;28","00;50;59;26","And so I'll hold up here."
"Speaker 1","00;51;02;15","00;51;03;10","20 billion."
"Speaker 3","00;51;04;17","00;51;28;04","Could be due to the bearer upon. Right. So it only is as good as the narrative, right? So I always carry Zimbabwean money around because that's inflation protected in the United States that you can't get near the inflation rate. So the reason to raise that is money. You know, we there's a book called The Past is a foreign country where we think people in the past, though, they just didn't get it."
"Speaker 3","00;51;28;21","00;51;48;06","And then we look at this and go, you know, money actually, it's interesting when people want to accumulate money, there's a lot of theories of money. This Smith in Switzerland. Hume But money is a form of communication between peoples in encoding of risk in the sense is what we look at in decoding risk and a universal risk encoding in a sense."
"Speaker 3","00;51;48;17","00;52;10;10","And it's kind of interesting because then it becomes abstracted into its own, its own end. That's when it becomes the commodity of money. Right? And this is not a medium of communication in exchange anymore, but it's own gain, it's own because it's used generically against all risk. I can de-risk so many universal risks. That's pretty true. It's like a universal solvent of water."
