"Speaker Name","Start Time","End Time","Transcript""Speaker 3","01;28;13;11","01;29;00;07","And the I what I said that we obtain an actual entropy term and that's because we in, in choosing the best action so in, in trying to, to match our actions to the one that we, we should actually prefer, we, we think it like we don't have a preference this over action. So we would. So for instance, I, if I want to reach a certain state environment so if I want to to go from this room to to the kitchen, maybe I don't care what's the, what's the shortest word, the shorter passes, I just care about getting there at some point or I don't care about going left or going round right now."
"Speaker 3","01;29;00;26","01;29;27;25","When I when I get off of my chair, I just want to to go where I need to go. So we don't we don't place a prior over the action. We just say whatever action is fine as long as it brings you the fastest as possible to the goal that the fastest thing is not even by the action itself, but but by minimizing the free energy so we don't want a preference over the actions we wanted."
"Speaker 3","01;29;28;13","01;29;58;08","We want the free energy to be the first spot. And so the actions are we some a unit for distribution over them and what remains is just an entropy. So it will be a real divergence between the queue over the action given the states and the this party, which basically becomes an entropy value. If you, if you you're some user constant because it's just subtracting a constant to that and the."
"Speaker 3","01;29;58;08","01;30;32;13","Yeah, the switching to the to the other part of the equation. So what does it mean to us this discourse center here. So is adding constant term useful. So I don't know if there's any other useful custom term that we could get. So the mathematically speaking, having a constant having gone up from an upper bound because of the constant building beyond me, because you're minimizing the same objective."
"Speaker 3","01;30;32;17","01;31;06;11","But then on top of that, we apply the contrastive, the contrastive approximation and that leads to another the upper bound and the as I said, there are some implication of this. We get to maybe a better representation, but are we getting farther from the from the actual objectives? So from my point of view, as long as we achieve something that is actually better, it doesn't really matter how far are we from the actual surprise and see now."
"Speaker 3","01;31;06;28","01;31;35;11","So in any case, we will always get some kind of amortization or approximation and we will probably never get 100% close to there to the surprise value. So because we don't have a perfect model, so a perfect model of the word doesn't exist, it's it's impossible to imagine that we can model every details of the environment, even if we are with a billion machine learning parameter."
"Speaker 3","01;31;35;11","01;32;13;29","And it's impossible to think that we will always act perfectly and always get in the, in the perfect route to go using the always optimal action, especially because there is always some uncertainty in the environment and there's a lot of things that we, we normally want to ignore in our everyday lives. So a lot of things there is not actually important to the capturing the word model or action y it's not always important beyond just percentile correcting over movement and so in the action, we think the important thing is that we, we get close to the goal."
"Speaker 3","01;32;13;29","01;32;50;25","So I will say, yeah, if there are any other term that we at the other center or just any other modification that we could do to there to the free energy function or that actually leads to better results without compromising the original goal of minimizing the energy. I think that's that would be a good way to uh, to address some of the issues that we, that we currently have with, we've actually been, for instance, that could actually lead to, to improving the performance of the, the artificial implementation of active inference significantly."
"Speaker 3","01;32;50;25","01;33;16;19","So that's also why I think that's taking advantage of some lessons that, that we learned from reinforcement learning is actually useful in acting inference as well because the there has been a ton of research about the way to amortize this thing or approximating something better or train a better deep learning model for some solving some very specific aspect."
"Speaker 3","01;33;16;19","01;33;24;09","And I think the objective inference research there to benefit from this, to take inspiration from this."
"Speaker 2","01;33;25;15","01;33;31;10","And maybe if I make that's good. Or can you go back to the slide with the action uh."
"Speaker 3","01;33;33;09","01;33;33;20","It's one."
"Speaker 2","01;33;34;24","01;34;21;09","Yeah. So, so maybe to make it easier here for or maybe people that are less familiar with reinforcement learning but are coming from a more active instance background. So in, in terms of active inference, but on a scale first thing, let's look at it. This is basically something that you should not do source. So so basically what happens here is that we see action inference more like a habitual thing, like a, a moment the state or I think I'm in the state, so therefore I can just infer my action results."
"Speaker 2","01;34;21;18","01;34;46;25","But it's kind of you become habituated. So I explained this hundreds of times and it's always this outcome. So I just stop planning and I just amortize this action into in the more playful C So that's basically the kind of the mechanism that that we apply here in order to avoid planning all the time because that's, that's the, the tricky part."
"Speaker 2","01;34;48;08","01;35;10;24","We have too much options to plan so we don't want to do this. So we just say let's amortize it from stuff, which basically means that this A, this or Q or a broken procedure. It's not only over stays but also over actions. And then so the action entropy just falls out by introducing the, the action in the user."
"Speaker 2","01;35;11;02","01;35;41;22","So it's not that we magically add an action action and return to the simulation. It just comes out because of having the actions esports over there but so did the my, the, this also means that we have an approximate there over actual selection and this works in at least three or four string problems because they're. Yeah, your goal is always the same, doesn't it shift."
"Speaker 2","01;35;42;21","01;36;28;02","It's not a, it's also not a if you, if you think back on on biological agents look like a complex distribution to maintain homeostasis basically just yet. This is the reward. This is very good. It's it's always the same thing. So this basically means that your environments very enriched with this this agency which also reinforcement learning solutions to their agents is exactly the environment is used for I can amortize what what I have to do because if I know my status I know they have to do basically things so change I guess if you have another environment in which this is not the case where you could be in a certain state and you would still"
"Speaker 2","01;36;28;02","01;37;04;22","have multiple options to do and you and you can only you can only really know what to do by planning ahead through by first. So search for information on what's happening and in these kind of environments, I, I think that's what position treatments will help you a lot. Are you going to do it just by amortizing. So it's, it's a trick device to, to allow it to work in this kind of environment because you you have to benchmark against some things and you have to be on board there."
"Speaker 2","01;37;05;05","01;37;31;24","It's so keep in mind it's not the silver bullet that will always work. We do deviate from vanilla extract insurance here costs section inference s like we just want to learn habits you don't want to plan. But this also means that there might be situations where it will not work and then it's not due to active insurance or for the energy principle that's not working."
"Speaker 2","01;37;31;28","01;37;38;12","It's more like the the crude approximation here by which things might not working. Well."
"Speaker 1","01;37;40;18","01;38;15;06","That's interesting about which training environments favor, what kind of algorithms and then how that shapes the perception of different algorithms like the navigation task. What if there was a fuel tank or there was a larger space that was going to require like multiple foraging information, foraging trips, for example. And so then the sort of single minded seeker is going to just die fast, but then something that's able to actually engage in planning wouldn't."
"Speaker 1","01;38;15;06","01;38;38;23","So that was a little bit like to those who are familiar with active inference. And then here's a variance on what we've seen before. How about for those who are more familiar with the dreamer architect or reinforcement learning? What makes active inference, active inference, and how is it different Well."
"Speaker 2","01;38;39;19","01;39;11;01","I think they are they're largely similar, let's say. I think that would be the starting point because both awesome people think about what's the difference. But I think the the the main point that we should rather stress more as an active interest community is that there are a lot more similarities between reinforcement learning and active inference. I would say that active inference is a bit more general than reinforcement learning."
"Speaker 2","01;39;11;10","01;39;51;09","In the sense that on the one hand we don't use the reward function per say, but we relax that the bit as in we just have a distribution over preferred outcomes, which is a bit more general, I would say. And then the second thing is that instead of starting off from the free energy principle as in this is the objective that we want to minimize you also gets the, the extrinsic value term here, which is exactly the same thing as for the reinforcement learning agents optimize."
"Speaker 2","01;39;51;18","01;40;36;02","So if you only look at extrinsic value, your agents will also do this. But the, the, the added value I would say comes in the information gain terms and this will only give you an additional benefit in environments where there is information to date. And this is not your typical reinforcement learning environment. But if you look at, for example, the teammates mouths from golfers, then these are typical environments where you can actually show that if you only go for extrinsic value you won't you will be acting suboptimal."
"Speaker 2","01;40;36;07","01;41;09;19","So you can actually prove almost that in some environments over there looking at the extrinsic value, given the correct model of the environment active inference rule. I think the crucial thing that we need to research on is how do you get to the of the cortex or the optimal model of your results enrich by optimizing your expected actually you're doing a sensible planning and this is still largely unresolved with our models."
"Speaker 2","01;41;09;19","01;41;32;14","We are taking steps in that direction. But as you can see, there are lots of issues to just find the correct model because if you just look at the models the likelihood based model should be perfectly fine, but based by the way you optimize in practice, then you see all kinds of problems like, okay, this, this, this little pixel is actually the most important pixel."
"Speaker 2","01;41;32;14","01;42;09;11","Look over the thing. And that does not appear so in my lost function. So that's why everything collapses. So in theory, it should work, but there are a lot of practical problems to find the correct model that pays attention to the correct details or to correct your observations. And this is still that this is something that is shared with model based reinforcement learning as well as active inference and I think there is a huge opportunity to find new techniques that can and put forward both both fields."
"Speaker 2","01;42;10;01","01;42;40;10","And we also showed this like the contrastive drama in the districting environment. Also improves performance on the normal dreams. So by having a technique that lets you build a better model, any model based algorithm will work. And effective inference has this special notion of also take into account information gain in environments where you might be denser to ensure your status."
"Speaker 2","01;42;41;12","01;43;14;06","So that's that's where it can prevail. But I think in most of the benchmark environments of similar days, especially in machine learning, you probably don't need these external. So you probably get away with just maximizing rewards which is in fact also an active inference agents. And to some sense, if of course if it's if it's I'm talking about a model based like dream agents in this case, of course, the model three ones are these are the differences."
"Speaker 2","01;43;14;07","01;43;29;05","They, they don't need to model the goal. But at least for mobile based reinforcement learning agents, I think it's pretty similar to what a negative influence to in these environments Thank you."
"Speaker 1","01;43;29;05","01;43;34;20","Tim Pietro, anything you'd add to yeah."
"Speaker 3","01;43;35;04","01;44;15;16","I would like to to discuss one aspect of three merit that's been a bit overlooked is the fact that it makes this amortization similar and it's also similar to what we have done. So yeah, this is this we learn a policy basically we own an action network that provides the correct state in the correct action for every state, but it is the key step to actually brings us closer to the acted in principle relation is that we, we imagine several steps in the future."
"Speaker 3","01;44;15;16","01;44;48;25","So it is true that we don't evaluate and long policies in the over other times that we have these prior about action it is given by our action network. But it is also true that given the fact that we evaluate the state three we expect to see and then from there we re start doing the the actual optimization process."
"Speaker 3","01;44;48;25","01;45;21;25","We actually get closer to the optimization scheme of active importance. In particular, there is a paper called Sophisticated Inference that discussed this when you, when you actually take an action and then you reimagine from that step what's going to up what's going to happen. There are some implication of this, but that we are not completely drifting away from the from the original activity story because of this is just a different way of doing the action selection process."
"Speaker 3","01;45;21;25","01;45;27;21","Similar in that indeed the three results are very close to the active inference itself."
"Speaker 1","01;45;32;05","01;46;01;19","Poole Thank you. I wrote down, if you don't know where you prefer to go, your lost drive fast. If you know how to get there, figure it out if you don't and then re-assess continually. And I hope that conveys some of the similarities and differences Do you have any final comments This is a very interesting line of research and we really appreciate this model stream."
"Speaker 1","01;46;02;14","01;46;10;00","Hope to see you in the future. Or should I say we expect and prefer it. But thanks again, Pietro and Tim. This is really awesome."
"Speaker 2","01;46;11;24","01;46;13;01","Welcome. Thanks for having us."
"Speaker 1","01;46;14;03","01;46;30;29","Thank us. Have a good day, everyone. Have a good day, everyone. Have a good day. Everyone, have a good day. Everyone, have a good day. Everyone, have a good day. Everyone have a good day. Everyone have a good day. Everyone have a good day. Everyone have a good day. Everyone, have a good day, everyone."
