"Speaker Name","Start Time","End Time","Transcript""Speaker 3","00;30;03;25","00;30;25;10","Another means square error compared to to an image that is very distant from the goal. And this kind of situation, especially when using reconstruction or in more realistic settings, are very, very likely because for instance, you can you can see that the center image is actually just a reconstruction of the model, which is not under percent accurate. So that could be the case."
"Speaker 3","00;30;25;10","00;30;51;18","And indeed, the agent could be confused and you will think that is not achieving the goal compared to maybe, for instance, a bus observation. But if it seemed that it was actually actually closer to the goal or again, when there is some some noise in the environment in real set up like the robotic, we always have this noise in the observation so it's our to to match our preferred outcome in, you know, even national setting."
"Speaker 3","00;30;51;20","00;31;17;21","So we we also try to to overcome this issue here So what we do propose is to use contrast learning a conservative learning is a is a mechanism popular in the in unsupervised learning scene that we will discuss more in depth in a few moments. So the the the objective that we want to where we want where there are to avoid reconstruction in learning the word model."
"Speaker 3","00;31;17;21","00;31;51;05","So we don't have any more of the decoder here as we see on the right. Then we want to be able to match preferred outcomes in the lower dimensionality space because we have seen that it's no dimensionality that's problematic. And also we we would like the this low dimensional state to be somewhat representative of the task so that when we match our goals in this low dimensional state, we are actually doing something that actually brings us closer to the actual preferred outcome that we we want to achieve in the high dimensional setting."
"Speaker 3","00;31;53;05","00;32;20;11","So let's let's try to compare to see what are the difference in between using the likelihoods to the inference model. And the contrasting models. So the idea in the likelihood actually inference model is that we want to maximize the accuracy of reconstruction. So basically this this means that we have this decoder that maximizes this maximum likelihood of the observation given the state."
"Speaker 3","00;32;20;19","00;33;00;08","So we want the state to to maximize the information that it contains about the observation. Basically, in contrast, learning we in contrast, deductive inference, we do something different. So instead of trying to reconstruct the current observation, we try to compress the encoder again, this observation and compare it to all of the other not all the other, as we will see in a while, because that's visible, but in many, many other samples that represent something different."
"Speaker 3","00;33;00;11","00;33;34;25","So that we in the, in the late in space, in this compressed space, we want our a state and the compressed image to be very close. And while this our state should be very distant from all the other hemorrhages. So we we are indeed maximizing the similarity with this and with the corresponding sample that this is here called the positive sample where we want to minimize the similarities and maximize the distance against all the other samples that are called negative samples in contrasting learning."
"Speaker 3","00;33;34;26","00;34;04;09","So as we'll see also in in a moment, this this mechanism here maximizes the lower bound of the mutual information. So we are basically trying to maximize the information in between corresponding observation in state while minimizing the information with respect to the all the other negative spurts so as we seen before, the the free energy bus can be summarized with this equation here."
"Speaker 3","00;34;04;09","00;34;32;17","So here I'm just talking about one time, one moment in this for ten steps. So instead the team presented for all sequences by using the field the notation. Well, here we're just considering one time steps the time. So as we as we have seen the free energy is basically are an upper bound on the appraisal information that we would want to minimize."
"Speaker 3","00;34;32;19","00;35;02;09","So we minimize free energy in order to minimize this appraisal of the agent. And the year is it's actually evident that we have this evidence on. So the 80 scale diverged into these old where there are equal to zero. We wanted to basically to to reach zero hypothetically in order to minimize these this evidence bound. And this can also be repeated in a way that is more practical implemented."
"Speaker 3","00;35;02;09","00;35;37;20","So by having the the likelihood of the observation given the state which actually means the accuracy of our model and that again the complexity of the model which is the close divergence between our variation variational distribution. Q Which we, we use. Q Oh, that's given all which is basically using the outgoing coding variation of relational posterior. So this is as typical as a stunning in variational encoders."
"Speaker 3","00;35;37;20","00;36;07;03","So when you when you try to infer the parameters of your posterior distribution by using the corresponding observation, and then we we want to minimize the close divergence between this out coded posterior and the our prior about the about the, the, the current or future states we can say given the boss state and actions and the in our case in particular we generally learn this this frame."
"Speaker 3","00;36;07;03","00;36;54;16","So we don't just use a uniform prior overstate but we will learn our years to be predictive of what the state is given the bus state. So it can basically seem like if we're machine learning in particular as a, as a conditional variation of encoder, we've, we've contrastive learning what we try to do is as I said, to maximize state similarity with the correct and corresponding observations over could sample while minimizing with the other and this means again that we want to maximize the neutral information between the positive sample and the corresponding state and minimize the information with the negative samples."
"Speaker 3","00;36;55;03","00;37;31;22","This can be written like this or the noise contrastive estimation. So noisy here. That's the abbreviation basically provides a again, a lower bound and the neutral information. So where we where we see that we basically have like a soft marks. So over the over all the the the observation is state what does it mean? So for each pair of state and observation, we run this volume."
"Speaker 3","00;37;31;22","00;38;02;12","So the value of this critique is that this critical function F to be as high as possible or we want it to be a very low respect to the other so that actually the exponential of these a compared to the sum of all the other exponential is either with the corresponding dissipation and very low with the rest. So this is basically saying that the if you want matching bears to be to be very close and distant bassoon to a very, very low value."
"Speaker 3","00;38;03;11","00;38;49;20","And the the this is lower bound is a is an approximation normally when we take a number of samples key from that a joined distribution that we define between X and Y in particular in our case is X and Y represent our observation and our in the States. So we define a priori these disjoint distribution to actually represent the fact that these state corresponds to this observation and we want to maximize the information in between them and the function F, x, y again is so so-called critique function."
"Speaker 3","00;38;50;03","00;39;19;06","So what does it mean is a function that should approximate the log density ratio that we see here on the right I won't go into the mathematical details of these, but basically is a mapping of the of the the two inputs so basically the mapping of our observation and our state and we want these again these outputs to be I for corresponding bursts and the and load for non corresponding bursts."
"Speaker 3","00;39;20;21","00;39;49;08","So how do we transition from the free energy of the path that we have seen to the to our contrastive formulation still what the the first step that we do is adding to the to the free energy functional as a term that we we assumed to be constant the despair, the entropy of the observation. So how can we assume that the entropy of the observation is constant?"
"Speaker 3","00;39;49;27","00;40;19;10","So in machine learning, we generally have a data set from which we sampled our observation about the past. So we assume when we train that our data set so that the distribution of the observation is fixed so the entropy of this distribution will always be a constant because we can modify that. I suppose for instance, to the States which which means that so the distribution of our outcomes cannot be modified."
"Speaker 3","00;40;19;10","00;41;01;26","And so its entropy is a constant. If we add disturbance to the free energy functional, we can rewrite it as a, as the coiled divergence minus this information gain or mutual information here between the states and the observation. So given this, we can now apply the fact that we in contrast, keep learning a functional this is a lower bound on the mutual information to actually derive the the free energy of the past where expecting all the terms result according to the previous light nets."
"Speaker 3","00;41;02;14","00;41;45;20","We basically have, again, this coiled divergence there. And then we have this the value of F between all and this to maximize and then to minimize all the again the the value of the function of with respect to all the other negative spurts So this brings those two to again an upward bound on this appraisal term. We see that this upward bone is actually even higher than the normal free energy, upper bound bus as we'll see later."
"Speaker 3","00;41;45;20","00;42;22;12","These are some nice property. Does it explicitly help us to get rid of the reconstruction and to learn a different representational space? It does some advantages compared to the to the likelihood based representation So let's now talk about how can we learn to behave using constructive inference. So in the likelihood based active inference model, what we were trying to maximize was again, the likelihood of the future observation, but under the preferred distribution."
"Speaker 3","00;42;22;21","00;42;49;22","So we want to we want the imagined outcomes to be as close as possible to the two that outcomes that we prefer a So these for these are environment in place that we we reconstruct what the what we imagine will happen in the dimensional space. So that emerge basically. And then we compare it to our preferred image, for instance."
"Speaker 3","00;42;50;10","00;43;17;14","And as we see before we can for instance, use a mean squared error distance or we can just use like we can just go down and compute the likelihood under the preferred the distribution or contested up to the inference. We again instead use a contrasting mechanism when we want now the the future state to be corresponding with our samples from the preferred distribution."
"Speaker 3","00;43;17;14","00;43;40;09","So we want the, the outcomes that we prefer to actually be a close to there to the state that we imagined so that now we don't need anymore to reconstruct what the what the outcome of our action will look like. But we can just say is the, the state that we match in matching with the preferred outcome that they want to achieve."
"Speaker 3","00;43;40;22","00;44;18;01","And the that's, that's what we, we maximize similarity with. And again, we also have some some form of the ambiguity minimization or epistemic value in trying to minimize the similarity respect to other outcomes. So in this case, minimizing the similarity in respect to outcomes that are not in the preferred distribution basically means that the other want to go far from something that you have already seen before in order to maybe get closer to the the preferred the outcomes, or you either just want to minimize your ambiguity."
"Speaker 3","00;44;18;01","00;44;48;05","So you want to be as far as possible from other outcomes in the schools as possible through that to the actual preferred outcome view that you're opting for. So as we have seen before, the expected free energy can be summarized like this. I'll first highlight some difference in respect to the equation the team present that. So first of all year we we take action to be part of the of their active entrance process."
"Speaker 3","00;44;48;05","00;45;27;24","So they aim for the process. Well, and before we have seen that, you can you can have a distribution of our policies and then you can you can sample the action from the policy and and compute the free energy of the future a given a posterior on your on a policy when I give them policy instead here we make the the actions part of the the generative models for the future and we actually want the agent to insert the injection for the future and not just compute them as a as a posterior of our over some distribution of the over the policies."
"Speaker 3","00;45;28;14","00;45;59;04","So we we have enough in the posterior is this 18 so we that we inferred both the the the future state and the future election and also the the prior other over the preferred outcomes that indicates we feel that I have this not confusing before because before the deal that was used to indicate sequences by in the paper I actually use it to to indicate the preferred outcome so yes notation issues but I hope there's not confusing."
"Speaker 3","00;45;59;04","00;46;39;26","So that is basically to say if this is the preferred distribution over observation state and explain and so this is basically our target distribution what we what we hope to achieve in the future and we can rewrite this as a as the sum of three terms. So we have this. So first of all I'm assuming that's the agent's us no prior preference in action so that for him any action that will bring it to the preferred outcomes it's fine so he has a uniform prior but action so the action doesn't really matter it is as long as it brings to there to the goal let's see."
"Speaker 3","00;46;40;15","00;47;30;28","And the so this in this way we we obtain an action and be and then the rest the intrinsic value is that is the same epistemic party that we've seen before. And so the the one that the obligation to to explore the environment more or either to reduce this ambiguity about the environment. And then we have the extrinsic value which is basically rewards or just just a way to get closer to the, to the actual preferred outcomes so that the value to pursue in order to minimize distance from the from the preferred outcomes in our competitive expected free energy, we we again to assume there moves as we did from the past."
"Speaker 3","00;47;30;28","00;48;13;19","So we assume that we are taking interpretation over our preferred outcomes since we don't imagine outcomes in the future, we just assume that the outcomes will will be according to the so the preferred outcome situation so that we can again sum the entropy over our fixed preferred outcome distribution. And then the steps are the same. So we, we have again this mutually information term between the preferred outcomes and the, the state that we mentioned in the future and the, the, the action and should be determined the scale divergence between the still other states and the other states."
"Speaker 3","00;48;13;19","00;48;40;28","So is a complex term I'd say, because it basically should represent and the difference between what the, what the agent believes it will happen and, and what is supposed to happen in the environment. So normally in active inference, we assume for the future that the the model of the world is correct so that the agent does not control of the over word model."
"Speaker 3","00;48;40;28","00;49;25;05","So it cannot change how the the environment dynamics will transition from one state to another. So I, I'm assuming year that this is this scale divergence in terms actually zero though I've seen that some work this could also be built left there are being greater than zero but then then it's basically adding the agent imagines that they can then it can violates the the environment dynamics hoping for a better dynamics that it will allow it to to be optimistic and think yet the thing that I imagine it will happen is actually going to happen so either we we don't allow the agent to to modify or the environment to move from one state to another and"
"Speaker 3","00;49;25;05","00;49;54;02","we just assume yeah these are the dynamics and betterment so our posterior over the in the transition dynamics of the environment is correct. And so the scale diverging in zero and then our objective again doing the applying the the contrastive the learning lower bound translates into this when we we have these contrasting mutually information between the preferred outcomes and the is this action entropy term."
"Speaker 3","00;49;54;07","00;50;22;29","So if you write out explicitly we again have this this to term which kind of reminds the two extrinsic value and intrinsic value for for the free energy. So we have this the term that actually there should minimize the similarity with the negative sample that is doing something similar to what the the intrinsic value in in active inference should do."
"Speaker 3","00;50;22;29","00;50;51;10","So basically are trying to to be distant from from previously seen their outcomes. This is kind of similar to explore the environment to minimize your ambiguity. So try to find something that gives you more information, not something that you have already seen and so the, the, the word model can be summarized in these three main components that we learn."
"Speaker 3","00;50;51;23","00;51;17;03","We have our prior network that, as I said before, is learned. And Schiller should learn the, the transition dynamics of the environment so trying to predict future states, given the US states and actions. And then we have this jury yourself that is shared between the the prior and the Posture Network. And this is what allows us to brings our history both."
"Speaker 3","00;51;17;20","00;51;43;09","So it just not stuck to the previous state, but also to include some information about previous states so that we have more, more information available in order to infer what the current state is actually is. Then we have our posterior network, which also has access to the that observation and the disclosure. CNN, as a as I mentioned, is a convolutional neural network."
"Speaker 3","00;51;43;09","00;52;11;10","And the yeah, here we have the actual layered description for our environments, which are 64 by 64. But that's that's less important. The important thing is that we have a convolutional model that compresses the formation from the observations for us. And these same convolutional network is also linked to the, to the representation model that is this the, the critique of the contrastive learning mechanism."
"Speaker 3","00;52;11;10","00;52;57;02","So the function that is indeed matching states and the observation in order to learn the good contrastive learning representation. So the, the function of that we minimize and respect the past is a is our contrasted free energy of the past, some over an arbitrary number of, of these key time steps in the over past the sequences. It is important to say that for the past there the negative samples that we take are an observation of the of of the same sequence of the object corresponding observation."
"Speaker 3","00;52;57;02","00;53;28;14","So that said that we have an observation in the States the negative samples will be on the other observation within the same sequence that are not the same in time, but also observation that come from, from other sequences. So, so that we are basically contrasting the, the current state with the different time steps. So what happened in different the moment of the of the same sequence of actions and the what happened in different situations."
"Speaker 3","00;53;28;14","00;54;19;29","So different sequences and that's how we, we try to, to foster our contrastive learning mechanism. Then we have the action models. So for our action model, we have two networks. One is the so called action network, which basically inverse to the, the action to take a given state. And then we have this expected activity network and this helps us pursuing what the team anticipated so that the fact that we we are amortizing the action selection process for very long term sequences by using a network that should estimate what the the value of a certain state is in the future."
"Speaker 3","00;54;21;09","00;55;17;27","So I'll try to be more more clear here. So basically the action network to minimize these this G lambda a functional that is basically an estimate that of of how much value is in a certain states. And although we get this estimate so the estimate is is provided by this formula here. So basically at every step we provide the the actual expected a competitive free energy for that state and then for the future the we we some we compromise in between an estimate of what the what the network would predict is going to is going to be the value in the future."
"Speaker 3","00;55;18;07","00;55;52;11","And the, the, the value itself that we are that we are computing we there with the functional so that the baby steps we basically sum the value that we we expect in the step there we bootstrap this. That's the way we normally see reinforcement learning. So we we apply some form of dynamic programing approach to to sum this value with what we expect will happen in the future and the we use these as our target for learning the estimate."
"Speaker 3","00;55;52;11","00;56;21;29","So we basically have the estimate and the estimate of the future plus the current value. And we compare the two when we want the, the actual estimates to be closer to what is actually happening plus the future estimate. And this is this is actually what is normally done in reinforcement learning. When you apply the the so-called bellman equation in order to estimate what's going to happen in the future by using what you actually know."
"Speaker 3","00;56;21;29","00;56;59;07","So generally like the rewards and in our case, the, the explicit free energy value and what you you can estimate for the future so you know, we're experiments we compare to we compare four flavors that make for reinforcement learning using likelihood model. This is very measured the dealer baseline. So the those are likely based and they're the word model and it uses rewards for learning action."
"Speaker 3","00;56;59;07","00;57;33;12","So the the river song freeze is already given to the agent. And then we compare it with contrastive drama. It is a modification of primary using a contrastive a learning for this word modeling sort of reconstructions and then we compare the two flavors of active inference in the standard and see one with the likelihood reconstruction model and our contrastive formulations so we use similar architecture and training routine for all the different baselines in the training routine."
"Speaker 3","00;57;33;16","00;58;13;06","Can be summarized as we see here in so the code. So for certain and for a certain amount of number of training steps that we if it's events, we are going to train our work model on the previous experience. So now on a replay buffer that basically represents our data sets of plus experiences, then we are going to use the trained words model to imagine some trajectories in the future by using our actually model and the replay buffer as well, which is used because we need to take the negative samples for the contrastive pre energy functional."
"Speaker 3","00;58;14;13","00;58;48;03","And then on the imagined trajectories, we are going to train our our action model in order to actually try to pursue the the preferred outcomes better. And then we are going to go back to the environment, collect a new trajectory using our word models to infer what the what the even state of the of the environment is at and everything step and using the action model to select the action according to the state of tweaking first and then add to the just collected trajectory to the data set."
"Speaker 3","00;58;48;14","00;59;26;04","And we do this continuously. So train the word model. Imagine some trajectories and the train the action model and again keep collecting so that we we continuously improve both the data collection process because the the the word model and the actual model gets better and also our modeling needs so that we get closer to the goal So one important insight into the person to produce before turning into an and vertical evaluation of the method is the fact that the using control scheme learning strongly reduces the the computational requirements of the model."
