"Speaker Name","Start Time","End Time","Transcript"
"Speaker 1","00;00;08;01","00;00;41;12","Okay. Hello and welcome everyone. It is January 28th. 20, 22. We're here in Acton Flat Model Stream number 5.1 with Pietro Marseglia and Tim Verboten. So this is going to be a model stream presentation and discussion on their recent work Contrastive Active Inference. We're going to have a presentation section and then discussion. So please feel free to ask any questions during the presentation that we can address in the discussion."
"Speaker 1","00;00;41;25","00;00;50;07","And Tim and Pietro, thanks a ton. We really appreciate you joining to share your work. So please take it away. And thanks again."
"Speaker 2","00;00;52;12","00;01;20;10","Yeah, thanks, Daniel, for inviting us as well. So I'm going to be able to get the better we are going to work on. Interesting of interest. So let me first set the scene. Why are we looking at active inference or basically our lab wants to build convergence agents? And so from that perspective, the studio and if you want to build something indulgent, it needs to be involved."
"Speaker 2","00;01;20;12","00;01;53;04","It needs to be interacting with its environments. And then most of those interactive instruments are basically your agents to your environment. It's interacting with. And you need to build the model, basically. So are first give an overview of active inference and the way that the three are and a little this material is also being covered in a previous middle stream, I think number three."
"Speaker 2","00;01;53;15","00;02;29;10","So if you want more details, you can think of that one again. And so then afterwards gets over and he will go to the nitty gritty details of the contrasting approach of inference. So let's get started. So basically active inference, it's a process theory of the brain. And basically it says that your brain or your agents build or you build this model of the environment, which is basically the joins probability distribution over that observation."
"Speaker 2","00;02;29;15","00;03;00;16","So things that you can see or experience actions which we do know the state and then states or states of the universe. So basically you have your agents that separate from the environment and its actions interact with the environment. And this gives rise to new observations. And so the idea of the ball is agents for out, which are kind of the hidden states."
"Speaker 2","00;03;01;02","00;03;30;21","That's the change by actions and the different ways to my observations. And if you can build such a model, then basically this enables the agents to plan some actions to to bring the agent to some preferred observations or outcomes and so forth. But so the crucial bits is basically how do you get this model of what happens if I do my actions?"
"Speaker 2","00;03;31;01","00;04;05;13","How does this influence the states and how does this influence the outcomes that I see? So the crucial for from experience is twofold. First of all, the key is what the agent does in a decision optimizing so-called free energy, which is a profound surprise, a prediction error. So basically, if Joe, this model allows the agent to predict the outcomes, that it will see that true witness and the better this match your actual observations, the more happier you are as an agent."
"Speaker 2","00;04;07;05","00;04;54;10","And crucially, you will also select the actions that will minimize the frequency you expect in the future. And so we think of this to the models just to to set the scene. On the one hand, the reason why so that we all know for the system is for this also to then see the move the jet will make from the let's see value act of influence presentation thoughts more countries the formulation of the of interest free energy object So we start off with setting to see what the genesis model so it's it's a bit laid out the diagram of the agents and the environments that was on the previous slide."
"Speaker 2","00;04;54;11","00;05;20;02","So basically this unfolds over time. So you are in certain states that gives rise to certain observation and then given an action on your previous state and basically move ahead to the next stage and this process unfolds over time. And you can see some of the circles are colored gray. And these are basically the things that you can observe."
"Speaker 2","00;05;20;20","00;05;44;12","So, you know, the actions, if you did that until now, as you know, the observations that you saw until now and all the rest is basically for you to infer. So you can only infer it in states until now, but you can also try to infer the hidden states of the future. Actions that you want to take or d'observation that you will experience."
"Speaker 2","00;05;45;02","00;06;12;29","And so basically that the so-called junk model joined distribution over the sequence of observation states. And action is then basically characterized as follows. So you have propriety over actions you have a license model. So so yeah. So your prior overreaction. So this basically versus what is appropriate if you take certain actions or time you have some transition probabilities."
"Speaker 2","00;06;12;29","00;06;52;18","So what is the probability that I will transition to this next stage given my previous state and this and you have the accurate model, which basis? Yeah, given the state I am which observation, I will see. And so it is basically the versus the so-called Markov assumption. That's your observation that you see at this time that it only depends on your hidden state and it does not really directly depend on anything else because if you know your if your your current in state, then you know your observation, you will see so that basically what is reflected here."
"Speaker 2","00;06;53;25","00;07;23;05","But of course, as an agent having this model this allows you to still to to assess how likely is a sequence of observations, for example, and allows you to predict given these actions what will happen with one crucial but of course is still the inverse of this model. Given that I saw these observations that are these actions, which is my current state, and this is basically non-trivial."
"Speaker 2","00;07;23;24","00;07;51;28","So even if you have the exact model that you refer to as this is typically intractable. So that's why it makes of inference. You resort to variation inference that you just say, okay, I just assume that I can build a model, the so-called for, for example, your model. And this is the thing that will tell you, given certain observations, what is my probability to begin a sort of this what's depicted here?"
"Speaker 2","00;07;51;28","00;08;42;28","So you do this. Q And Q is basically a variation of your distribution contours and you just say, okay, given some observation I want to have the best estimates for the state I am in. And the reality principle just sits, if that's what you want, then this is and you just optimize the free energy, which is no pressure and basically expectation over states and generated by your your expectation over to the difference between the what an accurate or your approximate posture and look like use false the drive model and if you can minimize deaths, that basically means that you will have the best explanation for any observations you see."
"Speaker 2","00;08;43;09","00;09;08;18","But at the same time, you also have the best approximate posterior for the true and you're not going to go to the whole derivation of this flow but basically you can convert this through to the second regression line. And this is the one that we use most often in our models which is basically the virgin between this and the approximate posterior."
"Speaker 2","00;09;08;29","00;09;39;00","So basically what is the state I am given your observations that so and described as basically just this is my, my guess that I am in the States given the previous state elections. So I don't know the observation but I want to test this without my observation. And if I see your observation, I don't want my beliefs to completely switch because the probability there's something wrong with my model."
"Speaker 2","00;09;39;20","00;10;12;09","And then you have the second term, which is the, the looks like this basically the accuracy of your model or how good are you at reconstructing the outcomes. And so this is all form to false basically or control your current events that so you know, your observations do so now you can validate the energy and then you can be a predictor model in order to minimize this thing."
"Speaker 2","00;10;12;24","00;10;35;13","But of course you also need to know your actions. You want to get to the future. And so if you look into the future, then talk about the expected energy. So here we didn't we we use by the shorthand for the sequence of actions into the future that also switched from D to just to denote that we are talking about future type steps basically."
"Speaker 2","00;10;35;13","00;11;15;12","But the same with the important business now that in the expectation now you don't have expectation it's only over states with also over outcomes because you couldn't sense your observations yet. So you don't know them so you can just do an expectation over anything that could happen. And, and then the move that is made in the conference is basically that's the on hand for the term which they call the instrumental value or realizing preferences."
"Speaker 2","00;11;15;24","00;11;48;19","And it's basically stating that as an agents for future outcomes they have some prior they think that they will regardless what happens that I think I will realize it's kind of your your preferred outcomes let's say can also cross this more like homeostasis. So my body temperature can be 37 degrees Celsius. So my expectation before knowing anything is that it will be 37 degrees and hence I will act in order to make it so."
"Speaker 2","00;11;48;19","00;12;13;27","So that's a bit reflexive here that disregards the the dependency on your reaction that you just say, okay, my prayer is that this is what I expected. So this becomes the instrumental value. And then the second, the solution is basically that your approximate just your model is basically very, very close to the studio so that you have a good approximation."
"Speaker 2","00;12;13;27","00;12;51;11","Then you can reside in the second term, which basically means that you have on the one hand and the third that's says, this is my belief or the state given injections I will do. And the other thing is also a belief about future states have an actions and some certain outcomes that I expect to see. So basically it says what would be the information that I gets from looking for certain outcomes."
"Speaker 2","00;12;51;28","00;13;14;25","And it's it's kind of in a systemic value or information gain which can drive you to explore. Basically, you want to have if, if you don't know how to get to your preferred state, at least you want to get to state as to states that give you more information on where you are and go, first of all, often says it's like the owl that needs fruits."
"Speaker 2","00;13;15;06","00;13;43;04","So what do you do with the first order you search for pre first. And so the epistemic value is basically searching for prey. It's like where should I go to do to get more information on this and then once you know where this then you can realize your preferences and the thought is that there was a pretty risk so how does the action selection works then?"
"Speaker 2","00;13;43;17","00;14;14;25","Well, basically you want to select the actions that minimized your expected strategy. So at each times, the first thing you do is you use your model to estimate your return. States like knowing which state may now given my latest observation, then you can evaluate the expected free energy for for each of also your plans for a future sequence of actions you can evaluate and expect to be energy."
"Speaker 2","00;14;16;03","00;15;04;19","And then this basically results in a belief over policy. So you basically take the the mind, the negative energy, you're multiplied. It's this precision parameter which just states how yeah. How how much confidence you have. The energy is correct basically. And then you use this the suffix so basically it just it just says the the policies that have low expected tree energy are the ones that are most likely basically that's that's the only thing is from the source and then referred in this section, according to this, you just select the next section for the sequence that you think will really give you the the minimum energy and that side of course."
"Speaker 2","00;15;04;19","00;15;30;12","And then you take this action, you get a new observation and the process is and so one crucial point in all our work is that it all starts with this just following is a flexible and typically you can and you have a certain problem and you know how the problem looks like, what the observations are or what the hidden state might be."
"Speaker 2","00;15;30;21","00;15;53;14","And then you can really pinpoint and write down the exact model and so optimizing. But in our case, this is often the true issue. If you look at the robots that drives around and gets them right inputs, for example. Yeah, well, these are the states things that you need to track. How do you convert these pixels to the state space?"
"Speaker 2","00;15;53;22","00;16;22;03","So all these things are there. They're just not there. You have the goal in a work is, yeah, I can then completely start from scratch and learn this and for listening the use of neural networks to access, function, approximate or actually provide the smoothness, these models optimize the parameters of these neural nets also by minimizing the energy. That's that's great."
"Speaker 2","00;16;22;13","00;16;53;10","That's it. So how does it look like all this? Not will. So we start off with observations and actions so this can be but pixels basically so and and by matrix of numbers let's see actions which could be any action could your whole city or whatever your agent can do and these numbers are put into a neural net which we told you in order and this basically reflects this Brooks's posterior."
"Speaker 2","00;16;53;10","00;17;31;10","This is just saying given my previous action and my observation outputs probabilistic presentation which is basically the means and the variances of the very patients. And then we have a second rule that's rich called transition model. And this is then so yeah, well, what will happen if I do a certain action out of my state evolves. If I say to a certain action Now finally, we also have the decoder or the electric model, the then outputs given the State's observation."
"Speaker 2","00;17;31;10","00;17;59;18","So in case of an image, for example, this will generate you a new image. And the goal is of course to have the best predictions possible. So if you look at the energy forms, again, in this case it's again you have this like in the form which basically just says that during the output of the decoder. So to generate image, I just want to have this close to the actual image that you've been."
"Speaker 2","00;18;00;10","00;18;32;12","See, so it's just a reconstruction lost in terms of neural nets, let's say. And the second to sort thinking through on a scale killer verges between the distribution that you generate from the encoder and the distribution that you generate from the transition. Well, it's so we apply this on a number of cases, which also we're seeing in the previous model stream."
"Speaker 2","00;18;32;21","00;19;00;17","So just to give you some intuitions, the first thing was the multiple problems, just which is the basic control problem. So here the sensory input, that's the position you are you basically have to infer not only the position you're in, but also the momentum you have the most you have. And so you can see that on the right, you can see the model predicting all likely trajectories for going left or right."
"Speaker 2","00;19;00;29","00;19;20;13","And you can see how in the beginning it's not sure on the course. So it's it's very spread out and and what it will predicts. But the more information that gets, the more kind of collapses. Yeah, I'm pretty sure that this is the behavior this will happen. And then you can use this tool to drive the agents towards the preferred states."
"Speaker 2","00;19;20;13","00;19;45;02","In this case, the, the flag the second one was using the quarries or environments or here you get these observations that are now just pixels from from this game and the preferred state of the car will still be in the central metric. And so you can see how it actually infers the actions that will bring it to the central district."
"Speaker 2","00;19;46;12","00;20;28;15","And it might even cut corners in order to the reach of preferred states a bit faster And finally, we also have this fun on the robots navigating our lab where encrypted with the number of sensor mobility so you can see the camera, but also from tracing lighter and also very dark range Doppler. So the radar range Doppler basically gives you in the way access the range and in the x axis, the the velocity of the reflections, basically the Doppler and here you can see how in the beginning, if it has been a number of situations and then basically that the model imagine what would happen."
"Speaker 2","00;20;28;27","00;21;10;06","So these are real observations and now it basically imagines what it will see if it turns around, for example, and just yet actually learns basic dynamics, basic behavior of of all the sensor model. So that's pretty cool So what are the limitations of this thing? Well, there are two core limitations that we address in the first one is that we use this this six X reconstruction both to learn the model, but also to define your preferred status like this is the image that you want to see and try to make that happen."
"Speaker 2","00;21;10;26","00;21;46;26","But the problem is that this great error in pixel in terms of pixels is not really the best metric. So, for example, if you have the the left image and you look to assist output an image is similar to that one. We have two examples you on the right and you can see that's the same image with some salt and pepper and those is actually scoring worse in terms of squared error than an image where the two the joint arm is actually incorrect."
"Speaker 2","00;21;47;10","00;22;14;18","So although in terms of behavior, the left one is better in terms of great error the right one is better. So that's of course problematic. If you want to control the arm, the words to go and on seconds limitations that if you need to evaluate the expected free energy for the huge number of potential trajectories, potential actions you can do, then of course this becomes intractable as the number increases."
"Speaker 2","00;22;15;06","00;22;40;24","And so the the ways that we go through this in the context of work is on the one hand, instead of using a pixel wasting constriction or just compressive learning, it sets out exactly this works with performance and in the next few sites. And then the second thing is instead of evaluating the expected the energy for all this, you basically amortize the forces actions."
"Speaker 2","00;22;41;01","00;22;55;14","So we also train neural nets outputs, actions, different stages. And so with that, we can now shift to get through. Google talked about the contrastive formulation of the expected benefits from."
"Speaker 1","00;23;02;12","00;23;03;01","Thank you, Tim."
"Speaker 3","00;23;05;16","00;23;47;10","All right. So thank you, Daniel, for having us. And thank you, Tim. You know, if you can hear me well, soon on my screen out Okay. All right. So now I would think about our recent work contrasted in France. So this work was recently published that noted that those in 31 very recently nice months. Let's start delving into it."
"Speaker 3","00;23;48;16","00;24;30;06","So the dissecting that we discuss in inductive inference is very similar to the reinforcement learning. One with the difference that in reinforcement learning, the old behavior learning is driven by rewards. So the agent receive reward function and the positive rewards should reinforce positive behaviors while negative. The rewards should penalize the agents to avoid those states and actions. However, one of the problems that comes with reinforcement learning is that in order to actually learn from rewards, you need a reward function."
"Speaker 3","00;24;30;08","00;25;08;22","And that's not always easy to have For instance, as you mentioned, especially when the state is not known in advance, so the agent don't exactly know its status is difficult. In that case, the design, the reward function, because you're not sure of what the agent knows and how it can assess its performance compared to the environment. So we instead focus on active inference in the inference the agents operates to that the principle of minimizing free energy as we have just so that the principle of minimizing free energy actually enables two things."
"Speaker 3","00;25;08;24","00;25;35;22","The one thing is to learn a model. The work We call this an artificial work model where work seems simple. And the other objective is to minimize the free energy future by trying to achieve some preferred outcomes of the agent. So we assume that the agent does some preferred outcome distribution that he wants to achieve and that this goal will be in the future to actually achieve these preferred outcomes."
"Speaker 3","00;25;37;29","00;26;07;05","So the the environmental setting we discuss is that one of the options piece of partially observable market is in process. So just to recap the observation that the agent receives, just infer the internal state of the environment which is not served. And then there's action which are actually known for the past, but the agent should infer or somehow choose among a set of possible action in the future."
"Speaker 3","00;26;08;21","00;26;40;13","So this is just a summary of what the artificial word module looks like, or as we've seen in the previous lights, we have an encoder that the information from observation we focus on visual environments. So here we have again an image which is basically owned by metrics, or the encoder could be, for instance, a convolutional neural network In our case, we have the the even state model with which takes the previous state and the previous action and in particular no work."
"Speaker 3","00;26;40;22","00;27;18;24","You use some some form of recurrent neural network model in order to keep preserving the history of the environment. And then we have the decoder that computes reconstruction of the information on the current state. So it tries to encode inside that in the States as much information not possible from what it comes from the from the observation. So the problem with reconstruction is that computing then especially in visual environments is is quite complicated because you need a big models that there are very good representational capacity."
"Speaker 3","00;27;18;24","00;27;46;18","And also the models cannot be 100% accurate. I think that low low dimensional settings because for instance, predicting an image pixelbypixel is practically very invisible. So it's very rarely happens. So let's call an example a year or so, a few a few weeks ago I was a I was training to be like models. So like a model similar to this one on the left."
"Speaker 3","00;27;46;18","00;28;29;18","So where we have the this encoder decoder architecture on that. Well, and I'm thinking the breakout game and try to to learn and even state to to learn action on top of the interstate. The problem is that the reconstruction of the V so we're actually pretty bad in that they we're losing very important information about the game. So for instance it was kind of able so we some uncertainty to model where the model of the game is but it wasn't able to model where the ball easy which is actually one of the two most important details in order to actually be able to play."
"Speaker 3","00;28;29;19","00;28;58;29","So even adding the reward function in this case so having the the the game score available and the agent wasn't able to learn the task because of of the state which was lacking the most important information in order to to keep improving. So this is one issue that we try to overcome in our work. And the second part of active interest involves learning to pursue the preferred outcome."
"Speaker 3","00;28;59;19","00;29;32;23","So in order to pursue preferred outcomes active in agent, the two things, one tries to minimize a the distance with respect to two disparate outcomes. But then the other way you also minimize the ambiguity with respect to the environment So normally this is done by trying to match the, the two distributions or trying to match, as we saw, even if we've scaled divergence to match the distribution of the match, the outcome with the preferred outcomes, distribution, whatever."
"Speaker 3","00;29;32;23","00;30;03;25","Again, in a dimensional setting, this can be quite complex because how do you define a distribution in an aid nation or here much could it be, for instance, just the center go around the, the big self. So we've the with the mean being the pixel value and then some fixed extend the deviation. But in that case we we get into troubles because we have the same issue discussed before we for instance have this kind of goal here and a noisy observation like this which actually adds an eye."
