"Speaker Name","Start Time","End Time","Transcript""Speaker 3","00;28;14;10","00;28;44;23","So there's the, and then there's some sort of affordance level and maybe we can get out of the whole sentient system thing and it's like it's just an affordance for the thing this to maintain the thing. This doesn't need to know about systems as such unless someone, some creature happens to evolve a brain which starts to sit down, working out system diagrams, two legged ones potentially, but otherwise it's like it's just things all the way up, right?"
"Speaker 1","00;28;46;28","00;29;31;18","Let's now that were 31 minutes in let's sprints up to that Markov cliff and then see where we go. So figure one of the paper is kind of making this first fundamental connection between the Lorenz system as defined by dynamical equations. So the traditional Lorenz is defined more like the blue version within equations of motion. Well it has a positively opposite exponent, which is to say that very closely located points diverge rather than stay in like a laminar flow parallel line world or converging."
"Speaker 1","00;29;31;27","00;30;06;05","So they diverge and that's what makes Lorenz system chaotic ergo difficult to predict given measurement error and tiny perturbations due to even thermal noise, which is like kind of how pseudo random number generators work. And then there's going to be an approximation based upon this stochastic solution and so the trajectory and the right panel here, it's the deterministic solution to the laplacian form of Lorenz based upon the Helmholtz decomposition."
"Speaker 1","00;30;06;20","00;30;19;03","And so this is sort of like the version on the right that's usually seen in the state space model is almost like we're sampling stochastic li from points along that racetrack. So that was figure one."
"Speaker 3","00;30;19;23","00;30;40;12","We would you just if you just explain that, just go over that one more time. Just to clarify that bit. I think I understand what you're saying, but it's kind of an important point you make there when you say deterministic solution that I didn't there is that window just to clarify what that means."
"Speaker 1","00;30;41;17","00;31;21;26","So the deterministic solution would have no noise so that the position at the following time is entirely determined by the non stochastic state that it's in at the preceding moment. Whereas when we talk about a stochastic form it's like that's like your cars driving and there's thermal vibrations on the road. Now, the lyapunov exponent on that car at non zero temperature is small so that the flow term dominates the vibratory term."
"Speaker 1","00;31;22;08","00;31;44;02","But there could be some other system where the difference between if it's in an absolute zero world and just on the road, then it's going to go straight. But once you introduce any wiggling, when the system is chaotic, it has that positive, the opposite exponent, then the tiniest wiggle causes the system to diverge."
"Speaker 3","00;31;45;21","00;32;12;26","That's really helpful because so basically normally we just like with the deterministic thing, it's just whatever the initial conditions, if it varies slightly, but then once it runs, it will settle into something. But if you you've got the initial condition and you've got the perturbations due to noise as it's actually in which and I suppose you could say a little bit of an extra change in initial conditions to each state that the lens attracts is moving through."
"Speaker 3","00;32;12;27","00;32;15;04","So. OK, that's that's helpful. Thanks, Daniel."
"Speaker 1","00;32;15;05","00;32;44;03","Yes. And I'm going to just show this image. This is I don't know if it's the very, very first, but this is the image that Lorenz used to talk about chaos in 1961. So I mean what's the difference between 76.8 and 76.85. It's imperceptible. If your thermometer only had like three significant figures, you wouldn't even be able to talk about the difference but I mean how different can it be."
"Speaker 1","00;32;44;16","00;33;13;14","And it turns out that these, those two systems start imperceptibly different. But nearby points in chaotic systems do diverge. And so it's like, OK, but they're still tracking each other, right? It's like, well no wrong. Later on and so of course a more chaotic system with a more positively operative exponent diverges faster. But any system with a positive leading the option of exponent is going to have divergence."
"Speaker 1","00;33;13;28","00;33;49;19","And so if you have a purely deterministic system or one without this kind of the option of induced chaos, then you can predict far out. However, prediction matter experts, as Dean, I'm sure, will revisit us to meet their match with chaotic systems. And that's actually one thing I hope that we get to by the end, which is that by putting action in every loop and inference on action, we can still, whichever of these timelines we end up on, we're going to be doing OK."
"Speaker 1","00;33;50;05","00;34;15;23","Because we're always readjusting our inference to whichever of these mountains we're on. It's not like one of these is better or worse or more or less challenging. Like they have the exact same upper and lower bound. The only mistake would be to make a prediction and be super confident about it and be on the wrong predictive timeline. But as long as we're always updating our predictions, then either of these days are going to be OK."
"Speaker 1","00;34;16;09","00;34;33;09","But if we put on the jacket because we thought that it was going to be cold here and that's when it was hottest, then we're injured. But if we just think, OK, well, we know we have the jacket, afford it, and so we're just going to keep an eye on that as we watch the temperature and continue to update our predictions, maybe then it'll be OK."
"Speaker 1","00;34;36;13","00;35;21;22","So that was the initial Lorenz attractor. Section three goes into the Helmholtz decomposition, which we've talked about in several other streams, and we've seen it introduced as the breaking down of a vector field, the total current in this kind of electromagnetic representation into the air rotational, which is kind of like the straight line. There's no rotation in those straight lines and the purely rotational solenoid or current flow currency, we've talked about solenoid in gradient partitioning and then what this paper does and I think the technical details are in the Appendix B of 16."
"Speaker 1","00;35;21;22","00;35;52;28","So that was the Bayesian Mechanics paper and then also there's this housekeeping, big lambda, and that's in one of the appendices to this paper. So that would be like something for someone else to help us understand a little bit of because it does matter and it's actually a key contribution because if the landscape is changing moment to moment, you can't just do the Helmholtz decomposition once and sail on that."
"Speaker 1","00;35;52;28","00;36;26;05","See without updating your estimate of the partitioning here of the decomposition here that decomposition. So again, dynamical systems, that's like the position of the car and then we're going to because of Section two, be having an equivalence between that dynamics and the flow modeling. And one of the terms that shows up on both of these is the fancy fancy I it's the self information."
"Speaker 1","00;36;26;25","00;36;52;26","The first part performs a reminder in gradient descent on the negative log of the steady state density, which can be interpreted as self information. So how surprised should one be to be at a given location relative to expectation? So we talked about how like the potential energy of the ball higher up on the ball is higher and then the potential function drops."
"Speaker 1","00;36;53;07","00;37;34;07","And that's the physical analogy to this more informational statistical distribution approach to the self information. And then in 3.1 that self information is going to be pursued and expanded upon for a a relatively more simple case. So we're going to identify due to the Helmholtz decomposition that there's this key variable which can be interpreted as like a potential function corresponding to the self's appraisal and that self's appraisal term may have functional forms."
"Speaker 1","00;37;34;28","00;37;42;25","So we can have a function that describes how surprised we should be Stephen Yeah."
"Speaker 3","00;37;42;25","00;38;17;23","If you could go to that last slide, the previous one there that I think this is quite useful. So the Focker plank, if it's an equilibrium which we're not because we're doing non equilibrium steady state, but if it were then it would be zero basically is a equilibrium is not changing. So there's no, there's no divergence because it's zero and then he's taking this homo composition which in a way is like a vector with a vector you've got, you know, it can split some things, move into X and Y."
"Speaker 3","00;38;18;11","00;38;49;15","So this the gradient is coming out in the solenoid. It was at right angles to the gradient. So it's kind of like that trick that he does with accuracy and complexity. You can say that there's a solenoid or a land gradient which go together for when it's still in a kind of a particular angular momentum sense. And then there's that ability to with the housekeeping to then move into the flow, which I'm not entirely sure."
"Speaker 3","00;38;49;15","00;39;25;20","I think that's the bit where we might need some quite what, because flow could probably be more specifically thought about. So now you've got this ability to sort of sort of structure through the kind of more particular context, the solenoids and gradient. And then there's this transition to a more kind of general or variable, which can be just we don't need to get the particulars now because it's a, it's a variational metric that just gets used in an approximation sense."
"Speaker 3","00;39;26;09","00;39;31;11","And then follows into what you're saying, would I be on the right tracks with that?"
"Speaker 1","00;39;32;00","00;39;56;14","I'm not sure who he is, even though I have an expectation because it's a multi-person paper. But just looking at these as like circles and triangles and squares, we can see that upside down triangle, fancy eye of X is in both terms. So there's like a Q multiplied by something and then a gamma multiplied by something. And we see that omega is defined as like the Q minus the gamma."
"Speaker 1","00;39;56;29","00;40;27;26","So these two terms which were decomposed out from each other, get recombined into the final flow so that's just like if it were like a times X minus B times X, and then Omega were defined as a minus B times X. So we're re composing a flow equation that still features this fancy eye. And yes, we're solving that for a specific point that matters."
"Speaker 1","00;40;27;26","00;40;57;00","We want to solve that for where the balls at the bottom of the bowl. So there's a function there that's going to tell us more or less in multiple ways, whether we're more or less away from the bottom of the ball. And again, it's not about the system being at stationary, it's about this decomposition or having a fork or plank steady state."
"Speaker 1","00;40;58;11","00;41;00;02","Dean So you can see you've got."
"Speaker 3","00;41;00;17","00;41;18;29","Just one quick thing. So at the bottom of the bowl, if we the gradient can effectively be zero, but solenoid or could still have a value because it can still be spinning around the bottom of the bowl. But the gradient then because I notice the gradient term isn't in the flow, but the solenoid all term is."
"Speaker 1","00;41;19;10","00;41;34;11","A the gradient is because Q minus gamma is in omega. So Omega is this omega. Delta fancy is just these two terms combined OK? OK, yeah. Dean."
"Speaker 2","00;41;35;06","00;42;03;15","Yeah, I was just going to say what typically when this is brought forward, it's easier to understand the decomposition and the re compiling if we view the blanket as a partition, where it gets little bit more interesting is when the blanket is literally an envelopment and there's a there's a physicist by the name of Keith Humphries who talks about emergence and he looks at that piece of it as well because there's a polar aspect to this."
"Speaker 2","00;42;03;25","00;42;27;27","We can think of that in terms of positive and negative fields, magnetization and stuff like that and how that is also a decomposition and a re compiling. So I understand how it was presented in this paper. That's the partition way of looking at it. Right? It's more or less, but there's also the positive and negative polar piece to this."
"Speaker 2","00;42;27;27","00;42;53;08","When we look at the mark of a blanket as a blanket as opposed to a separator. And again, if we're holding up two things at once, this this doesn't just just change that. It just making sure that we hold both things up at once, the envelopment and the divider. I just want to bring that out there because again, we can we can see it easier as a partition like the skin as a partition."
"Speaker 2","00;42;53;12","00;42;58;14","We don't typically see the skin as a platform for sunscreen. That's my point."
"Speaker 1","00;42;59;29","00;43;00;29","Thanks, Steve. Steven."
"Speaker 3","00;43;03;02","00;43;29;01","You know, this, this, this this is a good point in terms of you can imagine at first I was thinking about gradient you know, it's obvious that you've got a gradient that you can pass through maybe where the gradient zero, but also solenoid will flow. I suppose if if things are moving around this way and then it starts to turn and it starts to go the other way at some point, the solenoid inflow is also passing through a zero."
"Speaker 3","00;43;29;09","00;43;35;22","So they can both pass through a zero point. It just wasn't as intuitive when I first thought about it."
"Speaker 1","00;43;36;06","00;44;05;18","Yeah. And even if you have something that's spinning around like something that's spinning in a circle like a hammer thrower, it's actually continual acceleration. That doesn't mean it's speeding up. It means that the vector is continually changing. So now our map is of that acceleration and it is unchanging in how it changes. So that is to say that the system can have added in a different way of thinking about it."
"Speaker 1","00;44;06;00","00;44;29;20","Yes, a solenoid or component. We're not saying that ball's at the bottom of balls are dead and unmoving. We're saying in our map there's only one point because we set it up to be like a ball map. Where the derivative is zero. That's the solution where the rate of change is zero. So that's not to say that the system isn't moving."
"Speaker 1","00;44;29;26","00;45;16;05","That's to say that the flow steady state has been achieved in figure four. Well, in Fig. three, we see the three states. So this is like the cover of the GB book, like kind of three different projections from a three dimensional system the second versus the third, first versus the third and the first versus the second. And we're seeing how there's movements of sampled trajectories and they're kind of coming back to something that's ball like for any set of two dimensions so it's kind of like a three dimensional ball now because any two of these dimensions, it's more like a regular bowl."
"Speaker 1","00;45;16;13","00;45;52;26","The kind of soup goes in. But then like the Super Bowl is like a down projection of a system that has an attractor in a higher dimension. Potentially a much higher dimension. But Lorenzo, they're only modeling three because the particle only moves in three dimensions when we continue to investigate the bowl like properties of our laplacian approximation to that Lorentz system, we see that there's a few different shapes of balls depending on which angle we're going to shine the flashlight from."
"Speaker 1","00;45;53;16","00;46;22;14","Some of them are like spherical so a spherical ball doesn't have any specific correlation between the two dimensions. It's like a cloud of points. The regression is just like flat through it. However, there are some couplings where the ball is non random. So it's almost like if we were tracking the movement of a ball, it's getting jostled around in these balls."
"Speaker 1","00;46;22;28","00;46;42;00","Well, like the one of the first and third, if that was the light we were shining, it would just look like it was a scatterplot. This are totally the regressions flat. There's not much information being provided. It's it's within the ball. So already has some nice dynamics, but it's kind of within that attractor zone. It's to scatter. There's no pattern."
"Speaker 1","00;46;42;17","00;47;04;19","But clearly for the first and the second we see that there is a coupling. Now, imagine if we didn't see the ball because of course we don't. It's not there. That's part of our map. We're just seeing the movement of that ball as we sample it through time. And it would be only on this manifold kind of being like spending more time going from the top left to the bottom right."
"Speaker 1","00;47;04;19","00;47;31;17","In these images. So we're going to take that idea and then connect it to the jacobian. And the question, which is again, throw back to our matrix math slide and an awesome opportunity for anyone who wants to bring more of a technical interpretation to the stream. The Jacobian is like the first, the unnamed matrix is just like the matrix of position."
"Speaker 1","00;47;32;16","00;47;59;14","So that's like the first moment of the distribution. And then higher moments are like the partial derivatives. So Jacobian is like the first order, partial derivative. So that's like the slope of the ruler at that point. And then the Hessian is the second partial derivative. That's like the curvature. So if it's a ball, there's only one point where it's flat and then it could be flat and the ball could be like up or the ball could be upside down."
"Speaker 1","00;47;59;29","00;48;26;25","And so that's why it's important to also have this second curvature term to understand whether we're at a ball like this or ball like that. So that's kind of like calculus. And those balls, those ball attractor shapes which we're inferring using the laplacian quadratic assumption. So it's not saying that the Lorenz has these processes. These is these, it's saying that's the approximation that we're going to make."
"Speaker 1","00;48;28;22","00;48;58;16","It turns out that although there's somewhat of an unclear correlation and pattern in the first derivatives, so like the movement to the left, it's not like it's correlated with movement up. However, the second partial derivative, the hessian matrix starts to look a lot like the covariance matrix. So the actual positional covariance of these states with each other. So like the on diagonal is kind of obvious."
"Speaker 1","00;48;58;16","00;49;30;01","Like of course your position on the x axis is, is correlated well with your position on the x axis but there are correlations between state one and two, and that is recapitulated in the structure of this second order polynomial approximation to these attractors that are laplacian approximations. So again, up until that point in 3.5 and in figure six, Markov has not been introduced."
"Speaker 1","00;49;31;10","00;49;53;06","Nothing has been said that word hasn't come into play. It didn't come into the systems definition. And so that's just really important because it's just showing like there's a lot of groundwork to get to where we make the Markov Ian partitioning. And so there's power and challenge in that."
"Speaker 3","00;49;53;11","00;50;25;20","Stephen Would I be correct in saying that effectively? So it's a case of approximating the states of the event attractor and that's what's currently there. So this is different ways of showing that within some manifold state space and by approaching it in different ways, it reveals a different type of approximation. The only thing I would ask, I'm a little bit confused."
"Speaker 3","00;50;25;20","00;50;40;08","Why does squish maybe I'm missing something. I can see why there'd be kind of a round one I'm just trying to work out how it squishes. Is it something to do because of the solenoid or piece or the gradient piece or is there something else?"
"Speaker 1","00;50;41;09","00;51;24;11","OK, so if we were talking about just a particle undergoing Brownian diffusion in three dimensions, so it doesn't have any kind of correlations or any sort of structure, just it's just a random walk in three dimensions. Well then it would have a spherical error profile for all of these images. But we are capturing structure that exists because Lauren's structure has a specific specification so the states are whichever are being modeled, if you care about pressure volume, that's your state space, that two dimensional state space of the map it's not saying those are the only states of that system."
"Speaker 1","00;51;24;11","00;52;08;25","It just those are the ones that you're modeling. In the Lorraine system, we have three states. It's position in three dimensions, but those three dimensions again also apply to a Brownian diffusing particle, which has a difference jacobian, covariance and hessian. We're talking about those being calculated for the Laurens system with the parameters that they selected. And so we are pulling out CO variances and connecting it to this second order polynomial approximation in the session for a system where the movement is not just a Brownian diffusion."
"Speaker 1","00;52;09;07","00;52;16;07","And so that's why there's structure in the covariance and that's why the structure is interestingly recapitulated in the question. Dean."
"Speaker 2","00;52;17;20","00;52;47;26","Yeah, and Hollywood Hollywood supplement that with this things, things. There we go. Things that are in something that's moving, the thing that's moving that's in something that's moving that's on something that's moving has a tendency to have the negative charged things all congregate in one place down in the lower right corner and all the positive things all congregate in another place in the upper left corner."
"Speaker 2","00;52;48;00","00;53;19;00","That's the nature of movement and so that polar part of it is in play as well. If we consider it as part of these statistical transitions, and that's again, it's it's fascinating if you if you look at it, a minimum of two things. So not just not just as a partition, but also as an envelope, those things suddenly pop out at you and you see the pattern in and in a different way."
"Speaker 1","00;53;20;03","00;53;37;10","So I want to think about a physical system that's not chaotic but will help us understand what this covariance matrix is. So let's think about a children's carousel so it moves. The horsey is moving around in a circle. And so that's like our unit circle, like the four quadrants. And then also the horse is going up and down."
"Speaker 1","00;53;37;29","00;53;59;23","OK, so when you're, you know, so again, it's like, you know, if you're at 12:00 on the carousel, it's like you have a one for the Y and a zero for X. OK, so hope that makes sense now as it goes around, it's like point five and point five. Again, just using simple numbers here, like the X and the Y are correlated and then they're also correlated here."
"Speaker 1","00;54;00;02","00;54;28;24","So one could say that there's like a correlation between the X and the Y. Like they have a covariance together but now the Z axis is moving up and down independently. So a system like that, you'd see a covariance between the X in the Y positions of the horsey and not that they're a different system, but they are uncorrelated."
"Speaker 1","00;54;28;24","00;54;55;17","They don't provide mutual information on the Z axis, which is oscillating. Now, if this paper had done, we model a deterministic carousel and it's kind of like putting the rabbit in the hat because the covariance matrix, it looking like this would be no surprise. Because it would have been defined that way. So that's the key insight. And one of the key contributions is like they didn't put this in the hat."
"Speaker 1","00;54;56;11","00;55;44;09","This is the OG complex system, yet the approximation, the Laplacian approximation pulls out a covariance structure that's extremely tractable, and it turns out that it still has a very strongly positive and very similar the often if exponential. So it's like now it's like a chaotic carousel. And yet our approximate in our map of that chaotic carousel still holds the chaotic nature of the system while also giving these ball like attractors for any given to and even all dimensions or states considered simultaneously."
"Speaker 1","00;55;44;25","00;56;13;17","So we're not conflating the simplicity of a non equilibrium steady state with the complexity of the underlying density dynamics. So just because the map is simple doesn't mean that the territory is. And so that to me is a knockout blow against realism and for instrumental ism because this paper saying nothing about the underlying system active doesn't say anything about the underlying system."
"Speaker 1","00;56;13;23","00;56;30;08","We're talking about approximations and our maps of territories. In other words, the probability density can evolve in a complicated fashion in attractors so go ahead, Steven."
