"Speaker Name","Start Time","End Time","Transcript""Speaker 1","01;25;42;22","01;26;26;23","I think I agree. I'm just imagining that it could be possible to design a system where there was one coupling going out, but there was no coupling back in so one could devise edge case matrices that have various kinds of properties would those even be good maps of systems that we care about? Probably not. So for some of the basic attributes like of communication and of course, if one person's not wearing their headphones, like, yeah, the systems are coupled, one person's talking and the other person can hear them but not return any information right?"
"Speaker 1","01;26;26;26","01;26;56;02","So it's like that's interesting. It's a type of coupling that systems can have and it has a different blanket because of that. But especially for systems where we want to think about states that are influencing the environment and vice versa, whether it's communication or stigma, or coupling or collective behavior, that whole class of systems, it's extremely important to have, of course, in and out and more and less and different."
"Speaker 2","01;26;57;26","01;27;25;15","I wouldn't drop. I wouldn't drop or sorry, Steven, I just got to get this and I wouldn't drop or I'm actually suggesting that we we this tells us we must also contemplate. And so that's like saying, OK, so which is more important to the positive ions or the negative ions think they're going to conjugate and we can tell the difference, but we shouldn't apply a value all the time."
"Speaker 2","01;27;25;21","01;27;46;26","There are times when we can just see the difference and accept that for what it for what it is as opposed to always jumping to the idea that something has to be more or less that that the positive ions are more important than the negative ones. Maybe they are, but we shouldn't jump to that. Right away. Done and done."
"Speaker 1","01;27;48;27","01;27;52;05","OK, closing thought on this, Steven, and then we're going to get to free energy principle."
"Speaker 3","01;27;53;02","01;28;15;17","Yeah. So yeah, just just mention a little bit to what Dean said there. I like the. Yeah, if something is a charged particle, how much is the system of the molecule showing the distribution of charge and how much is the quantity of the thing this of that thing? Right. So I suppose and that that becomes I don't think there's a definite transition."
"Speaker 3","01;28;15;28","01;28;40;08","And I'm glad you went back to this diagram this is the one I was just want to mention that. And just to the the arrows there on the right. So we're sensory states. It shows that the sensory states are related to the same external states as the action states are affecting. So it shows it's almost like there's there's a regime of attention."
"Speaker 3","01;28;41;24","01;29;21;12","So it's not the sensory states aren't reading something coming in about something which is completely unrelated to, you know, it's not like I'm looking I'm acting in front of me, but actually my eyes in the back of my head. Right. So my sense is that there's an alignment and then when I look to the left, this this coupling that's going on, then between in the way that it's set up, between this, it's saying it's, it's, it's, it's not a mark of blanket when it's saying is a coupled system so it's sort of saying in a way that this more slight is more nascent version."
"Speaker 3","01;29;22;01","01;29;47;07","There's this kind of there's still a spookiness about it, I suppose you might say. Is this sort of a it's not it's not it doesn't drop out as far as a mark or blanket. There's, there's that kind of resonation going on and I suppose somewhere between left and right you start to become, you meet the, the conditions of a mark or blanket."
"Speaker 3","01;29;47;16","01;29;50;21","And I suppose, you know, that's an interesting point."
"Speaker 1","01;29;51;24","01;30;18;05","I don't want to just make the water murky with too many terminology. We haven't brought attention in. It's not related to what we are discussing here. But I see what you mean that yes, if actions were influencing state A, you know, your actions were moving something up or down, but you were observing the left, right? Yes. That's a different kind of system then if you're observing and acting on the up down movement of something that's not a regime of attention."
"Speaker 1","01;30;18;05","01;30;26;02","But I know what you mean. Let's get to the f eep. OK, finally."
"Speaker 1","01;30;29;07","01;31;07;28","Remember that edges reflect statistical relationships, which is the other side of the coin of saying that the absence of an edge reflects a conditional independence. So one can provide a definition of the conditional density over external states. So a probability density. That's why it was so important to go from dynamics to densities in Section two. And we're going to think about that external density probability density, conditional statistical density as being parameterized by the conditional expectations of internal states given external states."
"Speaker 1","01;31;08;22","01;31;28;27","Here's the formalism. See how the coupled systems have a flow where like given where you were on what even if it were a little noisier, as long as it looked like an oval, as long as you were like, you know that if you were low on the left, you were going to be low on the up and down."
"Speaker 1","01;31;29;04","01;31;46;15","And if you were further to the right, you'd be higher up on the y axis. OK, but imagine if the flow was like in a circle, you'd say, OK, we're at X on the zero. Well, you really don't know because you could be low, you could be high. Or imagine if it was just like a scatter cloud. No matter where you were, you would think it was everywhere."
"Speaker 1","01;31;46;15","01;32;20;11","In the box you wouldn't really know. But because there's a manifold, then this admits the possibility of a defeo morphic, which means like sort of like function like an stretchable map between the sufficient statistics of the respective densities not the territory, not the first map. I don't even know if we're on the second map anymore. We're talking about sufficient static sticks of densities of approximations."
"Speaker 1","01;32;20;29","01;32;47;21","OK, I think it's a deathblow for realism personally, but I would love to hear somebody who thinks it's not. The existence of this mapping rests upon a continuously differentiable and invertible map, which is linear under the place approximation. There's a few technical pieces there, but it's almost like we set up the system in a way that was defined only by its coupling."
"Speaker 1","01;32;48;11","01;33;15;09","But then we also got to choose our approximation approach, and it turns out that with a system with interesting coupling dynamics enough to befuddle almost every other kind of model out there, the approximation has a really nice relationship that recapitulates aspects of the system and lets us map. Like if we're on low on here, we can go to low on here and low and here."
"Speaker 1","01;33;15;09","01;33;56;21","Too low in here. Like it's a kind of, it's a function that can go both ways. And so that is going to be the relationship sigma mapping between the internal and external states, which was explored more in the Bayesian Mechanics paper number 26. This means the autonomous flow can be expressed as a gradient flow on a free energy functional of the variational density here are those four states, four kinds of states, external sense action internal and those are going to be expressed as a tuple."
"Speaker 1","01;33;56;24","01;34;28;24","It has to be because it has to be all four of those states co evolving and those have a gradient flow gamma and then the upside down triangle plus the solenoid will flow. So remember way back when when we saw that we had Q so in idle G Gamma for gradients and then lambda for housekeeping. OK, so now that is coming back into play, the soul annoyed all is still a single term."
"Speaker 1","01;34;29;05","01;35;07;20","That's just the, the potential function that self appraisal and one solenoid all term. Then we have a gradient over these four states and then the lambda housekeeping that can be rewritten and now Pi again let, let the ontology develop so that we can resolve some of this. But notice how particular states PI are the blanket and the internal OK but how have we usually used PI policy action selection?"
"Speaker 1","01;35;08;02","01;36;16;22","So this is a different PI. Yeah, the free energy functional on particular states. Particular states let's call them equals the self appraisal on the particular states plus the divergence term that is the form that then lends the ability to interpret that free energy functional on particular states to be rewritten in several ways, including energy minus entropy. That's a very classical chemical way to talk about free energy, to be phrased as the divergence between the Q distribution on external states and the P distribution on external states conditioned on particular states plus the self surprise all of those particular states or the one that's closest to the Bayesian information criterion, Bayesian modeling world but still being shown"
"Speaker 1","01;36;16;22","01;36;47;11","as equivalent to is the accuracy of minus model complexity and the evidence lower bound. So that's where we've seen that these formalisms come out many, many times, but we're approaching it from a very different way and a lot more bottom up. And I think but again, would be open to people correcting in a way that fully embraces the map territory distinction and makes no bones about it."
"Speaker 1","01;36;47;20","01;37;14;05","Whereas if you just pop in from the top with these formalisms, it might seem like they're describing aspects of the system. But I hope that the way we've approached this over the last like 6 hours of live streams literally, and the way that the authors wrote it so carefully makes it clear. We're talking about these formalisms on probably not even the first map and maybe the second map or summary statistics thereof."
"Speaker 1","01;37;14;20","01;37;27;16","These are relationships that are intrinsic to our approach of mapmaking because we did the laplacian approximation et cetera, et cetera, et cetera. Stephen And then D."
"Speaker 3","01;37;29;09","01;38;05;04","Yeah, this is very helpful. I might just ask, we go and walk through the very first sentence again in a second just because I think would be helpful, just to reiterate. But from what you're saying and I, I hear this really clearly is the particular states and the thickness of maintain in particular states potentially or of whatever those particular states persist effectively than is the same when at a higher order level over time and space as a policy because let's not."
"Speaker 1","01;38;05;09","01;38;09;21","Bring policy over yet we haven't gotten there, but we can say to internal states."
"Speaker 3","01;38;10;05","01;38;43;04","OK, I won't I won't jump the gun on that, but I I suppose the point is just to say that we can still be in the realm of things this OK, we can still be in the realm with thickness because we're talking about particular states of things. So we haven't got and I won't say beyond that. And then maybe just just to go through the ontology, not just of that first sentence just to reiterate, just to get it clearer, again, autonomous flow expected internal state."
"Speaker 3","01;38;43;04","01;38;48;28","Could you just recap that just to just unpack that a little bit more just so that it's a little bit clearer."
"Speaker 1","01;38;50;18","01;39;15;10","OK, so the autonomous flow so autonomous states are actions which are not we're not even bringing policy selection. And so it's the right direction. We want to go we want to be talking about internal states that are actually doing planning as inference that effect their action states. But for now, we're just treating the action states as outgoing statistical dependencies."
"Speaker 1","01;39;15;21","01;39;39;25","And then we're just we're pausing on how the actions are selected. We're just because do run system, there's no policy selection, but there are external states that are modified by states those are the active states. So it's almost like we can talk about action without policy inference. So the autonomous states, the autonomous flow at the expected internal state."
"Speaker 1","01;39;40;16","01;40;37;26","So these are expectations of autonomous states action, outgoing internal states can be expressed as a gradient flow. So now it's like we're going to rather than have a six state system, we're going to rewrite as four. Remember, we pulled out four kinds of notes and now we're going to express a flow not in a six dimensional space where each dimension was a measurement that we were making, but express a flow over the four kinds of states and then that means that even if there was a bunch of internal nodes that were communicating to each other, we could still use this fourfold breakdown."
"Speaker 1","01;40;38;11","01;41;05;08","Hashtag William Blake, hashtag Bucky Hashtag for Austin. No matter how many specifics were inside the internal or how many blanket states there were, like how many nodes in the graph or how many external states, because now it's like a flow over kinds of nodes. And then that because the nodes are defined by their directionality of relationship, like how they influence each other, right?"
"Speaker 1","01;41;05;08","01;41;20;00","Like internal and external, we know don't directly influence each other. They're conditionally independent based upon blanket states, et cetera. That allows us to write formalisms that are like evergreen and can be expressed as flow. Dean."
"Speaker 2","01;41;21;06","01;41;44;10","Yeah, I would just say that when I, when I first encountered these kind of formalisms, I always ask so and then what happened? And that's when I coined the phrase when in doubt, zoom, zoom out. But I didn't want that zooming in and zooming out to be collapsed just to the optical zoom. I just assumed that your legs wouldn't be compromised when you picked up a telescope or a microscope."
"Speaker 2","01;41;44;11","01;42;07;05","That you would still zoom in and zoom out by moving. Right. So the inference is in doubt. So how do you overcome that? You become more active, but not just with your eyes. You actually pick yourself up and move yourself around a little bit more, a lot. You don't just have to be on the on the north end of the carousel."
"Speaker 2","01;42;07;29","01;42;32;25","Sometimes you can pick up a ladder and look down on it as well. And that that'll give you a whole new set of data or more complementary data, a different collection. And so that's why I think it's really, really good to be able to see that and understand what it implies. It basically says if you're if you're if you're not sure at some more."
"Speaker 1","01;42;36;19","01;43;20;05","OK, could I disagree with action? First off, let's just look at this slide then, Stephen. So this functional the flow over the four kinds of states that is using this blanket partitioning paradigm can be expressed in several forms. Expected energy e big is expectation, expected energy minus the entropy of the variational distribution, the Q Variational distributions like the one that we get to control Q of MU, that's the Q of internal states, which is equivalent to the self information fancy plus the scale divergence between the variational and conditional density."
"Speaker 1","01;43;20;12","01;43;52;26","That's this k l divergence term, which is always greater than zero. So self appraisal is always zero or greater. You can't have negative appraisal. And then the divergence is always going to be positive as well. This can be decomposed into accuracy and complexity so that's this third framing. And in that setting, negative free energy becomes the evidence lower bound or elbow, which will be familiar to many people with machine learning backgrounds."
"Speaker 1","01;43;54;02","01;44;16;09","OK, amazing. So those are the three different formalisms and how they fell out. This is the basis of the free energy principle. What's the free energy principle? Put simply, it means that the expected internal states of a particular partition at non equilibrium steady state can be cast as encoding conditional or Bayesian beliefs about external states."
"Speaker 1","01;44;18;16","01;44;52;13","That's the free energy principle in this paper. Not the first and not the last way it'll be defined and not the only. But that's how they discuss it here. And basically we moved from early on. It's like tying our shoe with a density to dynamics side. And now we have this whole universe of formalisms that connect free energy looking formalism is like chemistry with information theory, formalisms."
"Speaker 1","01;44;53;03","01;45;57;02","So thermo chemistry with energy and entropy with thermo information divergence and self information to information and inference with accuracy minus complexity as a modeling heretic so that big free energy is big. And then they immediately go to talk about physiological perspectives and how that surprise or function that constitutes the potential is log model evidence. So if you're getting good evidence for your physiological model, you're spending a lot of times in your preferred and expected physiological states, and that can be seen as simply a statement of homeostasis where outgoing statistical dependencies, i.e. active states, maintain intercept of signals, i.e. incoming state sensory states within characteristic physiological ranges."
"Speaker 1","01;45;57;24","01;46;03;04","You minimize your surprise about that until you don't and you dissipate."
"Speaker 3","01;46;04;09","01;46;36;14","Stephen Amazing. And this this really ties into the active influence paradigm shift because, OK, traditionally if we're going to have represented not traditionally representation is for instance, like you were saying, it does really, really throw that out in a way because if I have a hundred cameras normally and I took a hundred different cameras all taking a photo, it's going to make it a hundred times more blurry in that sense."
"Speaker 3","01;46;36;19","01;47;16;15","However, in this sense, a hundred sources in this noisy dynamic cool gives me a hundred ways to integrate free energy reduction and even actually the noise of me moving it a hundred ways by 100 cameras gives me more and more information or thermodynamic ways in so that that just shifts very much the way we might think about how to know about how to act in the world, how cool."
"Speaker 1","01;47;18;02","01;47;33;15","Let's continue on and we'll probably do a few minutes after the hour to get to these last few points. So we've been talking about different ways that we can talk about the free energy functional of the particular states."
"Speaker 1","01;47;35;17","01;48;18;14","5.1 is where this idea of the internal states as a generative model and self evidencing or like the minimization of self surprise is really leaned into. So the alternative and deflationary perspective rests on noting that the free energy gradients are also the gradients of self information. So it's like the free energy itself is a wind that's difficult to latch onto so the free energy ball, the one where you'd be doing strictly as well as you could if you were on the bottom of it, were not on Apple, but the one that we can be keenly aware of is our self's appraisal."
"Speaker 1","01;48;19;18","01;48;53;10","So if the self surprise of gradients is aligned with the free energy gradients, then reducing our uncertainty about sensory states, incoming helps us on the way towards minimizing free energy gradients, reducing that difference. The organism wants to be minimally surprised about expected and preferred observations, and those are the perceptions or measurements. More technically it wants to be minimally surprised about."
"Speaker 1","01;48;53;10","01;49;29;28","Expect mid states and then preferences are going to play a key role. When we talk about active systems that do resist dissipation this is where the moth to the flame comes in. I just I love this plot arc from 2006 Ice Queen Kristen with the wings snowflake and then you know things are heating up for act in others are being drawn like a chaotic moth to the flame they come close but then it burns and then they fly away further."
"Speaker 1","01;49;30;16","01;50;00;29","So one could imagine these kinds of systems to be like stochastic chaos and that could be now again we're thinking about previously the learned system was like maybe a particle in a chaotic weather system. So that was like the weather systems that Lorenz was studying but now we're going to be thinking about particular states, like a particular moth that's able to not just have outgoing statistical dependencies, but to do policy selection."
"Speaker 1","01;50;01;13","01;50;23;26","So this is where we actually get adaptive active inference and again, you know, if there's two kinds of moths, some of them are just particles, and then they get burnt when they get burnt and they don't win, they don't some will survive and some what. But the ones that do enact effective policy selection are going to be persisted even a day later."
"Speaker 1","01;50;24;11","01;50;57;29","So then the Lepidoptera have been around for millions of years. So is it really any surprise that the moths have adaptive behavioral systems, but that when the niche changes like with electric and nighttime lighting, that that doesn't entail that it's going to instantly be the adaptive system for that new niche we can think about the motion of a moth attracted towards a flame, but constantly thwarted by turbulent or so in idle air currents, because active states influence sensory states and possibly external states."
"Speaker 1","01;50;58;08","01;51;22;22","This would look as if the particle, the moth, was trying to attain its most likely state in the face of random fluctuations and solenoid dynamics. So it's like there's those arrows that your rotational component are like converging the moth to the flame but then like Overshoot and the windy room are blowing it around. And so again, there's the moth in the room and we can look at it in the X, Y, and Z."
"Speaker 1","01;51;23;06","01;51;48;07","And if the candle were in the center of the room, it would be like a ball that the moth were converging towards for any two dimensions that you looked at. And indeed all three dimensions when considered together. And the movement of that particle, the dynamics of that particle would be related to something about the flow of the air in that room with a pull back attractor."
"Speaker 1","01;51;49;11","01;52;22;17","This perspective emphasizes the active part of self evidencing sometimes referred to as active inference. So we were calculating the potential to self surprise all the outgoing dependencies for particles before we talked about policy selection, and that is showing mere active inference as it's called. But then when you think about the real world where only the anti dissipate of systems persist and the successful ones even more so, that's where policy selection comes into play."
"Speaker 1","01;52;23;09","01;52;51;26","And that's actually where this paper ends. They basically just bring it to that point and say all systems are going to be able to be framed within this way. Again, not the territories. All of the approximations that we make will have these attributes and then we can imagine that there are some systems where the internal states are not just acting as if they're doing conditional expectations on external states."
"Speaker 1","01;52;52;07","01;53;30;08","But then they take those conditional expectations like about the weather. And then there's another node for policy selection. Like the other PI policy selection in the models we've seen. And then that PI can be like put on the jacket or not those like the two affordances or those are the two states in the affordance variable. And then in a disruptive world, you're going to see adaptive agents as the ones that are able to recurrently adapt to changing and chaotic circumstance to repeatedly come back to that candle."
"Speaker 1","01;53;30;29","01;54;31;18","And so just to summarize, then we'll just if there's any implications we want to touch, but we'll summarize they constructed a laplacian system that's quadratic in a bowl like in its potential function and flow operators state dependent flow operators, by the way, that includes the housekeeping function that evinces so provides evidence for stochastic chaos because it has that the option of exponent that was very similar to the ones that were calculated from the non Laplace assumptions or approximations the way that the polynomial approximation played out with the first and second order approximations gave a spa city which can be interpreted as conditional in dependencies and a partitioning into four kinds of states coupled systems have"
"Speaker 1","01;54;32;03","01;54;54;06","a conditional synchronization map. In this example, it had a linear form they were on that manifold that was like Y equals X. And this is important because in these laplacian coupled systems, the conditional synchronization map is necessary early DeFeo Morphic again would be awesome if somebody wanted to come on and like help us see what the technical implications of the DeFeo Morph ism is."
