"Speaker Name","Start Time","End Time","Transcript"
"Speaker 1","00;00;36;18","00;01;05;18","Hello, everyone. Welcome to act in flight to active flab live streamed number 32.2. It's November 16th. 2021 Welcome to the acting lab. We are a participatory online lab that is communicating, learning and practicing applied active inference you can find us some of the links here on this slide. This is a recorded and an archived live stream, so please provide us with feedback so we can improve on our work."
"Speaker 1","00;01;06;13","00;01;32;15","All backgrounds and perspectives are welcome here and we'll be following good and fun video etiquette for livestreams at this short link, you can see some of the upcoming streams. This is our second participatory group discussion on the stochastic Chaos and Markup Blankets Paper and then in the second two weeks of November, we're going to be discussing Thinking Like a State by our friend and co participant, Adele."
"Speaker 1","00;01;33;01","00;01;59;15","And we haven't yet set the papers for December. So if you know an author who you'd like to invite, or if you yourself would like to join for several weeks of discussion of one of your works, then just let us know today in active stream number 32.2, we're aiming to learn and discuss and ask what if and what is and hold all these different questions at once."
"Speaker 1","00;02;00;13","00;02;27;24","We're in the second participatory discussion around the paper Stochastic Chaos and Markov blankets by Kristen Hinds or Topher de Costa in PA. And last week we had an awesome discussion in the Dark One, and we got right up to the cliffhanger where the the M-word actually was deployed. And I think today we're going to sprint up to that cliff and then jump off."
"Speaker 1","00;02;28;01","00;02;54;21","So it'll be a fun discussion for those who are watching live. Totally write questions and comments in the live chat and Stephen and Dean and I and anyone else who joins will be just more than happy to hear what you have to share and to roll with it as you write. Thanks. So let's begin just by giving a introduction or warm up so we can say hello."
"Speaker 1","00;02;54;21","00;03;24;01","And then also just maybe what was exciting about the paper overall or since we all participated in the DART one, what are you looking forward to in the two or maybe how have you changed how you thought about it over the previous week? So I'm Daniel. I'm a researcher in California, and I'll say what I'm excited for until a little bit later and I'll pass it to Dean Hey."
"Speaker 2","00;03;24;01","00;03;47;22","Good morning. My name is Dean. I'm in Calgary in the in the one week's time since we left off, I, I think this paper, more than many of the other people we've had conferences throughout, breathes life into something that is typically perceived as not very alive. It's just, it's just a sort of a point to and an explanation of."
"Speaker 2","00;03;47;22","00;04;08;12","But I think this is one of those papers where when people pick it up and start having conversation with one another about the kind of work that's being done here, it makes it really, really interesting. Doesn't give us necessarily the answers that the authors could project would be given. And I really like that."
"Speaker 1","00;04;09;26","00;04;11;01","Thank you, Dean. Stephen, I'll."
"Speaker 2","00;04;11;01","00;04;11;26","Pass it to Stephen."
"Speaker 3","00;04;13;27","00;04;50;05","Yeah. Good morning as well from Toronto. I I'm really interested in this paper, I think, because it does give a unifying perspective. It does help with that unified perspective, even though at first when you see things like stochastic chaos, it can be like, Oh, we're going down another rabbit hole, et cetera, et cetera. But actually, rather than always justifying or talking about applied activity through inference, through applications and quotient applications, there is some benefit to this kind of coming to the foundation."
"Speaker 3","00;04;50;18","00;05;24;20","So I'm excited by that. And also actually following a conversation we have in Urdu in the fact that we have this complexity weekend is some of the ways that complexity can be talked about outside of a more woo woo kind of conversational sense at these foundational levels, which again seems to get into unnecessary detail. Ultimately, I think it starts to allow some of these crossovers between applications of complexity and this to happen, which for me personally, I don't think I was necessarily able to articulate a year ago."
"Speaker 3","00;05;25;01","00;05;29;26","So I think some of this work does just help fill in some of those gaps."
"Speaker 1","00;05;31;21","00;06;08;04","Thanks. I agree. Like the system that's picked up and turned around and remodeled throughout the course of the paper in a very narrative driven way is the Lauren's attractor, which is like the classic complex systems model. So it just kind of plays into contemporary work on complexity and so many other areas. But and then also, I really like what you said, like the authors I hope will be able to join for a future presentation so we're in contact."
"Speaker 1","00;06;08;04","00;06;41;09","They probably won't join today, but what the authors are putting out there and then how that's received and communicated around and explored, that's what's fun. And I know that will have many cool things to explore today. So let's jump to the big questions, then we'll look at the roadmap and try to remember where we got to yesterday and maybe a different big question is striking either of you or anyone in the live chat today."
"Speaker 1","00;06;41;20","00;07;03;28","And then we'll try to remember how far on our road trip we got last Tuesday and then let's see which sections we're going to get to. And we have a bunch of other things kind of written down. So the big questions that we had previously asked were What is a good model of thinking this in a chaotic, dynamic and disruptive world?"
"Speaker 1","00;07;04;23","00;07;32;04","How might this model or approach to finance speak to system sentiments? And they're in little tiny font. It's sentience, not in the phenomenological like experiential, but greetings of all. Good to see you. But sentience in the setting in the sense of feeling, thinking and feeling systems without worrying about the first person experience side, at least in this paper."
"Speaker 1","00;07;32;22","00;08;00;04","And then the key technical question of this paper, which bridges on to a million and a half other areas, is what is a markup blanket? Just what are these blankets and how is one model identified to find statistically, what are the pros and cons of different approaches? And so that's some of the technical details that we'll get to. So Steven, thanks for raising your hand and then welcome survival after that."
"Speaker 1","00;08;00;04","00;08;05;02","Feel free to say hello and introduce yourself if you'd like yeah."
"Speaker 3","00;08;05;04","00;08;26;08","I'm curious. I notice here that we start with Cygnus, which I do agree is this big question of things. This is something that fixed and brings up quite a lot. But I think he's often he's the he in that part I it is often a bit of a lone voice in terms of really pushing the thing. This side of things and I think is really interesting."
"Speaker 3","00;08;26;08","00;08;49;18","That second question then is, OK, how does that speak to system sentience? And you see now we move into systems right and OK, signals sort of to me, it gives rise to systems and gives rise to sentience. However, I think it's thing is is still their right thing. This is still the game in some ways of being maintained."
"Speaker 3","00;08;49;18","00;09;16;09","So that first question because when we then get into the third question thing, this can get lost and it's all about system sentience. And I think there's something really interesting there because there is a question of I mean, even as we say in those brackets, what it really means to have system sentience or even just system is probably rather ill defined."
"Speaker 3","00;09;16;19","00;09;32;00","And I suppose to some extent is how much is it even needed? How much can things be maintained as an equal partner in the game and not sort of passed over once we scale. So I think that's a good, good piece of a property nation."
"Speaker 1","00;09;33;06","00;09;46;16","Thank you. And to what extent can things and systems be identified in a bottom up way from measurements of dynamical systems? Or survival? Would you like to add anything or say hello or partial."
"Speaker 3","00;09;49;16","00;09;51;10","No, I'm a terrible."
"Speaker 4","00;09;52;17","00;10;13;20","I'm a complexity scientist. I have something in the system or theory which is interested in building an active models of social or political changes. And I'm here to see the discussion around the symbolism of the paper, which I did not revise, and I therefore cannot make informed comments on."
"Speaker 1","00;10;16;07","00;10;18;01","Thank you for Dean."
"Speaker 2","00;10;19;17","00;10;45;25","I just want to add one thing to what Steve was talking about there. I think what the big questions and what this paper addresses pretty directly is can we can we accept a minimum of two, that there's an abstraction and that there's a material aspect to thing this and and and marrying those two things is kind of what we we're hoping to be able to do."
"Speaker 2","00;10;46;10","00;11;10;14","But but it comes in two very discrete forms. So so what of that we call it thing this because it kind of spans both realms. And that's what I think I take away from the idea there can be chaotic and not absolutely."
"Speaker 1","00;11;10;22","00;11;52;01","There's the map in the territory. And one thing that we're going to return to is like the first map that we apply to the territory. So already we're separating the territory in the map, but even the first map can be chaotic. And then can we put a second map, the laplacian approximation, as it turns out in the paper, can that second map be one that gives us some properties that make it more tractable to handle like, you know, potholders taking something hot out of the oven, give a better grip on the first map which gives a better grip in terms of actionable insight into the territory."
"Speaker 1","00;11;52;14","00;12;07;25","Can that second level both be more tractable especially using computers, but also retain those chaotic properties, which we're going to see when they estimate the lyapunov exponent of the proxy, an approximation so."
"Speaker 2","00;12;08;10","00;12;16;21","That's the recursion prior to the the repetitiveness. That's what I think this really gets into recursion modeling."
"Speaker 1","00;12;17;19","00;12;18;19","Thanks, Dean. So, Steven."
"Speaker 3","00;12;20;10","00;12;49;17","Yeah, I'm going to go this is maybe a little bit of a question as well. It's rhetorical if it doesn't want to be answered, but I think that the thinness and the mark or blanket because we're getting to that stage here, there is this there's I think there's tends to be a sense that, OK, we have a thing because it's it's trying to sort of maintain itself and it just dissipates if world then it's effectively a system because it's got Mark Blanket in that."
"Speaker 3","00;12;49;18","00;13;33;00","Well, but with this, it's like, well, you've got lumens attractor then the winds attract it goes into this right now and then thing this potentially goes into probably with a few phases system sensing system. So the question is which side of the which side of thing this is mark of blanket this mark or blanket emerge from from going from lumens attractor into thing this and then continue or is it is like lumens attractor into thing this into malkovich and blanketed thing this curious what your thoughts on that and maybe this paper sheds some light on that."
"Speaker 1","00;13;35;00","00;13;59;04","Great question let's look at the roadmap and just see how that comes into play. So we talked in 32.1 about a few different ideas and we have some slides ready with just tabula rasa if we'd like to add notes or we can always modify slides and deal with questions as people are raising them let's go to the roadmap though."
"Speaker 1","00;13;59;11","00;14;37;12","OK, so the roadmap of the paper is as follows. In Section one, there's an introduction in section two, there is from dynamics to densities. So this is one of the really fundamental kind of linking events early in the paper where dynamical systems dynamics are linked to flow systems like densities so this equivalence between dynamical systems and density driven systems is going to be finessed extensively in the paper."
"Speaker 1","00;14;37;20","00;15;08;10","So that's an introductory step that's very important to note. The Helmholtz decomposition is a tool from vector calculus that applies very well to densities and flows where it's usually applied. But because of what links were made in Section two, it becomes possible to take that Helmholtz decomposition approach to dynamical systems that is specifically visited and revisited and then moved beyond in the Lorenz system."
"Speaker 1","00;15;09;03","00;15;56;23","That's one of those classical chaotic systems and a favorite toy of complexity analysis the Lorenzo system is moved beyond and then approximated with a laplacian and then even moved beyond there. So that's pretty much where we got to last week. We tried to do a really solid grounding in first the equivalence between dynamical systems and density driven systems, or two kind of representations of underlying systems that could be seen as equivalent and then we talked about the Lorenzo system and about how it's chaotic and how chaotic means like sensitivity to small changes as quantified by the by the lyapunov exponents."
"Speaker 1","00;15;57;19","00;16;20;00","And then we talked about how the laplacian approximation, which is kind of like fitting a quadratic which is kind of like letting the ball roll to the bottom of the ball. And this idea of like, well, if we can phrase the problem like a ball, then all we have to do is roll to the bottom. There's only one bottom and we know which slope we're on."
"Speaker 1","00;16;20;10","00;16;46;15","So that's also called convex optimization because no matter where you are, if you know that the problem is shaped like a quadratic curve, like a ball, you can just instantaneously estimate the slope of the ball and then just run downhill. Whereas if you're on a rugged landscape, just, you know, you're lost in a mountain region will go downhill, you're going to get trapped into a valley potentially, and you might not make it out to the ocean."
"Speaker 1","00;16;47;05","00;17;16;24","But if you could reimagine that rugged landscape in a way that was more bold like it would allow for tractable estimation of which way to move in section four, we get to the Markov blanket concept and the free energy principle. And I think that's going to be the really fascinating discussion is like, OK, so let's get what that Markov blanket, what is that partitioning?"
"Speaker 1","00;17;16;24","00;17;40;17","What are we really talking about? And then are we talking about the territory or are we talking about the Laurens map or are we talking about the Laplacian map? Where is this blanket partitioning coming into the picture? And then how does that help us reduce our uncertainty about systems and what does it say or not about that underlying system?"
"Speaker 1","00;17;41;01","00;18;21;28","And that's where we're going to be talking about particular partitions. Of course, a favorite and recurrent pun, which is that particular means specific, but also it means like a particle, like a autonomous particle drifting around in space. And then Section five really comes to a culmination with a discussion of the free energy principle alone. And so I think it'll be interesting to discuss like what is subsumed into the free energy principle and why do we need one section and blankets and free energy principle and then another section on just the free energy principle so that's kind of the roadmap."
"Speaker 1","00;18;22;15","00;18;23;23","Steven and Andy."
"Speaker 3","00;18;25;09","00;18;56;09","Yeah. Just a quick question. See if this clarifies something which I think is what you're saying dynamics is the dynamics more particular flow and densities while you could have a density of particles, it's actually more like a probability density on wave functions. Would I be right in thinking this is kind of a wave particle or part actually a particle then wave way into this."
"Speaker 3","00;18;56;09","00;19;01;02","And that's partly how the playing this out."
"Speaker 1","00;19;02;29","00;19;30;16","Someone with more experience with the formalism would be totally open to their contributions. On that question, my first take would be you could make dynamical systems model like equations of motion for a particle floating around. And so it's like you're focusing on the first, second and third derivatives of movements in X, Y, Z space or tetrahedral space for some particle."
"Speaker 1","00;19;30;16","00;19;52;12","So a dynamical system model could be describing the movement of a particle, but the flow that gives rise to the movement of that particle is it's kind of like figure in ground, like the dynamical equation features the movement of that particle. Like I want to know the pendulums location. And so that's going to be a dynamical model of the pendulum."
"Speaker 1","00;19;52;28","00;20;18;04","Whereas the flow based models, like you pointed out, are much more about, well, what is the underlying space of the flow of that pendulum? So it's like if it's to the left of the bottom, it's like it flows this way. And if it's to the right, it's like it flows that way. And so that is about asking what is the underlying flow dynamics that do give rise to movement of potentially particles?"
"Speaker 1","00;20;18;21","00;20;38;09","And those are why this meme is on the slide and why they are made in equivalence early in the paper, because it is like talking about the difference between the movements of a point through a space versus understanding the flow dynamics of that space that yes, does give rise to the movement of particles."
"Speaker 3","00;20;39;15","00;21;03;19","And could I just ask one? So what if almost it goes from a just purely the, you know, the momentum of a particle to this flow and the flow is kind of a bridge then between density dynamics, which is maybe more of a probability density of where it could be, which can map both to an object where an object might be, but also where a wave function might be in broad sense."
"Speaker 3","00;21;03;19","00;21;18;11","So then you're sort of going from literal particles in a classical sense to the flow, and then the flow then bridges into density dynamics, which is can be more probability orientated is that fair to say?"
"Speaker 1","00;21;19;07","00;21;47;26","Yes. Particle is going to take a particular meaning a little bit later. When we talk about the partition ning of states, but I believe that's correct. And also the density, like you suggested, ties much more closely to statistical density distributions. Like in statistics, we're often interested in density distributions of a special type like the area under the distribution summing to one."
"Speaker 1","00;21;47;27","00;22;25;19","The integral over a distribution being one allows us to treat it like a probability distribution. And so that's the whole debate in quantum is it actually a wave, or does that distribution of positional uncertainty merely describe our statistical inference on the location of something that's at a specific point? So whichever side we want to come at this from Section two says it's going to be OK to use both, and we're going to sometimes lean more on our left leg and sometimes we're going to lean more on our right leg because there's tools that exist for one, but not the other."
"Speaker 2","00;22;26;03","00;22;50;04","Dean Yeah. I don't know if this begins to answer Steven's rhetorical question, but I think where most people get introduced to a markup like it, they get introduced to the idea that it's either a way of partitioning and dividing or it's a way of being able to envelop or blanket. And I think what the paper points out is that it's both all the time."
"Speaker 2","00;22;50;04","00;23;14;13","So you could, for example, find a box of cookies and see all the cookies settling at the bottom. Whereas if the person is, you know, described as being creative, uses that box of cookies as a leverage point to get more cookies off the top shelf, now it's a platform and now it's a mound. And so we can see it both ways at once if we think of it as both ways and what's not."
"Speaker 2","00;23;14;13","00;23;34;01","Another question is that minimum of two piece again, that that is really fascinating about this. That really kind of blows people up. It's really both at once. Then you decide which is going to be and that's what I think is really fascinating for people who just sort of start getting into this because they they've been so habituated to saying, oh, it's, it's a cookie jar."
"Speaker 2","00;23;34;20","00;23;38;19","Oh, it's a platform. No, it's both and that's that's what we want to do."
"Speaker 1","00;23;39;19","00;24;01;03","Thanks. Dean and Marco in the chat wrote like a boat in a stormy sea. It moves at the mercy of the seas. And winds flowing forces with only its rudder sails and other limited mechanisms to steward the world's influence on its journey. So buggy meme one Unity is plural at minimum two Bucky Meme two on his gravestone call me trim tab."
"Speaker 1","00;24;01;05","00;24;20;14","Kind of like the rudder. And that is exactly getting at the point of this paper. Which is, if we just were talking about a dust molecule floating in the air, then we could say, well, we could use the dynamical systems model of the position of the dust particle, or we could do inference on the flow of the room."
"Speaker 1","00;24;21;02","00;25;11;18","And that gives us a different and complementary, totally excellent picture but that's a dust molecule. What about active systems that have affordances that are able to do inference on action selection, choose different policies? How do those active systems do inference? That's the winged snowflake, that's the moth to the flame. And those are the really exciting systems. And that also speaks to the difference between what's called mere active inference, like the particle where we can still have this partitioning and still see it as a dynamics or a flow versus the adaptive active inference, which is then we're thinking about those systems where the particle, the particular states are able to effect different policies and select between"
"Speaker 1","00;25;11;18","00;25;20;00","them in a way that acts as if it's resisting dissipation. And those are the kind of exciting systems that we want to get to by the end of the paper."
"Speaker 3","00;25;20;07","00;25;49;14","Stephen And pulling on that idea of the cookie jar is this the cookie jar is maybe almost a particle, a thing that is like leveraged and there's a thing ness which it becomes. So it's a it has a thing about it, but there's a thing ness of being an affordance. So this is an interesting just sort of came to me."
"Speaker 3","00;25;49;14","00;26;19;01","But the thing this in itself is slightly emergent because this only by the process of trying to use it to get the higher cookie does another kind of thing emerge, which becomes a step. So there's something interesting there about the ness as a as an emergent, you know, is it ever a step really? But it's always it's never not a thing at the same time."
"Speaker 3","00;26;19;01","00;26;26;09","So there's a I think there's something quite interesting there in that emergent stroke, flow, stroke in a literal sense."
"Speaker 1","00;26;27;13","00;26;53;21","And also, I don't know to what extent this is intentional but thing this we talk a lot about and assess the non equilibrium steady state or non equilibrium stationary states and so it's like the things ness. That's the thing. The thing we're talking about is the things ness. So we're not talking and saying that the system is at stationary."
"Speaker 1","00;26;54;01","00;27;27;03","We're saying that the things ness by virtue of how we're modeling it has stationary characteristics. And that is the thing as we model it, which is that always existing difference between the map and the territory we're not saying that the territory is even a thing. We're saying the way we're relating and interacting with the map, which we totally made, no one's going to deny that that maps things ness is tractable."
"Speaker 1","00;27;27;03","00;27;31;19","I can hold the map in my hands. That gives me a better grip on my road trip."
"Speaker 3","00;27;32;29","00;28;14;00","Stephen that's a severe. Yeah. I think also the the thing this can tie in to the idea that something ontologically comes into being through relation to some sort of network dynamic in which it acts and that actually that speaks this leavens a tractor, you know, so the lens becomes part of a network of an ontology of thing which is really a thing in relation to what some other thing is like, you know, because obviously the scale of the cookie box is quite a lot different to the scale of the atoms in the cookie box or the whatever scale we want to."
