"Speaker Name","Start Time","End Time","Transcript""Speaker 3","00;28;14;07","00;28;44;20","So there's the, and then there's some sort of affordance level and maybe we can get out of the whole sensing system thing and it's like it's just an affordance for the thing this to maintain the thing, this doesn't need to know about systems as such unless someone, some creature happens to evolve a brain which starts to sit down, working out system diagrams two legged ones potentially, but otherwise it's like it's just things all the way up, right?"
"Speaker 1","00;28;46;26","00;29;31;15","Let's now that were 30 fun minutes in let's sprints up to that Markov cliff and then see where we go so Fig. one of the paper is kind of making this first fundamental connection between the Lorenz system as defined by dynamical equations. So the traditional Lorenz is defined more like the blue version within equations of motion. Well it has a positively opposite exponent which is to say that very closely located points diverge much rather than stay in like a laminar flow parallel line world or converging."
"Speaker 1","00;29;31;24","00;30;06;02","So they diverge and that's what makes Lorenz system chaotic ergo difficult to predict given measurement error and tiny perturbations due to even thermal noise, which is like kind of how pseudo random number generators work. And then there's going to be an approximation based upon this stochastic solution and so the trajectory and the right panel here, it's the deterministic solution to the laplacian form of Lorenz based upon the Helmholtz decomposition."
"Speaker 1","00;30;06;17","00;30;20;08","And so this is sort of like the version on the right that's usually seen in the state space model is almost like we're sampling stochastic li from points along that racetrack. So that was figure what we would."
"Speaker 3","00;30;20;08","00;30;40;10","You just if you just explain that, just go over that one more time. Just to clarify that bit, I think I understand what you're saying, but it's kind of an important point you make there when you say deterministic solution that I didn't there is that window just to clarify what that means."
"Speaker 1","00;30;41;14","00;31;21;23","So the deterministic solution would have no noise so that the position at the following time is entire really determined by the non stochastic state that it's in at the preceding moment. Whereas when we talk about a stochastic form it's like that's like your cars driving and there's thermal vibrations on the road. Now, the lyapunov exponent on that car at nonzero temperature is small so that the flow term dominates the vibratory term."
"Speaker 1","00;31;22;05","00;31;44;00","But there could be some other system where the difference between if it's in the absolute zero world and just on the road, then it's going to go straight. But once you introduce any wiggling, when the system is chaotic, it has that positive, the opposite exponent, then the tiniest wiggle causes the system to diverge."
"Speaker 3","00;31;45;18","00;32;12;24","That's really helpful because so basically normally we just like with a deterministic thing, it's just whatever the initial conditions, if it varies slightly, but then once it runs, it will settle into something. But if you you've got the initial condition and you've got the perturbations due to noise as it's actually running, which as I suppose you could say, a little bit of an extra change in initial conditions to each state that the lens attracts is moving through."
"Speaker 3","00;32;12;24","00;32;15;00","So OK, that's that's helpful. Thanks, Daniel."
"Speaker 1","00;32;15;02","00;32;41;28","Yes. And I'm going to just show this image. This is I don't know if it's the very, very first, but this is the image that Lorenz used to talk about chaos in 1961. So I mean what's the difference between 76.8 and 76.85. It's imperceptible. If your thermometer only had like three significant figures, you wouldn't even be able to talk about the difference."
"Speaker 1","00;32;42;09","00;33;13;11","But I mean how different can it be? And it turns out that these, those two systems start in perceptibly different, but nearby points in chaotic systems do diverge and so it's like, OK, but they're still tracking each other, right? It's like, well no wrong later on. And so of course a more chaotic system with a more positively operative exponent diverges faster, but any system with a positive leading the option of exponent is going to have divergence."
"Speaker 1","00;33;13;25","00;33;56;14","And so if you have a purely deterministic system or one without this kind of the option of induced chaos, then you can predict far out. However, prediction matter experts as Dean, I'm sure, will revisit us to meet their match with chaotic systems. And that's actually one thing I hope that we get to by the end, which is that by putting action in every loop and inference on action, we can still, whichever of these timelines we end up on, we're going to be doing OK because we're always readjusting our inference to whichever of these mountains we're on."
"Speaker 1","00;33;56;14","00;34;15;21","It's not like one of these is better or worse or more or less challenging. Like they have the exact same upper and lower bound. The only mistake would be to make a prediction and be super confident about it and be on the wrong predictive timeline. But as long as we're always updating our predictions, then either of these days are going to be OK."
"Speaker 1","00;34;16;06","00;34;33;07","But if we put on the jacket because we thought that it was going to be cold here and that's when it was hottest, then we're injured. But if we just think, OK, well, we know we have the jacket afford, and so we're just going to keep an eye on that as we watch the temperature and continue to update our predictions, maybe then it'll be OK."
"Speaker 1","00;34;36;10","00;35;21;20","So that was the initial Lorenz attractor. Section three goes into the Helmholtz decomposition, which we've talked about in several other streams, and we've seen it introduced as the breaking down of a vector field. The total current in this kind of electromagnetic representation into the irritation, which is kind of like the straight line. There's no rotation in those straight lines and the purely rotational solenoid or current flow currency we've talked about solenoid or in gradient partitioning and then what this paper does and I think the technical details are in the Appendix B of 16."
"Speaker 1","00;35;21;20","00;36;05;07","So that was the Bayesian Mechanics paper and then also there's this housekeeping, big lambda, and that's in one of the appendices to this paper. So that would be like something for someone else to help us understand a little bit of because it does matter and it's actually a key contribution because if the landscape is changing moment to moment, you can't just do the Helmholtz decomposition once and sail on that sea without updating your estimate of the partitioning here, of the decomposition here that decomposition."
"Speaker 1","00;36;05;07","00;36;35;05","So again, dynamical systems, that's like the position of the car and then we're going to because of Section two, be having an equivalence between that dynamics and the flow modeling. And one of the terms that shows up on both of these is the fancy fancy I it's the self information. The first part performs a reminder in gradient descent on the negative log of the steady state density, which can be interpreted as self information."
"Speaker 1","00;36;35;18","00;37;15;24","So how surprised should one be to be at a given location relative to expectation? So we talked about how like the potential energy of the ball higher up on the ball is higher and then the potential function drops. And that's the physical analogy to this more informational statistical distribution approach to the self-insure position. And then in 3.1 that self information is going to be pursued and expanded upon for a, a relatively more simple case."
"Speaker 1","00;37;16;09","00;37;39;08","So we're going to identify due to the Helmholtz decomposition that there's this key variable which can be interpreted as like a potential function corresponding to the self's appraisal and that self appraisal term may have functional forms so we can have a function that describes how surprised we should be."
"Speaker 3","00;37;39;28","00;38;06;23","Stephen Yeah. If you could go to that last slide, the previous one there that I think this is quite useful. So the Focker plank, if it's an equilibrium which we're not because we're doing non equilibrium steady state, but if it were then it would be zero basically is that equilibrium is not changing so there's no, there's no divergence because it's zero."
"Speaker 3","00;38;07;20","00;38;28;23","And then he's taking this homo composition, which in a way is like a vector with a vector you've got, you know, it can split some things moving into X and Y. So this the gradient is coming out in the solenoid. It was at right angles to the gradient. So it's kind of like that trick that he does with accuracy and complexity."
"Speaker 3","00;38;29;11","00;38;56;14","You can say that there's a solenoid and gradient which go together for when it's still in a kind of a particular angular momentum sense. And then there's that ability to with the housekeeping to then move it into the flow, which I'm not entirely sure. I think that's the bit where we might need some quite what because flow could probably be more specifically thought about."
"Speaker 3","00;38;57;03","00;39;31;09","So now you've got this ability to sort of sort of structure through the kind of more particular context, the solenoids and gradient and then there's this transition to a more kind of general variable which can be just we don't need to get the particulars now because it's a variational metric that just gets used in an approximation sense and then follows into what you're saying would I be on the right tracks with that?"
"Speaker 1","00;39;31;27","00;39;56;12","I'm not sure who he is, even though I have an expectation because it's a multi-person paper but just looking at these as like circles and triangles and squares, we can see that upside down triangle, fancy eye of X is in both terms. So there's like a Q multiplied by something and then a gamma multiplied by something. And we see that omega is defined as like the Q minus the gamma."
"Speaker 1","00;39;56;26","00;40;27;23","So these two terms which were decomposed out from each other, get recombined into the final flow. So that's just like if it were like a times X minus B times X and then Omega were defined as a minus B times X. So we're re composing a flow equation that still features this fancy eye. And yes, we're solving that for a specific point that matters."
"Speaker 1","00;40;27;23","00;40;58;19","We want to solve that for where the balls at the bottom of the bowl. So there's a function that's going to tell us more or less in multiple ways, whether we're more or less away from the bottom of the ball and again, it's not about the system being at stationary, it's about this decomposition, having a Focker, Planck steady state dean."
"Speaker 1","00;40;58;19","00;40;59;28","So yes, it goes."
"Speaker 3","00;41;00;14","00;41;18;26","Just one quick thing. So at the bottom of the bowl, if we the gradient can effectively be zero, but solenoid or could still have a value because it can still be spinning around at the bottom of the bowl. But the gradient then because I notice the gradient term isn't in the flow, but the solenoid all term is."
"Speaker 1","00;41;19;08","00;41;32;05","A the gradient is because Q minus gamma is in omega. So Omega is this Omega Delta fancy is just these two terms combined."
"Speaker 3","00;41;32;19","00;41;33;19","OK, OK. Yeah."
"Speaker 1","00;41;33;28","00;41;34;08","Dean."
"Speaker 2","00;41;35;04","00;42;03;12","Yeah, I was just going to say what typically when this is brought forward, it's easier to understand the decomposition and the compiling if we view the blanket as a partition. Where it gets little bit more interesting is when the blanket is literally an envelopment and there's a, there's a physicist by the name of Keith Humphries who talks about emergence and he looks at that piece of it as well, because there's a polar aspect to this."
"Speaker 2","00;42;03;22","00;42;27;24","We can think of that in terms of positive and negative fields, magnetization and stuff like that, and how that is also a decomposition and a re compiling so I understand how it was presented in this paper. That's the partition way of looking at it, right? It's more or less. But there's also the positive and negative polar piece to this."
"Speaker 2","00;42;27;24","00;42;53;05","When we look at the mark of blanket as a blanket as opposed to a separator. And again, if we're holding up two things at once, this this doesn't just just change that. It just making sure that we hold both things up at once. The envelopment and the divider. I just want to bring that out there because again, we can we can see it easier as a partition like the skin as a partition."
"Speaker 2","00;42;53;09","00;42;58;11","We don't typically see the skin as a platform for sunscreen. That's my point."
"Speaker 1","00;42;59;25","00;43;00;26","Thanks, Steve. Steven."
"Speaker 3","00;43;02;29","00;43;32;17","You know, this, this, this this is a good point in terms of you can imagine at first I was thinking about gradient. You know, it's obvious that you've got a gradient that you can pass through maybe where the gradient zero, but also solenoid or flow. I suppose if if things are moving around this way and then it starts to turn and it starts to go the other way at some point, the solenoid flow is also passing through a zero so they can both pass through a zero point."
"Speaker 3","00;43;32;17","00;43;35;18","It just wasn't as intuitive when I first thought about it."
"Speaker 1","00;43;36;04","00;44;05;15","Yeah, and even if you have something that's spinning around like something that's spinning in a circle like a hammer thrower, it's actually continual acceleration. That doesn't mean it's speeding up. It means that the vector is continually changing. So now our map is of that acceleration and it is unchanging in how it changes. So that is to say that the system can have added in a different way of thinking about it."
"Speaker 1","00;44;05;28","00;44;29;17","Yes, a solenoid or component. We're not saying that balls at the bottom of balls are dead and unmoving we're saying in our map there's only one point because we set it up to be like a ball map where the derivative is zero that's the solution where the rate of change is zero. So that's not to say that the system isn't moving."
"Speaker 1","00;44;29;23","00;45;06;24","That's to say that the flow steady state has been achieved in figure four. Well, in FIG. three, we see the three states. So this is like the cover of the book, like kind of three different projections from a three dimensional system. The second versus the third, first versus the third and the first versus the second. And we're seeing how there's movements of sampled trajectories and they're kind of coming back to something that's ball like for any set of two dimensions."
"Speaker 1","00;45;07;09","00;45;52;23","So it's kind of like a three dimensional ball now because any two of these dimensions, it's more like a regular bowl, the kind of soup goes in, but then like the Super Bowl is like a down projection of a system that has an attractor in a higher dimension, potentially a much higher dimension. But Lorenzo, they're only modeling three because the particle only moves in three dimensions when we continue to investigate the bowl like properties of our Laplacian approximation to that Lorenz system, we see that there's a few different shapes of balls depending on which angle we're going to shine the flashlight from."
"Speaker 1","00;45;53;13","00;46;22;12","Some of them are like spherical so a spherical ball doesn't have any specific correlation between the two dimensions. It's like a cloud of points. The regression is just like flat through it. However, there are some couplings where the ball is non random, so it's almost like if we were tracking the movement of a ball, it's getting jostled around in these balls."
"Speaker 1","00;46;22;24","00;46;41;27","Well, like the one of the first and third if that was the light we were shining, it would just look like it was a scatterplot, as are totally the regressions flat. There's not much information being provided. It's it's within the ball. So already has some nice dynamics, but it's kind of within that attractor zone. It's a scatter. There's no pattern."
"Speaker 1","00;46;42;13","00;47;05;14","But clearly for the first and the second, we see that there is a coupling. Now imagine if we didn't see the ball because of course we don't. It's not there. That's part of our map. We're just seeing the movement of that ball as we sample it through time. And it would be only on this manifolds kind of being like spending more time going from the top left to the bottom right in these images."
"Speaker 1","00;47;06;21","00;47;35;19","So we're going to take that idea and then connect it to the Jacobian and the Hessian, which is again throwback to our Matrix Math slide and an awesome opportunity for anyone who wants to bring more of a technical interpretation to the stream the jacobian is like the first. The unnamed matrix is just like the matrix of position. So that's like the first moment of the distribution."
"Speaker 1","00;47;36;03","00;47;59;11","And then higher moments are like the partial derivatives. So Jacobian is like the first order, partial derivative so that's like the slope of the ruler at that point. And then the ocean is the second partial derivative. That's like the curvature. So if it's a ball there's only one point where it's flat and then it could be flat and the ball could be like up or the ball could be upside down."
"Speaker 1","00;47;59;26","00;48;26;21","And so that's why it's important to also have this second curvature term to understand whether we're at a ball like this or ball like that. So that's kind of like calculus and those balls, those ball attractor shapes which we're inferring using the laplacian quadratic assumption. So it's not saying that the Lorenz has these processes. These is these, it's saying that's the approximation that we're going to make."
"Speaker 1","00;48;28;19","00;48;58;13","It turns out that although there's somewhat of an unclear correlation pattern in the first derivatives, so like the movement to the left, it's not like it's correlated with movement up however, the second partial derivative, the hessian matrix, starts to look a lot like the covariance matrix. So the actual positional covariance of these states with each other. So like the on diagonal is kind of obvious."
"Speaker 1","00;48;58;13","00;49;33;03","Like of course your position on the x axis is is correlated well with your position on the x axis, but there are correlations between state one and two and that is recapitulated in the structure of the second order polynomial approximation to these attractors that are laplacian approximations so again, up until that point in 3.5 and in figure six, Markov has not been introduced nothing has been said."
"Speaker 1","00;49;33;14","00;49;53;04","That word hasn't come into play. It didn't come into the systems definition. And so that's just really important because it's just showing like there's a lot of groundwork to get to where we make the Mark Colvin partitioning. And so there's power and challenge in that."
"Speaker 3","00;49;53;08","00;50;28;03","Steven Would I be correct in saying that effectively? So it's a case of approximating the states of the Levin's attractor, and that's what's currently there. So this is different ways of showing that within some manifold state space. And by approaching it in different ways, it reveals a different type of approximation the only thing I would ask, I'm a little bit confused why those squish, maybe I'm missing something."
"Speaker 3","00;50;28;08","00;50;40;05","I can see why that be kind of around one and just trying to work out how it squishes. Is it something to do because of the solenoid or piece or the gradient piece or is there something else?"
"Speaker 1","00;50;41;06","00;51;24;08","OK, so if we were talking about just a particle undergoing Brownian diffusion in three dimensions, so it doesn't have any kind of correlations or any sort of structure, just it's just a random walk in three dimensions. Well then it would have a spherical error profile for all of these images. But we are capturing structure that exists because Lorenzo structure has a specific specification so the states are whichever are being modeled, if you care about pressure and volume, that's your state space, that two dimensional state space of the map it's not saying those are the only states of that system."
"Speaker 1","00;51;24;08","00;52;08;23","It just those are the ones that you're modeling. In the Lorentz system, we have three states. It's position in three dimensions, but those three dimensions again also apply to a Brownian diffusing particle, which has a difference jacobian, covariance and hessian. We're talking about those being calculated for the Laurens system with the parameters that they selected. And so we are pulling out CO variances and connecting it to this second order polynomial approximation in the motion for a system where the movement is not just a Brownian diffusion."
"Speaker 1","00;52;09;04","00;52;16;04","And so that's why their structure in the covariance and that's why the structure is interestingly recapitulated in the Russian dean."
"Speaker 2","00;52;17;18","00;52;47;22","Yeah. And Hollywood, Hollywood supplement that with this. Things, things. There we go. Things that are in something that's moving the thing that's moving that's in something that's moving that's on something that's moving has a tendency to have the negative charged things all congregate in one place down in the lower right corner and all the positive things all congregate in another place in the upper left corner."
"Speaker 2","00;52;47;27","00;53;18;27","That's the nature of movement. And so that polar part of it is in play as well. If we consider it as part of these statistical transitions. And that's again, it's it's fascinating if you if you look at it, a minimum of two things. So not just not just as a partition but also as an an envelope, those things suddenly pop out at you and you see the pattern in and in a different way."
"Speaker 1","00;53;19;29","00;53;38;07","So I want to think about a physical system that's not chaotic but will help us understand what this covariance matrix is. So let's think about a children's carousel. So it moves. The horsey is moving around in a circle. And so that's like our unit circle, like the four quadrants. And then also the horse is going up and down OK?"
"Speaker 1","00;53;38;16","00;53;55;04","So when you're, you know, so again, it's like, you know, if you were at 12:00 on the carousel, it's like you have a one for the Y and a zero for X OK, so hope that makes sense. Now as it goes around, it's like point five and point five. Again, just using simple numbers here, like."
