"Speaker Name","Start Time","End Time","Transcript"
"Unknown","00;00;28;23","00;00;57;16","Hello. Welcome, everyone. It is active live stream number 45.2. It's June 8th, 2022. Welcome, Carl. And we are having our third discussion on the 45. So welcome to the Active Live, everyone. We're a participatory online lab that is communicating, learning and practicing applied active inference. This is a recorded and an archival livestream, so please provide us with feedback so we can improve our work."
"Unknown","00;00;58;06","00;01;25;04","All backgrounds and perspectives are welcome and we'll be following video etiquette for livestreams. Head over to active inference dot org to learn more about the live streams and other projects that are happening in active lab. We're in active stream number 45.2. It's the third discussion of the paper. The free energy principle made simpler but not too simple. The first author has joined."
"Unknown","00;01;25;04","00;01;48;26","So thank you very much for that. And we're going to be discussing the paper and related topics. So if you're watching live, feel free to write questions and comments in the live chat and we'll try to address it if it's within the regime of attention. Otherwise, we'll just briefly say hello and then dove in to any number of places."
"Unknown","00;01;49;11","00;02;18;08","So just to begin, we can say hi and we can just mention something we're excited about or something we liked or remembered, or something that we might want to resolve by the end of the discussion. So I'm Daniel. I'm a researcher in California, and I think there was one question that was submitted by Brock that I would very much like to get into and also understand the role of mass and inertia for some of these statistical distributions."
"Unknown","00;02;18;21","00;03;00;14","But hi, I'm Blue. I'm a researcher in New Mexico and I have probably 100 million questions, but one one that's been bugging a long time about internal states and sensory states and the influence, whether it's reciprocal or not. So. Okay. And Carl, anything you'd like to begin with or lead off? Well, I'm Carl. And of the free energy principle, this particular one, I have a bit of a focus on curiosity."
"Unknown","00;03;00;14","00;03;22;12","I'm curious to know what you're curious about. So I was just to remember this question and how I would how and how I would provide a clear answer to it. That's what I focus on, answering the questions. Let's start with a question about curiosity and then blue. You can ask the question you had Where is curiosity? In these curious particles?"
"Unknown","00;03;24;01","00;04;02;19","They are technically an expression of curiosity is an expression of the imperative to select those courses of action or policies that yield the greatest information gain. And they are properties of certain particles, not all particles, but certain particles. And interestingly, the kinds of particles that conform or look as if they are behaving in a way to maximize their information, gain or minimize their uncertainty about it."
"Unknown","00;04;02;28","00;04;58;07","States that external to the mark of blanket are those that show very precise dynamics, usually associated with larger particles, things like you and me. So if you work through the physics and the dynamics that particles who preserve that mark of blanket have and make the further assumption that you're looking at a large classical like particle that conforms to classical mechanics, then you can demonstrate that the active states, the way that it acts upon the environment, are the product of beliefs about action that were that rendered the most likely actions, those that maximize information gain."
"Unknown","00;04;58;28","00;05;27;14","So that's that's a technical answer for me. Mathematically, this all fairly straightforward, but I imagine it might be a bit mysterious for if you don't know the underlying math. Okay, great start so blue to your question. So this is something that I've heard many times before. But but since I have the opportunity to interrogate you about it now, I think it's a good chance."
"Unknown","00;05;28;09","00;05;58;11","So here it says Particular partitions can be defined in terms of sparse coupling. Perhaps the simplest definition that guarantees a markov blanket is as follows External states only influence sensory states, and internal states only influence active states. And I find this troubling, and I found it troubling often in the past because I feel like internal states influence sensory states."
"Unknown","00;05;58;27","00;06;26;01","Like especially in the circumstance where someone takes LSD, your sensory states are totally then influenced by your internal like state of what's going on. Like, is this like poking holes in the Markoff blanket or what is happening when the internal states, I feel, have a great ability to influence the senses. Right. I like the notion of poking holes in your mask of blanket."
"Unknown","00;06;26;14","00;06;50;14","That's something you wouldn't really want to do too much if you were that Markoff blanket, because that would basically destroy the Markoff blanket. And interestingly, much of you know, I conceive of much of neuroscience as trying to sort of peer through the bulk of it. And sometimes you do poke holes in Markoff blankets, for example, invasive electrophysiology, for example."
"Unknown","00;06;50;14","00;07;14;13","You actually get inside and look at the internal states. But in answer to your question, which is, I think quite an astute question and those kinds of effects would be mediated technically by what we call active states. So it is certainly possible that you can alter the gain or the sensitivity of your sensory states and your effect, your receptor organs."
"Unknown","00;07;15;17","00;07;43;27","But that effect is mediated by an active state. So if you look again at that sort of influence diagram, the little arrows in it, you will see that there is a vicarious path in which the internal states can have an effect on sometimes a profound effect on the responsiveness or the sensory states per say. But usually what that translates into is the sensitive beauty or the responsiveness of sensory states to external states."
"Unknown","00;07;44;12","00;08;33;04","So in the instance of psychedelics, for example, you might construe that as if the drug was acting at the level of the retina, for example, that might be activating certain active states that are mediating attentional like phenomena at a very, very low level. Probably not the best explanation with psychedelics. You know, I would contend that anything that affects your perception is really something that can be understood as a different kind of belief."
"Unknown","00;08;33;04","00;09;01;02","Updating or perceptual synthesis given the same sensory information. So I'll I'll come back to you and ask, you know, Well, what did you mean by I know that my internal stress can affect my sensory states, and you might. Do you really mean your sensory states? Do you actually mean the rate at which your receptors or your any of your sensory receptors are actually firing?"
"Unknown","00;09;01;12","00;09;33;03","Or did you really mean the sense making that ensues from the same sensory input due to some internal we sometimes call it internal action, but some internal dynamics that change the belief updating and change that kind of thing. Explanation you bring to the table for this particular pattern of sensory input. Yes. And so I think it's I think it's a little bit of both."
"Unknown","00;09;33;03","00;10;01;24","I think especially like I think some of I feel like it's maybe MDMA that affects like the the way that your eyes move and in your head, like literally effects like your the ice skates. So I would think that like, I guess that's involuntary action. So I guess then it does impact the action even though the action is involuntary."
"Unknown","00;10;02;21","00;10;27;19","I guess that makes sense. So I guess I just don't that that makes perfect sense. And notice what you've done is that you've you're talking exclusively about action, you know, help teaching the world. And that obviously underwrites the sense making. But of course, that's not internal states affecting the sensory input. It's affecting the way that we palpate the world and the sensory input that we get."
"Unknown","00;10;28;00","00;11;12;15","And in a sense that that's the one way in which we express our curious behavior, that we actually palpate visually or personally the world with our eyes, with our with us know, sensory receptors in our skin and even orange receptive receptors that mediate those gut feelings. You know, these can all be deployed in particular ways, but these are reflections of acting on and acting on the world in order to produce different kinds of sensations so that you know, that answer, I think so highlights exactly that sparse coupling that underwrites the statistical separation of internal from external states."
"Unknown","00;11;13;17","00;11;46;21","Give me another example. I think they're the ones that are sort of counterintuitive or sort of violations of the most useful to drill down on, you know, to all sort of like, I think of extreme circumstances also not just like psychedelics, but but you know, when you're absolutely parched like so when you're absolutely, absolutely famished. So the food smells so much better when you're absolutely starving."
"Unknown","00;11;47;02","00;12;23;19","So so that's another example of how like my internal states, you know, I feel like effects your sensory perception or that's a great example as well. So I would read that example and it makes a number of excellent points, but certainly the salience of certain sensory cues and different states of being that you yourself infer will be very context dependent."
"Unknown","00;12;23;25","00;12;50;21","So your example is, you know, the food smells nice when you're hungry, but to if you like, articulate that and to realize that and also make plans in terms of what you're going to do about being hungry, or you have to have an internal representation not just of niceness, but also being hungry, you know, to recognize that you are hungry."
"Unknown","00;12;50;21","00;13;22;08","So I think that example almost paradoxically speaks to extremely high level internal states trying to make sense of all of these intercept of cues that are coming in. So that's a nice example of intercept of inference. So in the same way we tried to make sense of the patterns of visual input in terms of what caused that, what's the best explanation of this particular pattern is a face that a bird at very low levels is an edge."
"Unknown","00;13;23;16","00;13;52;05","All those rules in principle should also apply to the patterned inputs you get from your autonomic nervous system, your sympathetic and parasympathetic nervous system, and all the receptors that I repeat literally report your gut feelings and you have to make sense of that. And some of, you know, creatures like you and me can make sense of it by bringing these very high level hypotheses like I am in a state of hunger or I am hungry."
"Unknown","00;13;52;13","00;14;33;15","But this is just another percept, you know, and it's, as you know, has the same status as the percept of a face. You know, a face is a sufficient explanation for what I'm currently seeing enables me to make all sorts of predictions about what's going to happen in terms of, you know, looking at that face and hearing the sounds emanating from that face and knowing that I am hungry also has enormous benefit in the sense that it now constrains or provides or conditions, certain prior beliefs about what I'm likely to do next, including these mental actions that enable me to attend to certain other cues as opposed to other kids."
"Unknown","00;14;33;15","00;14;58;26","And I think it's really the smelling now is part and parcel of that is that you are actually attending to olfactory input. But in order to do that, you've got to recognize that the most likely thing I am likely to do as a hungry creature who knows that she's hungry, is attend to my olfactory input. So the mechanism of attention, interestingly, gets into this later example as well."
"Unknown","00;14;59;27","00;15;25;02","And that's the thing that's a nice observation in the sense that many people think that the that attention is a kind of mental action. It's an internal action. It's sort of basically appealing to this notion of mark of for the mark of blankets within the brain and certain high levels acting upon the lower levels just to set the gain."
"Unknown","00;15;25;10","00;16;04;20","You know, and if you're taking a particular coding strikes with the precision of certain signals and psychology rhetoric, this would be the salience of your of of particular certain modalities of input that that whole precise information for you at that point in time, that resolve uncertainty about the state that you're in, hungry, happy, fearful, whatever. You know, all of these things have to be inferred and recognized by the blink updating of the dynamics of the internal states."
"Unknown","00;16;05;25","00;16;41;05","I could first welcome Thomas greetings. Talk a little bit about action and how action integrates these complex nested chains of causal narratives. So we talked about different perturbations, whether it's a pharmacological intervention or some optogenetics or something like that. There could be modification at the level of the retina, and that's directly modifying the sense states. So there we don't need to appeal to any internal states changing to change perceptions like you're seeing something different."
"Unknown","00;16;41;05","00;17;08;06","When there's different light on the retina, then, as was mentioned, there might be modification of active states of ocular motor behavior. And then, Karl, you just brought it to the idea of attention as a mental action. And so looking back at the the partitioning in this figure, the particular states are the internal states mu and the blanket. So that's the whole particle as it moves around."
"Unknown","00;17;08;14","00;17;37;22","That's the entity as distinguished from the environments. But there's special attention paid to the autonomous states, which are the active states and the internal states. And it's almost like these are the ones where control can be applied either in this terms of direct ocular motor action or the the possibility of attention as mental action. And so sense cannot be directly controlled."
"Unknown","00;17;38;04","00;18;07;10","But in this strange loop way is what uncertainty is being reduced about, which is the outcomes of the observations. And so distinguishing these different subsets of the partitions like the particular states being the entity, the particle, and then the autonomous states being the ones that have special control, degrees of freedom and the blanket states being the ones that intermediate or make the internal and external states conditionally independent."
"Unknown","00;18;07;24","00;18;40;17","Each of these subsets and maybe even other subsets have special roles in understanding different cognitive informal phenomena like curiosity or drive and motivation and so on. And then also the example with the food, I am hungry. And then I thought about what if someone had the belief I am fasting and that food smells good, but it would not be pleasant if my fast were ruined by this sensory outcome."
"Unknown","00;18;41;02","00;19;25;16","So there's even degrees of cognitive action beyond and impulsively following drives that are of one sensory mode. Thomas Would you like to say hi or remark on anything you're seeing here or anywhere else or there's some questions in the chat. And so as of last time, I apologize. I'm a bit late joining run over a little bit of the hospital so lots of things on the slide that that certainly I'm interested in thinking about the roles of attention and and and and you mention the word salience as well."
"Unknown","00;19;26;23","00;20;00;24","And I guess the thing I might pick up on is that I in relation to that, the idea that attention can be a form of action and is that we can think about we can think about the things that are saving as interesting, things that are worthy of attending to, worthy of and performing that action that then obtains those data, which I can't quite a useful way of thinking about the relationship between those two terms and a way of understanding what we mean when we talk about salience or attention."
"Unknown","00;20;00;24","00;20;34;27","There's some things and and to me, this is one of the big motivations for and using computational neuroscience methods, using mathematical modeling as a way of trying to describe what's going on in that a lot of these terms are used interchangeably and the very different meanings by different authors in a lot of the cognitive sciences. And it's quite useful to be able to pin that down to something mathematical and unambiguous that that says what I'm talking about is let's use the same words, something, something different, but at least we can be clear on what is meant by it here."
"Unknown","00;20;35;26","00;21;03;10","So for me, it's one of the things that I found got me interested in active inference in the first place. This idea of being able to formalize things in in psychology in a very precise way. It makes me think of pinning insects. And sometimes by just pinning a few parts of them, the whole pose might be stabilized. And then other times you might pin this bug and somebody else says, Well, I have this one that's floating around."
"Unknown","00;21;04;22","00;21;43;28","It could be pin down or just trying to walk this path between being clear about how the terms are used, but not partitioning ourself off and saying, Well, we're ignoring the casual use of the English words, surprise or belief or curiosity or attention or salience. And we're just going to call that string onto this other formalism. So how to navigate the way that sometimes the formal isms do have words that tag them like risk or ambiguity and how to be clear about something."
"Unknown","00;21;43;28","00;22;28;20","Yet when the term itself may not have sharp distinctions, maybe a lot is cut out or is not fully encompassed by that definition. And it has issues with then people taking an unrelated issue or definition of that word and projecting that back onto the formalism. Yes. And as you say, I think it ends with translation to the question of degree as well is not just shutting itself off with one specific definition that's different to everybody else, since it's a way of saying, how can we how can we actually relate all these things together and see if there are multiple different terms that are used that apply to the same underlying construct?"
"Unknown","00;22;30;17","00;23;01;13","Lou, would you like to ask anything or I can go to a question in the chat. Go ahead. Let's go to the chat. Okay. I'm going to ask one shorter question while preparing another longer one. So Ali asks, how can seemingly irrational, non optimal behavior in some organisms be accounted for in active inference, different types of non optimal or seemingly irrational behavior, whether altruism or making mistakes?"
"Unknown","00;23;01;28","00;23;47;19","How can these behaviors be understood within a behavioral optimality framework? Did you have any thoughts on that one? First, I'm thinking about balls rolling to the bottom of balls. One could say, I don't like where this ball rolled or I wish things had been different so it wouldn't have rolled that way. But given where the ball starts and the structure of the landscape, it's just playing out a certain way."
"Unknown","00;23;47;19","00;24;28;27","So if somebody has a very strong aversion to risk, maybe even with the total accurate information, they could still make a decision where the outcomes are post-hoc perceived as suboptimal due to an extreme attention being paid to the possibility of a downside. A 1% chance you lose $1, but there's a 99% chance that you get $100. But if you're paying a lot of attention to that 1% chance of loss, maybe that causes somebody to not engage in this offer, that in the mean field or in this sort of other way or other set of priors, other attention would be quite relevant."
"Unknown","00;24;28;27","00;25;08;05","So given how things are set up, they play out a certain way and we don't need to take that too much onto the determinism path. But given a set of priors, Bayes optimal or variational Bayes utilizing organisms or those remodel as such may get two outcomes that don't always result in them achieving their even specified goals, but I think about it in terms of the old expression if you want to go fast, go alone, and if you want to go far, go together."
"Unknown","00;25;08;05","00;25;46;17","It's about cooperation and really in the effort of achieving any goal, I think that the altruistic behavior in terms of cooperation, well, it's not always really seen that way. I think overall it is that way. So, I mean, while giving $10 to a homeless person in your community might be, you know, depriving you of $10, it's also giving that person the opportunity to, you know, have a meal or whatever it just is."
"Unknown","00;25;46;17","00;26;12;23","It's in our nature to be cooperative, whether it's going to directly benefit us or not, because it's only through things like cooperation that we can build rocket ships and, you know, be sitting here today discussing this paper so we wouldn't have witnesses like the Internet if we didn't. Instinctive cooperate, regardless whether it directly benefits us or not. Great point about the scale mattering."
"Unknown","00;26;13;09","00;26;36;11","Zoom in. Why is that lever? So giving up all the glucose isn't glucose something important or pragmatic value for that cell? And it can be true and it can be playing a service at a higher level. So Thomas or Carl, I was just going to pick up on your analogy, your metaphor with the balls rolling into the different bowls."
"Unknown","00;26;37;06","00;27;01;28","And I thought that was quite a nice way of putting it in the sense that the optimum trajectory of a ball rolling into a bowl, if for any given bowl, is effectively going to be the most likely path it takes. Now, of course, you could you could swap that bowl for bowl of a completely different shape and you would get a completely different trajectory."
"Unknown","00;27;02;06","00;27;32;16","So what might seem optimal is the trajectory for one bowl might seem completely suboptimal for another. And there's a question that comes up here a lot in terms of thinking about psychopathology or disease processes, where people say, well, how is it that you can describe that as engaging in optimal behavior? Because clearly what's happening is so far not suppose the answer is that's your referencing optimality with reference to the wrong bowl and you need to think about what is the objective function."
"Unknown","00;27;32;16","00;27;55;20","Whenever we're talking about optimality, we need to say, what? What is it we're measuring optimality in relation to an act of inference predicted. The objective function is always going to be a free energy functional, but the specific priors that are going to making up that energy function will have a big impact on the shape of the energy landscape and therefore where we're going to end up moving the kind of trajectories we're going to have."
"Unknown","00;27;55;20","00;28;31;25","And so it turns around the question of saying is something Osborne says, given that it is optimal, what is the appropriate objective function defined in terms of the appropriate primes? Thank you, Carl. Okay. Yes. Just to reinforce all of those answers and provide a succinct way of responding to this important question, what is the relationship between active inference and bounded or optimal behavior?"
"Unknown","00;28;32;08","00;29;14;11","So one way to answer that question is just to query the nature of optimal behavior and bounded rationality, as it's usually defined in behavioral economics and sometimes in sort of behavioral psychology. And one theorem which brings those kinds of formulation into question is called the complete plus theorem. And what that says is that for any pair of lost functions and behaviors that exists, a set of priors that render that behavior Bayes optimal."
"Unknown","00;29;15;00","00;30;02;13","So to translate that into the current conversation, what that means is active inference can describe any behavior in terms of Bayes optimality given any lost functions if you allow for different priors. So what that tells you is that the notion of sub optimality is itself a little bit suspect. All you're saying is that there are unique priors that explain this behavior and what you normally end up realizing is that Bayes optimality, in the general sense of active inference, is not a way of prescribing optimal behavior, it's a way of describing it."
"Unknown","00;30;03;01","00;30;33;17","And that description requires an identification of specification of the prize in the generative model, which is effectively what Thomas has just said, and indeed practical applications of active inference to say in the context of computational psychiatry are just that they are just using active inference in order to summarize or to understand or characterize a particular person in terms of the prior beliefs they are bringing to the table."
