"Speaker Name","Start Time","End Time","Transcript""Friedman","00;32;11;29","00;33;08;17","I would assert that the notion that a framework can have the attribute falsifiable is a category error. The notion of false stability is thus a very weak notion because it's actually reflecting rejecting a no hypothesis in favor of an alternative hypothesis that has some limitations including the sort of the transcendental arguments on falsification, which is just that belief is rarely scrutinized using a falsification ist framework and then dropping from the transcendental arguments into a more history of statistics and science when we move from Frequentist towards Bayesian statistics, where the P value and so on, and the parametric distributions are seen as like special cases, but not the whole substance of the statistics."
"Friedman","00;33;09;22","00;33;33;22","Karl suggesting that a better way to frame evidence based selection of hypotheses, which is ostensibly what falsification is after as well, is in terms of how much empirical evidence is accrued by competing hypotheses and that's quite a different model than can then falsify the ones that aren't true, but shoot down the ones that don't exist. So this is quite an interesting area."
"Friedman","00;33;35;06","00;33;37;01","What would you say or adds this."
"McKean","00;33;38;22","00;34;12;28","Is a word verisimilitude. I think that is exactly what he's describing here. Again, just how much evidence is accrued rather than. Yeah, I mean, that's in practice how it works. So I don't completely understand the notion of Falsifiability as it's really important. But like Dirac had this notion of beauty or and he's saying, look at the equations really beautiful."
"McKean","00;34;13;25","00;34;47;25","Then maybe you check your experiment first. So like you were saying, it's kind of like that's not falsifiable, but then what do you mean by not falsifiable? And that is that you're not examining that claim. It's kind of there's a you know, infinite regression there of falsifiability that makes it intractable, which is why taking the opposite approach of just stacking up the evidence is you know, a way to make the sentence the same thing, you know, but a tractable version of it, right?"
"Friedman","00;34;48;03","00;35;14;27","So awesome. The right again, picking up on that last quotation there that the FP is not a falsifiable theory about the way things behave. It's a description of things that are defined in a particular way. Let's talk about utility is such a description. If the FP is indeed a description, is it useful in itself? The answer is probably no."
"Friedman","00;35;15;04","00;35;43;21","Oh, well, then we can stop reading in the sense that the principle of least action does not tell you how to throw a ball. However, the principle of least action furnishes everything we need to know to simulate the trajectory of a ball. In a particular instance, in the same sense, the FP allows one to simulate and predict the sentiment behavior of a particle person, artifact or agent i.e. some thing."
"Friedman","00;35;44;22","00;35;54;05","This allows one to build sensing artifacts or use simulations as observation models of particles or of those other mentioned types of systems."
"Friedman","00;35;56;13","00;36;27;21","These simulations rest upon specifying a generative model that is apt to describe the behavior of the particle or person at hand. At this point, committing to a specific generative model can be taken as a commitment to a specific and falsifiable theory later we will see examples of these simulations. So it's like the linear regression concept is not even where you would want to focus the brunt of your falsifying effort."
"Friedman","00;36;28;12","00;36;56;22","But if there are two different linear regression models, we might ask which one is preferable or which one is falsified by doing some subsequent perturbation or experiments? But the linear regression framework is like a framework, hence not falsifiable in the way that people often expect and deploying a specific generative model analogous to like a specific linear regression model, but different."
"Friedman","00;36;57;19","00;37;13;29","That is where there's a commitment to a falsifiable theory. I think the amygdala connects to this. That way that could be tested and that evidence could be evaluated within a falsification or Bayesian Bayes factor framework."
"Friedman","00;37;16;15","00;37;34;15","Falsifying the concept of generative models. They would be have crossed that bridge and now could be engaging in falsification and evidence comparison within some constrained space. Anything to, I don't know, as we close the introduction."
"McKean","00;37;36;03","00;38;06;09","To just again, the linear model versus a generative model of like the linear model will yield some approximation that's not necessarily a real possible observation to falsify. The generative model will produce many things that you might not observe possibly, but some that you will and then could potentially be falsified like you give specific examples."
"Friedman","00;38;06;09","00;38;30;18","So yes, it's almost like it takes this this me so scale and it, it separates the, the milk from the cream and the ATP wise over falsification. And then once you're committed to a specific generative model, it's actually written down, not just speculated that it could be written down then it's like, oh, well then it's trivial or against it."
"Friedman","00;38;31;01","00;39;00;18","So it kind of separated out the framework like language as a framework like Dave just mentioned in the chat how would you falsify a language you would not any more than you would falsify a conceptual framework. So one could falsify a language like English but things that are said within English might be amenable to being tested once they're actually said using that framework and interest."
"McKean","00;39;00;18","00;39;08;08","Evidence stacked up or not versus alternatives, just like language or Evolutionism."
"Friedman","00;39;09;06","00;39;36;20","So recall the roadmap. We're now going to head into the next sections, each of which is going to be building on each other in this concise narrative however, also semi standalone in their focus, and we're just going to do basically a first pass and some contextual zation because we have a lot of time in the coming weeks to discuss these topics in more detail."
"Friedman","00;39;37;13","00;40;11;14","So we're going to go to Section two systems, states and fluctuations. OK, so they write, we start by describing the world with the stochastic differential equation, the orders 2014. So this is a citation to the book Stochastic Processes and applications of diffusion processes and just one preliminary note, this is not the same sentence as the world is a stochastic differential equation."
"Friedman","00;40;12;14","00;40;40;27","We start by describing the world with a stochastic differential equation. So leave your realism at the door. We're describing models here they write, Why start here? The principal reason is that we want a description that is consistent with physics. Here's some discussion questions. What does it mean to be consistent with physics? What does it mean to be consistent with physics in theory or in principle or in practice?"
"Friedman","00;40;41;28","00;41;15;02","And then they write this follows because things like the Schrodinger equation in quantum mechanics area, a fluctuation theorems in statistical mechanics area B and Lagrangian formulation of classical mechanics. Area C, three different mechanics, quantum statistical and classical can all be derived from this starting point. So we're going back to like the last common ancestor of those three different mechanics."
"Friedman","00;41;15;24","00;41;35;06","And then that is where Bayesian mechanics is going to also be initiated from. In short, if one wants a physics of sentence, this is the place to start. Why start? Where where are we going? Why are we going anything you want to out here?"
"McKean","00;41;42;24","00;42;01;02","No, I think again, just that you know, that that's all these skip physics it's it's odd that you would be able to reproduce, you know, derive all these things from something that's not fundamental or important in some way."
"Friedman","00;42;01;24","00;42;32;25","So often they write, we are interested in systems that have characteristic states. This means the system has a pullback attractor. The sets of states that the system will come to occupy from any initial state. So the rubber band is going to pull back to its resting state if it's allowed to. And formalism, that stochastic differential equation describing the rate of change of the states."
"Friedman","00;42;33;03","00;43;02;13","So X are the states, the towers is the time and the dot notation is the derivative with respect to type. So how states are changing is equal to their flow f of x, f for flow and random fluctuations. Omega. So like a signal and a noise term, there's the the flow, the ocean current, and then there's the vibration that isn't the directed flow."
"Friedman","00;43;03;01","00;43;36;22","And this separation of scales is going to come back again and again. So dot notation again means the derivative with respect to time. So how things are changing with respect to time through time, this yellow means that time and causality are baked into everything that follows in the sense that states cause their motion this equation is itself an approximation to a simpler mapping from some variables to changes in those variables with time."
"Friedman","00;43;38;05","00;44;06;08","This follows from the separation into states and random fluctuations implicit in formalism, one where states change slowly in relation to fast fluctuations so if this term the noise term is dominance, then there will not be movements flow like movement on a manifold there's some more details, but things are changing in different ways."
"Friedman","00;44;08;12","00;44;38;26","Different kind of stochastic equations that are going to be presented here and in the book and in the citations, they help us see different parts of how we can use dynamical models to understand physics and specifically the physics of particular cognitive slosh. Tensions systems then in the footnote, they ask a question Why is the flow not a function of time?"
"Friedman","00;44;39;15","00;45;08;11","And that's what we're going to return to in dot one. How is time dealt with or not dealt with similarly or differently than other frameworks or other physics and then just to stay on this formalism one and then please give any other thoughts. This last line of one, he of X equals question mark the next step shared by all physics."
"Friedman","00;45;08;24","00;45;39;07","So those three areas that we described, classical, statistical, quantum and Bayesian is to ask whether anything can be said about the probability density over the states, the question mark in one. So this is the common grounding this is the last common ancestor of the multiple physics. And now we're going to take it in a different direction. A lot can be said about this probability density, Pyrex, which can be expressed in two complementary ways."
"Friedman","00;45;39;24","00;46;10;06","And this is going to introduce a very important distinction and dialectic. Here are the two complementary ways left side blue density dynamics using the Focker plank equation a.k.a also known as the forward Commodore of equation. Here's formalism to the Fokker Plank Equation describes the change in density due to random fluctuations and the flow of states through state space."
"Friedman","00;46;10;22","00;46;40;22","This is like a fields model and then the second complementary way in orange on the right side in terms of the probability of a path through state space using the path integral formulation and they write for formalism. Three. Conversely, the path integral formulation considers the probability of a trajectory or path in terms of its action. So what are two things that you can say or more about the probability density?"
"Friedman","00;46;41;18","00;47;24;03","What are two complementary ways that it can be expressed? What are important similarities and differences between this fork or plank formalism to approach and the path integral formulation of formalism? Three Are there other complementary ways to say it or other ways to say what is here? But this is just to introduce what's going to be very important and going to be moved back and forth in the course of this paper, which is one representation that's more field like continuum like, and then another representation that's going to be more trajectory and path based what do you see in there?"
"McKean","00;47;26;15","00;48;15;00","Yeah, we we discussed this briefly about you know, like a continuous space versus a kind of discrete or instantaneous space, like there's some mostly I guess metaphor there analogy. But when you just ask this question of what are other ways to see this, it's it's some reaction trajectory. Their path is like a sounds like like a like an action density or an energy density, like where the where is the kind of path of of the energy and the whole system going to events itself."
"McKean","00;48;15;00","00;48;18;17","Right. So it's it's like an action density gradient or something like this. Right?"
"McKean","00;48;24;00","00;48;26;12","Yeah. Cool. Really interesting."
"Friedman","00;48;28;04","00;48;56;03","Both the fork or plank and the path integral formulations, the formalism, 23 dialectic inherit their functional form from assumptions about the statistics of random fluctuations in one. So recall one with the flow and the random fluctuation term, for example, the most likely path or path of least action is the path taken when the fluctuations take their most likely value of zero."
"Friedman","00;48;57;00","00;49;25;13","So we're going to explore this more but the path of least action is not using action in the same way that active states are. Exactly path of least action does not mean the laziest or the least energetically costly or the least mobile thing to do. It's not that it is. So that is what we're going to explore what does it mean to minimize action in this framework?"
"Friedman","00;49;26;20","00;49;52;11","The motion on the path of least action is just the flow without random fluctuations. So if the question where you're trying to run in a straight line forward, there's two forces there's the flow of you running forward, and then there's your thermal vibrations. So in one limit, the flow might absolutely be overwhelming. The random fluctuation of least action would be that person running forward."
"Friedman","00;49;53;10","00;50;25;10","Conversely, if that person was like the size of one molecule, they would be being buffeted by stochastic thermal vibration. And so they would not be following that path of least action. In the same way this metaphor hopefully doesn't misrepresent, but paths of least action will figure prominently in the following sections of the paper, especially when considering systems that behave in a precise or predictable way, we will denote the most likely states and paths with a bold typeface."
"Friedman","00;50;26;02","00;50;54;26","So it can be a little subtle sometimes and so we'll try to clarify annotation and get assistance as we can. But like this is like a bold x, like a bold x 30 is the minimization of that unbounded function with respect to the action a of those states through time and that is going to be related to the change in extra time being just only the flow."
"Friedman","00;50;55;22","00;51;23;19","So here it was like x dot of T equals the flow of X plus a noise term. Here, if the noise term is zero, you can drop it and then they write other equivalents, the fork or plank and the path integral formalisms this dialectic that we've discussed, the formalisms provide complementary perspectives on dynamics. Did we mention that they're different but complimentary?"
"Friedman","00;51;24;18","00;51;59;06","The former deals with time dependent probability densities overstates the latter path integral considers time independent densities over paths the density overstates at a particular time is a time marginal of the density over trajectories. These probabilities Bayesian probabilities, Bayesian statistics can be conveniently quantified in terms of their negative logarithms or potentials leading to surprise and action respectively. So we'll explore the formalisms more."
"Friedman","00;51;59;15","00;52;29;15","But just to note that the fancy I the fracture I is the joint distribution and it is going to be a negative log on the joint distribution. P And then similarly a the action is going to be on those same variables in a slightly different way, being looking like a surprise conditioned upon x sub zero, the starting conditions."
"Friedman","00;52;30;14","00;52;42;26","And we're going to go into more detail in the coming weeks any more comments on Section two or will continue to three no."
"McKean","00;52;43;01","00;52;44;21","Yeah, that's awesome."
"Friedman","00;52;46;13","00;53;16;04","Section three Solutions Study States and on equilibrium so far. So Sections one and two, we have equations that describe the relationship between the dynamics of a system and probability densities over fluctuations, states and their paths. This is sufficient to elaborate most physics big if true here's where, for example, we could use the Focker plank or the path integral formalism."
"Friedman","00;53;16;04","00;54;18;25","So either side of that dialectic to derive quantum mechanics where the Focker plank becomes the Schrodinger wave equation mechanics one quantum we could focus on systems that comprise statistical ensembles of similar states to derive stochastic and statistical mechanics in terms of fluctuation theorems, statistical mechanics, mechanics. Number two, finally, we could consider large systems in which the fluctuations are averaged a way to derive classical mechanics, such as electromagnetism and data that general relativity, classical mechanics, mechanics, number three, all of these mechanics, quantum statistical classical require boundary conditions to give the examples the Schrodinger potential in quantum mechanics, the heat, bath or reservoir in statistical mechanics, and the classical potential for Lagrangian classical mechanics."
"Friedman","00;54;19;27","00;55;01;07","At this point, the AP steps back. I wonder what space it's in and asks Where do these boundary conditions come from? Indeed, this was implicit in Schrodinger's question in the famous article What is life in 1944 where Schrodinger wrote How can the events in space and time which take place within the spatial boundary of a living organism via accounted for by physics and chemistry and this is a bit of a nod slash reference to the paper of Rammstein at all in 2018 answering Schrodinger's question a free energy formalization formulation."
"Friedman","00;55;01;12","00;55;21;19","So this was a really impactful and relevant paper that started a discussion around the FFP and multi scale FFP and self-organizing complex biological systems. And so on. So anything to add about these mechanics and their similarities and differences."
"McKean","00;55;23;28","00;55;33;13","Markup like it's obviously what they're they're everywhere when you find it's a."
"Friedman","00;55;35;09","00;56;15;18","In formalism six, we're going to go into it hopefully in the discussions but just in livestream number 32 on stochastic chaos in markup blankets just to show where these similar equations were represented, we talked about how the Helmholtz decomposition could be used to take a field and decompose it into multiple sections. There's the divergence term, which is like or the gradient term, which is like you're on some landscape and the ruler that's the most angled just going straight up the hill."
"Friedman","00;56;16;05","00;56;48;08","That's like the divergence term, and that might be useful for going up or down a hill as fast as possible. Then there's this solenoid or control flow term, and that is like an ISO contour. And those two are part of the classical Helmholtz decomposition line. And then there's this capital Lambda, which is the housekeeping term, as it was referred to in 32, and we explored it a bit, but it reflects the way that that landscape is also influenced by movement."
"Friedman","00;56;48;14","00;57;19;17","So we wondered if that was like kind of like walking around on a trampoline where you can't just snapshot the topographical map and then do your navigation on the fixed map. But there's some change there. We'll come back to that later. So that's section three on solution study states and on equilibrium. Now we're going to really get to Markoff like blankets, particles, partitions and things in Section four."
"Friedman","00;57;20;16","00;57;23;24","All right. So what do you see in FIG. one?"
"McKean","00;57;29;13","00;58;03;05","Yeah, I mean, see these two inner red and green conditioned on each other that keep these external and internal states on the outside separate. They still have conditional relationship between like the sensory states, the external states and the active states, the internal states. But not with directly with each other. Right."
"Friedman","00;58;03;20","00;58;31;24","So awesome. So they wrote in the caption, it's an influence diagram I believe it's also fairly to say it's a base graph, but we're thinking of the arrows as influence and the nodes like the circles as variables it's a particular partition of states. Particular is a pun because it's it's one specific partitioning is not the only partitioning, but it's a particular one that we're sharing with you."
"Friedman","00;58;32;07","00;59;09;12","And it's partitioning that into a particle into something that's like distinguish the figure from ground. And the four states that get partitioned are internal states and external states that are separated by a Markov blanket comprised of the sensory and active states there's a lot that could be said and we're going to continue to explore. But just to give a few more notes, the partitioning entails that all of these states come into existence in a model specific way at the same time."
"Friedman","00;59;09;22","00;59;43;20","So it's not like there's some feature of the world that just is fundamentally an internal state it's the relationship between an internal and external state, conditioned on a blanket by which all of those assignments can be made it's like an incomplete sentence to have one referenced without the other also, we have the names of the states MEU for internal and ETA for external, and it's kind of like they almost look like flips of each other then."
"Friedman","00;59;43;26","01;00;14;03","As for sensory states, incoming info a for action, active states, outgoing actions. So if it's an external as sensory, a active and mute internal states, and then there's a few couples of states, sets of states that we are going to care about and the equations that describe them have super different implications. So one set of states that's interesting to compare together is the blanket states."
"Friedman","01;00;14;04","01;00;51;29","B is the set of S and A and that's more aligned with the purple 1988 formulation of the Markov blanket or boundary where it was an undirected blanket and first in and others have developed this notion of like a two way partitioning. So the blanket is the set of both S and A, the particular states apply not to be confused with PI the policy selection in the MVP, the particular states are B and MEU, so the blanket and MEU."
"Friedman","01;00;52;13","01;01;19;24","So the particular states are internal, active and sensory everything except for external. So the particle is like the cell, the boundary and the internal generative model. And then there's the autonomous states alpha, which is just a and MEU. And one way to think about those states are like if you were to design the system, those are the states that you can control."
"Friedman","01;01;20;16","01;02;05;09","You can't directly control the sensory input, which is the only thing that differentiates the autonomous from the particular states. You can't directly control what photons hit the retina, but you could control your interpretation and your action for where your eyes move, which might absolutely influence which photons do hit the retina. But the autonomous states are the ones that there's a degree of agency over in a way that is slightly different from just the consideration of the blankets and the internal states let's continue to talk about some of the formalism the conditional independence which are going to be up."
"Friedman","01;02;06;02","01;02;40;11","Let's pull back one more in associating some of these equations of motion with a unique non equilibrium, steady state or ness density. We have a somewhat special setup in which the influences entailed by the equations of motions place constraints on the conditional independence of the mass density these conditional independence, these can be used to identify a particular partition of states into external, sensory, active and internal states, as shown in the figure this is an important move in what space?"
