"Speaker Name","Start Time","End Time","Transcript""Unknown","01;33;02;18","01;33;30;20","And it is this these set of constraints that lead to a functional form for the expected free energy which can be decomposed into what we were talking about before, which is expected information gain and the expected cost. In the absence of those constraints, that expected information would disappear. It would all the things would cancel out in the general case."
"Unknown","01;33;31;01","01;34;11;23","So this is, if you like, a map of, you know, a visualize able way of looking at the information decomposition among the part of the particular partition in the context of the general case and in the context of precise case, just to sort of visualize the constraints that lead to curious behavior. So if you remember, it is expected information gain that describes apparent curious behavior because actions become more likely if they increase expected or have a high expected information gain or resolve, uncertainty or minimize entropy of the conditional sort."
"Unknown","01;34;12;19","01;34;45;21","So this is, if you like, an a visual aid memoir or an unpacking of what can be quite dense and unintuitive expressions written out mathematically in terms of information. There is an expected Lagrangian or surprises and neutral informations. I say that for Thomas, his best thinkers would be working on trying to get the simplest way of expressing these important constraints intuitively just using equations."
"Unknown","01;34;45;21","01;35;12;03","And it's not easy. And the reason it's not easy is that in these information diagrams, when there is no uncertainty, when the uncertainty reaches the entropy reaches its lower bound, the area disappears, at which point for discrete systems, the entropy is zero. So when there's no uncertainty areas equal to zero, h the uncertainty. The entropy is equal to zero."
"Unknown","01;35;12;26","01;35;39;18","That's how it should be. The problem is when Shannon wrote down entropy for continuous systems that no longer holds and you get negative areas. So there is no lower bound on the entropy of a continuous and a continuous differential entropy. So you really have to go round the houses to recover an area that disappears when in fact it is bounded by minus infinity."
"Unknown","01;35;39;18","01;36;13;25","So that that particular just was for Thomas. I've just emailed him today about that particular. At the end, Jane saw this problem with Shannon's entropy, you know, decades and decades ago, and try to repair it using something called continuous entropy and the object density of discrete points. So all of that worry and delta always continues to disappear. If you just stick with this, not these nice information diagrams where you know that the if the area isn't there, it's a jump to zero."
"Unknown","01;36;13;25","01;36;57;14","Awesome. It's like you could be 110% sure about something. Let's go to figure five. What is happening in Figure five? I think Figure five is is showing more or less what we've seen on the previous figures, but now just interpreted in the context of in the context of neuroscience, we've got the same action perception graphics we were talking about in FIG. two or the same equations and where the three energies have been interpreted in terms of theories and complexity components."
"Unknown","01;36;58;18","01;37;31;20","So that brings us back to what we talk in terms of interpretation of free energy as a means of estimating model likelihood or approximating model likelihoods and have Bayesian model evidence. And the models should be as simple as possible, while accurately accounting some data. And I think that's really to emphasize less interpretation of self evidence in that we we've spoken about for the idea that by minimizing your free and free energy, you're implicitly maximizing the evidence for some internal model."
"Unknown","01;37;32;15","01;38;17;16","And by putting this explicitly in terms of brain and we now talk about the kind of model that the brain might implicitly hold about the outside world and the kinds of models that might be required. The sentence be appearing behavior. And it got a nice ring to suggest a mock of blanket, but here explicitly many questions for another time about the order of the action perception loop and whether perception precedes action in principle or in different computational implementations."
"Unknown","01;38;17;16","01;38;58;03","How different aspects of the timing of the execution of different stages might converge upon similar outcomes and might not just noting it. In Fig. six, we have sentience, behavior and action observation. So what is shown with the brain and with these three graphics beneath so that this is a nice example of a of what's actually a slightly older version of actual inference now, and it's a slightly different implementation than what we might use."
"Unknown","01;38;58;03","01;39;44;29","But I think it's a nice example in that it highlights the transition from behavior in terms of continuous differential equations through to something that more sequential and behaves in the way that we might actually about plans as being one move and then the next thing after that and an implicit discrimination in time. And and so that the and the plot shown and sort of the upper left where we've got a series of lines which are kind of overlapping red line in bold and exactly that one that is showing what is more or less sort of predator prey like relationship that creates these sort of sequences."
"Unknown","01;39;44;29","01;40;13;19","So if you can imagine that that you have a alternation in a predator and and some sort of prey, whereas the prey population increases in size and that predator population will also increase in size behind that, as the predators have more to feed on, which will in turn cause the prey population to drop, followed again by the predator population dropping as food resources become more scarce."
"Unknown","01;40;14;27","01;40;47;02","And this is known as as efficient air window, less competition, or as a lot more for stereotype dynamic and the generalization of this. You can have many such sequences where one thing follows the other and you get the sequential set of peaks and what's going on here. Now, if we were to interpret each of those lines as representing the probability or the mock probability or some sum and mapping to the probability of one of several alternative discrete states and categorical states."
"Unknown","01;40;47;06","01;41;14;29","So here, imagine we're talking about blue, a blue, green or red, and then we end up generating a sequence of blue screens, reds, depending upon the underlying dynamics. So we have a continuous system that's now has the field of something sequential. And and what's happened here in the graphic on top of the brain here is to associate each of those discrete categories with different points in space."
"Unknown","01;41;15;23","01;41;44;17","So we're now saying this is where if we're looking at the blue points, then that's going to be associated with this sort of upper left location in space or so there's a blue as well, that choice of color to choose my part and, and so each of those sequences is then associated with the generative model that says, I expect that when the blue state is, is present or the red states presence, that my hand will be drawn towards each one of those states."
"Unknown","01;41;44;20","01;42;15;29","I predict that as if there is some sort of spring attached from my hand to where that location is, which means that as I as I infer the sequence, I'm sequentially drawn to where I believe I'm being drawn to each of these locations. Turn now if I'm predicting if my if my free energy or my margin like that says that the most likely states are the ones that would occur if my arm were really being drawn in this direction, the actions that then minimize the free energy are those to fulfill those predictions."
"Unknown","01;42;16;08","01;42;36;14","So all I have to do is predict where the kind of proprioceptive or visual data might get based upon. Where my hand is, is any one point in time and or predict what the data that I would obtain if my hand really were being drawn in this direction, and the resulting action fulfills exactly that and creates the sequence of movements."
"Unknown","01;42;36;24","01;43;03;21","And so what we get out is a relatively complex motor trajectory that has an almost autonomous type feel to it. And simply by predicting that I'm going to be drawn to each of these points in sequence, and this has been used in this particular example as a way of simulating handwriting or something that appears to be like handwriting simply by moving the piece of paper underneath, underneath where my hand is moving so that I end up with this sort of repeated pattern."
"Unknown","01;43;05;00","01;43;26;08","And you could imagine that in real writing, which we made of a series of points that we would associate with different bits of the letters would effectively draw our hand around those letting us be right, cool and categoric all shifts at the letter scale, at the word scale and so on, could be modeled in a, in a hierarchical way, absolute."
"Unknown","01;43;26;17","01;43;56;24","And that that sort of. Exactly to the point in terms of this move from this and this formulation act of inference that used to be used now to explicitly writing down a series of discrete, categorical and as you say, putting that together in a hierarchical model where you can now nix predictions of a discrete, categorical sort with short trajectories in a continuous state, and that continuous state space awesome will complete our lightning tour of the last three figures."
"Unknown","01;43;57;17","01;44;38;21","So here's figure seven. Just for for reference, we looked at figure three, we saw some faces and names and now we're seeing figure seven. What is being shown here. So here I think we're dealing with what what is a limitation of what we saw on the previous slide. And so when we were thinking about these fairly complex trajectories that had an almost autonomous feel like to them, and it's still only a relatively simple sort of behavior implicitly it's just dealing with the replication of some potentially quite complex or even arbitrary pattern."
"Unknown","01;44;40;10","01;45;12;28","But to become really autonomous, to behave in an intelligent way, really what we need is to be able to select between alternative sequences and alternative patterns and what this light is showing, is this idea, this one way, the way that we appear to evaluate different trajectories or the probability of of pursuing these trajectories is in terms of this expected free energy function, which can be decomposed in a similar way to what we expect the free energy function."
"Unknown","01;45;13;05","01;45;48;17","So in blue, the free energy functional being decomposed into our complexity in accuracy terms and various of the decomposition. But in the in the upper panel, we're now looking the decomposition of the expected free energy into into analogous type terms. And we've spoken about some of those already. So if intrinsic value is equivalent to the information gain we were speaking about before, and whereas the extrinsic value is more like an expected utility, the degree to which we prefer a particular outcome."
"Unknown","01;45;49;11","01;46;19;04","And just as on the previous slide, each of the faces relates to different ways that they can be interpreted under specific circumstances, but that there were particular parts of that expression or or don't matter. So in the absence of ambiguity, we end up with behaviors which are entirely risk driven. And so we might get back things like scale control type relations."
"Unknown","01;46;19;04","01;46;51;22","And he notes, or we'll go to a okay, here we are in eight. I thought for a second that we'd seen this before, but it's a subtle reworking of one of the previous figures, isn't it, with them? Here's five with the expected free energy. Yeah, correct. F in five and then just in a path. And now we have an eight G in the top."
"Unknown","01;46;53;02","01;47;24;12","And suppose this is the move that we were talking about before in terms of when the active states are effectively hidden from the internal states and become something that are themselves in third and so you can see added to the absence of any arrow connecting a to the variation free energy box, which is implicitly saying that the action itself is something that we have to draw inferences about and the expected energy is the way in which we can do that."
"Unknown","01;47;24;12","01;48;03;11","It's inference on action about action about the causes of action. Just many ways that have been highlighted for how inference and action are weaving together and different model architectures that might be more didactic IC, more illustrative, more pragmatic for a given context or a given type of thing that has a certain sparsity to its coupling. And to close on FIG. nine and then we can have last thoughts what is shown in Figure nine?"
"Unknown","01;48;03;11","01;48;33;12","Well, so Figure nine is a nice example of the application of this information seeking aspect of the expected free energy and to a task in which there is uncertainty about the orientation of the face that's presented to the active scheme and the alternative trajectories, the alternative parts of autonomous states that can be selected here are the alternative movements or the cuts that can be performed."
"Unknown","01;48;34;18","01;49;15;18","And so choosing the evaluation probability of each the counts depends upon the valuation, the potential information gain associated with those, which is a fact with the information gained, I guess in terms of the eventual orientation of the face. And I think in practice this, if I remember rightly, that this formulation focused very much on the ambiguity term and and I think it's subsequently been updated in various ways, but again, it kind of focused on the the continuous schemes and and provides a nice early example of how information games worked into the to inference type formulations."
"Unknown","01;49;15;18","01;50;00;25","We tend to use practically awesome in our final few minutes, we we look at the questions that we've looked at the end of every live stream and it would be awesome to hear where things go from here, from this recent preprint, from the textbook. What are some of the areas that any of you are interested in or that are now possible to head in?"
"Unknown","01;50;00;25","01;50;36;26","I'll go first then I don't have to go. Last decade, it's a difficult question to answer. There are so many ways you can take this. I think it's become beyond the capacity of any single group or person to really pursue all that all the directions. So nearly every field that we've mentioned is probably the focus of at least one, if not several groups around the world in small embryonic groups, but certainly working earnestly on the different levels of application."
"Unknown","01;50;38;04","01;51;09;12","Technically, what what Thomas and I know that's not quite true. And one thing that Thomas and I have been doing is trying to write the next simpler paper. So, you know, the the friendship principle made simpler, but really wasn't that simple. And they had. So the idea is now to work towards a full page paper that has everything you need to know to understand the free energy principle, the most recent ones down to about of eight pages."
"Unknown","01;51;10;16","01;51;57;20","And what it does is it just drills down on the package formulation and in particular the simplifications afforded by not worrying about non-equilibrium steady state densities and just looking at the densities over paths and just taking away all the unnecessary equations and drilling down what matters. And to me, what really matters is in the last sentence here and implicit in the last figure that you were discussing, which is curiosity, which I think is the key thing that distinguishes current Day II from AGI and to intelligence and understanding and resolving uncertainty about your sense, making understanding of a world and understanding the mathematical imperatives that describe that kind of behavior."
"Unknown","01;51;57;20","01;52;03;13","So this is a I'll end where I started, which is all about curiosity."
"Unknown","01;52;06;05","01;52;31;09","Excellent. Thank you, Thomas. I confess it is a really difficult series of questions to answer and that I think there is always more interesting directions to go in. There is time to pursue them, which is why, again, this concept is important that there are so many groups out there who are taking an interest in focusing in on these issues."
"Unknown","01;52;32;10","01;53;24;22","And certainly the idea of making it simpler, I think, is an important direction to go in and I think is also, to me, one one of the interesting things is, is also thinking about application and the setting of disease processes and trying to understand how and how different disease processes can be framed in terms of alternative priors. And just as a way of, I hope that's important, providing useful clinical characterizations of different kinds of pathology, different kinds of trajectories and different kinds of scientific states, and understanding how different therapeutic options might change the path through some some spaces of prior beliefs of various different temporal and spatial scales, as we spoken about."
"Unknown","01;53;25;15","01;53;54;08","And certainly I think that that's one of the areas I'm particularly interested, seeing things develop. Thank you. Blue. As I was saying the other day, I am really starting to think of active in France the way that like in every in every situation and in every circumstance that I find myself in, I find myself wondering how can I formulate this in an active in France model?"
"Unknown","01;53;54;08","01;54;17;14","And I did the same thing when I was in art school and learning how to draw in a very realistic way. I was learning to draw people and objects in the way that I saw them. And now I'm I'm looking at situations that I find myself in. And, you know, where before I would be in conversation with someone looking their earlobe, like wondering how could I best represent that on a piece of paper?"
"Unknown","01;54;18;16","01;54;47;14","Now I find myself in situations like wondering how would this fit into the active inference? So I think that there are many that the horizon is very broad and there are many avenues where we can tread the art and science of curiosity. So it's an excellent conclusion. Karl and Thomas, thank you for joining these discussions and everyone who is listening."
"Unknown","01;54;49;11","01;55;36;13","Thank you. And we hope to see you in Act in five. Or in any other fractal aspect of what we're all doing. So thanks again, everybody. Thanks, Blue. And see you in the next discussion by the."
