"Speaker Name","Start Time","End Time","Transcript""Unknown","00;30;33;26","00;31;10;04","Given the behavior and given that they're sensory states and usually using some kind of economics game. So I think the key thing here is that the principles that underwrite active inference are there to describe, not to prescribe, just in the same sense that Hamilton's principles, principle of action, will describe how a ball travels through the air or a massive body or the or the the bull in the in the bowl that you were just discussing."
"Unknown","00;31;10;13","00;31;36;18","And it does not prescribe optimal behavior until you specify the shape of the particular prize at hand, which will be or are by definition different for every particle, every creature and every person. So there is no optimality in the sense that there is a right way to behave. It's always conditioned on the prior beliefs of the person that you're talking to."
"Unknown","00;31;36;18","00;32;12;00","There's a further twist here which moves on from expected utility theory, and I'd also suggest bounded rationality, which is that the the objective function that underwrites choice, behavior and planning has two aspects to it. It's got the expected information gain and the expected cost or the negative expected utility. But the expected information gain depends upon what you currently believe, which means that the optimal way to behave depends upon what you believe in this moment."
"Unknown","00;32;12;10","00;32;40;25","So there is no, if you like, invariant optimal response because it's always conditioned upon what you know at the moment. So there may be times when you behave in a way that seems to ignore your prior preferences in order to resolve some uncertainty. And there'll be other times when that will be less. The uncertainty would be less, if you like, potent in determining what the best next thing or the most likely thing you're going to do next."
"Unknown","00;32;41;08","00;33;17;22","So I think active inference gracefully subsumes bounded and optimal behavior. But as special cases when you can ignore the way that we handle uncertainty, awesome. And it makes me think of even in the fully observable chessboard situation, there still might not be a single best move. And so situations with less observability and more openness in their affordances, it's even more that case."
"Unknown","00;33;18;05","00;33;49;02","So it's great how you mentioned, Karl, about the description rather than the proscription, and that is followed nicely by a question from chat. So I a Roland Rodriguez asked for Austin has said the free energy principle describes particular existence. Maxwell Ramstad says storms do not follow FFP while water does. I deduce then that for FIP the stone exists but the storm does not."
"Unknown","00;33;49;19","00;34;25;11","Is that accurate or otherwise? Can anything be said to exist that is not able to be described by the FIP? So if FIP is about describing rather than proscribing what can be described with the fip, that's a difficult question. I'm tempted to get Thomas to answer. I give him a starter while he's gathering his thoughts. So yeah, Friston has says FIP."
"Unknown","00;34;25;15","00;35;10;21","I think probably Rumsfeld talks about they talk about storms or stones. Interestingly, storms are somewhat difficult to describe because defining the mark of blanket of a storm is not quite so easy as defining mark of nugget of a stone. So I'm going to assume that we're talking about stones as opposed to storms. And so the answer would be the FIP applies to anything where a thing is defined, stipulated in terms of possessing a mark of blanket that enables you to distinguish the states that belong to the thing from any other states."
"Unknown","00;35;11;02","00;35;37;16","So if something exists, then the fip applies does. So that's, that's one thing that can be said very, very clearly. The next question is, well, are there different kinds of things? And the answer would be yes, absolutely. And it depends very much upon the causal diagrams. We're looking at the influence diagrams that we were looking at before in terms of the sparsity of what influences what."
"Unknown","00;35;38;03","00;36;19;12","So Stones may be construed as a as mark of blankets that don't have any overt active states. So they could be construed as inert. Things that were inert things could be described as mark of blankets or possessing a particular partition, which is another way of saying it possesses a mark of blanket. And you have you can distinguish it from a stone from the in which the stone is found, but that particular kind of particle or mark of blanket is inert in the sense it doesn't move around very much."
"Unknown","00;36;20;00","00;36;51;08","If it doesn't move around at all in an autonomous way. So that immediately distinguishes between two kinds of particles with or without active states. You can go on sort of defining different sparse structures and different kinds of things. And until we get back to the and then you mentioned strange loops before, and there is certainly an interesting, strange loop that emerges when when one's active states."
"Unknown","00;36;51;08","00;37;24;22","So one's actions are hidden from the internal states. And what does that mean? Well, it means that now my active states become causes of my sensations. But I don't know that. Therefore, now, because I am or I could read my internal dynamics as belief updating about my the causes of my sensations, I now can be read as forming beliefs about the causes of sensations that include my own actions."
"Unknown","00;37;25;02","00;37;55;07","And at this point, you have a mathematical image of planning that you move from things like thermostats and viruses through to people and, you know, anything that has a sufficiently deep or expressive generative model to cover its own action. So now you get into the world of the kinds of things that look as if they engage in and in planning."
"Unknown","00;37;55;07","00;38;17;27","And sometimes that's framed in terms of planning as inference. And that would be that would be an apt way to describe a lot of the you know, a lot of the biological self-organization we are interested in, but not all of it. You are you content the virus doesn't plan. You could even contend that a different scan evolution doesn't plan."
"Unknown","00;38;18;03","00;38;48;16","So not everything plans. But there will be certain kinds of things mark of blankets, particular partitions that look as if they do plan. Thomas Turn I don't know quite what his words to that. I suppose an alternative perspective on the question or more accurately, an alternative question is which systems that useful to try to describe with that energy principle."
"Unknown","00;38;49;12","00;39;19;12","And I think what Karl's described in terms of some of the special cases, the things that, you know, is it useful to describe a stone in terms of energy principle? Almost certainly not. And you sort of add any additional additional baggage and things, but it's not really doing any inference of an interesting sort. And perhaps best way of answering that question is to look at the sorts of things that the energy principle has been applied to and have found some sort of purchase."
"Unknown","00;39;19;12","00;39;53;21","Clearly looking at and looking at the cognitive neuroscience response and where it's a particular impact. And and I would imagine that part of the reason for that is that what's so interesting about brains and behavior is that what goes on inside a brain is, is and almost by definition is only interesting because it is something that relates to what's going on outside of that brain, to the whole business of doing neuroscience is about relating internal and external states in the way in which we relate to one another."
"Unknown","00;39;54;16","00;40;54;11","And so it's only once you once you start looking at systems like that that you really need to appeal to this kind of formalism. Right. So just a few notes on this. Are you mentioned different kinds of things and what taxonomies or classification schemes of things exist along? What dimensions do things exist and how does the FP bring cohesion or highlight tensions in the ways that kinds of things have been identified, like mental versus physical constructs, or just a few that were were mentioned different extent of seemingly cognitive states."
"Unknown","00;40;55;17","00;41;43;25","Then you mentioned the difference of the extent of the autonomous action. And then I think what the question and it was clarified a bit in the chat about the storm and the stone was about resistance to dissipation, resistance in its persistence. So where do dissipative persistent its regenerative propagate if cascading failing systems, its growing systems, what, what how do we think of those as different types of things or dynamically?"
"Unknown","00;41;44;19","00;42;08;23","It all boils down to the functional form of the dynamics. So from from the point of view that we had a principle, I should say, that, you know, this is a very colloquial view which is just emerging. You over the past few years and indeed of the past few weeks. So this is not accepted. We're still not receiving consensus about it."
"Unknown","00;42;08;23","00;42;38;05","But if you want to announce the form first principles, then you start where the free energy principle starts, which is in the dynamics. And the dynamics are defined by a stochastic differential equation, sometimes known as a random dynamical system in physics. This is just thing at the launch of an equation. And so any different kind of system and implicitly, if there is a thing in the system, then there has to be a particular partition."
"Unknown","00;42;38;23","00;43;08;26","That's something which is at the heart of the Fibonacci principle. It's a defining thing that's in terms of the ability to separate states of the thing from other states. So by definition we're talking about Markov blankets. And as soon as you write down a particular partition that implies or requires a blanket, then you have the opportunity now to look at the functional form of the influences of different states and other states."
"Unknown","00;43;08;26","00;44;04;11","And then you can now, if you like, knock out further causal all currencies to create a taxonomy of increasing stars, fitting of systems and ask questions. What sorts of behaviors would these more and more sparse systems demonstrate? And one nice example that we've just been discussing is if we cut the connection in the functional form of the coupling among the subset, so the partition between the active states and the internal states, so that now the active states, my action now becomes hidden from the internal states because it's been uncoupled, then it becomes a hidden cause of my sensations and I get a very different kind of interpretation of the internal balance in terms of belief"
"Unknown","00;44;04;11","00;44;49;13","updating. So that's one nice example of what would emerge just by thinking about things in terms of the dynamical architecture, namely the functional form of the dynamical coupling between different different, different subsets of things. You also introduced a very important another distinction. So that would be, if you like, one dimension along which you would be able to elaborate different kinds of things, different classes of things, different categories of things of increasing sparsity and probably in the increase in the sparsity increasing sophistication and you know, more closer to things like us basically, you know, the sparse you get."
"Unknown","00;44;50;09","00;45;25;16","But because you will get to, you know, to to and things that show autonomous behavior of of an intentional kind has this planning aspect but there's another crucial distinction which you refer to, which is the distinction between particular states that are dissipative versus conservative. Now, in this instance, for all things that exist for a given period of time, then the mark of blanket has to be there because that definitionally specifies the existence of the things."
"Unknown","00;45;25;22","00;46;21;11","That's an existential imperative. But within that non dissipating mark of blanket, you can have particular states, namely autonomous, internal and active plus sensory states that belong to big things. And that's important because with big things, all the random fluctuations that do the thermodynamic dissipation are averaged away and they start to behave like classical objects. So you have this distinction between small things whose internal states and sensory states and active states could show lots of random fluctuations, possibly even down to the quantum level versus big things like you and me that actually obey almost locomotion mechanics, classical mechanics, Newton's laws of motion, for example, or electrodynamics, terms of the behavior of neuronal populations and the like."
"Unknown","00;46;22;00","00;47;05;24","So these classical dynamics are subject to exactly the same rules and principles that underwrite the periphery energy principle. But in this special case, all of the internal, active and sensory paths dynamics are path of least action because you've averaged away, because you of course grained to an extent that there are no more random fluctuations. And that creates a very different kind of behavior that, you know, again, moves us into the realm of creatures that plan basically simply because they have this precise kind of dynamics."
"Unknown","00;47;06;01","00;47;27;21","So in summary, from the point of view of just the math, I think the taxonomy you're looking for, which I don't think is actually out there yet, but could be in the fullness of time, just said the reason I don't think it's quite out there is if you look at physics up until now, no one's really got beyond just saying there exists a heat bath or a skirting, a potential or a heat reservoir."
"Unknown","00;47;28;14","00;47;53;23","So they haven't really thought about apart, you know, a partition into a heat bath. The thing that's by the heat bath and the thing that contains the heap of which is the external states. So there isn't really a mechanics that really talks about things in this explicit way, which is one reason I suspect there isn't actually at this stage a physics of different kinds of things."
"Unknown","00;47;53;23","00;48;28;14","But if that if there is, my guess is it would be articulated in terms of the sparse coupling among partitions of a particular subsets of a particular partition and whether or not certain subsets or that dynamics are subject to non-trivial random fluctuations and uncertainty. Awesome. Well, apparently we all expect and prefer such a taxonomy, so people can probably guess how that will influence our future policy selection."
"Unknown","00;48;29;11","00;48;55;03","It also takes us to a question that Brock had raised in the week between the one of the two so broadcast. I'm interested in how Markov blankets interact and affect one another, specifically when their scales differ by many orders of magnitude. For example, baseball versus the air molecules, DNA in a cell nucleus versus the environment. Alpha particles DNA."
"Unknown","00;48;55;25","00;49;22;17","It sometimes seems the larger scale overwhelms the smaller scale and vice versa, conditioned on some particular timescale. I'm wondering if we're considering the Markov blanket as it's Markov chain into the past and future, if that relative scale is taken into account. Some things shorter or longer, Markov chains that could possibly explain the seeming flip flopping of direction of effects in their relative mass scales."
"Unknown","00;49;23;07","00;50;16;02","Or is there some generalized synthesis of action slash free energy that considers both of these and others to explain the direction of effects? So how do dynamically, potentially dynamically changing boundaries and multi-scale systems come together to help us understand cascading top down or bottom up effects, what Belushi does about from the point of view of evolution. Okay, here would be one thought and a precursor non FP perspective on this is Energetics, the version of Hermann Hakan 1983 Classic Citation Multi-Scale systems like the Ripple in the Wave."
"Unknown","00;50;16;14","00;50;44;20","Where is it that changing the ripple influences the wave and vice versa as well as Synergetic, which is a more geometric perspective that Bucky Fuller provides. So people have been thinking about what kinds of top down and bottom up effects are causing cascading changes in multiscale systems. And then to bring it to evolution like you suggested, the structure of the system."
"Unknown","00;50;44;20","00;51;22;29","So the system, as received by the current moment, sets up certain affordances for very similar stimuli to propagate through a system in a nonlinear way. So for example, like a pheromones of a given shape might bind to a receptor with high affinity that opens local channels that, makes that neuron fire, and that amplifies. And so that causes a change at the organismal behavior level because of the shape of that perturbation, but then just adding one methyl group or modifying the chemical very slightly."
"Unknown","00;51;23;13","00;52;22;29","So a very similar stimuli or a photon of a wavelength outside of the receptive range of a given visual receptor doesn't induce that kind of a cascading change. So perhaps it could just be said that the structure of the system and maybe even the sparsity of the connection among subunits predisposes it in a given moment to have what appears to be almost exquisite sensitivity for certain kinds of changes, while very similar changes next door may have very little effect and that potentially at a higher level, evolution and through the intra, intra and intergenerational timescales gets to a multi level position where the kinds of stimuli that one wouldn't want to have propagate through the system"
"Unknown","00;52;23;04","00;53;06;26","don't, and the kinds of stimuli that one would want to have propagate through the system do, because that multiscale system is the most responsive and adaptive over multiple timescales. Otherwise there might be something highly sensitive at one scale, but it's at a blind alley at another time scale or vice versa? Yes. Two blue. I instantly thought of evolution as soon as I heard that question and really thinking about where a situation where the particle of larger mass is overwhelmed by a particle of smaller mass."
"Unknown","00;53;06;26","00;53;53;20","I thought about the the sperm cell. So upon fertilization, I think that the particle smaller mass completely overwhelmed the particle of of larger mass, although the blanket of the the sperm cell, I think is then subsumed into the the the mother of the of a baby. But that I was reminded of the paper by Matt Sims that we discussed about counting biological minds and the interaction between Vibrio Fischeri and the squid when the the, I mean, the spin go in and out or the the Rio for Fisher I go in and out of the squid and a very like pretty it seems like very magical daily cycle and composed the light organ or caused the"
"Unknown","00;53;53;20","00;54;19;00","squid to like light up and enable its hunting behavior or facilitate its hunting behavior because then it doesn't cast a shadow over the organisms that it's hunting. And in this situation, it's interesting. It's these nonlinear effects. It's not one little bacteria that can make us fed light up, but it's got to be like a sufficient concentration of bacteria that that caused the lighting up of of the squid."
"Unknown","00;54;20;02","00;54;50;18","And it's like a compounded effect. So here, like the the small mark of blankets of each individual bacterial particle, a really maybe overwhelm the larger system and I don't know I feel that way also about humans the microbiome and the work that we've learned over the last 20 years, ten years maybe about the microbiome and its importance in human behavior."
"Unknown","00;54;51;04","00;55;20;11","The gut brain axis, just overall human function, functionality and toxicity and so forth. So, so I think that that all these small blankets really have have a very important effect and non-linear. But it does seem to take up a quite a mass of them to make an impact."
"Unknown","00;55;23;22","00;55;50;26","Can I just come in on the on that just to pick up on this synchronization of large ensembles of similar kinds of Markoff blankets? I think that's a very important notion. It does strike me that sort of three fundamental issues buried in this question, this sort of ensembles of Markoff blankets, and then there's the link between different scales."
"Unknown","00;55;50;26","00;56;32;16","So Markoff blankets of Markoff blankets. And then how does this manifest in terms of intuitive concepts like mass? So I just to rehearse what you're what's just been said from distinguishing between ensembles of Markoff blankets at the same scale, then you now have a mathematical image of multicellular organization through to eco niche construction, through to cult culture, aspects of evolutionary psychology in terms of lots of people interacting together."
"Unknown","00;56;32;25","00;57;14;20","And this has many, many fascinating aspect. It's the one, if you like, heuristic that I always keep referring to when trying to understand what a free energy like principle would would bring you. Is that because the very shrill free energies and extensive property, it means that the free energy of the ensemble, of a collection of multiple Markoff blankets, all talking to each other or coupled to each other via that blanket states, and is cast as the sum of each individual free of energy."
"Unknown","00;57;14;21","00;57;50;25","And if you just simplify the notion of free energy as predictability, what you're saying is that the the likely state of an ensemble is that in which they've jointly minimized their free energy by making everything mutually predictable. And this normally is manifested as generalized synchronization, which is exactly the sort of, you know, this the behavior of bugs that light up together or birds that flock together."
"Unknown","00;57;51;21","00;58;21;07","So you you see this and you could actually argue that sort of things like language are just one expression of a way to ensure that we're all mutually predictable. And in showing that we are jointly mutually predictable means that jointly we can minimize our free energy. So there are lots of really interesting sort of directions that you can take that notion of what would happen if you put lots of mark of blankets together."
"Unknown","00;58;21;20","00;58;47;19","The other the second thing, which I think speaks more to the evolutionary thing, is the the link between blankets of blankets at different scales. And, you know, we've just heard in the previous answers that this normally entails not only a course, graining moving, if you like, up in terms of the spatial scale, but absolutely crucially at temporal scale."
"Unknown","00;58;47;28","00;59;20;09","And I think that that's absolutely crucial. The fact that the and the mark of blanket at a lower scale is likely to less last for a shorter amount of time than the mark of blanket at the biggest scale. So it's perfectly permissible to apply the free energy principle to mark of blankets that exist for a short period of time, from the point of view of a larger scale, and allow for a metamorphosis, a phase transition and merging a mark of blankets with the sperm and the egg cell."
"Unknown","00;59;21;27","00;59;45;08","But from the point of view of the scale above, this is perfectly permissible. So the free energy principle only applies at the time scale that is associated with the level in question. But now the game is to understand how the mark of blanket or mark of blankets up the scale above couples to the scope below and vice versa."
"Unknown","00;59;45;09","01;00;26;19","And this brings us to all sorts of delicate issues about how you would read evolution and epigenetics as prescribing short that mark of blankets in phenotypic time. For example. It also again speaks to that this fundamental role of the separation of timescales that Daniel was talking about in relation to synergistic know, fast and slow modes. So I think that that kind of thinking about things from a different point of view of a separation of temporal or spatial temporal scales begs some deep questions about top down and bottom up causation."
"Unknown","01;00;26;19","01;01;05;24","That is, if you like, can be articulated in terms of the endurance and mark of blankets at any particular scale. Finally, the mass thing is interesting and it relates very much to the scale. And so mass at a quantum level is usually read as the inverse amplitude of random fluctuations. So if you're looking for the sort of, you know, the intuitive notion of mass as dictating the behavior of a very small particle, the quantum scale, then the, you know, the quantity that underwrites that is the amplitude of the of random fluctuations."
"Unknown","01;01;06;05","01;01;33;13","As things get hotter with more and more random fluctuations, they tend to have they look as if they have smaller mass. But as you get bigger and bigger and bigger and you move into the world of Lagrangian mechanics and classical mechanics and the random fluctuations disappear, then you're in the world now where mass takes on a very different meaning, and it effectively can be regarded as a an active state in the sense that my mass attracts you."
