"Speaker Name","Start Time","End Time","Transcript""Friedman","01;35;21;17","01;35;49;29","Sevenths from statistical to classical particles. So far we have a busy mechanics that would be apt to describe a particle or person with pullback attractor. But what is the difference between a particle and a person this speaks to distant classes of things to which FFP could apply molecular versus biological versus here we associate biotic self-organization with precise and predictable dynamics of large particles."
"Friedman","01;35;50;17","01;36;18;18","So as we described earlier, if we were talking about classical mechanics, something bigger would be more resistant to like thermal fluctuation. We could think about like that analogy to mass in the statistical setting, where are the priors? Like massive. And they're just on their own inertia and they're not being buffeted by stochastic city versus where is it a lightweight, something that is getting buffeted."
"Friedman","01;36;20;00","01;36;53;28","So here's going to be a distinction between statistical and classical mechanics in the setting of the particular partition it is often said that the AP explains why biological systems resist the second law tendency towards disorder and the natural tendency to dissipation in disorder. However, this is disingenuous on two counts. So is first in 2013 disingenuous or is that paper combating the disingenuous first?"
"Friedman","01;36;53;28","01;37;34;29","The second law applies only to close systems, while the free energy principle describes open systems in which internal states are exposed to an exchange with external states through blanket states of lots unpack there. What exactly is the exchange? Is it like an informational exchange or are like nutrients crossing and becoming incorporated into the internal states in seconds? There is nothing so far to suggest that the entropy of particular states or of paths is small so this is like the design language for particular states that might be totally buffeted by stochastic city or totally on the list."
"Friedman","01;37;34;29","01;38;06;11","Action Railroad and everything in between. But nothing has been said to identify one or the other. And so everything high and low entropy densities. So there's, you know, two particles in two different rooms. One particle is equally traveling to all parts of the room. The other particle is staying in one part of the room. So one of them has a very ordered distribution of space, and the other one has a very like disordered, you know, equilibrium equilibrium gas flowing throughout the room."
"Friedman","01;38;07;15","01;38;43;17","Both of them are particles. So what distinguishes between high and low entropy systems, e.g. between candle flames and concierges respectively, 28, we could have had a concierge and that is going to describe that and we'll come back to it. This suggests that precise particles such as you and me respond to environmental flows and fluctuations in a precise and predictable fashion."
"Friedman","01;38;44;10","01;39;17;16","Well, I'm an unpredictable guy. Yes. In our regime, of attention, it is almost like tuned to some maximally confusing or uninformative things. Or we could have some cognitive experience of being confused but someone's blood sugar through time has more predictability than zero. So it's on that continuum from totally buffeted to totally on the railroad tracks. And it's more like the railroad tracks if you want to survive or design high reliability systems."
"Friedman","01;39;18;20","01;40;07;10","And then they're going to introduce figures four or five and six. Four is about the difference between generic and precise particles. Using an information diagram for precise particles, there's no uncertainty about autonomous states given sensory states, knowledge about action, knowledge about internal states like metacognition, is the behavior of precise particles sufficient for sensing behavior? Perhaps? Figure five The implicit computational architecture used in simulations of sentient behavior and six is reproducing an example from the act and literature with action and action observation so figure four has to do with information gain and sharing with generic and precise particles."
"Friedman","01;40;08;26","01;40;50;23","Do you want to add anything? Otherwise, we'll just take one look at each of four or five and six. OK. Figure five Bayesian Mechanics Graphic Summarizes Belief Updating Implicit ingredient flows on variation of free energy and six Sentient Behavior and action observation. So this is like somebody involved in pointing or tracing or handwriting and also looking at visually in summary, precise particles immersed in an imprecise world respond almost deterministically to external fluctuations why might this behavior be characteristically biological?"
"Friedman","01;40;51;12","01;41;30;15","Precise particles may be the kind of particles that show lifelike or biotic behavior. So let's think of those two particles in the two rooms, one of them 24 hours a day, no matter what the temperature is or what the light dark cycle is, it's always equally covering all parts of the room. The other particle, you find out that when it's light, it stays in this part of the room, and then when it's dark, it stays in this other part of the room, which one of those particles, without knowing anything more, seems more biological, the one that's diffusing like a gas molecule or the one that has this orderly distribution, especially one that's conditioned upon like salience"
"Friedman","01;41;30;15","01;42;25;21","external factors. So the distinction between those imprecise and precise particles getting buffeted by thermal vibrations or being like the classical or like the Kepler universe, like the planets going around orbits totally on buffeted by thermal vibrations rests on the relative contribution of dissipated and conservative flow to their path through state space. One might associate precise particles with living systems with characteristic biorhythms, and then they bring up many, many nested biorhythms from rapid oscillations that are multiple times per seconds in neural systems, heartbeat, respiratory, circadian, seasonal life cycles, even pulling out to the evolutionary angle."
"Friedman","01;42;26;21","01;43;01;04","Turning this on its head, one can argue living systems are a certain kind of particle in virtue of being precise events, conservative dynamics biorhythms and time irreversibility. So, wow, how are these all related to each other? Where does the time irreversibility connect and there summary the emerging picture is that biotic systems feature so an oil flow in virtue of being sufficiently large to average away random fluctuations when core screening their dynamics and figure six explores that more."
"Friedman","01;43;02;06","01;43;33;27","OK, final technical section eight Path Integrals, Planning and Curious Particles. The previous section was focused on linking dynamics changes through time to densities over generalized dates. Internal states can be construed as parameter ising Bayesian beliefs about external states. Internal states are about external states. In this model, in what follows, we move from densities over states to densities over paths to characterize the behavior of particles in terms of their trajectories."
"Friedman","01;43;34;15","01;44;42;24","So formalism 29 we're interested in characterizing autonomous responses to initial particular states, autonomous action and internal states, the ones that we control. Recall that when random fluctuations on the motion of particular states vanish, there's no uncertainty about autonomous paths given external and sensory paths, knowing exactly what to do and exactly what to think. And there's no uncertainty about sensory paths given external and autonomous paths, knowing exactly what sensors will be observed, given the external world and the autonomous paths, which is what one does and thinks if we interpret entropy, is as the limiting density of discrete points figure for then the uncertainty about particular autonomous and sensory paths given external paths become interchangeable formalism, 30"
"Friedman","01;44;43;09","01;45;18;24","formalism, 31 expected free energy the autonomous path with the least expected free energy is the most likely path taken by the autonomous states. Expected free energy. How can we read it? What does it mean? Why does it matter that we're focusing on autonomous states? Autonomous paths, and how is it similar or different from other representations that we've seen and that we will see that did free energy and free energy of the expected future and so on?"
"Friedman","01;45;21;23","01;46;24;04","Expected free energy threats where it can be regarded as a fairly universal objective function for selecting paths of least action planning, planning as Bayesian inference equation. 33 expected free energy expected action, Bayesian optimal decisions utility pragmatic value expectations of information gain optimal info gain Bayes optimal experimental design, optimal hypothesizing. So not just falsification, not to beat a dead horse, but rather than constraining and then executing, keeping this infinite game optimal design perspective open so that we can always be tier of the balance between optimal decision making and optimal experimenting when simulating with active inference and planning afforded by path integral formulation."
"Friedman","01;46;24;04","01;46;49;16","One usually works with discrete state spaces and belief, updating over discrete epochs of time. That's where the partially observable Markov decision process MDP comes into play and plausible policies can then be scored evaluated based upon their expected free energy, and the next action is selected from the most likely policy policies or sequences of actions that can be taken."
"Friedman","01;46;51;07","01;47;17;17","In summary, we now have at hand a way of identifying the most likely autonomous trajectory from any initial particular state that can be used to simulate certainty and behavior of precise particles that we have associated with biotic systems. Expected free energy absorbs two aspects of Bayes optimality into the same objective functional, which is a function with functions. The information gain is optimal."
"Friedman","01;47;17;17","01;47;52;18","Bayesian design Bayesian decision theory is minimizing the cost function under a decision or choice and uncertainty as with the interpretation of variation of free energy, this dual aspect functionality of expected free energy is an interpretation of a single existential imperative to possess a mark, blanket, and implicit thinness teleological. It's worth reflecting upon the differences between the generative models that underwrite variational and expected free energy for V."
"Friedman","01;47;53;12","01;48;35;14","The generative model is a joint density over external and particular states supplied by or supplying the non equilibrium steady state density for the path integral formulation. The generative model is a joint distribution over paths because consequences. The generative model acquires a temporal depth they then have several figures that continue on this theme. Figure seven is related to a de Costa 2020 discrete states, both synthesis paper showing special cases of variational and expected free energy."
"Friedman","01;48;35;29","01;49;02;19","Like when there's no preference there's optimal information gain. When there's no ambiguity, you get pure risk sensitive policy. When there's no intrinsic value, you get expected utility theory. And when there's no ambiguity or preferences in some recent work by Ramstad at all have started to soft reboot the FFP and connectivity principle, which we're going to be looking forward to learning more about."
"Friedman","01;49;03;15","01;49;36;06","Figure eight is a about Bayesian mechanics and active inference, so we can contrast that with Fig. five Bayesian mechanics and active inference. Fig. eight Bayesian Mechanics and Active Inference. FIG. nine is a simulation in which ice skates are occurring, and we can explore this more to the conclusion there are many points of contact between what we described and other theories."
"Friedman","01;49;37;05","01;50;19;12","Please read the papers, discuss special cases. They discuss the mechanics of synchronization, separation of timescale and applications and then in closing, they write about how the developments are speaking to the shift in focus from the foundational issues addressed in this article to their applications, learning and applying active inference and RFP. It is quite possible that the foundational aspects of the free energy principle may also shift as simpler interpretations and perspectives revealed himself that brings us to the end of the day."
"Friedman","01;50;19;14","01;50;24;19","Zero. So, Brock, what would you like to add or say."
"McKean","01;50;33;18","01;51;12;12","I would like to add that for the next zero I will be preparing my answer to this part. First ahead of time. Well, I don't know, just writing down a few things and thinking about intractability and uncertainty and possible kind of informational information, entropy kind of questions that you can ask around that. Like what what makes those kind of ultimate Markov blankets of intractability?"
"McKean","01;51;13;18","01;51;35;06","Like how action intensive is it for information to cross like or for external for the external states to influence the indirectly influence internal states. Right. And another question."
"Friedman","01;51;36;23","01;51;43;26","How hard you have to push on the blanket. What kind of push and what. So, yes, they're conditionally independent, but also they do influence each other."
"McKean","01;51;44;28","01;51;45;04","In."
"Friedman","01;51;45;22","01;51;47;21","The blanket. So how hard do you have to push?"
"McKean","01;51;48;08","01;52;46;10","Yeah, and it just it seems like I guess what I'm saying is that the scale which we kind of you're using the particle people and the baseball analogy, right. Then we talked about that yesterday or the day about like just a large, you know, matrix, large space of states, of variables of, you know, dimensions of, of what you mean by a mark called blanket in a particular, you know, and the scale of that markup when you get to the environment right having like a big seeming to have a like a big impact on how hard you have to push there."
"McKean","01;52;47;03","01;52;57;00","Right the baseballs flying through the air, but the particles spreading out and, you know, being pushed around them. Yeah."
"Friedman","01;52;57;02","01;53;30;18","And I was like, are we little molecules trying to push the baseball or are we the designated hitter who's way over power and able to put it wherever we want? Or are we just doing the tiniest buffeting? Maybe this is a design language that helps us frame both of those settings. And recognize when are we able to be guiding the path of least action and where might, no matter how hard we yell, maybe we're not influencing it like literally at all."
"McKean","01;53;32;00","01;54;13;22","Or sticks, we're influencing like staccato, like stochastic, like it's not we can't kind of concentrate our action into one, you know, path, right? One like so yeah. There's, I don't know, there's a lot of wonderings and questions that are like, not probably very well informed to just read the papers on and continue reduce the uncertainty or yeah."
"Friedman","01;54;15;12","01;54;27;28","Awesome work with this zero. And thanks a ton for being a part of it. Thanks everybody for watching and all the great comments in the chat and we'll see you in the Dot One in the Dot Two. Bye!"
"McKean","01;54;27;28","01;54;30;07","Awesome. Thank you, Daniel.."
