"Speaker Name","Start Time","End Time","Transcript"
"Speaker 1","00;00;12;01","00;00;41;01","All right. Greetings, everyone. Welcome to Active Lab Live stream number 23.2. Today's June 15th 2021. And we're going to be having our two discussion on embodied skillful performance where the action is. And we'll see who else joins us live as we go through the slides in the paper. And also, of course, if you're watching live, we'd welcome any questions or comments."
"Speaker 1","00;00;42;15","00;01;05;05","Welcome to the Active Inference Lab, everyone. We are a participatory online lab that is communicating, learning and practicing applied active inference. You can find us at the links that are on this slide. This is recorded. Greetings, Dave. This is a recorded and an archived live stream, so please provide us with feedback so that we can improve our work."
"Speaker 1","00;01;05;28","00;01;43;04","All backgrounds and perspectives are welcome here and we'll be following good video etiquette for live streams. We're again on June 15th, having our second group discussion on embodied skillful performance where the action is. So this is sort of our jumping off point and let's see if we can make it a skillful one today. The goals are really just to be discussing and learning, to be hearing the questions and points that people found really interesting when they were reading the paper, as well as see where our discussion can spontaneously go."
"Speaker 1","00;01;43;04","00;02;19;04","As of course, participants join and leave and hopefully we get some fun questions from the chat and we're just going to walk through the paper and the slides go where we need to go to hopefully connect some dots. So with that being said, let's just go to the introductions and warm ups and we can each just give an introductory thought on the paper if we would like or something we liked or remembered something we're looking to resolve, reduce our uncertainty on by the end of the discussion."
"Speaker 1","00;02;19;22","00;02;25;24","So I'm Daniel and a postdoctoral researcher in Calif, and I'll pass to Dean."
"Speaker 2","00;02;27;14","00;02;40;11","Hi, I'm Dean. I'm in Calgary and I'm coming at a more embedded personality in this active inference lab world and I'll pass it over to Stephen."
"Speaker 3","00;02;41;28","00;03;07;27","Hello, I'm Steven I'm based in Toronto. I'm doing a practice based PhD through the UK. I'm interested in participatory theater, community development and ways to understand how people interact with each other in groups and individually. So this paper is quite relevant as it opens up some new avenues in that and I will pass it over to is it is Dave here?"
"Speaker 3","00;03;07;27","00;03;09;03","Dave Hello? Dave."
"Speaker 1","00;03;10;03","00;03;36;27","Yeah, Dave, if you can speak otherwise, no worries. Maybe you're just listening in. So maybe just a quick question. Stephen, where do we see the connection between skillful performance, which is often thought of like motor and bodily? How do we connect that to social practices which are among bodies and use verbal behavior or symbolic behavior?"
"Speaker 3","00;03;38;01","00;04;14;17","Yeah, I mean, this is this is kind of a question I think that's arising more and more as people are trying to question psychology or community psychology, which works on the individual or sociology which works on this sort of mass of people. But when you want to work with into subjectivity and sort of small groups and understanding the dynamics that are going on there, you kind of ask phenomenological questions about what it's like to be in that state, which is kind of a bit more direct than, say, some of psychological perspective on it, but it's still not quite working."
"Speaker 3","00;04;14;18","00;04;37;21","So then you say, well, let's go into action here. Let's get into what's actually happening in and among people and often if you then jump into action, that's another abstract area. But if you're in the area of practice, you're kind of in in between. You know, it's something that people are doing, something that people are doing between each other."
"Speaker 3","00;04;37;29","00;05;03;12","And but you're still able to talk about how it's happening, how it feels. So I think that, that this, this question of practice then, you know, takes you into the sort of areas that get used a lot in arts, arts, practice, theater practice, all these types of areas. So I think it's kind of a nice nexus that's normally a bit impenetrable."
"Speaker 1","00;05;04;17","00;05;44;10","Or it makes me wonder, do groups have skill or is skill something that only bodies have? So you see some football team or basketball team do some very coordinated play or two dancers that are improvising is that able to be reduced entirely to the skills embodied performance of individual bodies, or is there a way in which we could talk about a group embodying skillful performance, especially because so many performances I mean, except for what stand up comedy, a few other things there a group, and then even those individual performances are in feedback."
"Speaker 1","00;05;44;10","00;05;49;13","Sometimes with a group, it's just different roles oh."
"Speaker 3","00;05;50;13","00;06;18;17","That's a good point actually. I mean, I think that's really the exciting field of practice that's going to be growing over the next while. And I sense that it's almost impossible to get that from a snapshot. You have to have something that's progressing over time to get old. Let's just say I don't know whether that's true, but I sense that there's more use in understanding how things change over time and getting the dynamics than there is trying to analyze a snapshot."
"Speaker 1","00;06;22;20","00;06;32;04","Dave, if you have any comments, you can unmute and I'll see it or din any sort of just opening thoughts. How does this start to meet you today?"
"Speaker 2","00;06;35;03","00;07;11;05","But I'm going to come at it from a little different angle. I so I think that we're between is a huge it's the thing that that befuddles us and yet it's the thing that we probably want to know the most about and in this idea of embodying skillful, skillful performance, I was going to actually ask the author some questions around how she relates it back to sort of the the parts of the brain that resolve these problems."
"Speaker 2","00;07;11;05","00;07;36;29","So is it a spatial relationship thing, like what the hippocampus tends to provide us some insight on, or is it a caudate nucleus thing which says that we sequence everything out, we turn left, we turn right, we release the ball. And I was just curious about which because those two things work, but when one is on the other one is off, there's kind of a binary relationship between those two parts of the brain."
"Speaker 2","00;07;36;29","00;07;51;10","And so I wanted to kind of figure out how that that toggling back and forth is part of this skill that we are witnessing Nice point."
"Speaker 1","00;07;51;16","00;08;16;12","There's the more cognitively driven versus almost the more bodily driven and then that handoff is where we see skillful performance and that's where we see choking. It's where we see all these dynamics between cognitive processes and action processes. OK, we see another Dave. Dave, if you can, if you want to give any thoughts, just feel free."
"Speaker 2","00;08;17;13","00;08;19;08","Yeah, I'll just listen again. Thanks."
"Speaker 1","00;08;19;16","00;08;26;19","Nice. Right on. That's the real that's the real OG way to listen in in the gypsy rather than in the live stream."
"Speaker 1","00;08;29;00","00;08;59;10","Yeah. So we'll see who else joins in today. But that's a great question about the brain pieces. And then I always think about other species, like if insects can have embodied action and that seems pretty fair to say, can they have skillful action and how would we know? And then if they do, the layout of their brain and body is so different that it would map on, you know, they don't have a hippocampus, they don't have a prefrontal cortex, they have other brain regions."
"Speaker 1","00;08;59;28","00;09;26;17","So we don't need to get too locked into one implementation of these processes based upon human neuroanatomy when we know that there's other neuro anatomies that can deploy similar processes. So it helps us keep an open mind to the multiple realizations of active inference or of embodied skillful performance because of just the diversity of evolutionary systems."
"Speaker 1","00;09;28;23","00;10;01;07","Let's take it overview at the roadmap. This paper has a form that we've seen several times before, which is in the first half taking some non active inference body of research so in this case it's skillful performance and optimal motor control theory and investigating with a critical lens. This previous body of research to understand what does it really say or what are the assumptions."
"Speaker 1","00;10;01;07","00;10;47;19","So in this case, there's this instruction, this assumption implicitly or explicitly that's drawn out through the exploration of previous approaches to skillful performance and specifically the motor representations and motor commands that are implicit in optimal motor control theory. So that's part one. Part two goes from optimal control to predictive coding and active inference. And last time we talked a little bit about similarities and differences as you go from optimal motor control to predictive processing to active inference, what is generalized as you move from A to B to see what is different, what kinds of issues might you sidestep or introduce?"
"Speaker 1","00;10;48;12","00;11;17;12","And then in the last sections of the paper, motor control is positively reframed as this interactive sensory motor engagement with a world which puts us very squarely in the domain of active inference rather than in the instruction s domain of optimal motor control theory. Greetings, Blue. So that's kind of a general pattern that we've seen before where the first third of the paper is a background on previous approaches in a critical lens."
"Speaker 1","00;11;17;23","00;11;34;03","The second approach shows some sort of a transition from theory A to B to C, and then by the third part, there's a positive positivist argument as to why active inference is more in line with how things are or might be more useful. Stephen, go ahead."
"Speaker 3","00;11;35;23","00;12;12;03","Yeah. Further to our conversation earlier, I think this actually this this showing the instruction and then the interactive approach is really useful to sort of have a plausible way for affect and social dynamics to interplay with action because when it's under an instruction, this model is kind of hard to imagine how that kind of mechanical, almost message parsing type of approach can integrate into our sort of social dynamics."
"Speaker 3","00;12;12;03","00;12;39;07","Whereas the interaction and this approach does give that. So I think that's quite good. It can frighten people off because it brings in this other philosophical piece, which I think a lot of people do like running away from it first. But actually it does offer a more human humanizing or biological way to engage cool."
"Speaker 1","00;12;39;16","00;13;03;05","Let's just go there, blue, of course, raise your hand anytime you want to something. But this instruction ism versus interaction ism I think is a big piece that we'll walk away from this 23 with. It's something that we can take on in the case of embodied skillful performance, but I think we're going to be able to apply it to education."
"Speaker 1","00;13;03;05","00;13;30;22","We're going to be able to apply it to team collaboration. And so we can definitely return to this distinction between instruction ism and interaction ism. So Steven, just from, you know, your experience with drama or other kinds of work do you think people are how do people implicitly use constructionism versus interaction ism or what kinds of scenarios support or constrain constructionism versus allow for interactions to emerge?"
"Speaker 3","00;13;32;08","00;13;56;20","Well, I I think what tends to happen is in the models that people tend to use, they're kind of either in one camp or another. It's like so mostly it's almost implicit that there's some sort of interactive stroke flow is probably goes even further. It's sort of some sort of flow in the sort of performance arts world. They talk about flow and ease and that type of thing."
"Speaker 3","00;13;57;12","00;14;23;12","And what's also interesting is I know they talk about this in the Michael Chekhov acting approach is this always this battle between ease and form. So a dancer gets more form, they get more technique, they get more proficient their technique, but they might lose that ease that you have as a beginner. So forever trying to add more technique without becoming this kind of rigid or some automaton, you know?"
"Speaker 3","00;14;23;21","00;14;53;22","So I think there's there's that kind of side to it. And that that whole area, they just go off and it's it's kind of it just takes care of itself, but it becomes a little bit of a silo in a way. And then you've got people working in more straight activity theory, bykofsky kind of much more like what activity happened when and that they they, they are also in a bit of a silo."
"Speaker 3","00;14;53;22","00;15;22;00","So I think that you tend to find that and different, different areas, they, they are a little bit siloed in their approaches to sort of get around some of these challenges. So I think that the way of trying to break beyond what you can analyze, which often you have to look at instructionally because you kind of have to break down things into steps."
"Speaker 3","00;15;22;24","00;15;37;10","But that doesn't mean you need to keep it in a stepwise form in terms of how we understand what people really do. So there's this kind of I think there's this kind of gap that this will help to make plausible."
"Speaker 1","00;15;40;26","00;16;03;02","Interesting there how we capture the utility and the apparent advantages of constructionism some of them are written here, like the ability to separate different instructions. That seems pretty important if you say, well, how am I going to cook this multi-stage dish and someone just says, you know, here's all the ingredients and here's all the behaviors, but I'm not going to tell you what order to do what in."
"Speaker 1","00;16;03;17","00;16;26;21","If we can't separate and sequence events, then it's going to be hard to carry out a performance correctly. You can't just switch the order of musical notes and the sheet music. You can't just do things in a different order. So how do we get some of the features that we're looking for, like separate ability of modularity and take it into a fully interaction ist framework?"
"Speaker 1","00;16;28;03","00;17;09;01","One distinction there that the authors raise is like strong versus weak constructionism, and they'll end up continuing that. Both of these forms have similar underpinnings, but there's sort of a continuum between thinking that the instruction ism is completely its own neural representation ism. It's kind of like a Martin Baily type argument. This is the strong constructionism, thinking that it's totally just the neural representations that are entirely specifying on their own the movements that have to be performed versus a more dynamic or coupling version of instruction isms."
"Speaker 1","00;17;09;19","00;17;37;06","So they'd be like, you know, when you're tapping the gas, it's like an instruction to the engine, but it's not the entire go faster cue given the background of ecologically normal processes that enable them to play this role. So that's kind of interesting. Blue any sort of overarching thoughts or any where you think it'd be fun to jump in now?"
"Speaker 4","00;17;37;06","00;17;38;29","I'm just trying to figure out where I'm at."
"Speaker 1","00;17;38;29","00;18;06;29","So indeed, will there be a few other places, like a few other notes that we want to discuss? Dean mentioned one thing maybe we can even have a dot three and find out what a dot three would mean or a dot to point to one or something like that. Dot 21. So one piece was about the, the neural elements because in the figures we do see brains."
"Speaker 1","00;18;08;18","00;18;32;27","However, these are quite schematic. It's not saying that these are the brain regions where these types of things happen, which can be a little ambiguous because it's not actually an anatomical representation yet. It's superimposed on top of a brain. OK, so one piece we wrote down was about the neural and I think there was a few yeah, yeah."
"Speaker 1","00;18;32;27","00;18;33;17","Stephen, go for it."
"Speaker 3","00;18;34;27","00;18;55;05","Yeah, just time is, as you mentioned, about the streak. The weak and strong is kind of interesting because that's kind of trying to give this scientific feel, but it doesn't feel very satisfactory to try and have to say it in terms of weak and strong because you kind of think this well, what does that really mean and how does it shift between the two?"
"Speaker 3","00;18;55;05","00;19;23;18","I mean, I can understand what is being said, but it's it gets into this kind of fuzzy version of instruction ism. So I think that kind of sets up some of these questions that as soon as you move away from a strong instruction ism, it becomes harder to hold it together using the word instruction ism. So I think that's it's quite a good illustration of that because it's sort of you can see how the second paragraphs a lot longer than the first one, basically."
"Speaker 1","00;19;23;18","00;19;49;08","And yet great point. And it's also a common approach to basically rigorous philosophical argument. Instead of making an argument against the total category, you introduce a distinction in the category and then you might find that either one of those categories has some features that the other one doesn't, you know, instead of being against all wars, well, there's the good ones and there's the bad ones."
"Speaker 1","00;19;49;08","00;20;38;25","And then here's my distinction for just the bad ones. Or it could be that by making that distinction, you then can say, actually, this holds true for both of these categories. Or subcategories. And so that's how I've made my claim against all X is by first breaking it down. And then they do again find that there are, of course, are differences between these two forms of constructionism, but that they end up taking on some of the same assumptions cause there's probably a few other pieces we can explore this is the section in the paper that I'm sharing on the screen that says the formulation of sensory motor control in terms of optimal motor control theory"
"Speaker 1","00;20;39;13","00;21;07;27","heavily hinges on two different but highly interconnected assumptions. So let's see what the assumptions are, because it's probable that active inference is going to be contrasting or doing something different. So one is the central specification of the sending motor commands and they're efferent copies in the form of detailed low level instructions for control of the motor plan specified in terms of an intrinsic frame of reference, i.e. extension and contraction of muscle fibers."
"Speaker 1","00;21;09;16","00;21;41;20","So that's that instruction ism. And then to a separation of forward and inverse models operating on complementary aspects of action planning and execution. Awesome. So the first piece is that instruction ism that what's being sent descending or towards the body are instructions. And the second piece is a separation of the forward and the inverse models operating on complementary aspects of action, planning and execution."
"Speaker 1","00;21;42;00","00;22;05;28","So the forward model is like sort of a planning model and then the execution is like, OK, given what I planned, how am I going to execute that? And those are two different streams in optimal motor control and so we've been talking about how interaction ism we can explore, how active inference deploys interaction ism. But in interaction ism, we have a contrast with the instruction is 0.1."
"Speaker 1","00;22;06;20","00;22;25;08","And then through a unified generative model in active inference and the reduction of uncertainty in a unified generative model, we're going to move beyond this separation of these two forward and inverse models. Stephen. And then anyone else or any questions in the life."
"Speaker 3","00;22;26;18","00;22;56;28","Yeah, this is quite helpful. It gives that realization the optimal motor control theory. It could it can be very precise. You could imagine someone making a robot because you can measure everything. You've got access to all the data and you could make something within like a thousandth of a millimeter precision which humans or animals can't do. But it does have a bit of a limitation in terms of being able to integrate."
"Speaker 3","00;22;56;28","00;23;19;28","And I think that I don't know if you've seen any of the papers around the idea of Fields being around the robots joint. So that have like a field around the hand, the field around the and just move into the field rather than trying to work out what the actual muscle, what the actual joints should do. And they, they out competed other robots within like two or three months."
"Speaker 3","00;23;19;28","00;23;50;02","So this same idea of working with some sort of more fuzzy dynamic to build actually and just working out what's works most efficiently or best even though you're probably adding a lot more fuzziness into the actual understanding of the measurements, actually has a lot of them, has a lot of benefits in terms of learning how to do something quickly OK."
"Speaker 1","00;23;50;17","00;24;16;04","I think there'll be a few more cool points to return to on this notion of field, but I think it's also helpful here to look at how they distinguish the forward and the inverse models. So here a Ford model takes the system from an intrinsic to an X extrinsic frame, predicting the effects of different movements using musculoskeletal plans specified by neural activity."
"Speaker 1","00;24;16;04","00;24;44;09","So again, that's that instruction ism that's because we're in the optimal motor control. So forward model is basically plans that can be cognitive into implementations. That's the translation into motor of commands and their consequences. On the other hand, an inverse model builds motor commands by inverting the causal change. So first, that inverse model leverages a value function of states."
"Speaker 1","00;24;44;09","00;25;14;02","This is where we get the in optimal motor control, the non negotiable introduction of value as the central terroristic states have to be assigned value because value is what's used to determine which plans to select. And that leverage on the value function is used to form a mapping from desired target states, which again is built into active inference in a sense through the preference over certain types of states."
"Speaker 1","00;25;14;11","00;25;46;21","But the desired target state has to be specified in a slightly different way as an actual preferred state rather than over a preferences. Overstates in this awful motor control framework and that's in the coordinate system based upon the external consequences of movements. So I want my my arm to be at a 90 degree angle and then that is translated or it's mapped to a set of intrinsic coordinates in the space of muscle fiber activations, like my arm is at a greater than 90 degree angle."
"Speaker 1","00;25;46;21","00;26;17;27","So that needs to map to activation of biceps firing patterns so that the arm can contract, so that the angle is smaller and that's why frameworks based upon optimal motor control are sometimes characterized in terms of force control, because all the motor commands specify is muscle forces and joint talks. So that's kind of the macro to micro mapping is we have preferred states and the question is there's so many degrees of freedom with the joints."
"Speaker 1","00;26;18;09","00;26;49;27","So how do we go from potentially a broad set of preferred states or acceptable states into a specific pattern of muscular activations? So how do you go from make your hand just rest where it's comfortable, which is a relatively broad sort of plateau of accessible states into a position that each joint is going to be at equilibrium with and the two of these assumptions that we've been exploring here."
"Speaker 1","00;26;50;09","00;27;19;19","So again, one, the obstructionism and two, the separation of forward inverse model, that architecture induces the assumption or rests on the assumption that value valuable states is what causes action and that's what that first in 2011 paper introduced is sort of flipped that on its head, which is that well in models from omc t sequences of action are selected according to the value function of their states."
