"Speaker Name","Start Time","End Time","Transcript""Speaker 1","00;27;20;04","00;28;15;23","So value is something that's cognitive and induces action but that gets sort of flipped in the 2011 perspective because value is a function of the states, not a cause of them. So yeah, as written here, value is an attribute of states that are caused by movement. It's a consequence, not a cause and when we get loops, you know which ones, a cause of which something that's local locally A causes B but then you pull back A level and maybe the relationship can also be seen as sort of the other direction or maybe with feedback systems or embodied systems, we move beyond just any single linear framing of what causes what, but regardless of the direction"
"Speaker 1","00;28;15;23","00;28;45;20","or whether value is an attribute a states or it's a consequence or it's a cause, the point is there still is this central value parameter in optimal motor control theory and that value parameter, which is familiar to reinforcement learning like learning preferable states based upon their predicted value. That's something that we're going to be able to build on in active inference by pursuing not just value, but also allowing for reduction of uncertainty in a generative model."
"Speaker 1","00;28;45;29","00;28;54;11","Which could include pragmatic or value driven elements, but also elements that include curiosity like drives. Stephen and then anyone else."
"Speaker 3","00;28;55;27","00;29;38;27","And this ties in with Kaspar Hess work with Affect. You could imagine that the affective states are kind of generated on the fly at different scales. So as you start to move maybe slowly as you practice you these value states are kind of almost revealed and not necessarily available. And then maybe there's a state, but once the whole action's complete and that gives you an end to that value state, which may be only appears as that degree of surprise all is realized and it's always going to be slightly different each time you do something."
"Speaker 3","00;29;38;27","00;29;40;11","So this this is quite cool."
"Speaker 1","00;29;43;20","00;30;20;08","I've moved here to that kind of vector field representation of the difference between value only learning and performance. Here's our robot who's only interested in kind of taking a ruler, putting it on the hill and then going in the direction of the ruler going uphill. That's the sort of scalar approach to pursuing peaks. In contrast, we have that pick climbing or hill climbing element in active inference as that irritation or longitudinal currents."
"Speaker 1","00;30;20;24","00;31;03;27","But we also get this solid oil element. So I'm wondering, talking to people about performance, for example, or training in some way how would it be different to promote this sort of value, an equal value flow model rather than a comparative reward driven model? Like if a learner is constantly assessing whether it's a multiple choice test or whether it's baseball pitching or something like that, the learner is always assessing the value of states and everything is framed as value maximization and you're going to want to be doing accurate states."
"Speaker 1","00;31;04;07","00;31;27;01","You want, you know, the pitch, you want to be getting your pitches more accurate because more accurate is more rewarding. I'm just wondering how it changes training or the experience of practice to know that there's times when one is pursuing value or that in the long range pursuit of value can be achieved through this rotational or exploratory element blue."
"Speaker 1","00;31;27;01","00;31;28;04","And then anyone else."
"Speaker 4","00;31;30;06","00;31;51;15","So just talking about pitching specifically, like, yeah, you can, you know, hit the bull's eye, right? If you're going to pitch, you know, pitch a ball, you can hit the bull's eye you can hit the target, get it right over home plate. But like you never explore like what about like spinning the ball? What effects will like different spins that you put on the ball have on, you know, the way that the batter hits it."
"Speaker 4","00;31;51;23","00;32;11;24","So like the accuracy versus like the finesse of it. And I think about that in terms of dance also. Like if you're not, you don't explore like, you know what it feels like. Like if you're only trying to accurately make a movement, you're never exploring like the finesse element of it. So there's no like room for perfection or like ultimate mastery."
"Speaker 1","00;32;11;24","00;32;41;09","I think and where does skill become mastery? It's sort of like at least in chess, it's the, the masters who appear to challenge some of the basic rules. Like they don't castle early because there's some deeper plan or a jazz musician who moves beyond the framework of regular timing to introduce some other elements. So that play element becomes especially important."
"Speaker 1","00;32;41;17","00;33;19;08","It's almost like if you never learn how to do it correctly or normatively, you can't throw the baseball, so you got to get it over the plate. But then the mastery level after performance has been demonstrated in sense involves inventing a new way to pitch. Like there's, you know, a fraction of baseball pitchers who throw sidearm or throw knuckleball, all these different sort of unconventional approaches that art, the value function that they learned initially, or maybe it was their biomechanics and that was the value function that worked for them and some other value function just wouldn't have worked with their body and brain."
"Speaker 1","00;33;20;00","00;33;23;23","Stephen And then anyone else yeah."
"Speaker 3","00;33;23;25","00;33;53;06","Thinking from the perspective of coaching, who's so my supervisors works a lot with systemic coaching and performance coaching is this this becomes a more unifying approach. It might be four specific things. Optimal optimal control theory is quite useful for just unpacking something, but if you want to look at performance coaching more broadly or developmental coaching more broadly and how they relate this could be useful."
"Speaker 3","00;33;53;06","00;34;19;01","And I'm just thinking about Kristian Erickson, you know, the soccer player. Then if you heard he collapsed during the euro's and his heart stopped and all the team were around him trying to and then they had to play the game in about an hour's time. Now, their ability to perform was going to be very hard. It's not a performance coaching question at that point."
"Speaker 3","00;34;19;01","00;34;36;08","There's these other dynamics going on and I think that this this ability for active influence to at least unify how regimes can change and how it could be the environment, the system, the the emotions, all these things are quite."
"Speaker 1","00;34;37;13","00;34;41;19","Quite useful thanks, Dean."
"Speaker 2","00;34;43;00","00;35;12;28","Yeah. Yeah. I appreciate what you're saying there, Steve. I am aside from that, from the step by step part that I think the caudate nucleus tends to to perform when we're when we're trying to climb that little mountain there robotically. It's another factor, I think that's kind of interesting. And that's if it's embodied in its skill, there's probably three kinds of math at play."
"Speaker 2","00;35;12;28","00;35;44;08","There's the materialization, the how sort of the engineering of it. There's the what's in, what's out, what's superfluous and what what needs to be an element within the performance. And then I think what this paper does in the interaction is pieces. It brings the, the probably into the conversation. And I think you need all three kinds of, of calculations in order to be able to get a real grip on, on what's going on."
"Speaker 2","00;35;44;08","00;36;07;26","Maybe not an optimal grip, at least a fuzzy grip on what to do next. I think if you only have two of those elements, you've got the perfect conditions for an instrumentalist approach. When you add the probably whether it's Erickson what did he text or email all of his his teammates and said, go finish the game, we got it, we got to finish this game."
"Speaker 2","00;36;08;05","00;36;29;01","And I think Stephen's right. You can you can give it an instruction to your teammates and say, I'm fine, but you just had a cardiac arrest and we probably aren't going to be able to wipe that from our memory. In that moment. And so it's a little bit more complicated when we add probably. But I think we need probably in order for it to be interactions."
"Speaker 1","00;36;31;02","00;36;54;23","So that team like in the middle of the game, the personnel of the team changed in the individual story. Of motor control. It's like, but that's not between you and the soccer ball. So why should it change performance? But when we have the deep generative model of the individual that includes affect, that's one way to get to the loss of a teammate influencing performance."
"Speaker 1","00;36;55;05","00;37;21;13","And the second way would be to actually genuinely allow teams to be skillful performers in the sense that there's a distributed cognitive process on the team just like there is in the body. And so they actually changed. And whoever steps into that person's position on the field, they're going to have a different approach. So it'd be like switching out, you know, one arm for another arm or one forager an estimate for another, an estimate."
"Speaker 1","00;37;21;23","00;37;39;26","It's going to change the emergent properties of the group in a way that's an explanation at the group level rather than requiring to come back to just the optimal motor control, value driven instruction, guided of a Body Blue Yeah."
"Speaker 4","00;37;39;27","00;38;00;29","Just the probably is like what gives active inference? It's power, right? Like probably if I don't eat breakfast, I'm going to collapse in the middle of a field, you know, or playing a game or whatever. So so when you have that, that probably it allows you to guide all of your actions toward a given intention, I think."
"Speaker 1","00;38;02;10","00;38;03;11","Thanks, Blue Stephen."
"Speaker 3","00;38;04;12","00;38;33;15","Yeah. And I also think when probably because probably is often is still in that value my world, you know probably I will get this gain or that gain when the word uncertainty is put in uncertainty is a much scarier word. Than probability because it's like it has that risk component. That's really interesting that you say that that that we tend to say probably everything will be OK, but out of importance is like you don't know."
"Speaker 3","00;38;34;28","00;38;37;02","It's all it's all unknown to some extent."
"Speaker 1","00;38;38;28","00;39;09;08","Here's here's another nice piece from the paper that I think can continue this discussion about probability and maybe also how active inference reframes it. So the physics of flow embedded in active inference. Now it's an ongoing discussion. Exactly. The Formalisms that get us to a physics of information flow on sense cognition in action. So other live streams, other days, other years but let's just roll with this physics of flow."
"Speaker 1","00;39;10;12","00;39;38;11","It's accounting for sensory motor behavior to show that motion in a biologically realistic state space. Irreducibly includes two orthogonal kinds of motion, the irritation and the solenoid or component. So that's what we are looking at here. Just this is a paragraph that's representing this piece instead of just value only we have value and flow. And again, this is key to reiterate because it's something that isn't included in reward scalar representations."
"Speaker 1","00;39;39;11","00;40;09;01","So the former that the first one, the curl free, is what allows the flow to climb a gradient towards more valuable or probable states. Now that's one of the head scratchers and active inference that preferred states are likely states under an optimistic deep generative model. And that is the alignment that allows us to reduce uncertainty and by way of reducing uncertainty achieve our target outcomes."
"Speaker 1","00;40;09;25","00;40;35;09","And so when we align the deep generative model in an optimistic way such that we believe that likely states are preferred ones, that it's likely that tomorrow I'll have a regular body temperature, it's likely that tomorrow I'll be in this preferred body position, then we actually get to pursue value as a consequence of reducing uncertainty. There's more to say on this."
"Speaker 1","00;40;35;09","00;40;37;01","But Dean, go for it. And then Stephen."
"Speaker 2","00;40;38;04","00;41;11;01","Yeah, and I think, Daniel, that what that points out is that there's a dependency for people who want to introduce statistical propositions to what's the underlying situation that we're observing. There's a dependency on the derivative math and the accounting math. You can't you can't figure out what probably is without figuring out how and what and having a having a a sense of confidence around what, how and what are."
"Speaker 2","00;41;11;17","00;41;37;26","So I don't think it's it isn't just the introduction. The fact of the inference, active inference is also wholly dependent on a strong foundation in terms of really being able to get from priors through that hidden state. And how do we do that? We have to have derivatives and we have to have accounts so I think there's a real codependency."
"Speaker 2","00;41;37;26","00;41;43;17","Back to the between comment that Stephen brought up Cool."
"Speaker 1","00;41;43;26","00;41;44;19","Thanks, Stephen."
"Speaker 3","00;41;47;09","00;42;25;24","Yeah, that that that idea of things going through cycles, I think I'm not going to go into this again, but, you know, it often comes up is that's from what I'm understanding is is pretty much not present in optimal motor control theory because it's it's about you go there and then now you have a vector and that vector is a thing and that thing gets optimized but you never have that thing I think like the messiness that kind of in between and you're kind of holding that in between both."
"Speaker 3","00;42;25;24","00;42;50;12","But that only makes sense if you keep revisiting the in-between. Like if the you need to have earlier decisions, whatever. I mean, that's an open question again for another day. But the some way that you're revisiting this understanding because otherwise you've got no way to make any sort of information gains or information extraction unless you have a revisiting to compare."
"Speaker 1","00;42;52;13","00;43;20;19","Interesting and it's one of the key pieces, again, that we reduce our uncertainty and achieve preferred states through that process. I'm just imagining, you know, something from organic chemistry. It's like you want to study up, cram for your final and OK, you want to pass. So are you going to take a reinforcement learning perspective or an active inference perspective?"
"Speaker 1","00;43;20;28","00;43;41;21","Well, the reinforcement learning perspective is like saying you'll get the big reward when you pass. So what's the most rewarding problem that we should be solving or what's the most rewarding chapter to review? But you don't know because if you knew then you'd pass. OK, so you're kind of right back at square zero with value because you framed learning as a value question."
"Speaker 1","00;43;42;13","00;44;09;15","In contrast, the active inference learner would be like, Oh sure, my preference is to pass. How am I going to reduce my uncertainty about the critical path of passing? Well, let's I haven't even open the textbook. Let's go to the first table of contents or something like that. Like reduction of uncertainty gives a first step and then it even allows for, OK, maybe that wasn't even the right first step, or maybe that was a good two step path."
"Speaker 1","00;44;09;15","00;44;54;06","And now I'm ready to go a different way, but I'm trying to reduce my uncertainty about how to get to what I prefer, which is passing rather than I've Apriori valued this future state, and now I'm going to back propagate value at every single step of the line, and then I'm going to stress myself out. If this specific chapter isn't maximal, rewarding because everything again has to get reduced to value in this value is everything framework but in the uncertainty reduction framework, we see sort of this mist of uncertainty and then regularities and especially dependable ones emerge out of that."
"Speaker 1","00;44;54;19","00;45;28;11","And so we're planning amidst uncertainty with preferences in mind, trying to figure out what to do. That's planning as inference amidst uncertainty, which is just a world apart from planning to maximize value through time given, you know, what model again of how value is assigned. It's just a recursive question. And value learning doesn't give us that higher level answer for how we should actually go about planning to obtain values, let alone critiquing value as a pervasive framework."
"Speaker 3","00;45;28;16","00;45;52;19","Stephen Well, actually that's a very interesting talking about organic chemistry experiences at university that I had an absolute nightmare on my organic chemistry I mean, I give my textbook to someone I got behind on the organic side and it was this like two inch thick textbook on organic chemistry. And every time you go into it's got so many words, it's long names."
"Speaker 3","00;45;52;19","00;46;22;14","And all this is going on is really interesting because we had this class with a new professor and he got there and he got a few people to go up to the board and it became clear that absolutely no one knew the organic chemistry and no one had seemed to pick up on this. So we are now in the second year, no one knew they were doing, I think was even the third year and he said and he said, you recommended a little thin exercise book with exercises, not on all the different chemical reactions and all the structure and it just the key reactions."
"Speaker 3","00;46;22;14","00;46;51;11","And just to go through these exercises in this thin book. And basically that got me through the exam and got me on track. No and you know, so going for the big book and the the memorizing and the optimal control, it was just work out the five key types of reaction and do the exercises. And I think that speaks to what you were talking about there, you know, which ways the electrons move and that suddenly really, really changed everything."
"Speaker 1","00;46;54;14","00;47;26;04","There's also some fun drilling happening, of course, all around me. Welcome back, Dave. So this section right here, it's it's a nice challenge. It increases the difficulty of speaking, but it's fun. This is a challenge for other frameworks. This idea that the two flows together provide a richer framework for expressing skill, fullness as a process whose characteristic go beyond a simple gradient of value accuracy."
"Speaker 1","00;47;26;11","00;47;49;25","So we saw that reward is enough paper recently. And some participants at our lab are kind of curious about writing a response because that's the whole argument is they said, hey, reward is enough, the kernel can be reward. And that's how you get all of these intelligent behaviors provided that you have these second level tweaks on the model or these bolted on modules."
"Speaker 1","00;47;50;12","00;48;30;15","And then the contention of the authors here is that value functions and indeed any motor scheme based upon functions that return scalars are not up to the task of modeling the variety of skillful acts describing human behavior, any kind of behavior just human, because by construction they cannot account for the solenoid or aspect of flow. So that's pretty interesting that when we have to bottleneck into a single number, we lose a lot of the expressive ity that allows for explore and exploit behavior to almost coexist because we're collapsing onto a number line."
"Speaker 1","00;48;30;27","00;48;50;09","So there's extremely limited availability for, you know, what do you want for your main dish and your side dish? And you just say seven, you can't express two things with just one number, but if you could say, you know, seven and three, you could express something that's more in a two dimensional space."
"Speaker 4","00;48;50;16","00;49;13;17","Blue so I think you bring up an interesting point about any behavior or just human behavior. And I think about, you know, there's like dolphins that use tools, right, to crack open like fish and or to crack open not the fish, but the the sea urchins, right? So there's dolphins that use tools for eating and then there's dolphins that don't."
"Speaker 4","00;49;13;26","00;49;39;17","And so is there. And like this is like a hereditary like it's an example of cultural evolution in dolphins, actually. So it's, you know, it's hereditary, but only because it's passed on through learning and social learning. Right? So you bring up and then we saw the motor plant, right? Like the motorized plants, like does the plant learn where the like how like skillful performance?"
"Speaker 4","00;49;39;17","00;50;06;12","I mean, this is a skill for performance on the part of the plant. So it's a really interesting question whether, you know, I mean, we think about active inference as applying to all non equilibrium steady state systems, but does this maybe apply only in the human sense of movement, movement or what about like tribes of humans? Like what about like in a nomadic kind of population with the supply there also cool."
"Speaker 1","00;50;07;12","00;50;38;12","Here's another nice piece in this section that I think will be useful for us to learn about. So technically, it's easier to read when it's already been written. When you're getting the drilling experience, that's when it's the hardest to skillfully improvise. But reading is a little easier. Technically, active inference extends popular predictive coding models used in neuroscience, where perception is critical only perception is cast in terms of prediction error minimization."
"Speaker 1","00;50;38;19","00;51;03;17","So that's the classic rule in Ballard. 99 paper. That's sort of a mega citation and there's a huge amount of subsequent work. And predictive processing or predictive coding is just looking at the relationship from sense to updating of the generative model of sense. So it's a signal processing framework. And this is something I know that Dave is a big fan of us."
"Speaker 1","00;51;03;17","00;51;41;20","You know, it's drills and hammers. And I know that Dave is a fan of talking about the signal processing and the audio processing roots of active inference. So this is just on the inbound just from sensory information to estimates of that generative model of that generative process of the sensory data. The active inference framework extends this account of predictive processing to model motor control and explains action selection by appealing to the minimization of divergence between predicted sensory data and actual sensory data."
"Speaker 1","00;51;42;07","00;52;09;17","So each year we have the exact same divergence minimization. It will sound better on the live stream. My Jesse colleagues, don't worry, it's the same divergence that's being minimized, which is the difference between observed and expected sensory data. So in predictive processing, it's about sense and perceiving sense. And so you want to minimize the divergence between what sensory data you expect and what you're actually getting."
"Speaker 1","00;52;10;06","00;52;31;11","But active inference has inference planning as inference into the loop and explains action selection also in terms of the exact same divergence goal of predictive processing, which is again, to have your observed sensory outcomes come into line with your expected sensory outcomes."
"Speaker 2","00;52;31;19","00;53;01;09","The yeah, I one of the things I used to share with people is so today I'm wearing my murder of of Crows t shirt because I used to study a lot of court behavior. And even though I work, there's, there's still some question as to what sort of verbal cues there, what instructions corporates are able to share because they are social animals."
"Speaker 2","00;53;01;09","00;53;32;18","And there they are problem solvers, but you don't have one Corbett standing to the side as another of solves a problem giving them instructions so I think it's kind of interesting when we're when we're looking at this behavior question whether we're the only species that are actively inferring because they think that there are other species out there that you can make a case that they are doing that probably form of questioning and answering as well."
"Speaker 2","00;53;33;21","00;54;12;05","So yeah, it can be tools, it can be based on on on social constructs it can be based on caching. So deep memory. And again, there's a dependency, I think for behavior that uses active inference to also have some grounding in how and what. So I don't think that active inference in and of itself will allow us to, to minimize anything unless we have the derivative and the accounts."
"Speaker 2","00;54;12;16","00;54;28;10","So I think it's I think it's it's a virtuous triad here. But I think what this paper is trying to do is get away from the idea that all problems can be solved with only two kinds math cool."
"Speaker 1","00;54;28;10","00;54;29;11","Thank you, Stephen."
