"Speaker Name","Start Time","End Time","Transcript""Speaker 2","01;22;23;15","01;22;58;19","But I'll bring a bring a if you know, the movie is Independence Day and Thelma and Louise, I'm going to bring those into and kind of into a juxtaposition here. I think for the instrumentalists they don't necessarily see that there can be for the person who is living out the adversarial Greek myth that's against the aliens or that's against the the people who are chasing us down and trying to get our our convertible back there, isn't it?"
"Speaker 2","01;22;58;26","01;23;53;15","There is no set of instructions per say that those people want to follow. They're living the interaction is state and you could start out with kick the tires and light the fires all Harry Connick Jr. And still end up in a rapid deceleration moment ala susan sarandon and geena davis. And I think for people who are going to look at this problem in terms of how do we introduce this interaction ism in a way that doesn't threaten the top down hardness of how most most situations where we want people to be able to take up as an embodied skill, skillful performance without putting them in a situation where they behave like aliens or behave like"
"Speaker 2","01;23;53;29","01;24;22;17","police, chasing somebody down with a helicopter we're going to have to sort of I don't know I don't know if it's a slow rolling. I'm not sure exactly what it is. But those people who are now currently instructors and instructional lists by by profession, we're going to have to give them something so that they don't cling desperately to a model that I think the authors of this paper demonstrate."
"Speaker 2","01;24;22;21","01;24;49;25","It requires a rethink. I don't think we throw out instructional ism but I absolutely do think that it's it's place on the top of the mountain. And now all these little robots climbing up it, that that has to be reviewed and revisited. And so, I mean, as a go forward, I don't know how we put people in a place where they're comfortable with that kind of I don't want to say it's disruptive, but I think it is."
"Speaker 2","01;24;50;11","01;25;05;11","But I think we have to be able to come at this in a way that doesn't make them sort of circle the wagons solenoid annoyingly and try to protect something that obviously is is up for a bit of evolution before a revolution."
"Speaker 1","01;25;07;01","01;25;09;14","Nice points there, Stephen."
"Speaker 3","01;25;11;13","01;25;46;13","Yeah, I like that idea. Yeah. This challenge of having this mountain that we've kind of ascended and place these optimal control theories on. And maybe it's more like there's a mountain of active inference and there's a there's a little rock, a rock structure on the top, which is up to control theory, which we're able to sort of utilize on top of that, you know, but it's it's a lot more rickety and it's not the, the main game in town."
"Speaker 3","01;25;46;18","01;26;12;01","You know, the main game is our intuition, our dynamical balancing of all these different energy parameters. But we do and particularly humans have this ability to impose this extra shack of tools on the top that we now think is the main game in town."
"Speaker 1","01;26;13;13","01;26;53;19","Nice. So to Stephen's then to Dean's point, so as to which one's the mountain, which one's the mole hill, which one's the anthill here, Kristen says optimal control can be cast as active inference with three simplifications so as we increasingly clarify our understanding of these different models, we'll be able to see which models are nested within one another or are alternate framings of one another or are more overlapping than different, or what are those key distinctions or what are the variables where you can expand it to three and all of a sudden you've gone from Model A to B?"
"Speaker 1","01;26;54;02","01;27;25;01","So remains to be seen. And by him saying that optimal control is a thrice simplified act of inference along these three specific domains, it does suggest that the bigger picture might be active inference, and then you get special case optimal motor control with a value function as a derivative model within an active inference universe, even if these other models were developed first."
"Speaker 1","01;27;25;01","01;27;48;05","That's often the case that a certain model is introduced and then it's later generalized in several ways, so that in the future it's actually seen as a special case model, even though it's actually at one point. It was the only game in town, certainly for a lot of biology models. That's the case. And then, Dean, I really like this idea of like there's a job title called An Instructor."
"Speaker 1","01;27;48;13","01;28;41;15","And if somebody says I'm an instructor in, you know, organic chemistry or in tango baseball, people know what you're talking about. So how could interaction ism be so broadly participated in that? People say, I'm an interactor I'm a baseball interactor, I'm an Interactor. Maybe the job would be called that or not. So how do we, like you were saying, not kind of threaten or disrupt their modes, but give a yes and for what they're working on and maybe part of it is that the interactor, it's like reframing their interactions with their student, but just say as a cultural scaffolding of an interaction that doesn't make it a symmetric interaction."
"Speaker 1","01;28;42;05","01;29;31;08","It's culturally scaffolded moments of Bayesian model updating. And so it's like, yes, you do give instructions. That's the verbal term for what you say when you say pull or breathe or OK, slow down. You can still give instructions. We're not saying that that is not part of your toolkit, but let's more broadly look at your interactions with this dynamical system as doing what you want to do and maybe it'd be enough just to push them to that edges of the hill and just say interactions are a broader way than instructions, which you want to reduce everything you do to just barking instructions, or sometimes you lead by example."
"Speaker 1","01;29;31;19","01;30;00;22","Other times you show wordlessly you don't need to frame your interactions as instructions, recognize that you're just dynamical interacting systems. And this a lot of people are working on a framework that suggests that this is a broader way of thinking about training and might be able to help you on one hand with a high performance elements and on the other hand with accessibility and in making your work more communicable."
"Speaker 1","01;30;01;12","01;30;03;25","Not sure about that, of course, but just one way to go."
"Speaker 3","01;30;03;28","01;30;39;00","Stephen Yeah. With the idea of roles and how people look at performance in roles, this really comes back to coaching again. I mentioned that earlier is, you know, coaching came out of the need to supervise therapists and how they could be guided in their path as they were supposedly helping the people that were needy. They needed guidance. And that same idea now of coaching rather than teaching or instruct in."
"Speaker 3","01;30;39;17","01;31;14;07","And while they have their role is given the formal documents that you might need and provides in the bigger narrative and given certain tools, you know, you, you within that there's this idea of OK, what types of developmental or performance interactions can be nurtured and cultivated and I think this actually really can tie in to the kind of pragmatist social constructivist approaches that coaching is trying to work with."
"Speaker 3","01;31;14;08","01;31;35;27","As in, but it gives it a bit more it does actually give it a bit more meat without becoming too complex, which I think previously a lot of the active inference is maybe a bit too abstract. This is starting to show a bridge. There why coaching at different levels and and positive psychology more broadly can have a role."
"Speaker 1","01;31;40;24","01;31;42;15","OK, great. Thank you. Stephen Dean."
"Speaker 2","01;31;43;07","01;32;20;04","Yeah, Stephen, I appreciate exactly what you're saying. I just I think to get to a place where interaction is is no longer threatening. People have to want or appreciate that you can be a subject matter expert and a prediction matter expert. And I'm not sure I think there are maybe are some coaches who are both and I but I sort of transcended that and got into the wayfaring thing because Wayfaring imposes a prediction aspect to this."
"Speaker 2","01;32;20;17","01;32;45;15","I can't predict for you whether that running jump shot that you make. I can't be in your ear I cannot coach you to take that shot in that moment with that much time left on the clock. In fact, if I do that, I'm probably adding impediments and I'm actually being an optimal control is micromanaging you and you, whether you make it or not."
"Speaker 2","01;32;45;20","01;33;13;14","It's not about me. It's about whether the ball and the and the and the basket arrived at some sort of outcome that we both want. I think that I think that that's part of how we get people to a place where their dependency on their subject, subject matter, expertize doesn't overwhelm the fact that for these performances there is a predictive element."
"Speaker 2","01;33;14;00","01;33;42;16","And so we have to sort of give that equal billing. I don't think we have to overbill one or the other. It's back to the between. And that's a prediction matter expert. And again, I don't know if it's a role being a way fairer because you're in the boat with that other person, right? It doesn't matter whether you're the one saying, OK, well, I'm I'm getting a sense of the direction of the current right now and the other person's looking up at the stars."
"Speaker 2","01;33;42;17","01;34;14;17","You're working together. And so, yeah, everybody brings their expertize. And I think that that only that only materializes if we can if we can include something with the subject matter. Expertize culturally, yes, absolutely. There's a huge cultural piece to it. But I think I think you can be a coach and not necessarily be a Wayfarer, but I think if you're a wayfarer, you have to bring a predictive element into it."
"Speaker 2","01;34;14;24","01;34;16;10","Otherwise you're not being aware."
"Speaker 1","01;34;18;11","01;34;49;19","It's interesting that having an integrated way to talk about goal and process and interaction with a niche interaction with your CO wayfarers, just like your example with a movie, you know, there's is the map app going to tell you which directions to take that's kind of on the instruction list, end verses, are you on the run? So anywhere you go, you're, you're just not following instructions."
"Speaker 1","01;34;49;19","01;34;59;12","You're just negotiating sequential interactions and reducing uncertainty in a way that isn't just looking down at the application and seeing which way to turn when."
"Speaker 2","01;35;01;19","01;35;07;12","And I'm glad you picked up on the the map going out the back and over the trunk of the car."
"Speaker 1","01;35;08;09","01;35;15;24","Yeah, exactly. Oh, you're reading it. Oh, no. Right. Cool. Well, Stephen. Yes."
"Speaker 3","01;35;16;08","01;35;24;13","It's just one question. Wayfair, is that like a particular sort of approach is like an orientation based or."
"Speaker 2","01;35;25;21","01;35;48;24","Yeah, you're on your path. And how are you fairing? How are you feeling? OK, right. It's not just wayfinding. It's not just the discovery piece, but it's so how does that make you feel being in that uncertainty space? Because again, if we're going to close loop discovery, we'll eventually loop back around a recapitulation and then. Right, we're open systems that are constantly closing these loops."
"Speaker 2","01;35;49;03","01;35;51;16","So how does that make you feel like?"
"Speaker 3","01;35;51;16","01;35;51;25","Oh, yeah."
"Speaker 1","01;35;52;19","01;36;25;25","To connect that also to John Boik and Second Order Science, as well as Bucky Fuller and Trim Tab. When we're the rudder, we need to act in an anticipatory fashion. So that's kind of like first order cybernetics. The the rudder has to turn before you hit the iceberg. You know, you got to find a path. So pathfinding and that whole notion of anticipating or control comes to the rudder and the trim tab is the little rudder on the rudder."
"Speaker 1","01;36;26;03","01;37;11;00","So it's anticipating even the anticipatory nature of planning because you have to turn that trim tab even before you turn the rudder. And so here we have instead of a sort of mechanical model with recursive levels of rudders, we actually have hierarchically nested priors. And so it's a little bit like higher and higher level priors that in one sense when you look at one iceberg and you try to tell a story by backfilling, what happens they do act in increasingly anticipatory ways, but then when it's seen as just part of the wayfinding of the ship, they're all in a cyclic feedback with each other."
"Speaker 1","01;37;11;00","01;37;40;10","And it's not like one is really upstream of another, but there are certainly pieces doing different things cool stuff. Any final thoughts or questions? I don't see any other questions from the live chat, but another interesting and surprising dot two as usual, does anyone have any final comments."
"Speaker 2","01;37;41;28","01;37;42;13","And."
"Speaker 1","01;37;45;28","01;38;18;17","Well great. We'll look forward to some awesome up coming streams. Let's just look at those really fast. Next week on the 21st, we're going to have our symposium with Carl Feresten. So if you've been helping to co-organized this event and develop the questions with us, you'll be with us live. Otherwise we're going to be recording this, not live streaming it and then providing the recordings on our YouTube channel."
"Speaker 1","01;38;19;04","01;38;57;09","And then for the second two weeks of June, we're going to be doing a more technical or statistical paper empirical evaluation of active inference in multi armed bandits. Then in early July, we're going to have a fields and living paper scale free biology, integrating evolutionary and developmental thinking. Then don't have any papers for the end of July or beginning of August, but we'll figure out what we want to do there, and then we'll be turning to some industrial engineering and some other areas."
"Speaker 1","01;38;57;09","01;39;11;25","So as always, pretty fun journey. Thanks Dean Blue, Stephen, Dave for participating live and everyone for watching live on replay. We will see you on a future stream."
