"Speaker Name","Start Time","End Time","Transcript""Unknown","00;30;29;05","00;30;56;28","As we explore in the representations paper, it doesn't necessarily have to be that way. There could be an a hidden state internally having to do with movements left or right. And then there's a temperature variable outside. And then the model, the generative model of the Cognize air is about movements conditioned on temperature observations but not necessarily simply a thermometer being instantiated in the head."
"Unknown","00;30;57;06","00;31;32;13","So it's like good to look at this graphically and think about what is being connected to what without worrying too much about all of these side questions. But this is what they're setting up as the basis of their further discussion, which is it's about prediction and control and we can use Bayesian graphical approaches to represent that. Stephen And that informed state, as you mentioned, it's in some ways always slightly hidden from us."
"Unknown","00;31;32;22","00;32;10;28","How is that what is that mean to be an inferred state? In terms of is that the cognition that's coming out of that it's in some sort of deductive or can it be an effective sense of how well something's going? So again, it's not directly asked here, but access in that is one of the big problems that happens is how do you access what has been inferred when it's not necessarily something you can access through sort of direct reporting from a subject matter or from it from a participant?"
"Unknown","00;32;12;08","00;32;34;22","Right. Like another example of that might be somebody who has skilled action with respect to investing, but they may not be able to give an estimate for a number that's a certain, you know, asset is expected to be up because it's not like they're doing the asset price prediction and then doing a strategy. The cognitive model may have a very different structure."
"Unknown","00;32;35;18","00;33;04;25","So we explored it in the representations paper, but like there would be ways in which therefore that investment decision is not a representation of the actual stock market because it's not the same variable. But then the about ness of the investment decision would be a representation with respect to what was happening in the generative process. So those are some of the like side avenues that we've looked at previously, but they're all in play at once."
"Unknown","00;33;05;11","00;33;33;08","And so the question is just how to linearly structure to respect the specific contributions that are made here and the insight that can be gleaned without every single time pulling back to some of these questions. But it's great that we have like specific papers and memes and core terms that we can refer to and then carry on with what they actually contribute OK."
"Unknown","00;33;33;18","00;34;09;17","Any thoughts on one or two before we get into the structure of the ALO start or the home you start first? I guess let's go. OK, again, so we're going to go from this black and white. You know, Dorothy still in Kansas mode to some predictive motifs of ancestral brains and the three motifs, the red green and blue are homeostasis."
"Unknown","00;34;10;14","00;34;44;16","So returning to a set point, almost ASIS anticipating or approaching a set point in the future, which could be a fixed or changing one, and then implementing behavioral control, not just scalar homeostasis or ala status on an intercept of variable ok, citation 20 in the paper chance at all from the future. March 22 is where to look for more details on the homeostatic formulation that they're using here."
"Unknown","00;34;45;10","00;35;18;19","But we can see it in terms of their figure three. OK, so the left side, just for reference, there's figure two so that we can remember the structure of perception and cognition action impact that the authors are working with here. And we're going to connect this black and white figure two to figure three A This is a graphical model, graphical L in both senses, meaning visual like we're perceiving it through computer graphics and graphical meaning like a network."
"Unknown","00;35;18;29","00;35;47;17","So nodes and edges because there's computer graphics that aren't network topologies. But this happens to be a computer graphic that we're perceiving visually that also is reflecting a graph in terms of nodes and connected edges. It's a generative model for the regulation of a single intercept of variable. So here's A and B with the obvious dot and C, we split out to talk about later."
"Unknown","00;35;47;17","00;36;23;27","But first A and B this generative model includes an intro receptive thermo receptor and a belief about body temperature. The prior over X, which is body temperature is kept fixed and hence it acts as a cybernetic set point. Any discrepancy between the predictive thermo receptor activity given beliefs about X so y condition on X and the measured Y is registered as a prediction error that is canceled out by an autonomic response."
"Unknown","00;36;23;27","00;36;54;15","You, for example, a thermo regulatory response so hidden state on temperature beliefs about temperature. Why the thermometer perception and then there's the selection of action. So some sort of like vasodilation or thermo regulatory response. And then that's going to change the underlying unobserved true temperature, but that's not needed to be shown. So any comments on that first part?"
"Unknown","00;36;54;16","00;37;22;20","We're looking just at the top half of three A and connecting x y to you action can you still hear me because I have no can you can you take the cursor now and just reinforce the feedback in the feedforward part of this because the authors spent bit I don't want it sort of unpacked like they have at the at the figure three unpacking that we have at the bottom of the slide."
"Unknown","00;37;22;25","00;37;44;03","Can you just run the cursor over all the examples of feedback and feedforward going on concurrently? Because I think that's, that's really important to see that it's happening in both directions at once. Let's label everything and then definitely can do that's perfect. Thank you."
"Unknown","00;37;46;24","00;37;47;08","Wow."
"Unknown","00;37;56;01","00;38;52;20","OK, so light blue is action these are subtracted. So red circles represent expected values of x, the red circles which are used to make predictions about y these are subtracted to form a prediction error because those lines with the arrows on the end of them are just dependencies. They don't really show both the feedback and the feedforward yes."
"Unknown","00;38;52;20","00;39;05;06","Agreed. Like having some rounded edges and other directed edges let's see whether it's whether they're like kind or not."
"Unknown","00;39;10;20","00;39;53;16","Let's start with action. Action influences the state of the world, which an edge can be drawn to how that changes the state of the thermo receptor not y. Here was the observation. Yeah, that's the state of the thermo receptor is the observation. OK, yeah. So action changes this. The observation, the state of the thermo receptor which is being contrasted with the belief about temperature from there, a prediction error is generated."
"Unknown","00;39;54;02","00;40;27;01","It could be zero if there no difference or it could be higher than you can. You just show with a green or some colored line that has an arrow on each end, a connection that demonstrates within that diagram the feedback and the feed forward at once. Is that possible using this diagram let's see this representation. So a single arrow that a single line that has an arrow at both ends is a different color."
"Unknown","00;40;27;01","00;40;35;00","So we've superimpose it over this, but that it shows that there's a feedback feedforward loop going off at the same time."
"Unknown","00;40;38;12","00;41;38;15","OK, so here's the temperature information measurements flowing in to contrast with the beliefs. And this is it is in general really important to label the edges, not just use color coding and we'll let it roll. For now, the information is flowing from the measurement to the belief. Yep. And then that gives us the prediction error. Thanks. That the prediction error is used in the selection of action, which then influences future observations now the red circles represent expected values of X I'm actually not sure what exactly the red bottom larger circle is meaning because the prediction error."
"Unknown","00;41;39;02","00;42;11;01","Well, there has to be some way of representing that discrepancy. Right. So they needed the they needed the second ball on the bottom to show difference between prediction error and expectation. I think that's all that's trying to show yeah. Or another possibility might be that the prior is staying fixed, but this is. Yeah, yeah, yeah. Priors can also they can be flexible, but in this case, it's a fixed prior."
"Unknown","00;42;11;17","00;42;41;13","Yeah. That's because we're talking about homeostasis. Yep. Then the observations are diverging from the prior, and the posterior is kind of like the realized perception, which is a compromise between the sensory data coming in and the prior. And so, yes, there's a lot of degrees of freedom depending on how parameters are weighted. This green line might approximate the red a lot more sharply."
"Unknown","00;42;41;26","00;43;08;09","We'd call it a week or prior because sensory data updates the posterior to be more like it. Or it could be the case that having a lot of observations different from your prior don't change it. That's a strong prior where sensory data do not change it as much. But then here is the prediction error in relationship to X."
"Unknown","00;43;08;09","00;43;45;19","I don't know. We can look at the paper, but is mu shown in an equation? I don't have it copied out if it is when we look here while you're doing that. Yeah, but that is the perhaps here. OK, Steven, I think you know, just noting how the effects of the belief on temperature, it's it flows through the thermal sector down into the to get the expectations prediction error."
"Unknown","00;43;45;19","00;44;08;20","So it's you know it's it's it's like you shown there there is a dynamic going down from the belief through to prediction error they mediated it's like the thermo scepter is kind of like a mediator between belief and prediction error on what to do for action."
"Unknown","00;44;16;04","00;44;55;25","And another point I the reason why you can't find the view is because it's not actually pointed to in the description it's not really captured. Yeah and I remember reading and looking and looking and looking and not being able to find it and then looping back up a paper to go OK so how about feedback feedforward now there are cases where view is used to describe internal states that may be implicitly how it's being used, but it's super important that all variables are defined in a paper."
"Unknown","00;44;55;25","00;45;38;20","I wish they all had a table for every single variable and expression that were used. Yeah, it would make the zeros easier, but also it would reduce uncertainty for example, is is this Epsilon even described? OK, Steven? I mean, I suppose in a thermostat in some ways the the internal states, the by electric strip, in some ways it's kind of it holds the kind of the way that the expectations of action can happen because in some ways it dictates the way that the thermostat will behave."
"Unknown","00;45;39;10","00;46;07;01","It's in some sort of ways, even if it's kind of an analog process. So I'm thinking like where where with the kind of in a thermostat, where would I know this is a home homeostatic that so it's a bit more sophisticated now, but extrapolating that out, you've you've kind of got a belief and there's a belief of what something is and then there's an expectation of what you can do about it."
"Unknown","00;46;08;02","00;46;34;07","For instance, my beliefs can go bigger than what I can do in my actions. I could have beliefs about temperature which exceeds where I could even exist or where I am able to change it. You know, it depends on the scenario. So this is so held in in both scenarios in both the body and the context and the kind of the probabilities available."
"Unknown","00;46;35;01","00;47;08;20","OK, so for a non-living thermostat, it doesn't have a cognitive belief on temperature, but there could be something that's computationally like that reflected by like just a digital prior on temperature. And again, these aren't cognitive, personal, affective, experienced beliefs, Bayesian belief. This is just saying random variable reflecting in a model variable on temperature. So even a sincerely held incorrect psychological belief is not the Bayesian belief."
"Unknown","00;47;08;29","00;47;38;02","They might coincide at times if it were a parameter, but the belief here being the prior it must be adaptive. That's the evolutionary twist that actually helps resolve a lot of this because otherwise, right, the design space of all edges by all nodes and that any variable, I mean it's just like saying here's all the words in the dictionary."
"Unknown","00;47;38;06","00;48;17;27","And so evolution helps restrict the discussion to cases that actually do manage to achieve adaptive control. And this is where that translation from the silhouette of a head to a statistical density is assumed that the person who's following along with this just sees that. But it's that you can also see how easy it is to slip into the idea that always we've gone from the physical space and we just held on to the physical space when really now we're talking about a statistical density space and again, if you're not if you're not really, really careful, you could see how people can carry forward something."
"Unknown","00;48;18;06","00;48;40;01","But the actual thing that they're talking about has changed that's why the word discrepancy was such a big deal to me because I'm normally gloss over things, but this time it actually I went, Oh, OK, so there's going to be some there's going to be some moments here where we're actually talking about different things, even though in the continuum, we we kind of think that they're talking about the same thing."
"Unknown","00;48;40;01","00;49;26;09","No, we're not yep. It's the travails of realism and instrumental ism for biological active inference episode 55. Because are these terms, are they an example or is this an example of a model being used to discuss it's a real system, but this, suffice to say, is the architecture of the homeostatic. It undertakes action to reduce discrepancy relative to a prior held belief fixed in this case about what temperatures are expected slash preferred the dialectic of the first two PS from Livestream number 37."
"Unknown","00;49;26;29","00;50;04;10","This is an expectation and a preference because expectations having to do with survival are as good as preferences for survival over evolutionary time. OK, this is going to be contrasted with figure three B, which is the orlistat and so we see the same stack of X, one Y, one light blue, dark blue, red except there's now a second column next to it and there's some cross connectivity."
"Unknown","00;50;04;23","00;50;43;18","So again, the X's are going to be beliefs about so priors on and then these are observations. And so they're saying this generative model extends the home. You start by including a second set of exterior supportive variables that correspond to light intensity y, two observations of light and beliefs about sunrise. So like beliefs about the generative process. So generative model of the generative process furthermore, the model includes a predictive relationship between sunrise x two and body temperature y."
"Unknown","00;50;44;09","00;51;20;27","So again, I wish we could label every edge because the edges are meaning different things even at different times. Like this is a predictive relationship app, so it's an anticipatory one. But then the one about light intensity and the believe about sunrise, there would be ways to make that an anticipatory or an anticipatory and instantaneous relationship. But the result of this sketched architecture is that inferring a sunrise which will only happen with high posterior confidence if the visual observations are consistent."
"Unknown","00;51;21;06","00;51;48;26","So low prediction error, inferring a sunrise, not seeing a sunrise, that is not what is happening in the model. Inferring a sunrise and finding that visual observations are compatible with it can trigger the autonomic response, the behavior you of thermoregulation in an anticipatory manner that is before sunlight actually increases body temperature. Well, how would the parameter be set that way?"
"Unknown","00;51;49;09","00;52;12;28","Because if that were adaptive, then other parameter combinations have been weeded out already by evolution. So that is where we tuck the thread back into the ball of yarn, which is the parameter combinations that are not adaptive die, they dissipate, they fail to exist, they're not going to be measured as things in the future empirically, however you want to take it."
"Unknown","00;52;12;28","00;52;45;17","So like the quote, like how does it work? It's the same as it was 50 years ago, which is it has to do with survival of the persistent Stephen and these, these graphs. But they, they're useful as well as they do show beliefs tied to the observation space, the space available around the observation the whatever, the sensor that is available."
"Unknown","00;52;46;16","00;53;24;26","That's what gives the beliefs its scope. And then the expectations are tied in here more clearly to action. So the errors the errors or the that is that the what's important, the actual dynamic that's driving the action to change something is is coming out of the prediction area error that's feeding into action. I think that's quite important because, you know, this is like the proto animal."
"Unknown","00;53;25;05","00;53;49;17","You know, this is like the proto kind of piece here that ties into a lot of how we think about no knowledge and meaning. And I'm not saying that I'm just I'm just extrapolating a lot, but I think it does show how beliefs are tied to the type of sensor that is being used to shape the observation space."
"Unknown","00;53;49;18","00;54;15;24","And I think that's quite useful. Yeah. And these are just your first gut. I just want to get your gut. Both you guys opinions about that orange barbell at the bottom of a diagram because talking identity. But we're also still talking about dependency. We're talking about duplication we're talking about anticipation. So there's a lot of stuff packed in one orange barbell."
"Unknown","00;54;15;24","00;55;00;17","What do you think yeah. Going back to the full captioned the red circles represent the expected values of X, so if we're interpreting these as the posteriors on X because the expectations, the priors are the top blue ones, so it wouldn't have to be the red circles and they don't mention the word orange. No, not at all. Not note it's there and it's identity."
"Unknown","00;55;01;18","00;55;41;02","Note the lateral modulatory connections in the allostatic network. See 24 for details in 24 is the graphical brain the first and part of cross so yet again this is just a sketch model. They're not using it to fit any data or even simulate any data and it does relate to what Steven said about the the inter sensory or intermodal inference which is one could imagine a cognitive model where if Sunrise if there's noises that are associated with Sunrise, then beliefs about Sunrise can be a variable with edges coming from different sensory modalities."
"Unknown","00;55;41;17","00;56;11;25","So it gives us a separation of the organs of sense and internal cognitive modeling. Steven Yeah, it gives it gives a sense of when would something be important to act upon. So there's many, many things that I could believe I'm seeing or being perceived in terms of this is sunrise. So this is, you know, this is the type of light coming in and this is the nature of the light."
"Unknown","00;56;11;25","00;56;40;29","This is where the light's coming from. There's all sorts of stuff. The stuff that's really filtering down is what is important. And this is where the affordances come in, what affords me to make some action, you know, if it was expanded out. So there can be lots of things I notice. Like, I might notice that, that there's a line there and I might notice and believe it's orange by May not act upon it."
"Unknown","00;56;40;29","00;57;06;15","And so I take my attention to it and think it's useful as as many things going on in the page, you know, so when we're, we have beliefs. But then this what's being acted upon out of all of that to then create some sort of change. So I think that is also quite useful in this architecture oh god."
"Unknown","00;57;06;16","00;57;37;03","What can I add to this? I think really important. So we're talking about in the, in the context of it of a sun coming up. But let's, let's see whether it still is true. And I think it is just to prove a point whether that orange orange barbell still makes sense if we're talking about Daniel anticipating. 61 year old Daniel and Steven anticipating 61 year old Steven and Dean anticipating 61 year old Dean."
"Unknown","00;57;37;23","00;57;58;03","Now I'm much closer to 61 than the two of you but do I need the mark do I need the Monte-Carlo do I need to the Playout to be able to make that anticipation as long as I have the identity and the parallelism and the backwards and forwards looking dependency that we see between x x one and x two and why one and why two."
"Unknown","00;57;58;17","00;58;37;02","That's what I think it makes this a very interesting way of being able to sort of build on the previous homeostatic example thanks Steven. Yeah. I think also this speaks to traditionally we think about the meaning. What does this mean? What's all the meaning out there? As you mentioned, all the data, the stuff that it could mean to relate all these variables, but ultimately and the bit that is actually what active inference gives us is that barbell is where the meaning comes in."
"Unknown","00;58;37;04","00;59;02;07","It's like the way to know how being 61 is for you team is for you to imagine what it would be like to make choices and to act in the world as a 61 year old dean, not necessarily to go out and look at all the, the data set and speak or the beliefs and the things we think about the world, but to actually bring that in."
"Unknown","00;59;02;07","00;59;29;22","And, and of course you've got a better chance to do that because you're closer to being that kind of dean so I think that's quite interesting, that bar below the bottom in terms of pairing together the kind of beliefs about what actions and prediction areas are available. And it's more into that meaningful action meaningfulness realm rather than what does it mean, what's the data tell us."
"Unknown","00;59;29;22","01;00;06;03","So yeah, we might we might get there. And I'm not pushing back on what you're saying, Stephen. We might get there, but I think for now what we're saying, what we're saying is, is that in order to get there, we have to have more than more than a a a single stack of dependencies. We have to have a double stack in order to be able to extend the homeostatic nature of how we've evolved to where we are."
"Unknown","01;00;06;29","01;00;27;29","I don't know, again, I'm not pushing back on you. I'm just saying I don't want to jump that. I don't want to jump that firing test just yet because I think that orange barbell is going to turn into a green arrow and then all hell is going to break loose anyway. So we should carry on. I don't want to take Stephen's stuff away, but I want I think I want to park it because we're going to go somewhere in a minute."
"Unknown","01;00;30;01","01;00;55;06","I'm hesitant to ascribe too much specific specificity to something that wasn't labeled in. The caption doesn't have a clear labeling in the figure either. But I think it is already demonstrated that using graphical frameworks and partitioning is like we have an active inference, we can start to approach some of these questions like how would different kinds of variables be connected?"
"Unknown","01;00;56;00","01;01;38;15","How does that relate to future inference on action and counterfactuals, et cetera? OK, so these sections four or five, six, seven were just laying out the relationship between an evolutionary or a physiological function like homeostasis, alive status or simple behavioral control models of things that are core evolutionary features and functions, connecting them to the kinds of graphical representations which are like a little bit of a hybrid of a Bayesian graph and a factor graph because there's some kind of computations being implied here."
"Unknown","01;01;39;06","01;02;23;03","Whereas in a Bayesian graph the edges only reflect statistical dependencies, whereas we're bringing in a little bit more of like a nuance type relationship that one could imagine could be unpacked a bit more work to be specified, but it's just to show how different graphical models relate to different functions, architectural underpinnings, whether you think this is the actual architecture or whether it's just an instrumental architecture, like a model structure on a given phenomena how do model architectures relate to evolutionary functions?"
