"Speaker Name","Start Time","End Time","Transcript""Unknown","01;02;24;27","01;02;59;26","Where is evolutionary time in this model? We started out by asking like, how do cognitive phenotypes arise specifically over evolutionary, but also over developmental time? And that's where we get to one of the main pieces and contributions of the paper, which is figure for the five main dimensions of elaboration of generative models introduced in this paper. So there's other kinds of changes and ways that this structure could evolve, but they're going to focus on these five."
"Unknown","01;03;00;15","01;03;29;22","There's starting with the Homeo state. Does that have to be our starting point? Maybe not but starting with the Homeo Stat, there's the AI operation, which is identity unchanged. There's AI plus AI, which is just a parallel isolated duplication that's like from one photoreceptor to going to two photoreceptors, so to speak. There's the ALO stat, which is a duplication as well as a cross-linking."
"Unknown","01;03;30;22","01;04;10;28","So these are just sketches. One could also probably write that one as like a duplication followed by a linking. And there's no like change in linking, for example, here. So this is like a few of a taxonomy of operations there's increases in temporal depth within a level of the hierarchy. So looking one more unit further in time, at a given time scale, and then there's hierarchical nesting with a H, and the figure is shown like this because these are like the things that can happen to the homeo homeostatic and then they can have a second round and so on and so on."
"Unknown","01;04;12;14","01;04;49;13","There's so many other ones that could happen like where is reduction, where's loss, where's deduplication, where's the uncoupling of the orlistat reduction of temporal depth reduction of hierarchy? So there's a broad space, but one of the main contributions of this paper is to connect functionally oriented to graphical models of homeostatic and physiological function to the operations that result in the elaboration of simpler model architectures into different architecture."
"Unknown","01;04;49;13","01;05;21;10","Steen, this is an interesting part. I know Steven wants to say something too, but really quickly, there's no plus minus multiply and divide. There's an operation, but there, there is no symbolism for that. And again, that's, that keeps it safe on a statistical level. I think that's, that's a, it's a nice tell there. And I want to again, for somebody who is just sort of looking at this for the first time, pointing that out, it's not there."
"Unknown","01;05;21;18","01;05;55;12","And because it's not present, that tells us something to your point about maybe how do we get deduplication yes. It's well, I plus I it is like it's it's a suggestive use of the edition operator but we're not adding these just like integers. So yes, there are kind of like categorical operations that constitute this evolutionary algebra. OK, Stephen, anything on figure four?"
"Unknown","01;05;56;00","01;06;23;12","Yeah, I was just saying that. I was saying they've set up, they've set a kind of a paradigm from the homeless that they've taken that through and they've shown that it plausibly can carry through to cognition. And then like you say, that can be other ways. But what they've now given is they've given some legs. Another way to think of the legs that can be attached to that paradigm is this modeling approach."
"Unknown","01;06;23;12","01;06;54;17","Well, they could have chosen others by taking that. There are certain things which are hard baked into that early stage choice making, which then makes other paradigms wouldn't fit with it. Right. You know, you stand even with the other instruments, novelist you know, your instrumental models, your release models don't make sense unless you with this, unless you take in some of the paradigms that this structure creates Yeah."
"Unknown","01;06;55;05","01;07;30;23","Agreed. Thanks. So just maybe think like is this functional model realism? Like the function of the model is what is being tracked through time. And so that there's many other alterations that could occur. And then there's the even more granular like parametric changes or changes in connectivity or edge types. And then I think as you said, you know, when all hell breaks loose, that just what's interesting here."
"Unknown","01;07;31;01","01;08;11;03","Let's look at the analyst at a little bit closer detail OK? So previously we looked at the Alister and we were like, OK, there's an orange bar now Alice that has a green bar, it's a green arrow and it's a unit directional one. Well, this one, the dependent on the Alice Dot has the green bar. Oh OK. Well at my bad eyes because I saw, I saw the little arrow from the blue actually turning."
"Unknown","01;08;11;03","01;08;18;01","I didn't actually see that there was two circles. Thank you. There's my 60 year old eyes for you. Yeah."
"Unknown","01;08;20;04","01;08;45;19","OK, cool. And so each of these are in quite a different domain or at least like a different aspect of cognition. And these are the transitions that I can engage in. So like duplication retains the exact same function but it's a very important step and that's a little bit what I explored in the Dart zero with genetic duplications."
"Unknown","01;08;45;29","01;09;12;16","Like on the left side here on the screen having a region of the genome duplicate. Yes, one of the duplicate copies can just degenerate. That may be like opening up space or creating motifs for other kinds of later evolutionary steps. So even this is not like a failure, it's just a change. There's neo functional zation where then those two models can start to sub specify."
"Unknown","01;09;12;17","01;09;39;08","Like if you only have one photoreceptor, it has to be doing what it's doing, but duplicating it then allows one to focus on a different wavelength than the other, for example. And then there's sub functional zation, which is where initially a composite function AB becomes to like enzymes start to sub specialized on one of the two functions of the ancestral."
"Unknown","01;09;39;08","01;10;20;07","So this kind like a role duplication, OK, so duplications and important events. Then there's the ALO start and multiple things happen with a but we're seeing it as there is a duplication occurring and there's also cross-linking occurring between beliefs in one modality or beliefs about one type of thing influencing observations or about another kind of thing, as well as this lateral modulatory green orange bar we have."
"Unknown","01;10;20;22","01;10;57;27","And then we have two kinds of expansions into temporal depth sort of local expansion with the T operation just pushing the model one step deeper. And then the H hierarchical nesting operation, which brings it to another timescale of analysis then and this is where I really struggled, and that is in when we were at our start, it wasn't just comparative I felt like you had to build in time, especially if we're talking about identity, but then it was like, no, we're just going to leave it comparative and then we're going to introduce the windows up."
"Unknown","01;10;57;28","01;11;31;10","This I mean, I understand why they're doing that to try to make it tractable, but I don't know how they can say it can be compared to meaning. I know the difference between A and B right now, but not not sort of address the fact that in order to differentiate into A and B, some some amount of time had to had to have been applied to that split so I had as I was saying, you have to go back in time in order to just be able to do a comparison."
"Unknown","01;11;31;23","01;12;05;27","So it's temporal only going forward in time. I don't mean all hell broke loose, but I mean, I did ask this question. You're right. Like here there's there's the triggering in an anticipatory manner. And so in one view, it's like but this is a single time step model. So how could that occur? Because it doesn't have a temporal depth on the other hands again, like kind of that those two senses of representation in a structural sense, if the models are a single time step model it can't have a representation through deep time."
"Unknown","01;12;06;05","01;12;35;11","Ergo, it cannot be anticipatory functionally right. The other side of the coin would be if it's enough at this time step such that beliefs about sunrise trigger and a response, the model can be functionally anticipatory without a temporal depth representation. Right. Which is why the representation discussion was very important leading up to this one, because we're all over those eight quadrants here."
"Unknown","01;12;36;03","01;13;13;17","Because in evolution and this is something like cognitive psych people talk about is like our cognition being shaped towards effective, which is to say productive slash reproductive success is not towards like ultimate truth discovery. And so should we be too surprised that our instrumentation, which has had a certain objective function, is then susceptible to being convinced about things that are not true?"
"Unknown","01;13;14;09","01;13;36;02","Yeah. Well, I don't I don't socialize with those people, so I don't know. I just knew that when I was looking at it, I was thinking of in real practical terms, what, what, what is built into this in order for it to still make sense. And that wasn't necessarily passed out in the diagram. You kind of had to fill that in through your own interpretation of what was going on."
"Unknown","01;13;36;05","01;13;46;05","So thus back to discrepancy, that discrepancy thing is going to come up again and again and I'm really glad that they inserted as the beginning. Thanks, Stephen."
"Unknown","01;13;48;12","01;14;09;25","I think it's useful here to hear this temporal debts and hierarchical that been sort of spelled out. So because I think it sometimes is a little confusing in other papers quite where it fits so temporal depth. And this again might be where some of this ontology work can be useful just to sort of see if that can be kind of consistent."
"Unknown","01;14;09;25","01;14;45;11","But if temporal depth is, you know, you've got variables for past, present and future states, but they're operating maybe, maybe within the same kind of dynamics. And then if you've got different temporal rates operating simultaneously, then you get that hierarchical depth. And I thought in the past it's sometimes thought temporal that would have covered that more hierarchical depth."
"Unknown","01;14;46;10","01;15;31;16","So you know, this is interesting to think about whether this might be actually the way that that differentiation is best made differentiation is probably best made with reference to a specific model. And this gives us the design language and the grammar and the motifs. So if we want to predict 100 years in the future, should we have a decade model with ten year models, that's a times depth of ten decades, and then a nested model with a depth of ten years or but we have a one layer model with 100."
"Unknown","01;15;33;11","01;16;02;13","They're very different. And it's not to say that one is like more accurate or less. And depending on how the exact situation is set up, maybe the computational requirements of one or higher are different than the other, but that's the discussion to have. Do we want to have a B transition matrix? Let's look at a nested model with temporal depth so here we have on the top level of the Model S state two."
"Unknown","01;16;03;17","01;16;47;23","This is temporal depth happening at the upper level of the model. Three discrete time points in an upper level that is temporal depth. There's also nesting within each time step. There's a cognitive rollout on three time steps. This is one type of nested model, but there's other nice things that can exist. So here we see a depth of two and then at each level of the nesting, there's three temporal depth but they're totally different in architecture and in function."
"Unknown","01;16;48;00","01;17;36;17","So it is the interesting discussion like especially when we have to do multi scale prediction like Fermi estimation. So if the prediction is within one time scale, there isn't necessarily a need to nest. But once we get into larger time scales or where there's recurrence over multiple time scales, it makes sense to have a nesting model. Like if we wanted to predict someone's activity over the next seven days, it might make sense to have a day model with a nested model inside of that, because then within each day there could be parameter setting versus just trying to fit one time series and find the parameters that make that one time series oscillate in a circadian"
"Unknown","01;17;36;17","01;18;04;19","way. Instead, we just need a day model with a very specific kind of simple transition and then a transition at a nested level with a depth that's measured at the hourly or the minute timescale rather than the days. And that becomes especially important when doing family based model fitting like variational inference. So we're not just like getting all the data points and fitting a spline through them, but we actually need to have appropriate model structure."
"Unknown","01;18;05;09","01;18;34;09","Otherwise, free energy minimization will drive right off a cliff, just like we talked about with actual bacterium. So if we want to do free energy minimization and model selection on model structures, we can find the best model relatively easily given the families that we've specified. But there's no guarantees once we step outside of that spotlight that we're even in the right category structurally."
"Unknown","01;18;34;21","01;19;11;10","And so that's why humans having these design motifs in mind and many, many, many more helps us not get into what seems to be a global optimization based upon free energy minimization, but actually is a very relatively local optimization based upon unimaginative model structure learning. Steven. Yeah, thanks. That's really helpful and also ties into something I've been really thinking about in terms of the modeling itself is these, these, these scales, these steps you know, you're talking about the multi year decades."
"Unknown","01;19;12;01","01;19;35;00","When we're modeling, it's like, what do we have access to? So we tend to ascribe that in terms of what can we externalize and what can we use to put something into a model if it's instrumental? And then the cost is a question of, well, what is the realist perspective on that and what is there that's within our conscious awareness of being in the world."
"Unknown","01;19;35;11","01;19;57;20","Sunny, that can be reported as an event, a story and what time scales are present there. When you get into 100 years, it's beyond that. So then you're saying, OK, what you're going to extrapolate what sort of temporal structure. But on the other scale, if I'm asking, what do I think I expect you to do next or to Dean to do next?"
"Unknown","01;19;58;12","01;20;24;21","And it might seem intuitive. I can have a whole series of temporal and nested scales going on, which is not even available to me in a in a cognitive conscious way, I might have a sense of a feel for what I think is going on, but a lot of my predictive processing will be happening at rates unavailable to my conscious awareness."
"Unknown","01;20;25;05","01;20;45;12","So that's that also ties in. I suppose. I'm not saying it's not a sort of answer the challenge, I suppose, but it is the challenge of, you know, how much ends up being what we can get a measure on to put into our model as much as what it is. And that's the same challenge in a way that comes even from the various perspective at some level as an organism."
"Unknown","01;20;45;29","01;21;09;08","What is it that I even can access in some realistic way? You're not saying we can mostly or no, that would be put into something like this. So I think you're going to say something but I was going to add is that I mean, so the paper talk about how do we how do we use certain math to be able to understand maybe the evolution of cognition."
"Unknown","01;21;10;07","01;21;30;21","Right. That's essentially what the papers try to give us, you know, point in that direction. So again, in order to make this accessible, in order to sort of lower the barrier for people who actually want to have this makes sense because they don't necessarily spend some sums of hours on trying to figure this stuff out, like the authors or maybe even us."
"Unknown","01;21;31;20","01;21;50;05","I'm going to I want to point out something that I think is obvious to us, but maybe not so obvious to people who are looking at this and going, I have no idea what they're saying. I think, first of all, is that there's a chronic a chronological chronology, which we keep going back to, not just at the temporal depth level, but so that's relativity math."
"Unknown","01;21;50;18","01;22;20;26","There's an evolutionary aspect to this that's algebraic math, and there's a dependency so there's a statistic about do we have to be polymath in order to be able to feel our way through this? And I'm going to go back to what I said at the end of the 37 first, Carl first and said, You're not to be polymath, but you better be at least somewhat comfortable feeling comfortable with the math because there's no one math that's going to get you here."
"Unknown","01;22;20;26","01;22;47;25","It's a blending of all of them. And then it's how it how you feel about that. That's probably going to be the thing that lowers the the impediment to really being able to use this now in real practical terms going forward. So what's the next evolutionary step? Right it's how you're able to turn this into something. So I think that's I think that's one of the great gifts of this paper."
"Unknown","01;22;47;26","01;23;33;15","If you're not afraid of being if you don't consider if you don't to identify now where you don't duplicate now where you don't allow start now as a polymath, maybe maybe that's something we we all people that want to get into this maybe the British pronunciation of math helps reflect that there's already a plurality of math. And Kirby Earner coming more from the synergetic side, talks a lot about this, actually, like how the discourse around math is universal language makes it sound like math is a singular language when actually math is a plural verse."
"Unknown","01;23;33;25","01;24;09;04","And so math reflects that a little better, better it's not like these are just sort of slopes on one mountain, and that's mount math. And it's so high and only a few people get to the top and scale every side. This is just like we're using math. Yes. Of all different kinds. Stephen and I often that you see a lot of this in the papers that are published around active inference is often a team of people or a group of people where maybe one member is that higher level understand of the math."
"Unknown","01;24;09;20","01;24;32;12","But the other question is to understand what it mean to make an observation that could be a very the mathematician may not be the one what like some of the work with Brian Smith's work on the gut, you know, it was like, well, they're going to do inference well how do you get some tracks apple sauce on what's the gut doing?"
"Unknown","01;24;32;12","01;25;00;06","So they created some electrode. I'm not quite sure how they did it, but they had some way of getting sensory information, effectively sensory information or effectively some sort of information they put into their model and so knowing how action and observations flow in and the implications of that I think is also kind of a big part of of this."
"Unknown","01;25;00;06","01;25;25;01","Right. And in some cases it may be trivial part because it's fairly obvious. In other parts that may be the biggest area to and then that may be the biggest barriers. Well, often in organisms. Right. How do you how would you even access plausibly the approximation science which is in some approximation approximate. It's just chaos that it's tractable."
"Unknown","01;25;26;19","01;25;57;08","Yeah. The rate limiting step or impact and improvement in the real world is unlikely to be any single individual's conceptualization of math on a team if it's structured appropriately. And for those pushing the frontiers of math, their understanding of math is quite literally a rate limiting step for them. Or maybe it might be something very mundane like time availability."
"Unknown","01;25;57;21","01;26;26;02","But when it comes to thinking about real model based science and translational applications of active inference, I think that we're working towards new ways of combining skills and having shared knowledge, resources that help make that make sense. And using shared language and ontologies, narratives, formal documents, tools, or NFC, because we're doing it on teams and we're on line."
"Unknown","01;26;27;14","01;27;11;06","Let's just in the last 20, 30 minutes go through the final pieces of the paper so that this dot one will have been like a first sweep, initial pheromone deposition, and then we can return and take some cul de sacs, et cetera. So Section nine explores a little bit how the duplication operation allows for multiple behaviors to arise. And that's sort of by analogy to the the genomic duplications and specializations and all those different routes that can occur here."
"Unknown","01;27;11;17","01;28;03;14","They connected duplication a little bit more directly to the factor graph models in the sense that duplicated motifs have dynamics that are conserved over different sensory motor domains. So let's just say that we just had a visual model of the column of visual, and then we duplicated it. So now we have two photoreceptors with parallel columns and now the photoreceptor in the second one changes into a chemo receptor because instead of expressing red option protein it's expressing an olfactory receptor protein there can be a conservation of the dynamics of inference even when the observation has changed."
"Unknown","01;28;03;28","01;28;48;05","But it was a slot for observation. And so we went from having like binocular vision to binocular vision to binocular vision and olfactory perception. But you can't get there in one jump to just like duplicated transpose. It's not likely to happen in an evolutionary context. And we can see the structure of these graphical models as equivalent to being factories probability distributions, which is to say that the sparse connectivity of variables means that we can make parts of the model that can be like fine tuned independently in a way that can be fit very attractively."
"Unknown","01;28;48;20","01;29;19;19","That's the factor graph, that's factor ised Bayesian inference, and we've talked about that in other places but just here, all we need to say is duplication enables like a control C, control V copy paste, and then let's edit the other version, but that can now happen with evolutionary features and functions in real quick. Your hand gestures in this section point to the yours that gone with the gone or mesh beginning and then point to."
"Unknown","01;29;19;19","01;29;48;13","I'd like to pull that apart a little bit, but that's carry on. But that's what I took away from this. The meant the mesh began and in the beginning there was a mesh begins. We'll return to that for that too. Yeah, OK. Section ten talks about temporal depth. It's about time and about the endowing of generative models with temporal depth."
"Unknown","01;29;48;25","01;30;29;04","And the way that that supports prospective inference, anticipation or retrospective inference, which is like memory so here's what the operator looks like. We have X Subtitle X Out of time point. And then now there's X plus one the next time point or T plus one could be now and then T could be the last moment. So memory and I think I know because I don't I still see figure four slide 29."
"Unknown","01;30;31;02","01;30;58;03","OK, yeah. So the structure of anticipation and of memory are very similar. It just depends whether one has the stream of observation is happening on the left side and protection or the stream of observations or on the right side and in which case it's retrospection. Stephen. Yeah, I mean, so even they talk about what the police do. It's very hard for someone to lie backwards."
"Unknown","01;30;58;16","01;31;36;22","So you always get them to tell this story backwards because it's a it's very hard for them to do that because I say if we're creating things retrospectively, but so playing them forward, so to speak, it would kind of time without an auto emancipate that I looked at police in the paper. I see policies is that polices it's the great opportunity for my favorite joke."
"Unknown","01;31;36;22","01;32;19;05","But I want this section talks about temporal depth. OK from whence temporal depth? Various researchers have speculated that a major driving force for the development of deep temporal models was foraging and there's a lot of interesting empirical and conceptual reasons to think about foraging in terms of temporal and spatial depth of model and that's true in the vertebrates where they're discussing mainly like hippocampus and interactional system and in the invertebrates that don't have a hippocampus and terrain system."
