"Speaker Name","Start Time","End Time","Transcript"
"Unknown","00;00;23;18","00;00;52;25","All right. Hello and welcome everyone to Active Flab Live Stream number 38.1. It's February 16th, 2022. Welcome to the Active Lab we are a participatory online lab that is communicating, learning and practicing applied active inference. You can find us at the links on this slide this is a recorded and an archived live stream. So please provide us with feedback so that we can improve our work."
"Unknown","00;00;53;18","00;01;15;18","All backgrounds and perspectives are welcome and we'll be following the etiquette for live stream. Just release an unending torrent of emojis if you have to speak or just raise your hand, I'm sure that we'll get to it if you're watching live, please feel free to write questions in the live chat and we'll have enough time to hang out and discuss during the start."
"Unknown","00;01;15;18","00;01;51;05","One where we'll be opening into the paper. Check our active inference dot org for updated information on participating in any of the labs activities. I hope you'll find something that resonates with you today in Active Livestream number 38.1 we're going to be learning and discussing this cool paper The Evolution of Brain Architectures for Predictive Coding and Active Inference by Fasulo, Pas and Freston from December 2021."
"Unknown","00;01;51;24","00;02;18;14","And we're just going to enjoy discussing it and opening up any ideas or questions that us here on the panel have or those who are live chatting us. And we have some ideas and thoughts prepared a few things that we know that we can go into. And also I hope that everyone has brought some other prepared seeds and also of course spontaneously feeling like new things are arising."
"Unknown","00;02;19;05","00;02;43;10","So we'll just start with some introduction and warm up. We can each say hi and then maybe it'd be cool to just also mention like what got you excited about the paper or what made you want to discuss this paper? What's something that stayed with you? So I'm Daniel, I'm a researcher in California, and I was very excited by the evolutionary focus."
"Unknown","00;02;43;27","00;03;11;00","A lot of my research over the last years has been in evolution and ecology, so it's always awesome to see how people are thinking about how active inference, free energy principle and evolutionary studies can all be learning from one another. And I'll pass to Stephen. Hello, I'm Stephen Cilia. I'm in Toronto and I'm really interested in how this paper connects to my work with a spatial meaning."
"Unknown","00;03;11;00","00;03;45;18","Make it in social topographies because this paper talks about more biological, nice and stage of development rather than some higher order meaning often people think about and I'm really interested in how this sort of grounded bottom up and active ecological approaches can be thought about as something where we can actually ground a lot of our meaning making. And so I'm interested in how this might match with some of that thinking."
"Unknown","00;03;45;18","00;04;27;06","And I will pass this over to Dean. Thanks, David. I'm Dean. I'm in Calgary. What I found interesting about the paper is that given that I've worked with a lot of young learners for a lot of my life, I was really it was really interesting to see how this affirmed a lot of the thinking that I was doing when I was trying to get people past the idea that science is only about the biology and the chemistry and the physics, that there is a statistical predictive component to this and those relationships and that in that realm can build a certain sense of what the underlying architecture is."
"Unknown","00;04;27;16","00;04;58;27","So as I said, this is this is a lot of this is affirmations and it's kind of it's it's kind of seen as being not part of what is typically addressed as core learning. But I think it should be back to you. Dan. Cool. Nice intro. Let's just start with a big question and then either of you, if you have any reflections on the big question or we'll go over to blank slide and just bring up some questions we have."
"Unknown","00;04;59;12","00;05;21;21","And also it might be good to go over just some of the key points in the paper, like what did they actually do in terms of their contribution. So the big question, or at least one way to phrase something that might bring someone to approach this paper, what is the evolutionary neurophysiological basis of cognition and how do complex cognitive types arise?"
"Unknown","00;05;22;01","00;05;56;08","Like you don't go from zero to colony in one time step. How does it happen that evolution arises from precursor sometimes simpler, but also sometimes more complicated precursors? Stephen mentioned like what is the basis for sense making and cognition and sense making are very related. And what's been fun over these last weeks and months is we've explored basic or simple or reduced or basil cognition from a variety of perspectives."
"Unknown","00;05;56;14","00;06;51;19","Like we talked about the bio electric components of thinking about basil cognition with Mike Levin. Now we're thinking about a slightly different approach to understanding base or cognition which we'll be discussing here. And then also we've looked at some of these more complex cognitive phenotypes like mental action counterfactuals, deep temporal inference, all the objective logic, which we'll get into probably later how can we use integrative models of perception, cognition, action and impact like active inference to study this whole continuum and diversity of relatively simpler in our perspective, cognition, and also relatively more complex cognitive phenotypes and everything in between."
"Unknown","00;06;52;02","00;07;31;18","So yes, Stephen. And then on with it. Thanks, Daniel. Yeah, I mean, I suppose so. What, what some of the paradigm impacts of that, of taking that all the way through, I'm one question that might come up which you may or may not have an answer to or thoughts on, but, you know, Mike Levin's work with the Teleological Colons the different nested levels and how this sort of a could be thinking about what kind of action control potential of these different nested levels might exist."
"Unknown","00;07;32;04","00;08;01;05","I would be interested to think about how this may either be able to connect to that. I can see it connecting philosophically or whether there's another bridge needed between this modeling and that type of modeling. So it's just something I've mentioned a great Dean. Anything to add or perhaps I'm going to wait till you get to figure one."
"Unknown","00;08;01;22","00;08;23;28","OK, so we won't go through all of the finer points in the paper. That's for the reading of the paper itself. Nor will we even go over all of the overview, which is what the dot zero video 38.0 is for. So, you know, turn back time and watch that one if you haven't or pause the video. If you're not watching it life."
"Unknown","00;08;24;13","00;08;54;09","But what this paper does, as evidenced by their roadmap, is introduce a few basic principles of cognition, predictive regulation and control, and then also structure learning in generative models. That's not how every neuroscience biology text is going to begin the building blocks of cognition. It's not how every evolutionary neurophysiology text is going to be framing cognition, but that's what they do here."
"Unknown","00;08;54;22","00;09;23;26","And that will play into how it's similar and different than other approaches. Then with those building blocks in hand or on the floor, they provide three examples of motifs that ancestral brains may be modeled as having or may have actually had with those three examples in hands, it's then possible for them to state a more general way of thinking about the transitions among different structures."
"Unknown","00;09;24;19","00;10;12;19","These structures represent brain design as structure learning in generative models that is called in evolutionary algebra and they introduce five operators that can basically either leave unchanged or change the structure of brain design with respect to generative models. And each of those are explored in terms of what are the architectural changes that that evolutionary transition is, and then what are the functional consequences of that kind of an evolutionary transition then they have some discussions about how sequences or patterns of application of this evolutionary algebra could lead to different evolutionary phenomena."
"Unknown","00;10;13;01","00;10;46;17","So, for example, increasing temporal depth in the future means that models are increasingly prospective, increasing temporal depth in the past is like memory, etc. And then they close with mapping to a phylogenetic tree and thinking about that evolutionary algebra of state transitions being mapped onto the bifurcating tree structure. That's called a phylogenetic tree, which shows the relatedness of different life forms that's the road map."
"Unknown","00;10;47;06","00;11;18;28","Let's go to the long awaited Fig. one and talk about the action perception cycle and predictive regulation. And so there again discussing this in the context of predictive regulation, anticipatory regulation, cybernetics and control as a basic design principle. For the brain. So, Dean, what do you see here or what would be cool to think about so this follows, I think, is this the usual pattern when we're trying to explain where we're going to go?"
"Unknown","00;11;19;20","00;11;47;00","And so you just had a road map up. And I think a road map is a way for the people who are reading the road map to find their way. But I think what this diagram shows is that in that in the middle up there, there's something called a discrepancy. And that discrepancies are going to be given have given a label y and what I think is really interesting here is there's a there's a flip potentially that can happen here."
"Unknown","00;11;47;14","00;12;34;20","That discrepancy is where what I would describe as a rule factory and rule in the sense that we've we find pattern that's kind of our place where where as it says, the prediction and the observation come together. And I believe that that's different than a road map, which is find your way. I believe that discrepancy of that road factory is wayfinding and I think what we have the potential to do with this paper because of the way that they have sort of presented the information is the words become X, eventually become X placated rules, which then become action in the phenomenological space that's where it gets really, really interesting because I think most of the"
"Unknown","00;12;34;20","00;13;04;28","time when people look at things as a subject, they've taken the world and they've collapsed down to words and diagrams and models. But this potentially allows us to do this, flip that and move from the words back out into the space with a little bit more confidence. So yeah, that's why I wanted to kind of start here because I think the word discrepancy, it's the first time I've seen it in this kind of figure model and I really like it cool."
"Unknown","00;13;05;09","00;13;27;18","Yeah. It makes me think about setting off on the road trip, on the mental actions that reflect the paper, and there's the road map, which is super informative, but it is like in Structuralism, it's saying you're going to go to streets and then take a left turn at the stop sign. And then when this happens, then you'll do that."
"Unknown","00;13;27;26","00;13;59;22","And if you've see this, then you've gone too far. Kind of classic instruction type sequences. Here we have a figuring out because it's visually arranged with some local connectivity that's suggestive of a causal connection through time. But by no means is there only one way to read this simultaneous figure. And so that allows potentially for more of a figuring out, including a figuring out of rules."
"Unknown","00;14;01;04","00;14;42;24","Yes, it is indeed a little different with discrepancy at the intersection here, Stephen. Yeah. So this ties in with the lower bound evidence control approach on of action. So the idea is that action is what we can track to be approximate and perception is something that we can access but can't. And we can try to make more sense of this is a harder a harder piece of the equation to get together to get a handle on."
"Unknown","00;14;42;28","00;15;02;03","So I'm wondering if that's I mean, how how do you feel about that declaration in terms of its use across other areas of applied active of inference? I think it's a it could make things a little bit more digestible for a number of contexts."
"Unknown","00;15;08;29","00;15;33;00","OK, I'm thinking about this in the context of recognizing that it's different than other action perception loops that we've seen, which is just really important to keep in mind that we're not perceiving something that we're projecting too much because other times the outgoing arrow from the entity is what if this were a mark of blanket type diagram, which they often are?"
"Unknown","00;15;33;17","00;16;08;09","The outgoing arrow would reflect active states and then the statistical dependencies that are outgoing. But where is action? It's on the bottom, right? So let's really try to understand why the pieces are placed this way. The outgoing feature of the cognitive entity is the prediction. And here's observation coming in. If this were a mark on a blanket diagram, we'd have the worlds, and then the incoming statistical arrow would be the observation that would be the sensory states."
"Unknown","00;16;09;11","00;16;45;14","So here it's the outgoing prediction of the entity and the incoming sensory data or observation. Those two are being differentiated to form a discrepancy which is just a qualitative term, but it could be then brought a little bit more formally into a prediction error or a little bit even beyond that into like a free energy differential. This discrepancy has two arrows coming out of it."
"Unknown","00;16;46;14","00;17;26;18","From the discrepancy is a rising perception and the changing of beliefs. This perception always involved changing beliefs and the discrepancy is also giving rise to action. So what kind of a thing is discrepancy such that the inputs are prediction and observation and the outputs are perception and action. So at the very least, this is not the Bayesian graph representations that we've seen before or that we'll see in just a few slides with a more traditional interpretation of nodes as random variables and edges as statistical dependencies."
"Unknown","00;17;27;05","00;17;59;06","This is a little bit more like a thought map that then connects to the Variational Free Energy Equation, which we talked about in number 37 a lot more. But just to recall, there's the red and the blue lines, these two different components of the variation for energy, and those are shown again here. So check out 37 to learn more about the red and the blue and about variational and expected free energy."
"Unknown","00;17;59;06","00;18;34;29","But for here, we're starting with this action prediction discrepancy motif and then connecting it to perception and action as a variation of free energy minimization. Stephen. Well, I think one thing that's useful with this more nice and representation is this discrepancy can go in different, different directions. So it can be discrepancy in terms of temporal occurrence. When was the prediction predicted to happen?"
"Unknown","00;18;35;17","00;19;19;29","When was it observed? But it can also be what kind of prediction and what kind of observation or whereabouts was the prediction where a balance was. The observation is many different and at different scales, you know, so there may be that at the lower level is this quite a big jump between one? I predict the baseball coming to my hand when that prediction was made, when that observation occurs, and also when that is chained up at different, slower, bigger steps of the nested Markov blanket."
"Unknown","00;19;19;29","00;19;58;06","So the sequence so this idea discrepancy is I suppose is probably the biggest bucket they could find. I would imagine that that spot and that may be partly why it's there can I just add to that, Stephen? I think one of the things that's interesting, especially after just doing the 37 paper where we were talking about guides, to me, the timing of this was absolutely immaculate because now all of a sudden we've gone from guiding to almost taking potentially a referee's position on the world, which is a whole different thing than than taking the, taking up the position of being a guide."
"Unknown","00;19;58;27","00;20;18;18","And that was, I mean, that's not nuance, that's not subtle, that's quite, quite an identity shift. And we're going to actually get into identity when we look at some of the evolutionary steps later on. But I, I wanted to slow down on this because I thought, oh, that's not, that's not a minor change, that's a whole different perspective shift."
"Unknown","00;20;18;23","00;20;44;18","And I think we need to really make note of that because I think it colors a lot of what's to follow what makes you say that we're a referee in this situation discrepancy? There's a difference between what what the world is telling us and then how we rule on that. So think of any game where you get into an argument with the refs are they wrong?"
"Unknown","00;20;45;01","00;21;05;12","Are you wrong? It doesn't really matter. The point is that there's a difference. That's when you said differential graphing is maybe one of the ways to be able to make that explicit. That's not how it's typically framed out when we're talking about Bayesian or Markov and stuff so I think this is I think this is a big move."
"Unknown","00;21;05;28","00;21;37;22","I know it might seem like a tiny one, but I think as we go again, as we go deeper into this paper, it affirms a lot of the stuff that I actually saw when you're trying to go out there and forage and figure. So I'm excited to keep going yeah. It could be like the observation the baseball player is running towards the base and the coach is observing and there's this ongoing prediction and observation with no discrepancy because part of the generative model includes the person moving through time."
"Unknown","00;21;38;12","00;22;08;22","And then given the observation and the generative model the coach predicts, Slash expects and prefers, which we'll come to you again later with the three piece that the baseball player is safe. You rarely see super animated refusals when a call has gone towards somebody, but it's when it has gone against it's violated their fitness that there's a discrepancy with what the referee has called and what the interested coach has called."
"Unknown","00;22;09;10","00;22;43;13","And that is going to lead to some consequences. And again, we're still not at the Bayesian graph level, but that's going to be the next figure. Stephen this can then build on the idea of what's cognitive. What can you have a perspective on this? I think what you're saying that this referee position is as well as the kind of the swarming dynamics and the kind of inactive processes, much of which is beyond all ability to sense or integrate."
"Unknown","00;22;44;04","00;23;14;07","What is it once it starts to hit, what's the big bucket at the kind of cognition level that still isn't too much of a of an inflation? So in this case here a discrepancy. There is a sense of being able to distinguish perception and action at some level and find a discrepancy, which in some ways I would imagine covers a lot of what cognition would require to be thought of in a cognition way."
"Unknown","00;23;14;27","00;23;44;23","Other types of action, for instance, how we heal or grow, maybe action in perception won't be so separated, but this is trying to come at the idea of cognition. So maybe that also informs this process. Cool. So Section two again was just about the two concepts of predictive regulation and control. That's what we saw here. Predictive and control."
"Unknown","00;23;45;28","00;24;30;03","So it's just conceptually laid out. In Fig. two, they formalize brain design as structured learning in generative models. So here we have a different figure. We still have the cognitive entity and the world. We add in one layer of absolute the essential act in terms which is generative model, generative process. The generative model is the cognitive entities model of the generative process is the underlying phenomena that gives rise to observations."
"Unknown","00;24;31;16","00;24;59;22","It's the difference between the cognitive model of vision, a generative model of vision, and the generative process of visual input, which is like photons in the sun and all of that. So these are very different. They're complementary. But just so that we're really clear going forward that we're going to be using those in their specific sense, not using them like, oh, well, it's a generative model because this is a model of cognition that makes me excited and think of ideas."
"Unknown","00;25;00;02","00;25;44;27","That's not how we're using generative model here. So just to be clear on that, now we see action as changing the world represented by you and the cognition involves partially action selection, policy selection, planning US inference, but not going to all those details yet, which can have some influence on actual unobserved hidden states. The world x star x is the cognitive model of that hidden state of the world that is being inferred and y is the observation that then feeds back into the cognitive model."
"Unknown","00;25;46;13","00;26;25;10","So that's what these nodes mean. It's about partitioning the cognitive model from the generative process, separating the generative model from the generative process. And we're starting to see the traditional blanket form with observations, having incoming statistical dependencies and actions, having outgoing statistical dependencies. What else do either of you see in this model? Yet in so let's go back to being the referee for a second."
"Unknown","00;26;26;12","00;26;57;22","The assumption is that you're already attending and most of these models that that we have taken up in the past, especially in 37, what they try to focus on is getting from A to B. What this is essentially saying is let's add something to that translation, right from A to B, whatever we're trying to incorporate in this representation, let's maybe look at the interpretation part of it now and the recitation part of it."
"Unknown","00;26;57;22","00;27;20;16","So if I'm the umpire and we can all be umpires, we don't have to do that just in a baseball game. This is incorporating now a certain critical process I was attending and I saw this, but then there were 60,000 other people also paying attention and they saw that. That's where I think this is getting really interesting now."
"Unknown","00;27;20;29","00;27;47;25","This is actually bringing it back to sort of I still think it's an instrumental piece, but I think now we're going to incorporate some of the reality and where the 60,000 wrong or is or is the one person who yelled out safe wrong? That's what I see in this because that use is definitely embedded in the generative process, not the generative model."
"Unknown","00;27;50;13","00;27;51;13","Great. Thanks Stephen."
"Unknown","00;27;55;16","00;28;43;18","So the question that comes into mind is where the body is in all of this. And I sense that the generative process is the bigger process with the world the generative model gives a way to access those fires and to give away the hidden states and the cognitive model. Generally speaking, cognition is thought of more in terms of deductive and inductive reasoning and logic and it could be that the that there's elements of the active that could be held within the kind of body."
"Unknown","00;28;43;18","00;29;15;14","And I suppose there's a question there that sets a how and where that is. I don't think anyone quite knows the answer to that, but that's just my thought So let's remember that this partitioning is specific to a given instantiation of model based science, just like Majid was talking about. So we're not going around and assigning aspects or phenomena of the world into either generative model or generative process."
"Unknown","00;29;15;14","00;29;40;03","So where does the body fit in? Well, with respect to a model of the body being a structure, the real thing that gives rise to observations, it's a generative process, looking at the coin from the other side and thinking of the body as a generative model of its niche doing inference on certain things or acting as if in that sense it's generative model."
"Unknown","00;29;40;03","00;30;07;00","So different kinds of entities are not going to be just assigned simply to one side or the other. It's going to come down to what is specifically being discussed there's a few other not complex offers. But first off, just note that the notion, the notation here is not the same that's used elsewhere. So we will move towards better and cleaner or reformable notation."
"Unknown","00;30;07;00","00;30;28;03","But like X star as an external state and X as an internal state might be clearer for some people. It also carries a little bit of a baggage that the hidden state is exactly what is being inferred about the external world. Like there's a temperature parameter in the brain and then there's a temperature parameter outside in the world."
