"Speaker Name","Start Time","End Time","Transcript""Unknown","01;27;36;23","01;28;05;05","But we don't have to change anything for that video. And then as pixels are changing, update me on how to change them. And so that would be like the maximum efficiency encoding. And so you would give a full resolution of the first frame in the movie. That's the prior, that's D, and then all one has to do is think about how to encode how the subsequent frames change."
"Unknown","01;28;05;24","01;28;27;08","And sometimes they introduce things like a key frame. So every second so every minute it's it starts with a fresh prior. And so these are the kind of computational things that one can do when they're not bound by like the constraints of biological systems. But this is an awesome connection. Any other thoughts on that theme or like where does error propagation come into play?"
"Unknown","01;28;27;10","01;28;50;01","Or we'll turn back to the triangle so I don't know. The error propagation is, is interesting. It would be great to have like the input of somebody who is more like versed in machine learning because I think the idea of like back propagation, like this is an error and like sending that back to the previous layer in the neural network is super interesting."
"Unknown","01;28;50;01","01;29;23;23","And part of what like enhances the efficiency of their own networks, like, hey, fix this. And so I think I can't really find in the paper where they say that. But, but there's like a local correction for error within each layer of processing. So in the visual system and yeah, in signal processing itself, it's like each layer prioritizes just fixing their own error and then that contributes to the overall efficiency and accuracy of the system at large."
"Unknown","01;29;24;10","01;30;05;03","Yes, back propagation is mentioned 45 times in the paper with a quick search so it's definitely an important concept and also something that authors have worked in a lot. So good error propagation and back propagation and also that reminds me of when Professor Levin was here in 40.2 with the black propaganda and the imperatives for like the different parts of the neural network and the kind of information that they want or expect or prefer, and then how they want to escape being trained and engage and learning, but not being trained but still updating."
"Unknown","01;30;05;19","01;30;39;22","So they're learning and being trained both involve like updating priors, potentially appropriately. But in the case of training, there's a feeling like another entity or agents is imposing their will versus learning can also be associated with behavioral and cognitive changes, but as a different sense potentially than being trained anyway. So let's go back to the triangle as we're sort of not quite landing the dot one plane."
"Unknown","01;30;39;24","01;31;05;05","You know, the check has not arrived at our restaurant, but maybe we're working our way up to our first star. Where do we sit on where action is? And then we have a few terms that we want to put, which is message passing and then active inference. Oh, yeah. So what is another term that we can add in or something that we're seeing differently in a new light?"
"Unknown","01;31;05;22","01;31;47;24","Or where do you see message passing or active inference who so I think, yeah, so do we have action? Are we happy with where action is sitting because we have enough where it is? I think it's I have used every feature of Google slides sufficiently. I like action as sort of a fulcrum in the center of the merry go round is action."
"Unknown","01;31;47;24","01;32;21;25","And yes, more arrows can be drawn, but we'll keep it a little sparse. But go ahead. So I think maybe message passing sits between predictive processing and action. And then that's exactly what I was going to put active in France was you just typed in inference because I think if we're or yeah, it's hard to say we're active in France really goes maybe not right."
"Unknown","01;32;21;25","01;33;05;18","We're inferences but like somehow if action and the Bayesian brain and biological systems could form a a triad maybe active inference would sit in the middle of those things so message passing to Bayesian statistics and probability because it's something that we can do on a Bayesian graph it's a implementation approach, but it's also leaning a little bit towards the biological because when people talk about like how does a given piece of information or signaling or stimulus in the tail end up having an effect on the other side of the body or on the brain?"
"Unknown","01;33;05;18","01;33;39;17","Like there's some kind of now it's being used in a technical Bayesian sense with message passing, whereas in a more just sort of like conversational way with biological message passing, but whether it's a synapse in immune synapse or a neural glial synapse or it's a mechanical transduction or a hormone broadly, we can just consider these different biological mechanisms that convey information or updates or anything to be like past messages."
"Unknown","01;33;39;27","01;34;04;17","So message passing is going to be a formal technique, but it does lean towards modeling the ways in which different biological nested entities are exchanging information. Yeah, and so why I would put it with predictive processing is because when I think about the things that we were talking about, like how are signals compressed, how is redundancy eliminated, how is error propagated through a system or back propagated?"
"Unknown","01;34;04;17","01;34;25;20","So which is why I like I liked it there in the processing because like you can't legitimately process that information without like knowing how the message is going to be passed. Like if you're only going to get every fourth letter of the message I pass, well, I'm going to encode my message in every fourth letter, not in every single letter."
"Unknown","01;34;26;10","01;34;56;14","And that changes. Right. OK, thanks. Yes. So we have a message passing now as part of the philosophical concept of systems that engage in holistically considered predictive processing because it connects what biological systems are doing with some idea about like information sharing without any formalism, but then message passing via the form factor graphs is going to be in the Bayesian side because that's like the implementation."
"Unknown","01;34;56;14","01;35;27;24","So maybe message passing here. Yeah, it's like on the sort of predictive coding implementation side, whereas we know we're not saying biological systems are doing 40 factor graphs and message passing in that technical sense. But for sure we can think about it in this qualitative way. OK, so we have action in the center and then kind of bifurcated it to include action and inference a.k.a active inference for a few reasons."
"Unknown","01;35;28;09","01;36;08;01","First off, action is not just blind flailing action. When we talk about planning as inference and inference on action and inference about future latent states and observations that aren't explicitly about action, but we know in active inference that they actually do conditional on action so inference and action, how we think and how we act, how the entity's cognitive model is, and how the entities behavior is through time those two are like inseparable, dual, and that's why active inference says it all in the title."
"Unknown","01;36;08;19","01;36;40;15","It's about action and inference and all of the ways that they are related to each other. Again, whether it's like planning as inference about future action or inference on the consequences of action, or it's inference about something that isn't explicitly action itself, like what is the temperature but it requires or is conditioned upon policy selection in this framework, not the only way to look at it, but that's how they come together in active inference."
"Unknown","01;36;40;28","01;37;10;27","And like, let's move over to 4.5 where they introduce action formally the basic approach to including action within the predictive coding framework is to simply minimize the variation of free energy with respect to action. Free energy is not explicitly a function of action up until Equation 51, it can be made so implicitly by noticing the dependance of sensory observations on action."
"Unknown","01;37;11;12","01;37;39;01","So if your future sensory observations don't depend on action or don't depend on that kind of action, this is like an extraneous calculation. Like if you have a coin flip and you're rolling the dice and they don't influence each other, then they're conditionally independent. And so there's no need to to calculate the joint distribution if you're just interested in the coin flip because it's not having a causal relationship with the rolling the dice."
"Unknown","01;37;40;09","01;38;16;10","However, if we're going to have agency or model systems that appear to have agency, then there's some kind of dependance on future sensory observations related to action. In the visual case, the visual input is conditioned upon the ocular motor decisions, and those are actions of a musculoskeletal system. And then the way that it gets tucked into the equations is the change in action with respect to time is going to be related to a gradient."
"Unknown","01;38;16;10","01;38;59;21","So like a partial differential equation, but then it's amenable to gradient descent. It's going to be like a partial derivative of free energy and how it changes with respect to action so like am I minimizing free energy by steering the wheel more to the left or by steering the wheel more to the right? That's like d f over dx a change in free energy over change in action and then free energy F here is a function not just of the joint distribution of O and MU, not just a joint distribution of the observations on the thermometer and the mean estimate of temperature in the room that's kind of the pure inference take."
"Unknown","01;39;00;07","01;39;28;10","But again, we're suggesting that sensory observations have a dependance could be partial could be complete on action. And so now observations themselves are a function of action, and then that can be unpacked a little bit more in 51 and they discuss it further of course in the paper and elsewhere. But that's like how this inferential framework gets built in predictive coding."
"Unknown","01;39;29;12","01;39;57;19","And then action becomes introduced as something that inference can be about and that's what they say allows for predictive coding agents to undertake adaptive actions without any major change to their fundamental algorithms. It's not like there was the temperature thermometer module, and then now there's this totally ad hoc decision making module that's bringing in all this thing about well, what is the reward of different temperatures?"
"Unknown","01;39;57;24","01;40;46;05","What is the reward of different thermometer observations rather within this same parsimonious? And first principles inference framework, we can model active inference, which is inference, including action let's kind of continue on this action theme and then we'll we'll end in a few minutes so under such a scheme, the prediction error becomes the difference between the current observation and the target or set point that raises the question of where these set points of targets come from, and that's where they just sort of have that road leading off into the distance saying, well, in the evolutionary case, it's inherited."
"Unknown","01;40;46;26","01;41;13;27","In the computational case, it's just simply there. It could be just a priori speculated or it could have been a parametric empirical phase. So that's one really interesting point is like when you do introduce action, you have to discuss not just the target or the set point and how it's generated, but also you have to make explicit in the forward model as they write the dependance of the observations upon action."
"Unknown","01;41;14;09","01;41;35;21","And that has to be provided or learns because just that temperature thermometer model is not going to include a forward model of what happens when you turn on the heater or when you put on a jacket. So that's something that has to be learned. And then a second interesting thing that starts to come out of their framing here is like the costs of action."
"Unknown","01;41;36;02","01;42;05;23","And that closes the live really well with discussion that you raised of like Barlow and the information efficiency argument for why the brains ought to be doing something, something like predictive coding, efficient signal transfer and hence why it's either what they ought to or are doing or and how we ought to or could model it so that's why the costs of this are important."
"Unknown","01;42;05;23","01;42;43;15","Course of action are important. And then just one last piece and four or five was active inference in the control which is related to the generalized coordinates of motion. And we unpack that a lot in life through number 26 with the Bayesian Mechanics Paper of De Costa at all. And this connects control in active inference systems to a very commonly used engineering framework for controlling processes, which is PID control, which is framing action through time as being related to these three terms, which are described above."
"Unknown","01;42;44;02","01;43;22;00","So that's how they brought action into this paper was by spending many of the early sections providing like the single layer predictive coding model and connecting that to Variational Bayes that was in like Sections two and then in Section three and also in section two, they explored all these different interesting generalizations. The spatial case, the hierarchical case, and then they also connected it to biological systems and reviewed some evidence for predictive coding of different kinds."
"Unknown","01;43;22;15","01;43;50;05","And then instance in Section four, when they connect to several other inference algorithms like predictive coding and the back propagation of error, linear predictive coding and the Kalman filter normalization and the normalizing flows, which we didn't talk about predictive coding as biased competition also something we didn't talk about. And then after all of that action gets tucked into the picture and it's just like very clean in a very elegant way."
"Unknown","01;43;50;25","01;43;58;08","To think about it and helps us understand like maybe even how active inference is similar or different to some of these other frameworks."
"Unknown","01;44;01;14","01;44;25;07","So in the spirit of a layer cake, I think today, like we covered it. If this paper is a sandwich, we covered both slices of bread. That's like the very beginning and the very end, but we left out like all of the things that kind of come in between the meat and potatoes. You have potatoes on a sandwich ever."
"Unknown","01;44;27;04","01;45;07;27","They do it with some French fries sometimes but I know what you mean. Go to Subway. I'm going to go to Subway and be like, Can I get some potatoes on my mind so that I hope predicting coding special and then they go, then they go, What do you expect is going to be on the sandwich? It would be cool next week to really kind of dove in more to error, back to back propagation predictions are sent, you know, up an error sent down or is it the other way around and really kind of discuss these these computational graphs that they start to talk about."
"Unknown","01;45;08;06","01;45;35;14","So I think next week would be really cool to kind of dove into what's inside of the of the sandwich. Oh, awesome. OK, so we'll definitely go into some some so what's inside the sandwich back? Propagation of error, the biological evidence and examples. So I think there's a ton of exciting stuff that we'll be able to talk about next week."
"Unknown","01;45;36;27","01;45;50;15","The different paradigms like we could come over figure three, the paradigms of predictive coding and the normalizing flows. So we definitely we covered the bread today. Yes."
"Unknown","01;45;53;09","01;46;18;08","Well, anyone who is listening, we really appreciate it. Look forward to your comments on the video or joining us next week if that's going to work. And Blue. This was like super interesting and very helpful. So I think it's a great dot one and it's funny because like dot one, it's, it's the meat and potatoes of the 012 sandwich."
"Unknown","01;46;18;29","01;46;46;03","So it's like our middle of the bottom of the bathtub phase, the one where we're opening up all these ideas and just trying to like give a second coat of paint on a few things, go into a few technicalities re represent some knowledge. It's like that was in a very paradoxical or delightful way about not the potatoes itself, but rather about the beginning and the ends."
"Unknown","01;46;46;16","01;47;12;01","Well, to be fair, for those of you who haven't yet read the paper there's like 60 equations and like 55 pages plus an appendix. So no surprise that we covered the bread but it would be cool to tear apart a little bit of what's inside of the paper because I think that these layers are cool and important and the paradigms of predictive coding were super interesting to me."
"Unknown","01;47;12;01","01;47;44;23","And I love like the intersection between the brain and machine learning. And I learned a lot reading this paper, especially like I was taking neuroscience classes. I'm going to say how old I am right now, but I was thinking like neuro in college and like what at like in 2003, probably maybe 2004 with no idea learning about, you know, the work of Robert Ballard and Hubble and WHISTLE and, and all of these you know, centers around like visual experiments with no idea like how new they were."
"Unknown","01;47;45;11","01;48;13;07","No idea like how new of an idea it was like the processing through the visual cortex really. Like I didn't know how cutting edge the work I was learning about was. So it's cool to kind of have that framed for me and put in perspective and yeah, the building upon that that's been done. It's nice, excellent. Thank you very much blue and everybody else who's participating and see you next week."
