"Speaker Name","Start Time","End Time","Transcript""Unknown","00;59;18;04","00;59;50;25","Right? And so what Bayesian statistics does is it takes actually that you're not like Frequentist. They don't care if you ever found my said before, like your probability of finding zero mice and 30 mice and 50 mice and 100 mice and a thousand mice is all the same. Doesn't matter how many years you've been there before, like you are starting with nothing in frequentist statistics, you don't get to have any guess that there's even going to be one mouse in the desert where with basic statistics, like obviously you think that there are going to be some mice and you think it's going to be some number you can count reasonably so with whatever area."
"Unknown","00;59;50;25","01;00;16;17","And so what Bayesian statistics statistics allows for is that prior belief or that expectation that you have as experimenter. Awesome. And that's kind of what we were getting out with that idea of frequencies of having this implicit uniform distribution. You flip the coin ten times, you get three heads, you're maximum likelihood estimate is it comes up 30% of the time on heads."
"Unknown","01;00;16;18","01;00;43;27","Point three. However, if you want to take like a bigger picture view, you might have some sort of precision about where it's likely to be like is it likely to be 0.5? And you're going to be surprised if it were three because you just pulled it out of a cash register. And then in that case, you still might say, I want to have a uniform prior, and if it is point three, then it's point three or you might want to say, I'm very confident it's something else."
"Unknown","01;00;43;27","01;01;19;03","But Bayesian Statistics opens up the space to be specific about how we want to use our priors, how confident we want to be, how much precision we want to have in those priors, and then how we want to incorporate new information. So any other thought on that or let's continue on that and connect it to some Formalisms. So I have one more thought on the coin flip with with Bayesian with Bayesian idea, like if you know it's a fair coin and the probability is 50% and like if you flip a coin and we're betting each time, like, you know, a dollar, a dollar, a dollar, if you flip that coin, you flip the coin ten"
"Unknown","01;01;19;03","01;01;41;22","times in a row and it's heads every single time like on the 11th time, my bet is on tails because like it's not, it's a fair point. Like it's not going to come up every single time. Heads and so frequency statistics like does never allow for that previous information and also like where is that information? Which is something that always baffles me, like does the coin."
"Unknown","01;01;41;22","01;01;57;00","I already know that it's been flipped ten times and it's come up heads all the sense and that it then has to come up tails sooner or later. I mean, if the probability is so low that you're going to get like a thousand coin flips of a fair coin in a row, that is heads like I don't know if it's ever happened to anyone ever."
"Unknown","01;01;57;06","01;02;14;03","So like as we increase in the number of flips and if it's head to head to head to head, like it becomes increasingly probable that the next flip is going to be tails in my view. Right. Which is maybe totally wrong. But but where is that information stored and the Bayesian kind of allows for that to be there."
"Unknown","01;02;15;25","01;02;45;19","And I wonder if this even connects to where is that information stored in the quantum reference frame of the observer and nowhere else. But let's look at how that gets implemented in these Formalisms. So you just describe that setting where somebody has a belief that the coin is fair. Maybe that's an empirically grounded belief like previously they flipped it a thousand times and they got 5050, or they have just an a priori belief that is fair."
"Unknown","01;02;46;01","01;03;14;15","If that belief were generated by a real other data set, we would call that parametric empirical Bayes because it's the process where you set the priors as well as their confidence based upon some collected data set that's parametric empirical Bayes. Or one could just take that a priori concept synthetic apriori and just say coins ought to be 5050."
"Unknown","01;03;14;23","01;03;40;12","And that's what I'm sticking with. Let's just say that then we play this game, we flip it ten times and likely or not, ten heads happen. That's the trace of behavior. In the neat should actually happened. Now that might be seen as a totally likely outcome by somebody who believes that it always comes up heads, hence they're unsurprised or depending on what your priors were that could be variably surprising."
"Unknown","01;03;40;22","01;04;09;28","And then you talked about both when and how should you update your beliefs on that coin like maybe something changed while you weren't looking at it. And so you want like your best estimates to very heavily reflect the recency. And maybe that should be like a moving average of the most recent three flips or maybe the most recent 30 so let's look at two places in the paper where they do something like that."
"Unknown","01;04;11;05","01;04;37;12","The first one has to do with predictive coding and frame differences in algorithms, in video compression. And so in this area we can think about the way that the video looks. People who are watching this video, the way that the video looks is like the output. And then we want to encode like how surprised are we, what is happening when the frames are changing."
"Unknown","01;04;37;28","01;05;09;15","And so the simplest method is just count where it's different and convey that information. But it might also be important to use as they write more advanced methods that predict each new frame using a number of past frames weighted by a coefficient, an approach known as linear predictive coding. So that's one case where you're determining how many frames back, how many coin flips back should we use for that now casting and how should we wait them?"
"Unknown","01;05;10;01","01;05;44;17","So that's one area. And then a second area that they bring up and connect is the common filter. So here's the common filter, and this is their formalisms 33 and 34. And it has a lot to do with Bayesian statistics. So on this and Bayesian Kalman filter is very common we can see it in two different ways. So on the left side of this slide, the top image shows a prior prediction that's the prediction."
"Unknown","01;05;44;27","01;06;07;26","And then two is the measurements, and then there's the fusion. So we have the prediction, the measurement here with GPS, and then there's the Fusion so that is very similar to having a prior and then some updated sensory information and then the posterior. So it's just labeled slightly differently. But we can already see how this is like totally related to Bayesian statistics."
"Unknown","01;06;08;24","01;06;32;05","What this also brings into the picture is like a pseudocode that unrolls through time. So Bayesian statistics approach doesn't have to be about time. It can be about a static data set and then you could be modeling like OK, per extra sample of the population of their height and weight. We're going to update our inference on that relationship."
"Unknown","01;06;32;18","01;07;02;26","But that's a timeless analysis. It doesn't incorporate some sort of unfolding through time that can be incorporated into the common filter using this pseudocode. Down here on the left, there's some prior knowledge of state, and this is like two dimensions. And then there's a cloud representing a distribution of precision or uncertainty. So a more precise estimate would be like a tighter cloud there or a sharper peak or a sharper valley, depending on how you want to think about it."
"Unknown","01;07;03;19","01;07;27;19","And then less precision would be like a broader basin or like a more diffuse ink drop. And then there's a prediction, then a measurement occurs, which can be precise or can also have an associated measurement error term, which could be fit with parametric empirical Bayes based upon testing, or it could be determined on the fly with expectation maximization."
"Unknown","01;07;28;03","01;08;01;02","And then that prior gets juxtaposed in this update step and the outputs. So this takes sort of this timeless Bayesian update scheme and specifically adapts it to the case of something happening through time. And that's shown on the right side here with this image of like time is happening and we're getting these noisy X measurements and the true temperatures, the purple and let's just say it's unchanging in this case, but that could also be changing."
"Unknown","01;08;01;12","01;08;28;06","One can just imagine that, especially if it's very noisy, it's hard to get increasingly complex dynamical patterns, but that's all part of the game. And then the prior starts high and then the prior is weighted. It's kind of like a spline. It's weighted through all of these X's. And you can imagine one extreme case is like move to the last one that you saw."
"Unknown","01;08;28;25","01;08;54;05","And so that would be like basically recapitulating the measurements distribution through time. The other extreme case would be weight all the time, points evenly so that like we're kind of converging to a moving average. So if we have 100 hours of video that is like at a two and then all of a sudden it switches to an eight and then you're moving average would very, very slowly start moving up from a two."
"Unknown","01;08;55;00","01;09;28;05","And then one could imagine that there's some intermediate solution that doesn't use like the whole dataset because that's too slow to adapt and maybe takes up too much memory, but isn't just like a one step instantly switch to the nearest measurements and that parameter of how fast should you update your Kalman filter is a parameter in the model and so that is exactly what is being statistically optimized, is how much through time should we update our ongoing estimate."
"Unknown","01;09;28;15","01;10;04;08","And so in the static or the timeless Bayesian case, that's where we talk about precision. How much should we update our inference as new information is added to our dataset, but that doesn't mean appended in a temporal way. The common filter is making it explicit that these data points are being added sequentially, and that is providing us with this pseudocode by which the latency up to me, the latent state is updated not just as a function of adding data but actually adding data in a sequential and unrolling way."
"Unknown","01;10;04;16","01;10;34;17","What do you think blue yeah, great. I think that that was a super good explanation and very clear and yeah, my first interaction with common filtering was an imaging and image processing. So I think that's maybe where people come across that a lot, especially like doing laser scanning microscopy or a video I guess of the video update also is like that."
"Unknown","01;10;34;17","01;11;11;20","So yes. So let's just look at some of their writing, but these are like the smaller the formalism, the less we've paid attention to it and the more that we would love to know about what it actually means. But let's kind of pick up above there. 35, they write common filtering procedures in two steps. First, the state is projected forwards using the dynamics model or prior, and that's the P of beauty plus one that's the means at the next time step conditioned upon the mean at this time step."
"Unknown","01;11;11;28","01;11;45;15","So that's like what is going to happen next, conditioned upon how it is now these estimates are corrected or sort of compromised coming to a compromise by new sensory data by inverting the likelihood mapping P of observations at the next time points conditioned upon our estimate of where the latent state will be. So this is what temperature will the room be conditioned upon how it is now at the next time step, what will it be conditioned upon what it is now?"
"Unknown","01;11;46;05","01;12;16;09","This likelihood mapping, which is like the a matrix in the poem piece, is what is the probability of the outcome in the next time step being a certain way conditioned upon how we think the rooms temperature is going to be. And so these are the equations and some of the variables. And then they kind of conclude or in this little section, the derivation of the rules is relatively involved and that's in Appendix A and some other places."
"Unknown","01;12;16;24","01;13;15;13","But also the common filtering can be interpreted as finding the optimum of a maximum, a posteriori estimation problem. So this is almost like we have contact with the exhortation of the a priori what information are we bringing to the table qualitatively count or quantitatively base? That's the Apriori. And then Bayes kind of bridges that a priority the prior with a posterior URI Dutch, if that's the Latin for that one, but it's the posterior what happens after the sensory update and then that space between like the before and the after is the during and that's the during of the now that we're doing action and inference with within let's look at how they introduce anything otherwise"
"Unknown","01;13;15;13","01;13;48;13","we'll look at how they introduce action and then connect it back to active inference so I think the common filtering and the updating. So I think we, we kind of skipped over updating when we were talking when we were making our layer cake earlier and just how how messages in the nervous system biologically and in predictive coding are passed forward and backward."
"Unknown","01;13;48;13","01;14;21;21","So it might be helpful to back up and talk about error propagation and propagation of back propagation and propagation of signal through times just as like a very basic way because I think the common filter is kind of an advanced way to do that. OK, can we go back to we're back at the Triangle and so now we've added Variational as like a little badge to the Bayesian."
"Unknown","01;14;22;08","01;14;49;01","And also we're going to add Carmen as a badge. Where have we visited on this journey? And one can imagine that they could take a Monte Carlo or a Variational or an exact approach to common filtering and so on. And then you mentioned a few more biologically inspired or compatible features like error propagation and so on. So what is an area in the paper or an idea that's relevant here?"
"Unknown","01;14;51;18","01;15;28;24","I think that the signal propagation and, and bottom up prediction error, like how does error propagate like through visual systems, through like neural networks? I think that there's applications here. And is it the error that's fed forward or is it the signal that sped forward or where does the error go in the system? So I think these are some confusing things that that maybe they they touched on in the beginning of the paper."
"Unknown","01;15;28;24","01;16;00;22","So let me see if I can find exactly or there's some debate here. And while you're looking so I've I've pulled out this right edge of the triangle. So we're going to just leave some of the baggage at home and take out to the table just this link between Bayesian statistics. And probability and biological systems. And then you raise this really important question about like how do we think about error estimation?"
"Unknown","01;16;01;07","01;16;59;12","And also some related terms. There would be like precision ambiguity, risk compression, and so those are error estimates. And then how are error estimates propagated and communicated how are they propagated and communicated in language? I'm not sure if I had to guess in our error estimates communicated in systems. And so we might be interested in mathematical systems. So then the way that you communicate the error is just you multiply the two variables, you have a precision matrix and then you have like some sort of hidden state matrix, and then you basically just buzz this kind of pristine matrix by some error matrix."
"Unknown","01;16;59;26","01;17;31;04","And so if your error on something is like zero, this is not exactly how the multiplication would work because multiplying by zero, but if the error were zero on something one would want their estimates to be passed through without being blurred. If the estimate of the uncertainty were super high in the extreme approaching total noise and uncertainty and variance estimate, then no matter where that pristine estimate or word you'd want it to be like totally fuzzed over."
"Unknown","01;17;31;11","01;17;57;05","And then one could imagine that in a per variable ongoing way, you'd want to be updating these variance estimates. And that is exactly what happens in the common filter, which is this unrolling and ongoing estimate of observations. Latent states and that the variance that links them and that's done like through matrix multiplication. But how does it happen in biological systems is a different question."
"Unknown","01;18;00;12","01;18;43;16","So I think some things come into play here, like redundancy and signal compression and then error propagation forward and background. And so there is this in predictive coding slash predictive processing because I'm still like not 100% on the on the difference there. But but I do think this is a predictive it seems like it's a predictive processing thing, but the authors do say predictive coding there is like a bottom up construction of a model."
"Unknown","01;18;44;01","01;19;13;28","So the authors say that but it's not only that the authors say that perception is not the result of an unbiased feedforward if bottom up processing of sensory data, but a subset of process of using sensory data to update predictions generated internally by the brain. So there's the idea of a model comes in here. Yeah. Generative model, where do you see generative model in these discussions?"
"Unknown","01;19;17;28","01;19;51;06","I mean, it's kind of threaded throughout. So I think the idea of variational inference brings in a model because the model constructs the estimate of the posterior, like where we're consistently there's a consistent effort to update the estimate of the earth, sorry to minimize the divergence between the actual posterior and the estimate of the posterior so the estimate of the posterior is like, you know, trying to make the model match reality."
"Unknown","01;19;51;14","01;20;19;08","So trying to make the picture of the cat match stretch Ben folds into the model of the cat. Yes. Awesome. So generative model with no conflict complications is being put into the Bayesian statistics area because if you specify a model that's generating thermometer outputs, given the temperature, it's quite literally the generative model. And we know that there's kind of two directions."
"Unknown","01;20;19;08","01;20;42;00","There's like the recognition model and the generative model that's the tail of two densities because of a distribution can also be understood as a density. And so in the realm of statistics, generative model is quite literally the approach that is taking parameters of a model and using it to generate, for example, observations. In this case, no need to complicate that."
"Unknown","01;20;42;16","01;21;12;14","But then there's a few ways that we hear different people in different papers talking about the relationship between biological systems and generative models as well. As recognition models. But we're focused on the generative model here, and sometimes these are even coherently or incoherently used differently in the same paper or the same sentence, which is our favorite. And we'll eagerly await the kind of automated detection systems that will enable us to do high throughput analysis."
"Unknown","01;21;12;14","01;21;45;09","But here's just a few of the kind of ways that people can talk about that. We hear sometimes that the biological organism or cell is a generative model, has a generative model, enacts a generative model, or the more instrumentalist we can model that system with a generative model. And so this bottom one is kind of like saying, I'm just planning to use Bayesian statistics to model a biological system."
"Unknown","01;21;46;02","01;22;23;14","And so perhaps we could say that this is the least bringing assumptions to the table of what that system is doing. Because by saying we can model it using a generative model, we can use or fit drive a generative model for this behavioral cognitive system. We're just remaining purely with both feet in scientific instrumental ism and empiricism. We're making only claims about the map and not about the territory per se, which might be throwing out the whatever with the whatever."
"Unknown","01;22;24;09","01;22;47;21","However, these ones are when people are making claims that are about the territory what is the brain? Is Bayesian brain what the brain is doing? Well, it's not passing around screenshots of these equations like we are. So what is it that it is doing? Or again, is it on the instrumental side? It's just something that we can use to model the brain."
"Unknown","01;22;48;01","01;23;31;11","So yeah. So going back to predictive coding and, and also linking to what is the brain doing? And really this is why I wanted to stop here. I found, I found this out in the paper, but that was when we were talking about common filtering and image processing and then error propagation in a system. They took early in the paper about predictive coding as a means to remove redundancy and applied it to signal processing to reduce transmission bandwidth for video."
"Unknown","01;23;33;04","01;24;04;11","And this they also say here Barlow applied this principle to signaling in neural circuits, arguing that the brain faces considerable evolutionary pressure for information theoretic efficiency. Since neurons are energetically costly and redundant, firing would be potentially wasteful and damaging to an organism's evolutionary fitness. Because of this, we should expect the brain to utilize a highly optimized code which is minimally redundant."
"Unknown","01;24;05;00","01;24;43;18","And they say predictive coding minimizes this redundancy by only transmitting errors or residuals of sensory sensory input that cannot be explained by top down predictions. And so they remove redundancy at every point in the layers. So it's like when you're watching a video and or even like the flip of click. So we see like, you know, the flip flipbook that sort of a little figure kicking a ball from the point that changes is the point that's prioritized, the point that's different in each frame not to the point that stays consistent because that is where the action is here, where the motion is happening."
"Unknown","01;24;43;29","01;25;16;24","So that that's what's prioritized here. And that totally connects to information theory. Informative updates are the ones that update your prior to move it to a different posterior. That's the Bayesian information concept as opposed to, for example, the change in entropy which is like based upon simple entropy. So they're totally compatible. And if this seems like a technical detail, it is, but also this is the Bayesian concept of surprise and information."
"Unknown","01;25;17;06","01;25;49;25","But that was a great section you pulled out. So here where we're really highlighting as following Barlow, applying this principle of redundancy removal, but already we can caveat how much redundancy to remove because of more redundancy removed system is also potentially more fragile. Like if we only have one copy of each saved file now our threat of losing it is very high."
"Unknown","01;25;50;08","01;26;15;14","So redundancy is always in a trade off with like resilience and other system features. So this is one principle, but it's not the only principle at play. So redundancy doesn't mean we're going to pare it down to nothing. It just means that for an organ like the brain which is using like 20% or however much of an organism's energy budget, changes in its efficiency by several percents can be really important."
"Unknown","01;26;15;26","01;26;43;00","So that principle of redundancy removal is being applied. And the argument is that the evolutionary pressure is for information theoretic efficiency. So if you don't have anything to update, you don't want to spend the energy to do something extraneous, nor do you want to spend any more energy than you might have to on updating. And that's again because of the wastefulness of potentially excess signaling."
"Unknown","01;26;43;24","01;27;16;15","And then with evolution there's always a twist, like what if it is wasteful? And that's just some second level reason why. So it's not the whole story. This is just sort of short sentences because of this. We should expect the brain to utilize a highly optimized neural signaling neural firing code, which is minimally redundant, and then they connect it back from what the brain ought to be doing normatively at a first pass to the Formalisms that were being described with predictive coding."
"Unknown","01;27;17;03","01;27;36;18","So in the frame difference, in case it was like only tell me about the pixels that are changing and then if nothing's changing, just send me like a little beep and I'll just know it's just one piece of information just to keep it exactly the same. Even if it's 4K video, and it's a gigabyte per seconds or whatever."
