"Speaker Name","Start Time","End Time","Transcript"
"Unknown","00;00;29;14","00;01;02;10","Right. Hello and welcome, everyone. It is just adjusting things. It is May 4th. May the fourth of 20 to be with you. And we're here in active live stream number 43.12. I don't know how you do it with always joining during the theme song welcome to the Active Lab. We're a participatory online lab that is communicating, learning and practicing applied active inference."
"Unknown","00;01;02;23","00;01;31;11","You can find us at links on this slide. This is recorded in an archived live stream, so please provide us with feedback so we can improve our work all backgrounds and perspectives are welcome and we'll be following video etiquette for live streams. Check out active inference dot org if you want to learn more about what's happening in the lab and get involved and participate in the live streams or any other activities all right."
"Unknown","00;01;31;21","00;02;03;29","Well, we're here in live stream number 43.1 and are continuing the discussion of the paper predictive coding a theoretical and experimental review by Barron Milledge and yourself and Christopher Buckley in 43.0 with Maria We went over some of the background and context and did like a first pass on various aspects of the paper, but by no means exhaustive it because it's a long and very intricate paper."
"Unknown","00;02;03;29","00;02;29;02","And also it touches on a ton of other areas of more general interest. So there's a lot to discuss and in the 43.1 today, we'll see where things go. If you're watching live, it would be awesome to have any questions in the live chat. Otherwise we will just start with some introductions and pick up with whatever people are finding salient and exciting."
"Unknown","00;02;29;25","00;03;11;00","So we'll just start by saying hello and going from there. I'm Daniel and I'm a researcher in California, and thanks a lot blue for joining I'm Blue. I'm a researcher in New Mexico. And yeah, I'm excited to be here today. This paper was really intricate and detailed and provided a lot of background that I don't have because there are so many active papers that I want to read, but I don't have time to get to them all because I like to read things very thoroughly and slowly and carefully and look up the things that I don't know."
"Unknown","00;03;11;00","00;03;40;08","And the references traveled down the scientific rabbit hole, so to speak. So yeah, this was a good paper that kind of helped me know shirk all those active responsibilities that I have and came out with more questions than answers, which is always a good sign of a good paper. Awesome. Well, how about going into the paper what questions did you have?"
"Unknown","00;03;40;08","00;04;26;19","And maybe we'll get to how our questions evolved, but what were you expecting to find in the paper and what questions were motivating you to seek it? So I always have had a hard time. Like, what is the difference between predictive coding variational Bayes and Actin Right? And like, I was really hoping that the paper would kind of lay that out for me and like know so like, I mean, I kind of got a good historical overview of how they all are interlocking and overlapping which I didn't know before because, you know, all these things, none of them are simple and there are intricate details in all of them."
"Unknown","00;04;26;20","00;05;05;08","Like you know, that I don't know all the details, ins and outs, but I think that this gave a very good like historical overview of how these things kind of layer into a nice little sandwich great. Definitely a good starting place. Let's also add Bayesian brain there to the mix and start to look at maybe some similarities too, because they're not exactly like addressing the same area and they're compatible, often more compatible than not."
"Unknown","00;05;05;08","00;05;34;05","So getting at what distinguishes them is very important. And like one way that that happened and it came up in the dot zero was so much of the paper was dealing with inference on the relationship between observations and on observed latent states. So think like trying to infer the temperature of the room given the thermometer readings and that was so much of the paper."
"Unknown","00;05;34;16","00;06;17;07","And then action comes into the picture in section four or five. It's like predictive coding the authors write can also be extended to include action allowing for predictive coding agents to undertake adaptive actions without any major change to their fundamental algorithms. But that's 50 equations deep. And so it was very interesting to see like if those 50 equations are kind of like the stem, I know that the equations are not sequential and building on each other in all of these cases, but then action gets tucked into a bigger picture very seamlessly."
"Unknown","00;06;17;16","00;06;46;26","And I think that speaks to the the relevance of distinguishing how they're similar and difference and why it matters, I guess. So how should we even begin to look at that? So even action actually came up earlier in the paper before 4.5. So action came up in a section 2.3 with dynamical predictive coding and generalized coordinates. And this I thought was a really good example."
"Unknown","00;06;47;00","00;07;15;27","Like I was craving and still am craving like a really simple example. Like, like it's one thing and we talk about the equations, we go through all the letters and compare this and that, but it would be really great to see a super simple example works to like from start to finish using all of these observable states latency, complexity, accuracy, like it would be really great to see that at some point."
"Unknown","00;07;16;28","00;07;43;18","And if you're listening to this livestream and want to come on and give like a guest tutorial on like how do we actually work these equations into some very simple problem that we can solve in real life? Like I would be more than happy to facilitate that presentation. Yeah. Because I can't even like I can't jump from like all these equations into like how does that apply?"
"Unknown","00;07;45;07","00;08;19;16","But even in 2.3, this was kind of a good a good a good ish example, a real life example about like inferring, you know, the velocity and the acceleration and the jerk just give in that the observed coordinates. So that was kind of and it talks here about also free action, which I've not heard before. So instead of minimizing the variation of free energy, it says we must instead minimize the free action, which is F bar."
"Unknown","00;08;20;18","00;08;43;09","And I've not seen or heard it referred to in that way, but it's modeling like time series of observations so like, you know, you know, the coordinates set time one time to time, three of the swinging pendulum, for example. So, you know, this coordinates and you can kind of guess you know, how fast is the objects moving. And you can infer these other is other variables."
"Unknown","00;08;43;09","00;09;14;05","So I haven't seen that reaction, but it did even come up before four or five yes. And it speaks to that expected free energy EAFE, which is what do you expect the free energy to be? And then there's the free energy of the expected future, which one of the authors has worked on, which is kind of a slightly different variant and then here's another way to look at the free energy of some future time steps."
"Unknown","00;09;14;19","00;09;47;06","And and it speaks to that difference between the variational free energy, which is like what you're able to calculate right now with the information at hand and looking backwards. And so the more perceptual aspects of inference can be calculated using the variational free energy approach. But then any time the future is coming into play, there's uncertainty about the observations as well as even uncertainty about what actions one will take, let alone the consequences of the actions that one will take."
"Unknown","00;09;47;15","00;10;23;02","In the future. So we do need a different way to calculate it. And then as you're kind of getting out, this is a different way than we've seen it before with a minimization of free action. But let's return to this page and think about how we can distinguish with like a Venn diagram or something that helps us understand how these core ideas are linked one couple that we can highlight is predictive coding and predictive processing."
"Unknown","00;10;23;17","00;11;04;01","Do you have any thoughts or questions on that? Yeah, so maybe not a Venn diagram, but like maybe we should build perhaps like a pyramid or like a level building because I think, you know, based on the, the what I read in the paper I think really predictive coding kind of starts it all off. And also, b it makes sense to make a layer cake like being that these all kind of start off with the layers of cortical processing that happen quite literally in the brain."
"Unknown","00;11;04;11","00;11;33;17","So I think making the layer cake maybe makes the most sense. OK, so we're in the kitchen where we're in the active restaurant kitchen and what are we going to build in or what is the bottom of this layer cake? So I think the bottom at least so so there might be two layers on the bottom one from Helmholtz."
"Unknown","00;11;34;00","00;12;26;17","So we can start with like the perception as unconscious inference view of how Helmholtz and then predictive coding as described by Ro and Ballard in their description of the visual system in the visual cortex. OK, and again, kind of calling back to the dot zero, the two qualitative philosophical ideas that the authors invoke in that Maria helped us unpack were Helmholtz notion of perception as unconscious inference and Kant's concentration that a priori or beforehand structure like prior structure is needed to make sense of sensory data."
"Unknown","00;12;27;02","00;13;10;02","So we're going to have one bottom layer of the cake with Helmholtz and then also with the Katia. So this is going to be our qualitative philosophical layer of the cake, these two notions. And then you mentioned another critical work which was round balance 1999 work, building on a broader history of applying predictive and anticipatory approaches to different neural systems and in the zero, the two neural systems that we looked at were first the retina system with the Sreenivasan 1982."
"Unknown","00;13;10;11","00;13;45;07","And this is looking at retinal physiology and like the electrophysiology of photons hitting the retina and then another area where predictive approaches especially early on were getting built out around and towards was the cortical hierarchy and the different layers in the mammalian cortex. So these two anatomical exemplars of some micro circuitry, some histology, that is compatible with a predictive approach."
"Unknown","00;13;45;07","00;14;41;02","OK, so we have these two basal layers, but we even had more basal layers, but we have biological systems that are doing predictive things and that includes the retinal as well as the cortex also, of course, if anyone has questions, we'll get to it in the right way. So please ask any questions or doing any comments. So we have the retina, the cortex as examples, but there's others, OK, and then if there's a third layer that we can add to the bottom, I think it would just be Bayesian statistics because so I think it comes maybe before that also or maybe like maybe now maybe Bayesian statistics is like a a layer too."
"Unknown","00;14;41;02","00;15;20;25","But like I think before the Bayesian statistics and even before biological systems doing prediction, there's the information theory component that I think is important also. OK, so well we have this is qualitative and philosophical then we have biological and actual and then we have a formal area and that'll be information and base information. Yeah, the information goes under the base."
"Unknown","00;15;20;25","00;15;58;13","I think just like the Helmholtz comes under the count. Right. I think it's the really the relationship between information and probability, which we started to explore in or we explored a lot in the genetic quantum systems livestream number 40. That was 40 I think so many streams ago. OK, this is fun and I think we're we're going to start building this into a tasty structure."
"Unknown","00;15;58;25","00;16;27;11","So we have the philosophical coming in on the left, and that's one onramp that just like we had discussed earlier, like this is something that has been almost imminently available to thinkers for thousands of years. These are the kinds of qualitative claims that anyone can experience, whether by thinking about the blind spot or about how their sense making in response to some stimuli."
"Unknown","00;16;27;18","00;16;56;08","This is just the idea that the sensory observations are first off, not the direct contact with the world. Like we're not seeing the lightning strike event. We're seeing photons hit the retina and sound hit the eardrum. And so we're receiving sensory input. That's not kind of Plato's cave angle and then contact Helmholtz elaborated on that to include this idea of unconscious inference that requires a priori structure or like what we would call like a Bayesian prior."
"Unknown","00;16;57;02","00;17;24;06","Then we have this biological area and these are just reflecting natural systems that are exhibiting some kind of behavior. Like we can think about the 1999 paper of round power themselves about the functional interpretation of extra classical receptive field effects. And we talked about that in the zero, like the classical effects are kind of the simple normative ones."
"Unknown","00;17;24;07","00;18;01;11","Like the joke is it's classical because of the papers in the order they were published, but that doesn't like make it even true, let alone the best model. The classical is just like, it's like classic rock. You might like other genres, but then there's the classics or whatever so that's the biological systems that are exhibiting certain kinds of outcomes and then we have these two formal or quantitative areas and those are the Bayesian statistics and probability as well as information theory."
"Unknown","00;18;01;26","00;18;12;28","And they're definitely linked as well. But we'll just leave them as kind of two conjoined layers here. OK, now where do we go from here?"
"Unknown","00;18;16;25","00;19;04;18","Well, this is not the question, but so maybe predictive coding and predictive processing and like really what's the the difference between these two? I think predictive coding came from neuroscience. So maybe that layers on top of the biological part, the biological piece of the cake and then predictive processing might go on to the quantitative piece also. Yeah. And it really is what Maria highlighted and drew out in the dot zero, which was using a quote from an Andy Clark book."
"Unknown","00;19;04;29","00;19;33;18","And Clark wrote that predictive processing is not simply the use of the data compression strategy known as predictive coding. So at least in this take, predictive coding is like MP for it's like an encoding strategy, which is also why we connected it to frame different seeing and video encoding. But predictive coding is going to be something that's data oriented and it's related to information theory, compression information encapsulation."
"Unknown","00;19;34;03","00;20;01;07","And then Clark is writing predictive processing is not simply that. And so Maria spoke to how another way to think about the difference between predictive coding and predictive processing is to use coding for the formalisms and implementations and processing for the philosophical understanding that prediction is the basis of signal interpretation as opposed to merely recognition or descriptive models."
"Unknown","00;20;01;10","00;20;40;07","So if anyone has like a thought on that, then, you know, put it in live chat or come get involved, but let's work with that delineation going forward. So predictive processing is going to be somehow related to the formal sorry, predictive coding is going to be more close to the formal whether it's predictive coding in a biological context or whether it's going to be in a philosophical context or something it's going to be more on the formal side, whereas predictive processing is going to be where a little bit closer to the philosophical."
"Unknown","00;20;40;23","00;21;15;00","Yeah, I think so. And then maybe like does the Bayesian brain like make up the the third part of our predictive coding layers over the Bayesian statistics? And predictive processing layers over the philosophical than does the Bayesian brain somehow make the in-between sandwich that goes over the biological OK, OK, so let's see, we have predictive processing as being a philosophical approach."
"Unknown","00;21;16;11","00;21;56;22","And in consideration of these philosophic goal memes and themes in the biological case, which we're certainly bound to then we can have predictive coding as kind of the formal way that these predictive anticipatory systems are implementing predictive processing. And then what is the Bayesian? It seems pretty fair to put it at the intersection between Bayesian and Brain, but what is the Bayesian brain to you?"
"Unknown","00;22;01;24","00;22;51;29","So to me, the Bayesian brain is kind of, you know, I'm trying to look back to the paper, to their description. But in my recollection, recollection of the Bayesian brain, which is like probably my first introduction to Bayesian statistics, I was like, Oh, this is great. And it wasn't even the Bayesian thing. It was like the Jane in interpretation of the Bayesian Brain paper, but like that paper was like probably the my like turn on to Bayesian statistics and implementing this and so in my mind, the Bayesian brain is just this idea that the brain uses Bayesian reasoning or Bayesian updating to process information and, and go forward."
"Unknown","00;22;52;01","00;23;19;29","So but that's probably a very simplified interpretation I think there's going to be one more realist interpretation, like the brain is doing Bayesian stuff, and then there's the more instrumentalist interpretation we can use Bayesian statistics to model what it is that the brain is doing. So is Bayesian the territory or the map of the brain. But we'll just leave it as an edge for now."
"Unknown","00;23;20;18","00;24;05;08","So I'll read a question from Deane, and then I think we're going to be exploring a lot where action and active inference comes into play. So Blue Deane writes, What do you think of this as coding you are doing something in coding as processing. You determine by comparing processing and or not processing as you're doing. So process entails processing types what I'm hearing there is encoding doesn't require two arguments."
"Unknown","00;24;05;23","00;24;43;25","It just takes one. You take one file and you zip it. You've encoded that in a way so predictive coding can encode and or implement some type of informational algorithm without a reference or a comparator, whereas Deane saying As processing, you determine not with this single arguments plug and chug, but you determine by comparing as you're doing. And so predictive processing, it does have that sort of top down and bottom up as it's often visually represented."
"Unknown","00;24;43;25","00;25;14;16","But processing is entailing that full stack and therefore the processing is requiring something like a minimum of two to have consideration. If you're processing nuts, then you're sorting them into two different kinds or you're removing something from something else about those. Like you're doing something that has composition ology or some type of multiplicity to it. It's not just something you can take that one file and just zip it."
"Unknown","00;25;14;26","00;25;43;13","So that's a great point. Dean, I think I'll add two little arrows here yes. OK, yes. Blue. Let me share the slides. Thank you. I'm left in the dark here. I definitely. Yeah, agree. With Dean's point about the coding versus processing. Like, I can write a whole lot of things, right? Like, I can take a whole lot of notes and that's coding."
"Unknown","00;25;43;13","00;26;08;16","That's like encoding the information from our conversation, this live stream. But like, until I do something with those notes, like turn them into elements of a paper that I want to write or something like this, like I have not processed what I have encoded until I take them forward. To a forward step. So I think like there is kind of this temporal implication with processing versus coding."
"Unknown","00;26;09;06","00;26;35;05","Hmm. Yeah. Also like the timeliness of processing, like you want to process the food before it has become bad or something. So, OK, we have predictive coding again, these are just tentative slide play. If anyone thinks differently, they can join or write a comment, but predictive coding might entail something of a unique directionality, just like a dot sip."
"Unknown","00;26;35;05","00;27;09;21","And you say, well, somebody will unzip it later, but we can encode it without that part of the loop being acquired. And then we have this two directional relationship with predictive processing being like top down and bottom up OK, what do you see now? Or I can bring up something yeah. So I'm not really seeing anything. So why don't you bring up what what is on your mind or what you're thinking of where is action?"
"Unknown","00;27;10;16","00;27;47;29","And then I think that'll start to walk us towards where active inferences because of the temporal nature of processing. I think action might start in the processing elements like even in something like mental action, like people do like thought correction or thought remediation. So like if you're you you know, you have this prediction and it like surfaces in your mind, but then like you carets the prediction or like you, you know, you think you see a snake on the floor and then say, oh, that's a snake."
"Unknown","00;27;47;29","00;28;13;24","But then you look, let me see that snake like and then you have to zoom in, look at it closer, and it ends up being like a coiled up rope. Right? And so it's not really a snake, but like you direct your attention because of some prediction and then can continue to process that prediction. So so possibly action starts in the processing in the processing area or maybe it's there in the middle."
"Unknown","00;28;13;24","00;28;38;21","Well, I'm going to start it in the middle. We can see where it goes because I think it's going to have an important edge to each of these three areas. So there's a few ways to represent it, of course. So how does action relate to biological systems? Or first, let's let's start with some philosophical frameworks that highlight the importance of action."
"Unknown","00;28;39;12","00;29;10;04","So this includes and activism embodied the forties, fifties, seventies, et cetera, et cetera, et cetera, everything involving like this sort of embodied, enacted and cultured, extended, et cetera, approach to cognition and philosophy. And those can be quality. So putting that edge here, these are different qualitative and philosophical areas yes. They can be formalized. We'll get to that edge."
"Unknown","00;29;10;14","00;29;26;26","But these are qualitative memes that come from this philosophical area, and they're going to draw us to action. OK, now how about biological systems and action? What do you think about when you think of biology and action?"
"Unknown","00;29;29;19","00;29;44;20","I don't know. I think like those things are kind of inextricably linked in my mind. Because, like, you can't have life without having some action. I mean, cells replicate yeah."
"Unknown","00;29;46;28","00;30;16;02","I think this is going to be just something that doesn't demand to be that but is totally true. Biological systems are active there. It's active matter and life is this multi scale organization of activity. So there's many ways biological systems are doing action. And what are some areas that are formal, whether or not they have to do with biology or any philosophy?"
"Unknown","00;30;16;19","00;30;41;16","Can you name a few areas of like formal theory and science that you think relate to action? So I mean, I think just that's maybe more related to processing. But, but as I said earlier, I think processing is related to action. But like Bayesian inference and and Variational inference, I think which also tie in a lot to active inference."
"Unknown","00;30;42;00","00;31;24;13","I think that they come in there in the processing, slash processing through action or action through processing. OK, great. So Bayesian planning as inference as well as areas like cybernetics control theory, and different formal ways of modeling active systems and modeling decision making these could be related to a biological system or not, and they can be drawing on a philosophical framework implicitly, explicitly or not."
"Unknown","00;31;25;08","00;31;46;13","All right. So now this is starting to get fun. You added another term there. I think this will merit a detour. But then I return to here, which is the variational Bayesian approach. So what do you think Variational is meaning or doing here?"
