"Speaker Name","Start Time","End Time","Transcript""Unknown","00;31;49;29","00;32;25;19","So it's interesting and part of what makes this complicated paper and also like a complicated detour that like the authors cast predictive coding as variational inference, like even though we've kind of made this distinction between predictive coding and predictive processing where coding does just it's like a one way street and processing is a two way street. The authors nevertheless use the term predictive coding as variational inference."
"Unknown","00;32;26;14","00;32;58;12","And this predictive coding or this variational inference. I think the the key construct here and that's probably I don't know, it overlaps with with Bayesian brain maybe too is the idea of having a model of of the data generating process. And so I think variational inference kind of throws the idea of, of a, of a model into the loop."
"Unknown","00;33;00;07","00;33;40;12","OK, so let's zoom in on this blue corner of formal and quantitative areas. And so these can be taken in an action independent way. They can be explicitly about action like planning as inference, or they could just more implicitly rest on inference. I'm sorry, more implicitly rest upon action. For example, in the case of we're inferring the hidden state of the temperature of the room and we're observing the thermometer that doesn't have pie it doesn't have a it doesn't have action in that model."
"Unknown","00;33;40;19","00;34;03;16","It might just have those two parameters of like the rooms, temperature, hidden state and the observations of a thermometer. But then we can kind of take a step back and see. All right. Well, there's the person who's engaging in this experimental action, the person's ocular motor, zooming in on the thermometer maybe we can just abstract away, but action is always baked into it because we're talking about active systems."
"Unknown","00;34;04;02","00;34;31;00","But let's just put some of that aside for a second and take a quick detour to talk about variational inference, because it's a really important topic. Let's think about and we've also explored this in active live stream, 26 and 37 and a lot of other types. So let's look at three different ways of doing Bayes, Bayes ways, Bayes areas as they were."
"Unknown","00;34;31;19","00;35;04;06","So and maybe there are more, but the three that we can list up here are exact Bayes, Monte Carlo and Variational Base. So pick one and then what is like something important to know about that way? Of doing Bayesian statistics well, so I am by no means an expert in Bayesian statistics actually like cracked out my Bayesian data analysis book while I was reading this paper because it was one of those papers."
"Unknown","00;35;04;06","00;35;26;18","Like I said, I'm a, I'm anal retentive and detailed. I like, what does that mean? I have to look up every little thing I don't understand. So like, OK, so let me start with exactly BS, so exact Bayes, but I think about exact Bayes it's like the probability of A given B like the probability of rain given clouds or something like that."
"Unknown","00;35;27;07","00;36;00;06","And so it's like an alternate alternative to frequentist to statistics where the probability of rain and the probability of clouds or like a coin flip is easier to talk about, right? Like so each flip of the coin is half. And so like, you know, the idea that what are the chances that you're going to get heads you know, five times in a row is half times, half times, half times aftermaths."
"Unknown","00;36;00;21","00;36;41;09","So in Bayesian statistics, there's or the probability that you're going to get rain. Here in Frequentist statistics, the probability that you're going to get rain and the probability that you're going to get clouds is the probability of rain times the probability of clouds. That's a great way to put it. And then in Bayesian statistics, there is it evaluates the probability of rain with clouds, like given what you already have observed before, like if it's rained, it's usually cloudy this percent of the time and it takes into consideration the probability of rain with clouds, probability of rain, probability of clouds, all of those things separately."
"Unknown","00;36;41;09","00;37;06;14","So it gives you a prior estimation, I think. So I don't know if that's probably super confusing. Great note. You mentioned a lot of really important points, which is it's an alternative to Frequentist statistic. Analysis. So we're not getting a P value out of this and we're able to explicitly say our priors and not to go down this rabbit hole."
"Unknown","00;37;06;14","00;37;29;04","But a lot of Frequentist implicitly has a uniform prior and we'll just leave it at that for now. So the exact Bayes is using the BS equation essentially as written. And just as you said it, there's the probability of something given something else. And then you kind of find the probability of that other thing given the first thing multiplied by these other terms."
"Unknown","00;37;29;15","00;38;00;25","And then you fill out all of those variables and you literally do that division and so we explore it like this in the case of actual constants paper with the bacteria. And so there is the exact Bayesian bacteria that was having its prior and then taking in new information and updating how it thought about what was out there based upon the new incoming information and it was like in a formula and it was like dividing exactly the numbers that you see here in this way."
"Unknown","00;38;01;08","00;38;38;22","OK, so that's exact base. Now what are some issues with exact base? It might be straightforward when you're talking about that coin flip, but if you're talking about high dimensional space or something that is just bigger than the RAM or whatever of your computer, when it comes to the implementation, there's often challenges with exact base. And so there's several techniques that have been developed to approximate what an exact Bayesian approach would be in a more tractable way."
"Unknown","00;38;38;26","00;39;02;28","So there's two alternatives to exact base implementation and the spirit is going to be exactly the same of taking in new information and updating our priors as specified. But it's going to be done in a few different ways. So first, what about Monte Carlo? What is Monte Carlo? So Monte Carlo, you probably know more about the history than I do."
"Unknown","00;39;02;28","00;39;56;19","But but Monte Carlo is like a sampling technique. So, you know, instead of trying to calculate the probability of rain and clouds using exact bars, you just sample like out of, you know, a thousand rainy days. How many of them were cloudy and out of a thousand cloudy days? How many of them were rainy? And so instead of like getting an exact measurement of your distribution, like what is the where is the overlap between clouds and rain, you just randomly pick out from all of the possible days, you estimate your sample that way so it's based upon sampling."
"Unknown","00;39;57;10","00;40;24;00","And so it's like we might not know one of these terms, but we can at least draw a sample. And so this does a few different things. It connects us first to empirical and specific data as implemented, like in a row of a program, not just B, sub I or some sort of analytical representation, but like this is where we're getting into this specific sample was pulled by this algorithm at this time."
"Unknown","00;40;24;22","00;41;06;16","And one method that's a common thing is the Markov chain, Monte Carlo and this is using a local re sampling approach like assessing local managers of a given chain that's engaged in sampling. And you kind of drop these chains into different parts of the probability distribution and then have them evaluate different aspects of that distribution. So it's as easy or hard as dropping those paratroopers into different parts of the physical landscape and then having them accept or reject different proposed moves so that's sort of a two dimensional landscape with the height being elevation."
"Unknown","00;41;06;20","00;41;33;24","And maybe that's what you want to map because you might want to know, is there one central peak are there two peaks that are very similar? And take that into the statistical case. And this is especially helpful for when there's no why don't I see no idea, but there is not the desire to explicitly formalize what shape the distribution looks like."
"Unknown","00;41;34;00","00;41;57;26","So we might want to do like Bayesian pilot genetics. And so we need to talk somehow about the likelihood of a given DNA sequence being that way. But like where do you go from there? And so that's where the Monte Carlo sampling based approach really comes into play. And then because it's based upon sampling the advantages are you can run that sampling for three iterations or 3 million."
"Unknown","00;41;58;05","00;42;26;23","So it's very flexible with the amounts of computing power that you bring to bear on this challenge. But also there are the risks of over sampling, which is that you have use some unneeded electrical power and computational power, which is really non-trivial. But also there's the risk of under sampling. And you might even be like in a regime where you think that you've sampled because you're getting samples that are just confirming what you already know."
"Unknown","00;42;27;05","00;43;03;28","But, you know, there's a whole other island that you didn't do the paragraph to. So one can be lulled into a false precision with bootstrapping and sampling based approaches because they can give ultra high precisions but that can be based upon actually more like a biased sampling approach or all these other features. And just the one anecdote that I have on that is in the Bayesian phylogenetic case, I remember this one professor in undergrad, Professor Moore, and he'd always say Fuzzy Caterpillar you want it to look like a fuzzy caterpillar."
"Unknown","00;43;04;06","00;43;30;03","There's some technical details, but it's like you want it to be exploring the full range of a parameter like if something could be zero to one, you want to be exploring the full range. But returning to the best estimate, and that shows that you're sampling like the diversity of what that parameter can be, but also spending more or most of your time in the most likely and in the best regions."
"Unknown","00;43;30;09","00;43;48;15","And so if the value were at 0.5 and the range of what's possible is like zero to one, that looks like a fuzzy caterpillar with more thickness in the middle and then a lot of fluctuation but it's not like it's spending a ton of time, that one, and then it drops suddenly to zero because that would suggest that you're not converged yet."
"Unknown","00;43;48;23","00;44;25;07","Whereas when you see that fuzzy caterpillar it's like you're sampling the extremes and getting novelty and testing different combinations, but you're also returning to something that is working. So Monte-Carlo sampling based approach brings in all of these opportunities and challenges associated with sampling well. So I was under the impression like you talked about over sampling, but I think over sampling, like as you as sampling goes to infinity, like your your accuracy increases like gear closer able to get the true posterior."
"Unknown","00;44;25;27","00;44;48;18","But I think it's it's uneven sampling. That's the danger in the Monte Carlo method. Like if you're sampling too far in one end or the other and perhaps like asymptotically if you exhausted the state space, then you would know that you had the right answer. But the whole reason why we're using any kind of terroristic approach rather than exact bars is because like we don't have the full state space."
"Unknown","00;44;48;29","00;45;16;02","So yeah, there's relatively low cost to oversampling, but we don't always know when that is and then under sampling can be just totally misleading. If we take that as our only representation of that distribution. And so there's all kinds of cool techniques that involve like multiple chains happening in parallel. And some of them are like higher temperature and less temperature."
"Unknown","00;45;16;02","00;45;42;21","So for one of those paratrooper teams, it's very cold. And so they're only making the best very local moves. It's like the elevation is sharpened for them. It's very hard to get out of a local rut, and there might be another team that's very high temperature and for them the landscape is flat maybe even completely flat, and then they're like a hot molecule that's able to move over something that might be a barrier for another team."
"Unknown","00;45;42;28","00;46;15;25","So that team is going to like fill in the details and locally explore quality solutions, whereas there's another team that's like it or another chain. And so that's the multiple chain Monte Carlo approach. And there's a lot to that in phylogenetic, which is where I've seen it the most, but also probably many other areas OK, so I've, I've, I've run it in phylogenetic too, and like, I mean, the program can take forever to find because, you know, too many parameters and whatever, they can really take a long time."
"Unknown","00;46;16;09","00;47;03;24","The computational power is no joke. Well, like what goes into the Monte Carlo sampling. So we have that phase which is calculating the true posterior. And then we have the Monte Carlo, which is estimating the true posterior to sampling. And then we come to the variational, which is trying to minimize the divergence between what the true posterior and your approximation of the posterior rate, minimizing divergence between the true posterior like what we would really have wanted to actually know what is the actual temperature in the room conditioned upon the noisy thermometer estimates that we're getting."
"Unknown","00;47;04;10","00;47;26;07","So are we going to sample our way out of that one? The variational approach is going to be very different and in 26 I think we had like the cat and then one approach was like the Monte Carlo was like pointillism. It was like dots were sampling pixels from the cat and then it becomes like a pointillist picture of a cat that if you do sample densely enough, it looks like a cat or it's recognizable as a cat."
"Unknown","00;47;26;29","00;47;44;17","And the variational approach was like a clip art template and so let's just say that you had a template of different curves or of like you knew that, that it wanted to be a cat, you knew you were looking at a cat. So then you have like a cat template that can get stretched or zoomed in or out."
"Unknown","00;47;45;10","00;48;11;22","And so that might be very straightforward to optimize because you're just trying to minimize the divergence between these very limited parametric changes that you can implement. And of course you run into a situation which we'll explore various aspects of variational inference. What if you try to stretch that cat emoji onto a different animal? Or what if it's a totally different kind of data set?"
"Unknown","00;48;12;00","00;48;45;23","So you will find some divergence minimizing solution that doesn't mean it's sufficient or even in the right ballpark just like doing owl to least squares, minimizing linear regression will always find a best fitting linear regression but that best fitting linear regression can be like hilariously inaccurate. Like if the data are like a parabola like a you, the best fitting regression might be like a flat line through the middle."
"Unknown","00;48;46;07","00;49;13;12","Or if 80% of the points are here and 20% are over here, there might be a regression that's very misleading. That's like The Simpsons so-called paradox. So in Variational, we're not going to use sampling, we're going to use the minimization of a divergence, which is a real divergence. But they mentioned in this paper it can also be a different kind of divergence, and the Rainey divergence has been explored in some recent work of Saget at all."
"Unknown","00;49;13;29","00;49;52;12","So we're going to minimize the divergence between the true posterior and a distribution. Q that we control and is tractable to optimize so it's like instead of that sampling based approach, we are dropping the teams at different parts of the landscape and then they were going to report back on information here in the variational approach, it's like we have a template and then we're going to just do stretching and bending again."
"Unknown","00;49;52;12","00;50;16;16","This is kind of a tortured metaphor, but we're going to stretch and bend and there's only a few parameters on the stretching and bending and we're going to find the best fit of those stretching and bending parameters. Like if it were a linear regression, Y equals X plus B, the two dials that you get to change are like the M, the slope of X and B like how high or low the regression is."
"Unknown","00;50;16;27","00;50;57;24","And then you're finding M and B that are the best fitting about the data Y. And so you're kind of like minimizing the least squares error term here. It's not a linear regression that we're fitting by minimizing the least squares. It's a variational Bayesian approximation that we're fitting by minimizing the divergence between the true posterior and the distribution cue that we control and is optimal or is able to be optimized well, else would you add on that I think that's it."
"Unknown","00;50;57;24","00;51;34;15","So the, the true posterior and the, the distribution that is tractable and we can optimize over. Yeah, that's it. So, so let's close this. We'll look at computational intensity on very emotional is like much less right then because instead of calculating all of the parameters for every little dot, every little point on the sample, we are calculating for like a big blob."
"Unknown","00;51;35;04","00;52;04;12","It's like one big blob instead of several little points but we calculate for that big blob this is the density of that of that function. These are the parameters of that. So, so now we're going to back out of this formal cul de sac that we've been in. And just remember to ourselves, even if it's your first time hearing Variational Inference and or you're kind of like Blue or I where it's like we've read it in how many papers, but still every time we kind of start on square zero."
"Unknown","00;52;04;24","00;52;31;08","So why do we use Variational Bayesian inference? So the first thing is it allows us to use Bayesian statistics and probability, which we might prefer over for example, Frequentist, OK, Variational Bayes then allows us to use a heuristic Bayesian implementation. So if there's something that's too challenging or implausible for exact Bayes, now we can approach it like Monte Carlo or Variational."
"Unknown","00;52;31;08","00;53;03;06","These are both his mistakes. Unlike Monte Carlo, it's not based upon sampling. Variational is based upon a family of equation fitting, and so it can be implemented very efficiently, which isn't always the case for Monte Carlo. It rests upon an appropriate factorization of the problem. And one other piece is this connects to analytical equations in physics. So it's almost like Monte Carlo is like a computer scientists approach."
"Unknown","00;53;03;18","00;53;22;08","It's like how much RAM do we have? How many processors do we have? How big is this data set going to be? And then there's no analytical equation or closed form for Monte Carlo. It's like engineering. It's kind of like you have to have some art and skill and science coming together for the Monte Carlo to be the best it can be."
"Unknown","00;53;22;22","00;53;46;24","And then it's more about like an adequacy and an efficacy question because you're not converging to the infinite asymptote again, otherwise you could have done something else. And then the variational is like the physicists approach and it draws on the variational calculus of Feynman and others. And this is the part that's very amenable and connected to the equations of least action and all these other things like factor ising equations."
"Unknown","00;53;47;18","00;54;18;27","So it's funny that you bring up the computer scientist approach in Monte Carlo and like so I am a horrible computer person. I mean, I will brute force wrangle my data like just give me more ram, just give me more processing power. Like I, I just want to make things work out of any patient for finesse. Right? So in my mind I think about the Monte Carlo like the brute force, just shove your data through the algorithm no matter how much ram it takes."
"Unknown","00;54;19;05","00;54;41;20","I think about Monte Carlo like that and I think about the variational Bayes boy like the people that I can do, like, you know, very simple things in code to make it run much faster that have that like very good skill with like, oh, well, we can just, you know, run this little factorization or, you know, we can make the problem run."
"Unknown","00;54;41;20","00;55;02;12","So much better on the computer. So I think about it, about the variational like that be bigger, right? It does have that connection to statistical physics and to, to Feynman. But I think about it as like a highly optimized way to run Bayesian statistics. But why, Daniel, would someone want to run Bayesian statistics in the first place? So, so maybe you want to give us an example."
"Unknown","00;55;02;13","00;55;25;21","Why would that happen? Well, yeah, we will pull back. Just the last point there is the variational methods. We might even have a higher mystic for those or an algorithm or approximation of those. For example, message passing. And for any factor graphs, those draw an equivalence between Bayes graphs, where nodes are random variables and edges are statistical relationships."
"Unknown","00;55;26;10","00;55;52;19","These graphs can undergo variational inference and there's a tractable way to use toolkits like that developed by the bias lab and use message passing and a form factor graph representation to have like a level of implements ability for even the variational. Whereas it's not possible to imagine like a horrific for Monte Carlo, it is the horrific sampling is sampling."
"Unknown","00;55;52;19","00;56;16;18","You can do better sampling, but that's the game that you have chosen. Whereas in Variational even this question of minimizing divergence does require kind of like a proximate or an operational approach because how can we minimize the divergence between the true posterior and something we control and we don't know what the true posterior is. So there have to be a little bit more added."
"Unknown","00;56;16;18","00;56;44;29","But this is like very awesome discussion because it's helping us pull out. Like this is the sort of exact approach. And then there's a more computer science like sampling approach and then a more analytic goal and physics related approach. OK, so why do we want to do this? Let's pull back to our triangle here. Why do we want to do base and thinking about the concepts here?"
"Unknown","00;56;45;06","00;56;46;12","Why do we want to do this?"
"Unknown","00;56;48;14","00;57;13;08","I asked you, you're not allowed to turn the question around on me. That was me asking you. You're not allowed to just talk and then ask me well, there's a few ways to take it. I guess one would be what is the alternative policy selection if we're doing research or application, what is our alternative to picking some Bayesian approach?"
"Unknown","00;57;13;13","00;58;01;20","So if we take the Bayesian road, we know that there's going to be some sort of try emergence later. Exac Bayes, Monte Carlo, Variational, Bayes, something else. Or we could go down a different statistical path, like we could use Frequentist statistics, and maybe that's totally adequate, ineffective for the situation and both are just maps. So a well-fitting linear model of height and weight doesn't make height and weight a linear model, a really good fitting action perception loop, whether it rests upon a kernel of Frequentist statistics or Bayesian statistics doesn't make those systems that way that you modeled it so I would say Bayesian statistics is useful when we want to do some kind of formal"
"Unknown","00;58;01;20","00;58;32;29","or quantitative inference where we want to be specific and explicit about our prior beliefs and how we want incoming information to update those beliefs. So I agree, and it's what I always try to tell people, you know, when I'm explaining, like what is Bayesian statistics, which a lot of people have never heard of, like in college, at least when I graduated, there's there's no Bayesian statistics course."
"Unknown","00;58;32;29","00;58;55;04","Now many schools have them. And, you know, I'm outdated already, but it's really like when you're doing frequentist statistics, you go out to the desert and count mice every year, right? Every year you go and count how many mice you see in the desert or something like this. And if you I mean, you expect to see some mice in the desert, otherwise you wouldn't be there counting them."
"Unknown","00;58;55;16","00;59;18;04","So you expect a non-zero answer. Every year you go out, you find ten mice, 20 mice, 50 mice, 30 mice, 20 -10 mice, and every year you go count mice. So if you were to go like you have some expectation that you will find mice, you also have some expectation that there is going to be less than a thousand mice because every year you sample this place."
