2619037	2627547	B	0.64276	Here we characterize decision as a secret of four step actions.
2627667	2638700	B	0.87321	So each action correspond to a movement to right or left or up or down.
2639362	2648047	B	0.66	And we consider a four step sequence of that option which is expressed as D.
2648230	2659637	B	0.80469	So it has four power, four possibility.
2661337	2662925	A	0.75	256.
2663812	2666077	B	0.69	Yeah, 256.
2666245	2681707	B	0.62411	So this is a protein on XY coordinate because in the middle panel, middle point correspond to the current position of agent.
2681860	2704637	B	0.78	And with four step movement, agent can go one of any current position and the current brightness corresponds to the expectation about the agent decision.
2705662	2707597	A	0.69868	Well this is very interesting.
2707780	2714912	A	0.99766	If we just were to think about you're at a point and you can go up, down, left, right, you have four moves.
2716462	2721362	A	0.63299	Naively it sounds like, well it should look like a gaussian blur.
2721862	2728302	A	0.99987	Most of those should cancel out and then it should become rarer and rarer monotonically.
2728482	2743550	A	0.90543	But actually you start in the middle, you can't end up on these white squares because it's like one, two, three and then you have to leave.
2744737	2745500	B	0.57	Right?
2745862	2765837	A	0.8349	So it's kind of like horses in chess or other pieces where actually their embodiment, it's very unexpected that you can't in four moves end up next to where you began when you can be so much further.
2766262	2781062	A	0.95	And then we see this kind of like embodied inferential prior with QS that embodies regularity beliefs about the width of the road and the separation of the roads.
2781412	2793362	A	0.68	And then there's these like embodied action priors and real consequences that have to do with the structure of movement.
2794837	2796277	A	0.80491	So what it's doing?
2796370	2801272	A	0.88178	It's thinking about policies of length four.
2801380	2804300	A	0.79751	There's 256 policies of length four.
2804887	2810602	A	0.86611	There's some degeneracy because there's obviously not 256 squares here.
2810770	2819142	A	0.78411	So while only one policy is going to take you up, up, down, down, other squares are reachable.
2819202	2829050	A	0.88609	Like the center square is probably the mode because it can be reached at least a handful of ways.
2831587	2848550	A	0.8	And then at each time point it's basically saying okay, I know where my X position is and given my local eleven by eleven view, I'm trying to plan to go right.
2854662	2868025	A	0.79	And then here through time in the simulation here it starts at 30 something, it quickly figures out how to get to about 40 and then it's kind of going up and down on 40.
2868987	2876662	A	0.99299	But it can't really break out because all of these bottom four routes are closed.
2877162	2883325	A	0.69	It has a breakout and then very quickly it hits another plateau around 60.
2884212	2884975	B	0.41	Right.
2885562	2893075	A	0.98765	Then it kind of has a very nice breakout and in just a few steps goes very far.
2895162	2897217	A	0.74883	So what is dopamine doing?
2897265	2902987	A	0.99511	Or how is Dopamine helping it in the plateau and then to break out of the plateau?
2903562	2904325	B	0.46	Yes.
2904762	2918852	B	0.63112	So this agent learned this particular structure through many trials.
2919032	2931487	B	0.74828	So before training it failed to reach the goal, but after training it achieved such a nice behavior.
2932062	2961057	B	0.55269	So to active this, the role of domain is that we design gamma function such that if the agent can move rightward with some distance during some time limit, then risk becomes small like say comma equals zero nor risk situation in that sense.
2961135	2969437	B	0.98256	In that case, this agent updates synaptic weights through hebion frostbust.
2970087	2993112	B	0.92191	But if the agent failed to go rightward with some distance during a limited time frame, then gamma becomes large like zero six which is larger than the average zero five.
2993250	3007012	B	0.69215	Then we design that drawing in attention antihebian prosthesis occurred instead of Hebbian.
3007512	3020117	B	0.60554	So antihabion indicates the works as the disassociation between the current state and current decisions.
3020252	3026732	B	0.97194	Because the current decision does work, it's not good decision.
3026897	3042182	B	0.78533	So we try to make the agent who will get that particular decision rules through conversation of heavy and plasticity done by Dharma factory.
3042347	3050512	B	0.65921	So this can be an arrow to the Dopamine moderation heavy and activity.
3051912	3073037	A	0.94651	So if the policy is resulting in the expected outcome, gamma stays at .5, the policy is as risky or consequential as expected, and then the policy can either go better than expected, which facilitates learning to support that decision.
3073187	3086287	A	0.82	To be made more or the outcome of the policy can be worse than expected, which disassociates previous conceptions to discourage that kind of behavior.
3086937	3087700	B	0.95984	Exactly.
3089337	3111700	B	0.98865	Crucial point is that this association with different time frame in the sense that we consider multiplication of current risk and least decisions to average over past two present Hebbian product.
3112062	3126377	B	0.9952	This makes an association between past decision secrets and the current risk which enables to optimize decision to minimize the future risk.
3126557	3129112	B	0.97	It is just a safe time frame.
3131562	3146800	A	0.88848	So here risk is being used in a formal sense similar to how it's used in economics which is the associated uncertainty of outcomes with respect to a policy.
3148062	3150850	A	0.9934	Where does danger come into play?
3151737	3159262	A	0.90262	Like what if there was an adversary in the maze or something that was dangerous?
3160212	3167867	A	1.0	How does this kind of model accommodate or hunger or different kinds of competitions?
3167927	3172612	A	0.98197	Because right now it's basically just trying to diffuse right word with a bias.
3173187	3173950	B	0.63	Right?
3174537	3183850	A	0.93924	But how do different kind of situational elements become interface into the generative model and generative process?
3184812	3197372	B	0.9	Okay, any of those factors can be involved in risk factor, a single risk factor.
3197417	3209547	B	0.68227	So you can arbitrary design and risk factor because risk factor moderate generative model.
3209730	3220217	B	0.90229	So that's why agent try to minimize the risk through basic embryo updating.
3220277	3227287	B	0.98041	But the risk itself is in some sense outside of such a Bayesian framework.
3227712	3233417	B	0.60246	So we can design arbitrary risk.
3233477	3241537	B	0.92738	So it may involve some danger factor, any other factor.
3243762	3254117	A	0.88	And this simulation, it is a POMDP or it is a neural network.
3254177	3260950	A	0.79	And what scripts might we look at to understand the structure of the maze agents?
3262212	3274037	B	0.79	Okay, it is basically expressed using the quantity in home depp for tractability.
3274187	3310600	B	0.90295	But for example, if you see the MDP learning probably okay, there is a variable Lamme type in the definition of SIM type correspond to the type of simulation.
3310675	3320775	B	0.68443	So if it's one or two it becomes homo DP or neural network to my understanding.
3321200	3356987	B	0.74102	Well, in this particular example, Jelle, we use the let's say maybe it's not good example that DeForest is learning the deforesting this script as well.
3357050	3366000	B	0.78093	So maybe another as an example, let's see.
3369287	3375467	A	0.83218	What is MDP init is initiating the markup decision process.
3375665	3376202	B	0.9909	Exactly.
3376295	3396450	B	0.43697	It's just determining the initial state of the computer generative model fe compute variational free energy or risk MDP computer risk function.
3397937	3409512	B	0.46992	So basically we use the neural network structure computation in this particular setup.
3410237	3428762	B	0.65622	So when you click maze m then in the line 31 line we determine that Lamme type is two.
3428825	3433512	B	0.72494	This correspond to neural network architecture.
3434012	3492612	B	0.64361	So there is a very slight difference between home depicture and neural network architecture because assuming neural network architecture correspond to, you know, considering considering okay, well, if you choose the palm DP architectures, then we sometimes use the gamma function to computer the posterior expectation about parameters.
3493337	3507900	B	0.86665	But in the neural network modeling the gamma function doesn't appear but it is replaced with the logarithm of some function.
3508562	3520292	B	0.86	And simply speaking, the difference between the gamma function of something and the logarithm function of something is asymmetry Lamme.
3520490	3528472	B	0.89579	So that's why we can transform home DP two neural network architectures.
3528517	3532800	B	0.94729	When the number of samples is sufficiently large.
3537287	3545325	A	0.99719	Which form do you expect performs better under small or large amounts of data?
3547487	3553137	B	0.70441	Well, for large amount of data they work in the same manner.
3553937	3554812	B	0.58283	Same manner.
3554887	3573292	B	0.94198	For small amount of examples, I'm not truly sure but it corresponds to assumptions about the posterior belief distribution.
3573427	3595362	B	0.73222	So if you assume delicious distribution then your resulting function form is something that used the gamma function in terms of basic inference probably which is optimal.
3600512	3606600	A	0.91989	All right, let's return to the earliest questions from today.
3608012	3628887	A	0.62873	So in your script, which people can reference, there's basically a toggle between having it in SIM type one or SIM type two corresponding to the POMDP in the neural network.
3630212	3635787	A	0.99687	What about if there's a published neural network or POMDP?
3637112	3644412	A	1.0	How can we use this architecture to create a translation?
3648000	3649905	A	0.99513	Is there any difference in this?
3649952	3665800	A	0.96319	Kind of like translating models in the wild different than the full construction of a special script that can speak both languages?
3670500	3678987	B	0.83567	Well, in terms of script there's no difference, sympathetic difference.
3679575	3680430	B	0.72	Right.
3680627	3684680	B	0.60515	So they work in the same manner.
3684740	3706155	B	0.70486	So only a translation of variable the same source code in two different ways.
3706277	3714995	B	0.81228	So if you see that this is a neural network generation, then it is translated as a neural network.
3715085	3719650	B	0.92506	Or if you see that this is a POMDP, then it's POMDP.
3723075	3735700	A	0.6676	So for some neural network being used in an industrial setting, how would we get from the neural network to a POMDP?
3736050	3739900	A	0.79	And where or how would that representation be valuable?
3740925	3741687	B	0.7	Right?
3742275	3761345	B	0.44618	So when neural network in the different architectures the important point is that we consider a particular form of neural network which is called canonical neural network architecture.
3761510	3775000	B	0.7659	So only when we assume this crossover neural network then you can find the exact correspondence to a particular form of POMDP.
3775350	3790287	B	0.6159	Otherwise you need to establish another equivalent between another form of neural network architectures and some sort of Bayesian model.
3792825	3807850	B	0.97673	This may be expressed by POMDP, but maybe not so straightforward to be expressed as the computational AP architectures.
3809175	3818637	A	0.86587	So what is it about the canonical neural network architecture that facilitates its translation into the POMDP form?
3819225	3824487	B	0.66	Yeah, first of all, it assumes sigmoid or activation function.
3824850	3832975	B	0.54	It is nicely correspond to enthralpy time in the force DP equations from DP formulations.
3833400	3840275	B	0.81232	So that's why we can clear marketing.
3840425	3848105	B	0.64007	So yeah, in other words, simply speaking, they have the same nonlinearity.
3848240	3873530	B	0.89762	That's why this translation is very easy with another nonlinearity or neural network equation, then we need to find another type of entropy equation or another type of prior distribution.
3873665	3876175	B	0.88	It is very nontrivial.
3878175	3882912	A	0.83	How does one even go about doing that research?
3889575	3919137	B	0.78348	If you want to go that direction, then I think the first step is to find the prior brief, which makes the prior brief and find the equivalence between a particular neural network architectures and particular Bayesian model.
3925312	3929675	A	0.89355	This sigmoidal activation is interesting.
3930412	3942362	A	0.9	It corresponds to general patterns seen in psychophysics, like two objects that are the same weight.
3943162	3957962	A	0.82096	You're going to have a chance of saying that one is heavier and then initially the difference has the most returns on that decision being made accurately.
3959287	3983150	A	0.86	And then as it crosses some threshold where it just is beyond a noticeable difference, the decision becomes essentially probabilistic, like the firing curve becomes saturated, the neuron chaos, a very low belief about zero or very high belief about zero or one flip that.
3986587	4010387	A	0.7448	So there is a nice grounding of that kind of a sigmoidal response curve with respect to stimuli differences and it has of course, tractable analytical properties, but it also just happens to be a good response summarizer.
4011262	4012882	B	0.64	Yeah, you're right.
4012960	4018567	B	0.81639	So sigmoidar function is also known as a psychometric function, as you say.
4018765	4026342	B	0.99144	We observe that characteristic in many psychical experiments.
4026477	4060700	B	0.73	And the previous work also said that even at the single neuron level, neuronal level, the same behavior were absorbed, which means that each heuristic we can reobserve the similar property, which is sometimes called as neurometric function, which is which have the form of sigmoida activation function.
4063312	4076675	B	0.79246	So it is nice reason to design neural network architecture using a sigmoid or function.
4078837	4089962	A	0.59847	All right, let's cover a few questions in the chat from Dave and then in the end turn to some general thoughts.
4090462	4094600	A	0.85	Okay, this was when we were looking at figure three.
4095337	4103442	A	0.7942	So you described these vectors or matrices.
4103502	4106547	A	0.99761	What kind of matrix or vector did you describe?
4106592	4112925	A	0.93	The mass block matrix.
4114625	4116000	B	0.76149	Block matrix.
4118900	4123712	A	0.98356	Block rock learning what?
4124075	4126510	B	0.94	Okay, rock matrix of rock.
4126555	4131430	B	0.9218	Vector is a vector vector or matrix of matrix.
4131490	4134587	B	0.2778	So imagine that.
4142900	4147112	A	0.9398	Sorry, just zoom, just glitch just repeat the last piece.
4147550	4157400	B	0.91	Okay, well, broke matrix Dean that the element of matrix is a matrix.
4158125	4165875	B	0.52541	So let's say two by two matrix like matrix in the ear pointing.
4166375	4176375	B	0.87486	So this here W one hat is a matrix and W zero hat is another matrix.
4177250	4184550	B	0.61	And combining four matrices, we define a single block matrix.
4186625	4189112	A	0.95029	All right, thank you.
4189625	4199260	A	0.83733	So Dave then asks the hosts of Machine Learning Street Talk Number 67 with Karl Friston.
4199305	4202925	A	0.99872	Another podcast, Karl Friston has spoken.
4204100	4214087	A	0.75868	Pressed Karl Friston on why is it so important that most of the values in a generative model matrix assume values of exactly zero?
4217037	4221262	A	0.99945	Why is it important that generative model matrices are sparse?
4222962	4223725	B	0.9254	Why?
4230687	4232232	B	0.40258	I'm not Bull sure.
4232385	4237450	B	0.99	I think there is some context before that point.
4238037	4253200	B	0.91	I think on that particular situation, then, yeah, as you say, the many elements in the matrix or gentle model should be zero, but I'm not sure if it's a general statement at all.
4254312	4264575	A	0.56772	What do you think about compressed analyses on sparse matrices?
4268825	4282350	A	0.99143	Is that a useful technique or direction?
4285850	4299295	B	0.55	You can use that knowledge to construct model, so you can use that knowledge to make more accurate inference.
4299385	4305225	B	0.81027	So in that sense, generally speaking, such assumptions should be useful.
4306775	4320250	B	0.96577	For example, yeah, as you said, it would be possible to use some sparse prior to restrict the value of parameter.
4320325	4332340	B	0.53366	Like, it is in principle same as assuming some L one norm to design the distribution.
4332445	4338665	B	0.84	To design the prior distribution, which is mass Dutch speaking.
4338757	4343625	B	0.98723	Exactly same as considering Lasso regression.
4345550	4346312	A	0.95	Yes.
4348250	4368525	A	0.82796	So we've explored a little bit how from a canonical neural network to a particular form of a POMDP, gives us some semantics and interpretability around the dynamics and plasticity of the neural network.
4369175	4381050	A	0.99303	What do we gain by taking a stated POMDP generative model and deriving an analogous neural network?
4383725	4391625	A	0.96173	Do we gain access to efficient computation, new software packages, different applications?
4395462	4413182	B	0.82167	Well, if one use Home DP and one's goal is so design an efficient basic model, then I think your Home DP expression is sufficient.
4413272	4442457	B	0.75856	So you don't need to consider neural network architecture, probably because Homedippy architecture and Bayesian correlation is designed to achieve some sort of mathematically optimal inference and decision making.
4442535	4442817	A	0.58	Right?
4442865	4448837	B	0.64152	So it itself is optimal scheme.
4448987	4464637	B	0.57791	But if one need to consider a link between Bayesian inference and biological substrates, then this mapping is crucial.
4468962	4478807	B	0.81908	Simply speaking, we consider that we assume that a brain perform Beijing inference, but its substrate is still unclear.
4478897	4486697	B	0.82306	So we need to link the Bayesian quantity to biological quantities.
4486892	4492987	B	0.7134	So this mapping, this equivalent, helps us to its translation.
4493862	4494447	B	0.51	Right?
4494555	4508912	B	0.90457	So when you start from on the model, then this translation facilitates the process of finding its neuronal substrate.
4509062	4527917	B	0.84098	So once you translate that to a basic to neural network quantities, then it facilitates the experimental validation application to reality.
4528052	4554700	B	0.52029	So if its modeling is apt for a particular neural network neural circuit architecture, then it should provide some prediction about the architecture or dynamics of the empirical data.
4555212	4555932	B	0.6	Right?
4556085	4564302	B	0.7865	So first we start from Bayesian model, which is not necessary to be equal to empirical data.
4564395	4570547	B	0.63039	So there is some mapping, but it's mapping is not straightforward.
4570742	4591537	B	0.99871	We may have multiple mappings, but once you translate Bayesian model to a particular neural network architectures then mapping or relationship between applicable data to such a particular neural network model is straightforward.
4592187	4600750	B	0.87087	So it helps us to apply base to an explanation of MP card data.
4606737	4626037	A	0.71314	So is it fair to say that neural networks have found wide recent application because they facilitate statistical learning in cases where the inference problem has not been a priori well specified?
4627137	4636375	A	1.0	One can just have a folder of images and a list of labels and just say, here's the data.
4637412	4643737	A	0.99941	Run it through this architecture or this architecture Explorer.
4645137	4657825	A	0.83	And so with this concordance we gain new interpretation into those settings that kind of arose from ill specified inference problems.
4658412	4684687	A	0.88	And then on the other hand, for problems that we already have well specified in terms of a POMDP generative model of a particular form, we gain the connection to actually implement it with empirical data and bring it into relevant industrial settings.
4687987	4709167	A	0.99833	What systems or phenomena are promising to continue research on the image example obviously is a simple case, but are you continuing research into more advanced computational agents?
4709365	4711937	A	0.96037	Robotic animal.
4716200	4746505	B	0.45	Oh, hello can design a more sophisticated agent which performs some difficult tasks based on canonical network neural network but there is some limitation, clear limitation on that direction.
4746565	4746965	B	0.84	Right?
4747057	4763025	B	0.60478	So yeah, I should emphasize that across the canonical neural network which correspond to a particular home DP is much smaller than general home DP framework.
4763600	4767670	B	0.66349	So there are some limitations, a least of limitations.
4767760	4792725	B	0.69789	So if one's goal is designed and sophisticated DAGs to perform some task or control robot, then one direction is just forget such limitations and take the mathematical optimality right and another direction is barrelscale probability.
4793075	4819425	B	0.69135	So if one wants to image some agent which is barely possible, then this correspondence is crucial because it tells us biological limitations through the existence, no existence of such a mapping between POMDP and particular neural network architectures.
4819775	4822562	B	0.59824	So, yeah.
4823000	4833975	B	0.71553	So it would be useful to consider a vertical substrate to achieve exafferent task.
4842162	4851362	B	0.72	And that task would be related to high dimension image processing.
4851512	4859882	B	0.98373	Image recognition or sound recognition, such as multimodality, can be inbox or decision.
4859972	4879677	B	0.9946	Can be higher dimensional like in the mainstays, we just consider the four directional movement, but it can be extended to higher dimensionality, like arm movement, body movement, so on, so on.
4879845	4887412	B	0.85288	So in principle it can be extended in that direction.
4890312	4896387	A	0.99753	Which directions or questions are you excited about?
4896525	4906162	A	0.96286	Or what areas of studying the basis of biological and computational intelligence are relevant?
4907112	4907967	B	0.94	Yes.
4908165	4922447	B	0.69432	So in terms of the importance of canonical network, as you said, virtue is a biological probability.
4922567	4970012	B	0.80628	So it would be nice that if we model some task which is conducted by learning and one already recorded some neural activity, then we design a task which is exactly same as the task which is done by the animal and then compare the simulated agent and Mpcar data to discuss about the similarity or difference between the simulated agent and the animals.
4970162	4973950	B	0.9869	That would be very interesting direction of research.
4976862	4988650	A	0.53	Yeah, and if there could be some unexpected prediction or explanation in the computational agent, that would bolster the relationship.
4989462	5025452	A	0.7	And then one other aspect is it would help with the reproducibility and the documentation around behavior studies if the computational agent were preregistered and someone said we've already done the statistical power analysis and we've already explored with parameter sweeps how many observations we need to make of the two armed bandit.
5025557	5030067	A	1.0	How many observations of the three armed bandit should we do?
5030190	5034100	A	1.0	Three mice 100 times or 100 mice three times?
5034912	5041987	A	1.0	Those are the total substance of designing research programs.
5042862	5055787	A	0.92	And so having a formal representation of behavioral tasks that are being studied will help us design behavior observations and experiments that aren't simply ad hoc.
5060037	5063875	B	0.60984	All right, that's an interesting application.
5066862	5072800	B	0.52986	This framework helps to design the experimental setup itself.
5073762	5098300	B	0.69	And what we often consider is the prediction ability of these modern canonical neural networks to predict the Jelle phoneization or dynamics of the VR neural network in the animal during the learning process.
5098662	5121347	B	0.7232	So in place for it is possible to predict the behavior after learning based only on data in the initial stage because once we obtain some empirical data, then we can fit that data to design a particular canonical network.
5121542	5137617	B	0.75	And canonical neural network makes some correlation through a minimization cost function which is exactly same as the Bayesian belief updating under a particular guarantee model.
5137815	5159972	B	0.66102	So which means that its dynamics goes through the shortest path on the free energy landscape which means that we can make some quantitative prediction about the sinatic trajectory or neural activity or any kind of parameters.
5160167	5171267	B	0.87602	So we demonstrated that using in virtual neural network and uploaded some footprint recently.
