5171402	5214407	B	0.77705	So at the stage, at least at the level in vitro network, which is much simpler than VR brain, we could predict the self organization of in virtual network using this canonical network architecture and this support the probability of free energy principle because this canonical network predict the communication through the variational free energy minimization and its solution.
5214497	5224537	B	0.80437	Its results have a very tight correlation between correlation to Archer synchronization.
5227962	5230787	A	0.93658	That's a very interesting experiment.
5230862	5239387	A	0.73813	So what animal were the neurons from and what was measured about these neurons?
5239737	5266802	B	0.94	Yes, so that in vitro network is obtained from blood embryo, we use cortical cells to make that individual network and task is sort of causal inference task which can be designed in the form of OMDP.
5266982	5279957	B	0.63193	So imagine that we usually simulate agents that receive signals generated by OMDP generative process and process and Beijing task.
5280122	5287847	B	0.87358	So we just replaced that Bayesian agent to neural network.
5287967	5311537	B	0.87125	So we stimulate neuron with some signal which is made by some hidden sources through like a human mapping and question is whether in viral network can info the hidden states through some communication and they can they could Ines the hidden culture.
5315112	5323922	A	0.97665	What does it look like functionally when the neural network has succeeded at inferring the hidden causes?
5324117	5335397	B	0.48	Yeah, the direct conversation is done by the response number response spikes to a particular pattern sensory input.
5335517	5345502	B	0.72504	So again, we can see a clear correspondence between activity level and posterior belief about hidden state.
5345595	5352782	B	0.8625	So here we see re a book response to an electropaste memory.
5352872	5381500	B	0.99743	We see the response from ten to 13 milliseconds after each stimulation and we compute the number of spikes and that spikes changes their preference in the sense that some neurons learn to preferentially respond to force one but not source two.
5382237	5392912	B	0.53913	So which is not a response to input itself, but it looks like a response to particular source.
5393337	5410382	B	0.80366	So it is inference which is empirical evidence that neural network actually perform some sort of causal inference in a manner consistent with traditional Bayesian inference.
5410547	5418162	B	0.79	And then we compute another quantity in Bayesian inference in the real vertical data.
5418300	5458987	B	0.98956	We show that firing special factor is consistent with the prior belief about hidden states and we also compute the synaptic rate statistically through some connection strength estimation method and show that the estimated synaptic strength is consistent with something encoding posterior belief about parameters, as expected by the theory.
5460612	5488237	A	0.93056	Well, we looked at table two earlier and this is almost like the next step after the theoretical concordance is all right, well, let's measure the release of a neurotransmitter or the empirical synaptic strength or the firing threshold or all these different features in different empirical systems.
5488962	5496250	A	0.67467	So what experimental systems does your group work in?
5502012	5509767	B	0.94215	That in virtual system was made when I was a PhD student.
5509890	5528582	B	0.83132	So that is experiment we done in my previous route and now I COVID to the Bijan Institute and I'm a Princepal investigator of Celery unit.
5528672	5540887	B	0.58569	So now actually we don't use any experimental setup, so any experimental bidding is down with some collaboration.
5541237	5546732	B	0.65183	So although I cannot say detail about that exploration.
5546822	5557322	B	0.88494	But yeah, we learn some collaborating work about the implication of salary using various animals.
5557517	5565700	B	0.5	Yeah, so we hope we can show some interesting results following results using animal data.
5569662	5571775	A	0.99012	Very interesting.
5572887	5591587	A	0.7	Yeah, well, it speaks a lot to the stage that our field is in in certain ways where we've seen a lot of graphics that are suggestive.
5592387	5615967	A	0.99929	This paper and the building on the previous 2020 paper made a suggestive possibility much closer to an analytically demonstrated translation and then took the next step incrementally into the in silico agent.
5616165	5625175	A	0.81	And so it's only natural to then explore different embodied systems as well.
5630862	5647300	A	0.98285	Are there any other sections that you wanted to like, look at or highlight or any other topics about the paper or adjacencies or active inference that you think are interesting to go into?
5650212	5663417	B	0.6	Yeah, okay, I would like to mention about some implication of these papers, which is not the director discussing the papers.
5663552	5671675	B	0.55402	So for example, well, we focus on a discrete state space model.
5672037	5683652	B	0.82215	So we avoid to assume some subscript that encodes the coherence of the distribution.
5683757	5688617	B	0.46901	So once you assume homedp then it is categorical distinctions.
5688677	5696792	B	0.75584	So it is different from assuming Gaussian distribution characterized by me and variants.
5696927	5707632	B	0.80197	So the neural substrate of variance is still unclear and we now try to figure out that.
5707785	5730767	B	0.54727	So this is one direction of limitation and another implication is that thanks to a simple ODP structure in this paper, we don't care about the hierarchical optimization.
5730902	5744437	B	0.92836	But generally it is crucial to update parameters through hierarchical optimization through some backpropagation like computation.
5744787	5751617	B	0.95979	Although it is unclear whether back propagation itself occurred in the real brain.
5751677	5768062	B	0.94984	But we still have some alternative that achieve such optimization and it's neural substrate still unclear and this paper doesn't address that direction.
5785650	5796475	A	0.99885	Another area I'm wondering about is like where in neural structures is the learning reflected?
5797575	5800790	A	0.62817	Where is the function and learning reflected?
5800970	5809955	A	0.88236	Well, sometimes it has to do with not just structural Tweaking, but the presence or absence of synapses.
5810015	5823695	A	0.93095	So obviously this model does not expand into synaptogenesis synaptic pruning, let alone neurogenesis and neuro allostasis which we mentioned in the previous discussion.
5823860	5841015	A	0.98472	But understanding how these larger scale structural changes which are certainly important in biological systems become reflected in artificial neural networks and then how that translates all the way back to P-O-M.
5841032	5844300	A	0.46854	DP and then whether we could go the other way.
5844437	5855360	A	0.99886	What kinds of POMDP structures in their neural network realization would have structural modification.
5855480	5864535	A	0.76557	Like you COVID imagine a POMDP that does structure learning but the neural network doesn't have structural change.
5864717	5874250	A	0.9957	Or there's A-P-O-M DP that doesn't do structural learning but it's manifested by a neural network that does have a structural change element.
5875125	5880690	A	0.84932	So structure is doing something very different in these two different categories of model.
5880857	5903085	A	0.53	And then also even within neural firing, which is different amongst different species and so on, there's different aspects of what that firing is that would have different implications for the actual biological substrate of cognition niche.
5903267	5911160	A	1.0	The simple connection is firing rate to posterior belief.
5911355	5914535	A	0.99924	Average firing rate, no change in posterior.
5914655	5917830	A	0.93679	Reduce the firing rate if the posterior should be going down.
5917952	5920020	A	0.99328	Increase it if it should be going up.
5920172	5937625	A	0.99332	Or maybe there are neurons that have a flipped valence but the same type of relationship, but there's other firing patterns like spike time dependent plasticity synchronization amongst different brain regions.
5938800	5944000	A	0.77419	There's a lot of things that don't change the rate overall.
5945250	5953150	A	0.73998	That again from the biological systems we know that those phenomena and mechanism are important for different cognitive processes.
5957400	5963337	A	0.85317	So there will be many many years of a fruitful relationship.
5965875	5973945	A	0.72879	I'm going to bring in this picture that Alexandra had taken.
5974022	5996187	A	0.99403	Maybe we need a third panel in figure one because these three systems moving between them is going to be the substance of the field for a long time and there may be other edges to build.
5997150	6030965	A	0.99143	But understanding how artificial neural networks intermediate between the empirical measurements and manipulations that we can make of real neural systems and the interpretability and factorizability of POMDPs it might be a bridge too far to go from the POMDP to the neuron.
6031145	6040075	A	0.99	You could always use this technique but it would be a purely descriptive statistic type approach.
6042825	6071187	A	0.92793	But it's so interesting that by intermediating through a formal connection established in figure one I Dean in equation one but also shown here, then we can kind of extend the chain of exploration, prediction, control, design all the way on through.
6072300	6096025	A	0.96	And that just unlocks like an incredible amount of neuroscience that hasn't been formalized mathematically and an incredible amount of generative models that have been specified for different learning settings sometimes even by analogy to biological settings.
6097200	6108175	A	0.96406	But the metaphor remains just a metaphor until it's possible to intermediate with this type of neural network development.
6109125	6112737	B	0.75	Yeah, that's a crucial point.
6116400	6131130	B	0.61	It is easy to imagine that phenomena can be modeled using very realistic neural model or free model synaptic model.
6131252	6131937	B	0.75	Right.
6134400	6149715	B	0.91038	We believe that it is possible and then Laje model is not necessarily tractable, not necessarily useful because it's too much complicated to analyze something.
6149807	6160150	B	0.83758	So we use some reduction, usually mathematically speaking, which correspond to topological transformation to make the model simpler.
6160800	6182040	B	0.9	And then we need to consider the translation of that simplified neural network model because neural network model itself is not explainable which just represents some dynamics and its functional meaning is not clear.
6182207	6193975	B	0.96741	But thanks to the Bayesian framework we have a very nice event framework to least the experiment ability.
6194400	6210850	B	0.76	And this translation, this correspondence helped us to link such a phenomena base equation modeling and functional base equations.
6212250	6223600	A	0.83	Yeah, one paper from 2017 that was much discussed by some could a neuroscientist understand a microprocessor?
6224325	6239487	A	0.89	And this group with Jonas and Courting, they had a simulation of a microprocessor from an earlier video game console, I believe.
6240075	6263085	A	0.87	And then using the analogy of like the transistors and their connections as neural firing and structural connectivity they were able to simulate experimental settings, input and action and then make measurements from every neuron including doing lesions and loss of functions and so on.
6263192	6286825	A	0.9	And it turns out that a lot of the techniques that are used to derive scientific explanation from analogous data collected from a biological system, those techniques which ostensibly should be isolating functional explanations in fact did not isolate effective exploration.
6287175	6303700	A	1.0	You could have a deletion over here that induces some statistical change all the way over here and that may or may not be a useful clue towards the function of even subcircuits.
6304575	6326125	A	0.85	And so I think that was a wake up call with respect to the interpretability of simply this connection between the biological and the neural network.
6327450	6348625	A	0.95237	This connection alone is of limited applicability even when the neural network model becomes so complex as to recapitulate the biological phenomena, you're never under any guarantee that you're going to recover interpretability.
6349050	6360815	A	1.0	You may have just created an atomic level simulation of the phenomena, but of course, a map that is the same scale as the phenomena isn't a map.
6360995	6364450	A	0.39632	It's just a copy that has no more interpretability.
6366600	6398125	A	0.91	And it's almost like what is now extended again, as we kind of just summarize this and think about how we move forward, is that connection can now be extended into the space of interpretable causal models and the generalized Bayesian graphical computational frameworks and all the heuristic that we can then use like variational, Bayes and all these other methods.
6398550	6420155	A	0.78808	So it'd be interesting to look back at different data sets of in vitro and in vivo and in silico neural activation, especially if the task was of this constrained set of POMDPs and it was already amenable.
6420215	6433750	A	0.98945	Because, as you brought up, other settings would require a little bit more theory development before we understand what POMDP family would be applicable.
6439650	6440280	B	0.98211	Cool.
6440402	6444837	A	0.86471	Well, do you have any final thoughts or questions?
6447300	6450625	B	0.61238	Well, do you hop.
6454912	6467087	A	0.64	I kant to download the MATLAB scripts and generate the figures, play around with a few of these parameters?
6467887	6472175	A	0.507	Like, I see that you can change how far the entity can see.
6473887	6481037	A	0.71	And then with these models, I'm also always curious about the computational complexity.
6481462	6494162	A	0.7271	Like if you extended the planning horizon from four to five or you dropped it down to three, what is the runtime consequences and what is the performance consequences?
6495187	6511487	A	0.92	And where might we be able to use single or swarms of really simple agent, maybe even making binary decisions and achieve high performance?
6512437	6550257	A	0.97	And where do we really need to move into these large combinatoric spaces in order to solve problems and the kinds of complex planning problems that we solve, whether it's planning our day or planning our week, are those force like true Deep Harrison planning problems with extensive consideration of counterfactuals and calculation of alternatives?
6550422	6569387	A	0.98698	Or are those actually composite decisions that are made up of smaller, simpler, sub decisions that we may or may not have flexibility to restructure?
6571612	6580550	A	0.96082	So that a decision, a complex chess maneuver, a sacrifice in chess or another game.
6582262	6598262	A	0.99	It may be possible to model that as a Deep Horizon scan or a kind of intuitive heuristic for an appropriate skilled entity.
6601537	6622647	B	0.98303	For this particular two Brea structure, there is a clear limitation about the horizon forward because it doesn't use forward prediction, it used post action approach.
6622692	6636587	B	0.83089	So it's a clear limitation, but still, it may have some performance ability, active, some levels of affordance.
6638587	6643637	A	0.91882	That provides even another way to look at planning.
6644887	6660172	A	0.99	The two ways I was describing planning, as it's often described in the PMDP literature is again, is it a true Deep Horizon consideration or is it just short term heuristics or nested models that are short?
6660355	6666812	A	0.87	And I think that this paper says maybe neither.
6667537	6690477	A	0.99168	Maybe it's purely the active causality on the past that leads to the emergence of sentient and maybe even teleological planninglike behavior through the ongoing reconsideration of the consequences of least action.
6690657	6694947	A	0.96517	But it's neither a short nor a long term planning challenge.
6694992	6698352	A	0.97159	It's actually like a memory and learning challenge.
6698457	6700287	A	0.94	And no planning occurs.
6700437	6701150	B	0.5	Right.
6702637	6708587	B	0.39078	Indirect planning planning element is involving C matrix.
6710212	6715937	A	0.99863	Planning as a phenomenon occurs and derisking through time occurs.
6716437	6743225	A	0.52269	But it says something quite interesting and deep that that phenotype or function could be enacted by a system that explicitly looks a long way ahead, explicitly looks a short way ahead or moves forward and looks backwards only, right, which is what they sometimes say about the past and the future.
6745012	6754550	A	0.85446	So that may be a very biologically plausible form of learning.
6755887	6765050	A	0.95	And it's already intimately connected with the dynamics and the activity in terms of an integrated loss function.
6766537	6771725	A	0.77175	So these are all excellent directions to keep learning on.
6772837	6773600	B	0.8	Right?
6774262	6783802	B	0.57	And I'm also interested in the barrel implementation of such a short term or long term for the prediction and running.
6783895	6799562	B	0.7	And I hope to find some nice connectivity to such implementation of Bayesian motor and implementation in VR brain network.
6800887	6801697	B	0.84484	Cool.
6801880	6810962	A	0.89	And also I'm always curious about the invertebrate brain as an ant researcher.
6811387	6823672	A	0.97	And so many of the brain architectures as well as the brain architecture that people discuss are mammalian centric, which makes sense.
6823855	6836975	A	0.98	The mammalian cortical column and the relationship with Dopaminergic midbrain and the cortical regions and the spinal reflex arc those are all important systems of interest.
6837562	6846662	A	0.99958	Yet the micro and meso anatomy of the invertebrate nervous system is pretty distinct.
6847687	6859112	A	0.47947	So our model should be able to describe neural and cognitive systems, of course, across invertebrates and vertebrates.
6859537	6878762	A	0.784	So I look forward to also seeing what those models of the invertebrate nervous system and collective behavior where you could have some type of backwards looking risk inference of the swarm.
6880012	6881162	A	0.60754	Who knows?
6883537	6884300	B	0.71772	Well.
6886537	6890997	A	0.99306	We really appreciate the time that you took for these discussions.
6891042	6895250	A	0.98	I think they are immensely important.
6895687	6899462	A	0.98	And we wish you the best of luck in these continued directions.
6903387	6904150	B	0.08	Yes.
6906612	6907962	A	0.96	Okay, that's it.
6908025	6908875	A	0.99955	Thank you.
6909687	6910962	B	0.99776	Thank you very much.
6911100	6911967	A	0.99439	See you next time.
6912015	6912712	A	0.85294	Bye.
