"Speaker Name","Start Time","End Time","Transcript""Unknown","01;18;40;03","01;19;04;24","And so in theory, some things like this might form at the intermediate level and these might be the ones they're most heavily coupling with. This hippocampal system, which is giving you this syntax of, say, transitions. It's like structured composition. That's, that's really kind of come in that for a minute. Yeah. And then blue, OK. Yeah. So there's a lot there."
"Unknown","01;19;04;24","01;19;22;29","That's, that's exactly along the lines of what I've been thinking about this. I've written a bit about these like conceptual sort of grid cell type things that it seems like there's a lot of evidence that's really awesome. I know like my mentor was doing some research that's related to this stuff, so that's OK, if that's what you mean, then I'm totally on board."
"Unknown","01;19;22;29","01;19;49;01","Like, I wasn't sure if you meant that or something more language, like with like discrete tokens with other parts. But I mean, that might be encompassed by this as well. But it seems like people are finding also like encoding stuff like the hierarchical structure, like the grammar of language is also encoded is found to have a correspondence with like the structure of people like this and the relationship to these bumper tractors."
"Unknown","01;19;49;18","01;20;12;00","That's amazing. Yeah. I was going to mention also, so you you gave all these examples of graph of neural networks that are sort of isomorphic with the domain that they represent. I was going to mention recursive neural networks used for language processing as well. The network topology matches the syntax tree or something like that. So that's very that's very much along the lines of where this is going."
"Unknown","01;20;13;01","01;20;45;10","Thanks, Alex. So blue and then DNA afterwards so I want to kind of loop back around to what Adam said about dreaming because he totally like took the words out of my mouth, but maybe also touch on the question that was asked by the person in chat about mental wandering. So is it possible? So so Alex, you're you know, objection to the dreaming and the physicality was that there's no evidence for top down control during the week cycle."
"Unknown","01;20;45;10","01;21;17;09","Is that correct? Is that what I heard you say? Sorry. No, I actually meant to say kind of the opposite. I meant I meant to say that the problem with the wake with the Helmholtz machine as a model is that it doesn't it doesn't model top down effects during waking perception. Right. And that's what I interpreted. So so OK, so if it doesn't if it doesn't model top down effects during the week cycle, is it possible that maybe there are like overlapping Helmholtz functions happening?"
"Unknown","01;21;17;09","01;21;41;28","Right, like so, you know, your mind wanders off or you're not paying attention and like maybe you're consolidating, like you're you've got like one set sleeping, one set waking, and there's maybe like an overlapping construct of this like wake sleep learning cycle happening like while you're out mental wandering. I'm consolidating, you know, the information from, you know, what I learned at breakfast or something like that yeah."
"Unknown","01;21;42;11","01;22;08;10","Yeah. I mean, I think there's I think there, there are like, like this model is adjacent to like many really interesting, plausible variations. Right. And slight elaboration. So like what you're talking about sounds to me like in that vein, like I saw an amazing get repository of just like Helmholtz machine variations right? Where they just they just tweak certain parameters like let's see what happens if we propagate a few steps down during the wake cycle as well, you know, things like that."
"Unknown","01;22;09;04","01;22;27;09","So I think I don't know I don't know if I fully grasp like exactly what you had in mind, but it sounds pretty good. And thanks for I mean, is that. Go ahead. Alaska oh, no. I was going to say thanks for also trying to address the comment and because I felt like I didn't wasn't able to answer it real nice."
"Unknown","01;22;27;09","01;22;50;05","And there's definitely wandering in dreams. And how is that different than the week wandering? And could that get out what the difference is between sleep and wake? And could this model maybe give us a bit of a wedge to enter into that discussion so Dean, than anyone else for the race tent? So, Alex, back to back to Analogizing."
"Unknown","01;22;50;14","01;23;12;12","So I'm reading your paper and I can read something and I go, oh, my goodness, look, there's the world's biggest nickel. And then I continue reading and then, oh, look, there's the world's largest corncob. And then I have a chance to have a conversation with you, and you're like saying to me, Well, let's bring this back into some sort of proportionality."
"Unknown","01;23;12;22","01;23;36;00","So explain to me, what is the two carat deep diamond that you were trying to allow readers of your paper to get to? Because I know it's I know I blew it out of proportion because when I first read it, it was a big deal. But maybe you can help me bring it back into some sort of scale as to what was your deep hope here."
"Unknown","01;23;36;29","01;24;08;20","You know, it's interesting. You know, I mean, I didn't I don't I also don't mean to suggest that you got it wrong or anything. I think the proportion you're finding interpretations that are consistent with what I said, you know, it's not like it's not there. But it's funny that if I'm trying to if it seems like I'm trying to put you know, to put things in proportion or ground it in any way, it's kind of funny because I feel like others are trying to are trying to do that, like, you know, relate this to embodiment and connectivism and things, much more concrete."
"Unknown","01;24;08;20","01;24;31;05","And I, I keep trying to keep it abstract. But, but anyway, the main I don't know what the hope was here, I think yeah, I'm not sure I think, I think I just really wanted to point to the passage, but it was really about this identity thesis, right? Which I'm not even sure that I agree with, by the way."
"Unknown","01;24;31;05","01;24;57;26","Like, I'm not sure that identity theory is the way to go in understanding the mind's relation of the brain. I'm kind of like not really a reductionist, but I wanted to it seemed like there was a possibility of, of articulating a quantitative version of that right? Using the tools that we've developed over the past several couple of decades that Lewis didn't have access to."
"Unknown","01;24;58;16","01;25;13;26","And I just really I just love David Lewis as a philosopher. I think he had some amazing ideas. And I, I wanted to and it just seemed to me it's not so much about that. I wanted to show anything in particular. It just seemed to me that there was a natural convergence here that that could be spelled out."
"Unknown","01;25;14;19","01;25;42;00","So that's kind of what I was trying to do. Thank you. So Steven just raised hands and then anyone else who raises their hand. And also in the last half hour or so, anyone who wants to ask a question in the live chat. So Steven, then Adam I was just so tying in a bit with what was also said by Adam around the hippocampus."
"Unknown","01;25;43;06","01;26;12;14","So you've got the place cells in the hippocampus which gives the some way to bring the environment in potentially in this semantical. I don't know how to explore those semantics, but a semantics of place, if that makes sense. So now we've got our environment, external states essentially being brought in in an attractive way. You've got action states could be the grid cells with the what lists of what's out there."
"Unknown","01;26;13;10","01;26;43;11","And the sensory states is this lower level flux that's coming into the bottom of the brain and then the generative model would be the the higher level kind of. Well, that's sort of interesting what the generative model is in all of that is. That makes sense. If, if we were to play in that, in that sense, it would it would give that way to bridge the I'm a big fan of the hippocampus."
"Unknown","01;26;44;19","01;27;13;13","That's I thought I'd love to see how it all fits in some of these pieces. But I'm just curious around it, is that kind of a role for these grids and place cells could be quite useful to do this tracked ability between higher and lower level states? Sure. Alex, if you have any thoughts there, otherwise, I'll go to a question from a chat and then yeah."
"Unknown","01;27;13;13","01;27;40;00","I mean, I guess just really briefly, it seems to me that that if we if we are using these these, these cells in this sort of we've leverage this thing that was originally meant for physical spatial navigation and we've transposed it to like conceptual spatial navigation essentially. That's really cool. I could see it being the sort of the thing that conditions expectations for the sensory motor stuff and the sort of it would just sort of define the generative model."
"Unknown","01;27;40;00","01;28;05;06","I guess the dynamics at that higher level would be the thing that sort of sets the, the set points for things. But I think at the moment I would say so just to the question, which is also for Adam says thanks. Adam did mention that the transition process probably involves quantum tunneling. May I ask if he thinks the same for the transition from mind meandering back to focused attention?"
"Unknown","01;28;05;22","01;28;31;14","So, Adam, feel free to take up that question as well as anything else you like to add, as anyone can raise their hand oh boy. I guess like there's a sense in which like one of the quantum tunneling events, I guess I would have a minus. So like, there'll be like these regimes of sense making where the hippocampal system will lay down a given tiling of the hippocampal system in collaboration."
"Unknown","01;28;31;14","01;29;09;25","The lateral cortex with the grid cells will lay down this tiling of some domain within which you're doing this modeling with where you can get basically the relationship among these both attractors. You can get this like structure the syntax and through the pointers a kind of semantics. And also with it's themselves having a semantics of space maybe just in the relation, but the so I guess we look at quantum tunneling like so so but then if you get enough prediction error from the overall system, this seems to trigger these resetting events where you'll break up the frame and then you'll do a new tiling and it's kind of like a re grip on the act"
"Unknown","01;29;09;25","01;29;41;05","of inference. It's like a new kind of engagement and a new set of policies that could fit within this different conceptualization of the same space you're working with. And so these events of remapping, I guess you can maybe think of them as like the quantum tunneling. It's like you're just you're not doing I don't know if this works, but it's like they're called like I'm people called like levy flights, like an animal's like foraging in a patch and then it's like, and I'll just like jump to a greater patch, which is like not getting enough."
"Unknown","01;29;41;21","01;30;00;02","And so it'd be like the kind of like imagining in this place. And here you're simulating this place, and then you're like, OK, a little bit or not quite the thing. And then now you're imagining something else, then you're imagining something else. I guess you can think of those as like clock and tumbling. Like you're not just like working within one regime of simulation, just fixing that thing."
"Unknown","01;30;00;10","01;30;33;28","You're moving from here to here to here. But the question I had raised my hand was, so there's a sense in which you might think of like predictive coding style models of cortex. And it was like more complicated than predictive coding, but there's a sense in which something like that is probably true, because if you do a primarily suppressive regime, you end up inducing Spark City and if the events that are in the worlds are clocking slower than your internal updates, you come out ahead in terms like that."
"Unknown","01;30;34;06","01;31;16;02","I mean, that's why they did it for video coding. It's just more efficient. And so I'm wondering, is that enough to give like a psychophysical identity mapping in terms of like there's a sense in which you will minimize predictive coding mechanisms so that we go with just those. They should minimize they should minimize activity yeah. Yeah. That's that's actually kind of where I'm coming from with this paper and so to a large extent, I was thinking about, yeah, predictive coding as a way of understanding neural networks."
"Unknown","01;31;16;14","01;31;39;24","So I think although this perspective can, can encompass, you know, active inference and such, I think that's sort of the core of it is that the brain is literally trying to. Yeah, to it it's varsity, as you said in this varsity, minimize activity, only pass forward signals that need to be passed forward. And that means that you're sort of quelling activity that doesn't get passed forward."
"Unknown","01;31;40;09","01;32;10;15","So I think I don't know if that's strong enough to get you an identity, but I think it's, it's consistent with the identity idea and it's I think it's a large part of the inspiration for me awesome. Steven with the raised hand and then anyone else yeah. If you could just speak to how you see that predictive coding predictive process in being more or less useful at certain times."
"Unknown","01;32;11;10","01;32;31;06","As the sort of the, the discourse and when maybe active inference is not as needed at certain times, you know, maybe thinking in applied context. But I'll just be curious yeah."
"Unknown","01;32;33;07","01;33;09;09","It seems it seems to me that if you like that, if you want a like the the main advantage of active inference, practically speaking to me, seems to be like modeling like explicitly how how policies actions are chosen like decision making, right? Based on how you expect your actions to change the way states evolve. So I think that that happens implicitly in a well trained predictive coding architecture."
"Unknown","01;33;09;25","01;33;43;09","Right. And I see I don't see any fundamental theoretical advantage to active inference there in terms of explaining how things work unlike a in principle level. But that said, it's really hard to like just train a recurrent neural network or whatever to to do what you want it to do and then interpret it states and so on. So if you have an idea of a generative model of what the agents generative model should look like, that makes much more sense to write it down a priori and try to build an active inference model than to just learn it from data."
"Unknown","01;33;44;03","01;34;09;13","So that's as close to maybe a applied setting as I could get, but I hope that sort of speaks to. Yeah, let me let me try to get another view on that from you, Alex. Where would you put active inference in relationship to supervised and unsupervised learning for those who might be less familiar with those topics? When you're talking about learning from the data versus a generative model, where does active inference fit into that?"
"Unknown","01;34;10;16","01;34;11;25","Yeah, that's a great question."
"Unknown","01;34;14;26","01;34;43;23","It's a bit it's a bit tricky because there's this issue of preference learning that's kind of not settled in the like as far as how how much of the feature of of real biological agents of learning do we think that is? But like so to me, the most natural way of thinking of of unsupervised learning happening in active inference is that you've got sort of a you've got a phenotype right?"
"Unknown","01;34;43;23","01;35;11;12","So some aspects of which are going to be immutable over relevant time scales, but some aspects of which will change, right? So we're talking about synaptic weights. You could think of that as an extended part of your phenotype, and that will change over time scales with perceptual learning and, and during the life organisms, lifetime and such so like that that is I think is neatly you can categorize as a form of unsupervised learning."
"Unknown","01;35;12;15","01;35;43;04","But that's also not really again, it's not it's not there are people who are active infants sort of practitioners who don't really think that preference learning is a thing that happens or yeah, it's not clear what role it plays. But, but, but overall, I mean, well, there's also there's also got to be a role for something like supervised learning."
"Unknown","01;35;44;01","01;36;12;01","It seems to me that the closest thing that we have to that in real systems is, is like a reinforcement in a way. So like and that's certainly not to play a role that's complimentary to uncover as learning. But I think I don't know this the sensors kind of shit. I'm sorry. It's I'm happy to, to to take it up more."
"Unknown","01;36;12;01","01;36;42;20","I'm just not sure what like I don't know how to, how to how to tease apart the the, the parts of active inference that should be understood in terms of unsupervised learning versus just like learning in general. And how much of it I suspect a lot of learning in general is got to be unsupervised. And I think active inference is sort of naturally interpreted predictive coding certainly is an unsupervised learning paradigm."
"Unknown","01;36;42;20","01;37;12;20","And to the extent that active inference reduces to that, it is too great thank you. And these are definitely all topics we're always trying to think clearer about and communicate clearer about. So Stephen. And then I think this is a useful conversation. I know it's a bit of it's put you on the spot a little bit, but I think as a group it's quite useful this question of when a generative model comes into play."
"Unknown","01;37;13;00","01;37;49;28","So with reinforcement learning, I suppose that there's a generative model in relation to like an induction, an inductive reasoning in terms of the goal, like you're trying to narrow the gap between the target, that you're reinforcing the rewards and reducing the gap, whereas there's this adaptive potential in active inference too. And I wonder whether in the, in the population or the population of the brain's attention, I'm sort of wondering if place cells and sort of more granular parts of the lower levels of the neocortex."
"Unknown","01;37;49;28","01;38;23;14","So I'm not sure if that's the right term are basically exactly of more unsupervised, very unsupervised, very active kind of potentially ways of engaging. And then these grid cells as they get more populated with what things are becoming kind of more top down, maybe more, let's go back into say a more reinforcement learning or supervised learning is like and then you don't forage as much, so to speak."
"Unknown","01;38;23;14","01;38;49;24","You just go straight to the point which probably I should do now and let someone else take over this thing. Stephen, Alex, if you want to add something, otherwise we'll go to Adam yeah. No, just so I mean, that kind of makes sense to me. I think I think you need I think you need supervised learning for representation, learning of whatever isn't innate, right?"
"Unknown","01;38;50;01","01;39;26;14","And then once you have that framework, then, then you can start to think about like reward, like meaningful, you know, interpretations of sensory stimuli that you can associate with reward. So that's all I'll say for now. Cool. Adam a quick comment, the question of a quick comment on what Steven said. I mean, interestingly about the hippocampal system, is there does seem to be like this, like very contrastive thing to it in terms of like comparing between current states and then imagine states and like different like duty cycles of theta."
"Unknown","01;39;26;23","01;39;50;06","You'll be seeing there seems to be this comparison operation going on. So it could be very much like this higher level, highest level supervisor here. And this like matryoshka dolls of like quasi homunculus are things that we're thinking of. But the question I was wondering, there are people who don't believe preference learning is a thing. Oh, I shouldn't, I shouldn't put anyone on the spot."
"Unknown","01;39;50;12","01;40;09;21","It's not that it's necessarily that they believe it's the thing. It's that it's not clear that we need to invoke it to explain behavior or behavioral things and at least in many cases. So I feel like I'm going to I'm going to be speaking for for people who are colleagues of mine who I don't want to I don't want to misrepresent their views, so I'll shut up about it."
"Unknown","01;40;09;21","01;40;37;16","But there's definitely controversy about the extent to which it happens, I suppose. I mean, I'm wondering, I guess, like to what it's like. So like there are things like like metal learning principles where like you have like if you're figuring out like new ways of approaching policies. And so you're like realizing goals and you're building up these like policies to like an exploratory fashion as part of your phenotypic plasticity."
"Unknown","01;40;38;02","01;41;00;21","And but I guess there is a sense in which like if we're like for subscribing to the free energy principle, you can only prefer one thing and that thing never changes and everything else is just instrumental it just it could just only prefer to be basically Agent Smith for the entire world. You could like my iPad or me, me, me, right?"
"Unknown","01;41;01;27","01;41;29;03","But, you know, ultimately this should be like we, we, we in terms of like evolutionary favorable equilibria. But it seems like I guess there is a sense in which that never changes. Yeah. I mean, just to say one thing, to like to try to defend the people that I have been talking about when I say preference is controversial, preference learning, I mean, there's clearly something that that looks like preference learning, right?"
"Unknown","01;41;29;03","01;41;53;16","It's just a question of whether you're really learning preferences or you're just learning new associations with, with the things that you prefer. And those two processes are conceptually distinct. They might be dissimilar results, but yeah, point erasing is interesting that is that really your preferences like you literally your phenotype. So well the inclusive you. Yeah, that's exactly where I was going to go."
"Unknown","01;41;53;26","01;42;30;24","Could there not be a cultural scaffolding that's developed over ecological and evolutionary time that values diversity of perspective? And so yes, it is true that at different scales, some type of active inference could be happening. But I don't think that Agent Smith would be the only attractor at the bottom of that bull. It'd be more like a maybe a plate with a lot of different levels, a lot of different kinds of food that could be converged upon why would it have to be converging on one specific, especially Hollywood represented version of what efficiency is just a thought."
"Unknown","01;42;31;13","01;42;59;15","But yeah, I don't think Agent Smith would win like and villains usually lose, you know, Steven, that well, this this could be though when you get into that non equilibrium equilibrium dynamics is like once you get a dictator who establishes an equilibrium, that's an energy equilibrium, which is that's going to be more powerful than the more subtle organic non the equilibrium states."
"Unknown","01;42;59;15","01;43;27;19","It just dominates times. And if there is bathed in equivalence in some near or distant future between actual energy usage and governance, for example, some sort of crypto system with energy and voting and information and finances all being mixed together, it'll be an enormous nexus of power and maybe we'll be able to use these kinds of frameworks to describe them."
"Unknown","01;43;28;05","01;44;01;19","Stephen And also going the other way then, if you this is my belief, this is without it. I strongly believe that it's a creates community engagement in meaningful ways. You have to create the container for those more subtle non equilibrium states to have a chance to breathe this this woman Arianne Landscape she's a she's a theater director in France she talks about don't crush the butterfly."
"Unknown","01;44;02;00","01;44;28;26","She'll tell the actors don't crush the butterfly. The butterfly is like the idea so don't grab hold of it because you will crush it. So it's quite a nice metaphor. You have to hold it lightly and allow it to and there's this there's a certain because equilibrium dynamics or somebody comes in and basically start shouting at people always over dominate someone is trying to do some let's all come together and find each other's plurality."
"Unknown","01;44;29;04","01;44;53;14","So anyway, that's that sort of dynamic. So it ties in with what you're saying. Oh, so I flipped to 49 where we have our usual set of just closing discussions. So in these last 10 minutes we'll just be remarking on what we thought was interesting or important from the conversation. What would we like to pursue next in terms of our own work or."
"Unknown","01;44;53;14","01;45;17;08","Alex, in terms of your research, I'm sure we're also all curious as well about how you apply these ideas in terms of your, you know, whatever Nonproprietary applications you think that this bears on. If none, then that's its own interesting claim. Or maybe there is something that this helps us do in terms of practice what are the next steps here?"
