"Speaker Name","Start Time","End Time","Transcript""Unknown","01;20;40;15","01;21;08;08","So you can use some of that internal energy to do other work and also release heat. In other words, split ATP into ADP and a free phosphate and extra energy, free energy, energy you can use. And this is what was one of the most fascinating probably facts that I learned in my biochem education. Exactly how much free energy is released with a hydrolysis of ATP and how is that free energy used to do cellular work?"
"Unknown","01;21;09;00","01;21;34;17","The calculate a Delta G for the hydrolysis of one moles, ATP is -7.3 K caliper more. So if you just burn the candle, you get -7.3 units of energy. That's under standard conditions. In fact, the Delta G for the hydrolysis in a living cell is almost double that -14 k cause a mole. How is it vital ism? Is it magic?"
"Unknown","01;21;34;21","01;22;08;03","Well, can't rule that out. But there's a lot of tricks that can be played with localizing reactions. So you can have a little tiny bubble where the air is ridiculously acidic. Like one proton vibrating around, but it's so small that the protons, local acidity is unreal. And so there's all kinds of tricks that can be played with how things are combined and separated and connected to each other and related that help you get more energy out of just the hydrolysis of an ATP."
"Unknown","01;22;08;20","01;22;31;19","So just think, if you can get two acts on burning the candle in a cell, probably you can do a lot more than two acts on the information in the environments. Is that physical? Is it just statistical? That's the question. But it's certainly is happening physically with the cell. So it seems like it probably could be happening in the brain as well."
"Unknown","01;22;33;15","01;23;14;12","Biochemistry blue. Now the cell has the demon, so so, you know, we were putting these slides together. It's like, where is Maxwell's demon in here? Like the cell has the demon, I guess. I don't know then where does active inference come into play? Hashtag and flap. And so we searched for the term and it's used twice. Both times it's used a little bit indirectly, referring to the literature on active inference and the literature on the FFP and also it's related to topics we've talked about, like top down priors, the events of the organism."
"Unknown","01;23;14;23","01;23;27;26","So it'd be super interesting to hear from. Alex, where does active inference come into play in your agent as you had the thought experiment or just where does active inference come into play?"
"Unknown","01;23;30;04","01;24;08;29","As a key test in prediction? Although in another sort of classic three sentence paragraph, Alex does take it both ways, which is basically to ask whether the identity is to be tested. And he suggests that you could look for a stochastic code. So in encoding, just like we saw earlier on with that Sengupta 2013 paper, the encoding that's going to be like the sort of trade off between only giving a little information but making it the right info so that the model can be updated appropriately is to see if that is empirically plausible."
"Unknown","01;24;09;24","01;24;54;20","And this is an interesting philosophical point, which is that the conjunction of the identity thesis with ATP Free Energy Principle is a falsifiable hypothesis, even if the FIP is not so inactive. 14, 15, 20 we talked a lot about this, what is falsification and relationship with the FIP. And so it's almost like FIP is a carrier, like it is deployed in really clearly falsifiable ways, yet it is more of a carrier wave that isn't directly falsifiable or I'm not sure where what he was getting at here, but I thought that was really fascinating to think about."
"Unknown","01;24;54;20","01;25;15;09","Not just, oh, it's a corollary that's falsifiable it's like we're taking the FIP and another field and now that is going to be something that we can both formalize and falsify. But here we just have falsification. Here we just had formalization and we had to amalgamate them in order to make something that would take the best of both worlds."
"Unknown","01;25;16;25","01;25;39;08","So let's hear from that and then this is where I said he has it both ways, which is but not that something is true and false, but actually that the evidence is going to run backwards to us. He's saying strong empirical evidence for the right type of encoding together with the formulation of cognitive dynamics. In terms of that variational Bayesian inference supports the case."
"Unknown","01;25;39;23","01;26;10;05","So maybe there would be so much evidence for some kind of encoding. What kind of encoding, how much evidence, how would we know? But we'll find out. Maybe it would be overwhelming positive evidence for the identity thesis. And then as always, then what? What then? Then if then all these cool learning terms that Dean has been helping us understand what would happen then what would happen if the identity thesis is true or not?"
"Unknown","01;26;10;25","01;26;35;20","And then what would we be that so pretty fun. Thank you both for participating. Any last thoughts? We'll have just a closing section. If anyone wants to ask a question, the live chat, they can. Otherwise we'll just close it out. Can I ask one quick question? Oh, yes. Yeah. So I'm glad Blue brought up the thing that she thought was really important about the paper."
"Unknown","01;26;36;14","01;26;56;08","So I want to kind of swing all the way back to the beginning because I think identity as a as proximal formalisms is really important. And I want to just read part of what he wrote and write directly under this section for a transparent code, because he never really does get into this too much. But I think it's I think it's kind of matters."
"Unknown","01;26;56;08","01;27;25;25","He wrote stochastic coding and variational inference in order for the thesis of this paper. To make sense, it must be kept in view that the generative and recognition densities of variational inference or densities over and then he puts in brackets possible external causes of the sensory input. That is to say, in the presence of most philosophers and nearly all cognitive scientists, they are representations and it is their representational function that defines them as statistical models."
"Unknown","01;27;26;10","01;27;58;13","Fixing the encoding of the recognition generative densities allows us to directly relate the representation of work in quotes. That is, the divergence between the densities is decreased, decreased by due to physical work. That to me is it would be amazing for him to be able to give that to me in real terms and real examples. Of people doing that on a on a sort of ad hoc basis, because that would be lovely to turn to."
"Unknown","01;27;58;13","01;28;25;19","What is because I understand, appreciate the down the train track thing, but the worry is to be able to sort of translate that what he wrote there in terms of a transparent code around what if would would make my day and not just my model it would make my model of my day, make my model of my day be but that sounds super interesting."
"Unknown","01;28;25;19","01;29;13;20","And that part first about representations. We didn't even tackle the representation question because also in several other streams we've asked about what is the representation, internal representation, where are these representations, what if they're distributed in the environment? Or among agents? Is that still a representation, but also that adjacent possible? That's kind of like, whoa, if our perception is actually just the tip of the iceberg of a really deeper generative model, and there's cases where it seems intuitive, like, Oh, well, I guess DateTime is contingent on having a model of night or thinking a is contingent on knowing that it could be A or not a but even that whole framework for thinking is still just"
"Unknown","01;29;13;20","01;29;37;25","part of a bigger process. And that's what I think a lot of philosophy tries to grasp at from a lot of sides we're working with a kind of forceps, but there's like a bigger picture. Well, it sounds like we're also working with something called the Transparent Code which blows me up because. Oh, OK. Well, if that's all it was, can you just tell me show me what that is."
"Unknown","01;29;38;01","01;30;03;20","And I know it's going to be hard because it's transparent, but hey, let's go live from Curves. Thanks, guys. Well, thanks to those who watched this live or in replay, we hope that you'll join us for the discussion when it happens or after. Thanks a great time. Talk to you later, Dean. Great time. Talk to you later, Dean."
"Unknown","01;30;03;27","01;30;14;22","Great time. Talk to you later, Dean. Great time. Talk to you later, Dean. Great time. Talk to you later, Dean. Great times. Talk to you later, Dean. Great time. Talk to you later, Dean. Great time. Talk to you later, Dean. Great time. Talk to you later, Dean. Great time."
