"Speaker Name","Start Time","End Time","Transcript""Unknown","00;52;25;05","00;53;08;26","So maybe that speaks more your, your point. But, but I think the possibility of, of spelling the structure out even for one instant is, is the is the lever that Lewis uses to, to draw his philosophical conclusions OK, thanks. Thanks, Steven. And then Adam this question about prediction and time, I think like you just saying there may be a sort of a timescale at which things are just flowing, like what sort of speed is it that things are just doing their thing I cells are doing their processes."
"Unknown","00;53;09;19","00;53;28;13","That's what Dean was talking about. Woods is longer time scales than that. And I think like you say, there's something different there. That's the more everything beyond a certain point has to be imagined. I suppose anything that's not possible to do variation of free energy on you've got to do expected free energy and to do expected free energy."
"Unknown","00;53;28;13","00;54;01;06","You basically have to imagine some a bigger imagine in a different way. So just our limited sense of imagination like our body has to imagine at some level the expected free energy is basically what expected free energy is. So I think that's that then does bring in some interesting ideas around folk psychology. Would you say that those mental states should ultimately be action and sensory states that are being predicted?"
"Unknown","00;54;01;22","00;54;32;24","So the mental states are basically the recapitulation or expectation on sensory states and results in beliefs on action states. So that they could be seen as mental states. But actually there is a more distributed realization of that of interest is just that that sort of is something that could hold. Yeah, I mean, I think the spirit of Lewis's proposal is also functionalist, right?"
"Unknown","00;54;32;27","00;54;55;09","So so the basic idea Functionalism, of course, is that mental states in the philosophy of mind is that mental states can be defined in terms of their relations to inputs and outputs. And also to each other. And I guess it's the to each other bit that distinguishes it from behaviorism. So but yeah, I think that these implicit definitions that Lewis talks about would rely heavily."
"Unknown","00;54;55;09","00;55;18;25","It would depend heavily on things like when I believe that there's a cat present, I expect certain visual appearances to occur and I'm disposed to act in certain ways. And maybe you want to cash to the I tend to want to cash the actions and the sensory stuff out in terms of proximal stimuli and like motor effector states rather than distal things and extended things."
"Unknown","00;55;18;25","00;55;53;04","That's just I don't know, that's, that's my my, my, I'm not with a bias or what, it's just the way I tend to think of these things. But definitely I I guess I would say that the relations between the mental states, though, are just as important as their relation to the active states and the sensory states when it comes to this kind of this kind of formalism I missed an opportunity to."
"Unknown","00;55;53;27","00;56;32;00","It was a really interesting comment, actually. I don't know if I did it justice, but I'm still thinking about it. I just just add one little things I just before. Yeah, OK. Very quickly, but one thing that comes to mind that I think might connect to what you're saying and you were talking about this and and and so there seems to be something there about the combination of arms and what's, you know, so for instance, and there was a dog and there was a woman with the dog and we're in the park and the dog was wagging its tail."
"Unknown","00;56;32;24","00;56;56;28","And then there was blood on its teeth when it smiled. And then suddenly that's changed it. Right. So the triangulation of the ends flips. Once you suddenly the dog bears its teeth and you see blood on them. All right. So that links into what they do in qualitative research where they often triangulate to get something which is got trustworthiness rather than accuracy."
"Unknown","00;56;58;21","00;57;19;03","And I think there's something interesting there about what you're saying in terms of that. My knowledge of that field of linguistics is that the if I can bring it back into embodied work, I find it easier. So I'm trying to do this and, and, and, and that's that has got some practical applications. I think in a number of areas."
"Unknown","00;57;20;20","00;57;57;19","Oh, definitely. Yep. Thanks, Adam, if you can return. Yep. OK, go for it. Adam. Hey, making coffee. So I'm eventually I'd like to get to free will and actually loop around a little bit to actually depression as it was the case with respect about. But before we move on from Ramsay's sentences, not to belabor it, but so is the idea that so you strip away the specific entities being signified you look at the syntax and then you're saying, can the same syntax apply in another system?"
"Unknown","00;57;57;19","00;58;18;29","And then you have the mapping that this would be the map. So would is that the basic idea essentially? Yeah. If you take syntax in a, you know, in a slightly broader sense than totally yeah. OK. So I guess I'd be wondering like like in terms of like act of inferential modeling, would it be something like like with like the graphical brain?"
"Unknown","00;58;19;00","00;58;43;23","Like you have like this form factor graph where you have like the continuous regime down below, but then have this like the street regime up top and like maybe something in like the factor graph portion you can look for like some sort of like said polymorphism or isomorphism there or like if it's in brain, you would do some sort of like you would look at ensembles and like describe them as like attractors moving along some sort of manifolds."
"Unknown","00;58;43;23","00;59;19;16","And then like when you screen those or throw a blanket around them or reify in some ways if that if the syntax of their interrelations matches people's subjective reports of their experience, then you would be able to actually potentially identify like physical, substrate, physical and computational substrates of consciousness. Is that I mean, yeah, I think you fire like well they were going that's I think that's where, where we're going except I never made the bridge all the way to consciousness because that's one thing that I, I reserve the right to not decide about."
"Unknown","00;59;19;16","00;59;39;02","I think your work on this is really cool. Actually, I kind of suspect that like most of the main theories of consciousness are kind of overlap a bit. And there's a core that's, you know, it's sort of like getting out of the way things are, which I think you've written about. But so, so I want to just bracket the consciousness thing for a second, although maybe that totally ruined it for you."
"Unknown","00;59;39;02","01;00;02;13","I don't know. But like, I yeah, but that's that's exactly the idea. I think you just expressed it very well that if you work with. Yeah, you have to squint. You have to do some course screening. But if you look at the dynamics of the physical system, you'll be able to discover, in the ideal case, some of the same sort of syntactic relations that you would get from the psychological perspective."
"Unknown","01;00;02;13","01;00;25;17","And I think that's also very consonant with the way, you know, connection modelers describe their work sometimes. So like you think a connection is simple neural network made of these simple processing units, you can derive that architecture just by looking at the brain and sort of very much simplifying things or you could derive the same graphs in some case just by looking at cognitive processes."
"Unknown","01;00;25;29","01;00;51;29","And so it's the idea that you have two perspectives and one thing that if you have a graph isomorphism, then that is what was being hinted at with it being sufficient to find that there's relationships among mental states like I always feel like I feel this way before this other feeling. And then if you found that there was some brain state that always preceded is at the end point or is there still more to explain in that context?"
"Unknown","01;00;52;16","01;01;19;23","Let's actually get to another topic that we highlighted last week, which was the sleep wake example so I'm here on Slide 40 and we're considering a system whose analysis is tractable, at least according to Alex and we have an agent whose behavior as far as Sleep Week is concerned is defined by equation 3.1. So could we walk through what is happening in this simulation?"
"Unknown","01;01;19;23","01;01;46;09","Like what is the agent doing, what is the agent consist of? And then what does the Equation show? And then how does that relate to what we're showing in this paper? Sure. So I think I think this is another aspect of the paper that that was maybe seemed to be making a deeper point than it was. But I'll just talk about this briefly."
"Unknown","01;01;46;09","01;02;29;24","So this was actually just meant to be sort of a slight modification of just like a Helmholtz machine running the sleep algorithm. So I don't know if I need to set that up blue. We talked about that a little bit in 2.0. But the idea was if we just have a generic let's we have a neural network that has a generative model that's sort of encoded in its top down connections and approximate recognition model in the bottom up connections and so so one way of doing this is to run the algorithm where you basically generate states of the network top down like Tennessee's functionally speaking, and then you adjust the bottom of weights so that"
"Unknown","01;02;29;24","01;02;52;04","they're likely to produce those fantasies. And then you you alternate this with the so that's the sleep cycle you alternate this with a wake cycle where you use the input of the kind of sensory data that you want the model to learn to generate. And you do a bottom up pass and then adjust the the top down generative connections that they're more likely to produce those states that are induced by input."
"Unknown","01;02;53;04","01;03;13;14","So so all I was doing here was saying look, if we if we suppose just make the assumption that this is a real system we're talking about, it's ridiculously unrealistic. Right? So this that's why I said it's it's something that's tractable to analyze, but it's also also quite a far cry from anything biologically plausible. But it's not also it's also not completely off the mark."
"Unknown","01;03;13;14","01;03;42;10","Right? So I think there's a reason that the homeless machine was kind of like a seminal moment in the evolution towards what we have now because it got a lot of the course screened sort of conceptual structure really down. I don't know if it had been pulled together before in this form anyway. So let's suppose that the wake and sleep cycles of that machine occur with equal probability, then we can talk about probabilities of certain states occurring in the network just period, right?"
"Unknown","01;03;42;10","01;04;07;27","Whether it's during a sleep or a wake cycle, and so if you just grant that, if you if you ignore the fact that this is a really only and it ends up being an approximation to an approximation right? So it's, it's, it's running its wake sleep ends up being a sort of an approximation to the algorithm, which is itself not quite full variational based."
"Unknown","01;04;09;03","01;04;31;24","So anyway, lots of approximations, but if you ignore that for the moment, I just want to make the point that you could talk, you could talk about the you can thoroughly, completely characterize the possible the probabilities of various states of the system. And so you could use that to define this. This, ah, here is just the probability of a certain state of the system being in a certain state."
"Unknown","01;04;31;25","01;04;38;07","I hear the size referred to like the states of the individual neurons, but that's related in a simple way to the overall state of the network."
"Unknown","01;04;40;09","01;05;06;23","So you can talk about the probability of the system being in one of these states regardless of whether it's running awake or asleep cycle. And then that gives you a if you have a probabilistic description of the states of the whole system, then you could you could use that as a, as it to define the relevant terms in thermodynamic strategy, so the entropy and the energy and such."
"Unknown","01;05;08;06","01;05;38;22","So that's the basic idea. But the part that you that you were wondering about, like what is this system simulating? What does it perceive and such? That's all that's this example is completely agnostic as to any of those details. So once again, this is highly, highly abstract and I apologize. No, it's cool. And what do you think this model would allow us to continue developing towards or what does it show for the argument that you put forth as far as the psychophysical identity thesis?"
"Unknown","01;05;39;29","01;06;08;13","Right. Well, I don't know that it shows anything in itself. I think it was what it was trying to do was was was write down a system in which the target would be clear. So like that you want it to be the case that this our distribution so solving for this right. So the R distribution because it's it's essentially made up of or it's it's factored into these wake and sleep cycles."
"Unknown","01;06;08;13","01;06;39;25","Right? Those have direct interpretations in terms of variation for energy of inference. And yet we have a well-defined distribution over the states of the system that we could use to describe its physics. So I just wanted to show that there's one simple case where where we can we can write down a distribution that bridges these two descriptions. And then then in the subsequent paragraphs, I try this, I try to argue that we can generalize this beyond equilibrium."
"Unknown","01;06;39;25","01;07;07;19","And that's the that's that's the very tricky bit. And I don't claim to have shown it by any means. I'm just again, I was trying to remove obvious obstacles to this. This is being true. Awesome. So Adam, with the raised hand and then blue or if anybody else wants to go for it, in terms of weak sleep there could be some potentially biologically realistic implementations of something like that."
"Unknown","01;07;07;27","01;08;03;03","O'Reilly and has a paper on deep predictive learning where he describes a model of the sound some a cortical system doing predictive processing that's a very weak sleep wake sleep ask of a synthetic person, if you like. If he thought that was like a good like psychophysical identity mapping there. The other thing would be oh, if if we think of experience as being the ramification of experience with the mapping what happen at the level of predictions then and if the predictions are the sleep part, is there a sense that experience is always like a kind of paradox, that it's always the dream like you Wake Park is the stuff is just updating it, but the"
"Unknown","01;08;03;03","01;08;23;01","actual thing generating the experience is the dream part. That's like correct, sir. Yeah. No, yeah. So I have an unpublished paper on this too, on the representational division of labor. So people like in predictive processing literature say things like, Yeah, we experience our expectations of the world or whatever, but I'm not I'm not so clear that it's that way."
"Unknown","01;08;23;01","01;08;48;20","I don't know I guess if you think that the predictions are the carriers of the experience or the neural correlates of the experience or something, then, then that would be the case. And the weeks that cycle would do nothing. But I think it's I don't I don't see the reason to embrace that that that interpretation of of what's going on here because it's awesome no."
"Unknown","01;08;48;20","01;09;10;03","I mean, that's all I'm all about. I'm all I'm all about the idea that that we experience sort of virtual models in a way. Right. That's that's cool. I just I don't interpret that in terms of like it's just the it's just the top down driving signal that we experience, although maybe I'm not really against that either. And I can see why you'd want to say that anyway."
"Unknown","01;09;10;03","01;09;41;21","I just don't think that there's any inference from the Helmholtz machine to that, like, because I would love to look at this paper you mentioned, by the way, unlike biologically plausible versions of this, because I think there's a lot that's right. About the the reason I say it's so implausible is just that it doesn't have any role for top down modulation of bottom up signals during perception, which was by design, so that it would work quickly but that's the main limitation that concerns me cool."
"Unknown","01;09;41;22","01;09;51;00","Thank you, Alex. Stephen with the raised hand and then anyone else and also anybody watching live, you're more than welcome to write a question in the live chat. So Stephen, go for it."
"Unknown","01;09;53;06","01;10;25;06","Just to just to help me clarify. So this being a track support for analysis so the key the key point is that by going to stochastic, it is those in principle how recognition and generative densities can be used together. Is that the kind of the point that this shows just because I'm struggling, I think I'll just say I'm not so good with the formalism to exactly get it."
"Unknown","01;10;25;06","01;10;56;02","But I think the general point you're making is that you're going to stochastic algorithms, and therefore you've got this potential for the recognition and generative density, which is basically sensory and that's essentially to be reconciled and shown even a very simple case. Would that be a great region event? I think so. I think definitely that's it's it's in large part, right?"
"Unknown","01;10;56;02","01;11;40;15","So that the idea that we're dealing with a stochastic system is kind of important because, yes, I want to claim that or I want to advance the the suggestion the possibility that probabilities are encoded by probabilities. So then you could have an actual identity. Whereas if you're just encoding like if you're using like I don't know, the A scheme that's more like what coefficient talks about often where you have sort of neuronal states that are encoding the submission statistics of the distribution, then I don't think you could get an actual identity because you just you'd have a clear representation that has a certain almost convention built in of how things are represented, whereas I'm arguing"
"Unknown","01;11;40;15","01;12;16;08","for the possibility of a much more direct encoding. And that does depend on this being sarcastic but the other part of this that I forgot to mention that sort of I think maybe crystallizes the the point that I was trying to make is that if if we're at equilibrium with respect to the networks, if we're at the, the almost machines equilibrium distribution, then in that case, if you do take ah describing the physical probabilities of the system that you would use to specify the threat of dynamic properties, then you could show that in that case at least the variation of free energy and the thermodynamics energy would be the same."
"Unknown","01;12;17;20","01;12;44;15","And then the generalizing to non equilibrium of course is the hard part but that's, that's, that's more concretely what I was trying to show there yeah. Thanks. So I'm going to go to a question from the chat and then we'll go to Adam. So Cambridge breaths asks, can this model describe or map the transition between focused attention and mind wandering grateful for any elaboration?"
"Unknown","01;12;44;15","01;12;45;09","Thanks everybody."
"Unknown","01;12;48;29","01;13;24;27","Anyway, we want to take that. I, I don't know. I don't know. I don't know. It just maybe the dream versus, you know, sleeping versus the waking. But then even within the waking state, we have a wandering phase versus a very tightly focused phase. So there's sort of what is happening, if that reminds you of anything. I mean, I'd say if, if we're talking about this model, talking about the Helmuth machine or this, like, slight elaboration on the humans machine, then I don't think it would do anything that sophisticated just because, like, so as Adam says, there are biologically plausible ways of implementing this kind of thing."
"Unknown","01;13;24;27","01;13;49;06","But like anything is fine grained as a shift from attention to mind wandering. I think it's probably going to be left out of the model that's at this level of sort of abstraction and approximation. That's my thought. Thanks. So Adam, then blue and then anyone else with a raised hand or a question in the chat adam. Not sure I can address the mind wandering."
"Unknown","01;13;49;06","01;14;29;25","Exactly. Looks like a physical identity, but in terms of like the mountain climbing analogy, I'm wondering if it's like mind wandering is kind of like a exploratory hill climbing with a little bit of quantum tunneling or something like that. But that's a so I mean, what would you what you think actually it might loop around to the brain in an interesting sense and that there is like if we think of like lower levels of like a cortical hierarchy as doing something more like a variational inference of like continuous message passing, maybe we have like some discrete updating."
"Unknown","01;14;29;25","01;14;57;15","There are two so that seems to be like one kind of implicit representational regime. There might be a sense in which you're getting like probabilities in terms of like the track of hardness along as hierarchy corresponding to like probabilities of like a hierarchy of nested events in the world and like a deep temporal hierarchy and the detailed protocol hierarchy of like the latent causes of the world."
"Unknown","01;14;58;13","01;15;48;05","But there seems to be like potentially like as we like move inwards like another level where these get re represented into more like concentrate when you wonder like deep association cortex and like be a different game. And then when you're getting like coupling with like the hippocampus system, now it seems like you're getting something almost like like explicit syntax with like discrete semantics because like you can map like there's these pointers blowing from like the relationship among these like you can like bump attractors in hippocampal system or like these place cells, but they can be used to like contextualize the whole overall system within some sort of structured syntax and I don't know, like would"
"Unknown","01;15;48;26","01;16;16;14","do you need something like that to have the probabilities for is that what you're looking for? Or could there be more like this, like enact of hierarchy of like a hierarchical Boltzmann machine that has invested in part because there and that those are problems like yeah, both of you it would only like the re representation yeah. I don't know I think a lot about this this issue of re representation and how much, you know, if it happens and what it's doing and stuff."
"Unknown","01;16;16;14","01;16;44;20","But I think I guess I need to understand more and this is totally just my ignorance about the kind of models you're describing with the hippocampus and such. Like I tend to think of I tend to think of semantics in the brain just in terms of like vector space models. And so I'm just curious, I don't know if we could talk about it now for a bit maybe."
"Unknown","01;16;44;20","01;17;09;02","I don't know, it's up to Daniel and others, but like what is the explicit syntax in this case? It sounds something like something that that would be friendly to to what I'm trying to do. So I guess like so this explicit syntax, it's like still heavily research. There seems to be kind of like a gold rush among different companies and like you're allowed to try to figure out the system like DeepMind."
"Unknown","01;17;09;02","01;17;38;06","This is kind of like what started them was like a sabi is like making discoveries about this. But the idea would be that you have this graph structure that would be that originally would have evolved for just locations and like meet space or physical space, but then got repurposed for any kind of space. And so this gives you like structured state spaces, whether you're navigating through the world or you're navigating through like a spatial topology, right?"
"Unknown","01;17;38;06","01;18;05;29","This basically the contents would be these. And so it would be at the top of the cortical hierarchy and it would have pointers that could be unpacked in terms of like these more like modes of an active engagement or maybe like another like intermediate level pieces of consciousness where you're getting like more concentrated attractor dynamics with like potentially a quasi topographic relationship to events in the world."
"Unknown","01;18;05;29","01;18;39;16","And so the principles are they're a graph neural networks might be relevant there where basically you get this orders of magnitude greater representational efficiency by actually making the geometry of the system over which you're doing the deep learning resemble the thing that's being model. So like there's like a graph, a grid neural networks that could be used for like spatial modeling or there's like graph mesh neural networks that could be used for like a modeling of like someone's like oppose of a thing or an object."
