"Speaker Name","Start Time","End Time","Transcript""Unknown","00;26;51;29","00;27;31;01","And more recently that Melanie Mitchell is like explicitly drawing a connection to the global in her workspace theory. And so there could be like a generalized annealing that provides that it has a contrast of bits and an annealing generalized annealing. But that does give you like two kinds of like psychophysical identity mappings maybe, and a total a total speculative note would be sometimes we have, you know, accuracy minus complexity or pragmatic versus epistemic gain, maybe some decision making approaches that are able to hold both together and maybe even rebalance between those different modes."
"Unknown","00;27;32;00","00;27;58;29","Dean, I'd like to actually go to 12 and hear a little bit more on what you thought about contrastive diversions before we head to the next topic. So what did you see or find interesting on Slide 12? What brought you to that slide? Well, I'd actually looked at stuff from all over Woodford before, and so that was kind of why again, I was I was sort of I was connecting dots in my own head."
"Unknown","00;27;59;11","00;28;24;18","And so it's interesting because the parts that Adam and Stephen just brought up in part and part of our conversations off offline, one of the questions I asked Daniel and Blue was around the idea. So you have the physical math and you have the statistical math and somehow they come together and make babies. And that's what we kind of have here."
"Unknown","00;28;24;26","00;28;53;22","And so what is this? What is this project? And all I liked about the the not too not to discount or put aside the simulated annealing piece, but to give what what I think happens as if, for example, when the person goes down, goes down the stairs under control as opposed to falling to their death, you know, lowest energy state."
"Unknown","00;28;55;01","00;29;17;15","I thought that this essentially spoke to it by just giving a nice metaphor in terms of shining the torch beam in our chosen direction of travel, which allows us to see the lowest point in the field in that direction, which I think Alex was again addressing. I don't think, Alex, you meant to make this such a central point of your paper."
"Unknown","00;29;17;15","00;29;46;28","But I thought in terms of trying to explicate the simple idea, the fact that you didn't just focus on the fact that there's a gradient, but how does a person move down that gradient and not lose control, which is kind of what I wanted to bring forward here. And in the notes at the bottom, which I can't see on my screen, there's a really nice explanation for what contrast of divergence has in terms of being an assistant."
"Unknown","00;29;47;18","00;30;04;05","That's why I want to bring that one for you. Alex, if you want to give a thought on that. And then, Stephen, I don't know how much of the thought. I mean, I think it's it's a really cool angle that you have on this. And it's I think it's again, it's, it's something that's there, even if it wasn't my intended focus."
"Unknown","00;30;04;25","00;30;09;28","And it reinforces, I think, some of the themes that I was focusing on. Thanks, Stephen."
"Unknown","00;30;12;16","00;30;45;15","So what I think is quite useful and I'm kind of be sort of bringing this idea of if I was trying to explain this to an arts practitioner or someone who does in a psycho therapy or something, how to explain the implications. And one thing that I think it's important here is when you talk about that energy minima, I try to jump to the bottom of a hill I metaphysically I might know that I'm at a lower energy potential energy overall, but actually I probably get a higher energy when I hit the floor for a while."
"Unknown","00;30;46;05","00;31;12;01","Right as I start to get stressed and perspire and assuming I'm not just completely squished to oblivion. So you're in this interesting you know, I suppose we do that on rollercoasters a little bit, but we there is there's what we all infer in about our states is what it is, because we don't directly experience being at the lower energy state."
"Unknown","00;31;12;24","00;31;45;06","We experience what us and so states enable us to infer about the results of our actions. So and then from that we compare that to our expectations based on the stick in the sand or the big sticks in the sand, which is our phenotype, which is what we can then use as something to anchor against so I'm wondering that that has an implication about how people think about the world because of these types of ideas."
"Unknown","00;31;45;19","00;32;09;07","You know, this there's this sense that they are connected and interconnected at the same time. They're always separate in terms of being able to touch something because they're not touching something. They're getting sensory data which makes them get allows that model to predict what they've just done. They didn't actually touch in the way that people might think they've touched."
"Unknown","00;32;09;17","00;32;28;28","So I'm just putting that out. There is some question yet. Alex Yeah. For it. Yeah. That so there's there's this piece of what you keep doing. Stephen You keep trying to make this like put like put all this in touch with like the body in the world and stuff. And I'm like, No, let me just stay in my internal model."
"Unknown","00;32;29;13","00;33;06;27","I worry about that. But so I don't know, actually, I don't know if I, if I understood the thrust of just like the last couple sentences is. But I think the point that there's the fact is we don't we're not yeah. We don't just want to like leap to the lowest energy state possible come what may. Right. It's much more about the process and I think what you said about the this thing being anchored in the phenotype and you know, the priors, general, is, is, is really important 11 another paper that I wanted to write or I don't know if it's a paper or maybe it's just a blog post or a tweet or something,"
"Unknown","00;33;06;27","00;33;31;00","but it's just on the back of that. Yeah. So like you always have to bear in mind when you're talking about this energy minimization process that this is all relative to a phenotype which itself embodies some amount of energy. Right. And so in fact, you might even say that the stable phenotypes are some kind of like optimal tradeoff between accuracy and complexity, right?"
"Unknown","00;33;31;03","00;33;48;26","Just in themselves. So there's this force that's sort of pushing up from below, which is just the having a phenotype complex enough to predict anything. And you have to work within that, like those boundaries so I don't know if that really addresses your point because again, I totally missed that. The embodiment part just like flew by me. But it's, it's nice."
"Unknown","00;33;48;27","00;34;12;12","Just one point and then Adam. So I really like that example of a person or a body in motion going down the stairs and the difference between the controlled walking down the stairs or maybe even using an assisted mobility device and then falling down the stairs. And both of them can't stop at one moment. Whether you're tumbling or whether you're walking, you still can't stop there."
"Unknown","00;34;12;19","00;34;37;07","So it's always dynamical and you are going downhill and you are converting your potential energy into, you know, going to a lower energy state. So those two are good ways to think about where does bodily control and motor coordination, which we'll talk about in 23 soon with embodied skill for performance but let's think about a mountain climber that's somebody who's actually contrastive lead diverging uphill."
"Unknown","00;34;38;00","00;35;02;12","And so that shows us that it's not just like the die is cast and then whether you fall or control on the way down, but there's a way in which going to the top of the mountain is like going downhill or kneeling or reducing the contrast and divergence relative to your expectations of where you want to be. And now you can imagine if the water levels rising going uphill is a survival strategy."
"Unknown","00;35;02;26","00;35;26;20","So we want to have a way of describing where does control and bodily control come into the picture going downhill and then even generalizing beyond just bodies with mass falling in a controlled or uncontrolled fashion towards the kind of cybernetic planning that could actually result in a mountain climber, for example, going a little downhill and little to the side and then making their way up the mountain."
"Unknown","00;35;26;24","00;35;53;04","So Alex, then Adam and Steve. Yeah, yeah. And that's really it's a really good point to bring up, especially in this context of, you know, of the thrust of trying to simplify things by identifying physical and psychological things like no, sometimes you want to climb the mountain. So I mean, my may, my immediate way of trying to summarize how that would work is just, well, you've got a strong prediction that yeah, that you want to be at the top of the mountain, right?"
"Unknown","00;35;53;04","00;36;11;04","That's your sort of, that's your sort of desire distribution. It defines your desired distribution of our observations and so that's going to that's going to drive you to climb the mountain. But I think that the way it does that is approximately is that there's going to be an actual, I would say, an actual physical disequilibrium in the brain."
"Unknown","00;36;11;23","00;36;57;01","Right. That's caused by the discrepancy between your predicted state and the state that you're inferring from your observations and lowering that, you know, that potential is what drives the action of actually climbing the mountain. So yeah. Cool. Awesome. Adam And then Steven head spinning a little bit, but hopefully this works. Work is like up, down. But I'm wondering in terms of something like depression and could we think of it as like a very high local minima and like if we thought of like what we would expect?"
"Unknown","00;36;57;04","00;37;21;16","So I guess what is it that's being predicted? At which level of the generative model, like what is it? Everything is what's, what's being predicted. Like and actively like between the worries Minnich and what's been predicted over the whole like skinny encapsulate organism, the brain and then subsystems there could be some. Ultimately they have to come to some kind of harmony, but they could diverge."
"Unknown","00;37;21;16","00;37;50;20","But the idea would be like thinking of a a landscape that like when the energy's high, it might be more jagged and it might be more likely to get stuck at like local you're stuck at this local minima and you want to get to that really low one. And so you could think of something like niche construction as like looking for a catalyst to like try to like smooth out like make a more navigable landscape."
"Unknown","00;37;50;20","00;38;06;13","Or you could think of like the psychedelic would be like a turning the heat. So I'm thinking of the difference between like a, a thermodynamic versus a kinetically favorable chemical reactions like you might like. Yeah, it's theory if you can get from there, there you come up ahead with the output with the amplitude. But you can't get there."
"Unknown","00;38;06;13","00;38;29;04","It's not kinetically favorable. And so like the different things we're doing is trying to like find ways of getting kinetic favourability for, for this thermodynamic favourability and bring those into alignment. Very nice, Adam. You can build that bridge. You don't have to afford the river or swim across or you can just pray for the quantum tunnel to appear so."
"Unknown","00;38;29;04","00;39;03;03","But they do. Stephen And then in wow case there's something very quite important here, I think because OK, we're, we're minimizing this energy gradient. OK, that's fair enough. Particularly for robots. Which are using reinforcement approaches and they're basically working on energy gradients. And then you've got the idea of you can work with variational approaches, i.e. more like this gives free energy where the reaction can slightly have entropy."
"Unknown","00;39;03;16","00;39;24;10","But the big T thing as well, if you're going to take your agent is that we're at the level of the chemistry is the chemistry is non equilibrium chemistry. So the whole of the gives free energy is built on equilibrium chemistry. Here we've got a non equilibrium chemistry when you get to the matter of the organisms and the cells and the and everything."
"Unknown","00;39;24;10","00;39;57;27","So I think what's an interesting point here is so you're going down the stairs, you're trying to fall over, you're being a rock climber. So overall there's this energy piece around how the agent moves for the agents and moves. Unlike a robot, you might have the old pistons, the actual cells in that are operating that this non equilibrium state and quite how different actually this gap between these attractor basins versus energy basins which we normally think of."
"Unknown","00;39;57;27","00;40;30;06","I actually don't know. I don't even know. I'm interested to ask how fits that? Like what is how much does it shift things to have basins to do with attractors as opposed to just basins to do with energy equilibrium, energy gradients. And and that's the thing that's different in terms of what's really going on when I'm climbing a mountain or that is all my muscles in that at the actual level of making things happen, a swarm in and trying to enable this kind of biological process to happen."
"Unknown","00;40;30;26","00;40;58;28","And OK, from a system perspective, I can see the energy being less for me falling on the ground, but for my muscles to move and everything there, they're operating at this non equilibrium process and which will have energy impacts but also as some other types of dynamics which you don't have, you have this non equilibrium steady state dynamic which you don't get in traditional chemistry."
"Unknown","00;40;59;12","00;41;18;20","So there's something there. I'm just sort of I'm not saying I expect an answer in that, but I think it's a, it's an important point that seems to be a gap. It just it really shone out for me there. Nice. Thanks, Steven. It's kind of like if it's a ball at the bottom of a ball, then it's, it's that's the annealing, it's the crystal state with a ball in the ball."
"Unknown","00;41;19;00","00;41;49;10","But then if you have a neuron that's holding a resting voltage that is being actively maintained with an enormous expenditure of energy, but it's its own kind of ball that it's converging to, whether it's above or below its set points it still doing a type of convergence, but it's a dynamically held state. And you're absolutely right that sometimes the lower level entity or the entity which the larger one is composed of, they have their own active dynamics."
"Unknown","00;41;49;19","00;42;13;11","Even when the top level system is at rest or appears to be unmoving, so Dean and then we have a few other fun topics that we'll get to. Well, I'm going to see if it's OK to ask ask Alex to jump to a third rail at this point, because I'm really, really curious about the modified Ramsay sentence aspect of his paper."
"Unknown","00;42;13;17","00;42;38;14","What I was hoping he might be able to speak to a little bit about is not just what that what the Ramsay sentence is talking about, but the implications in terms of different time intervals and what that role that plays in us, being able to understand how the modified Ramsay sentence works. In your paper perfect. I switched to that slide 44."
"Unknown","00;42;38;25","00;43;02;25","So yeah, I was definitely curious about that as well. Alex, what does the Ramsay sentence or this entire area of formal logic, how did that come into play? Yeah, so right. I kind of trumped up the Ramsay sentence thing in the last episode, but it's kind of silly of me because there's not a whole lot to it and in a way, but then it maybe that's just how it seems to me from the perspective of where I'm coming from."
"Unknown","00;43;02;25","00;43;35;03","But the reason this is in here is that the whole identity, the philosophical mind, brand identity piece of this is based on I was mostly inspired by David Lewis's approach to that topic. And so there there are a couple of influential approaches. There's Lewis and there's Smart, I guess the two big papers, but basically what what this piece of formal logic is doing is just trying to capture what what a theory says about the entities that it sort of implicitly defines or how you could get from."
"Unknown","00;43;37;03","00;44;02;25","This isn't all explicitly spelled out graphically, but how you could get from just a collection of statements that you might have sent to about whatever the topic happens to be. In this case, we're talking about mental states from that to a a theory that's expressed in general terms and that again, implicitly defines the are the entities that figure as the value, the values of these variables here."
"Unknown","00;44;04;08","00;44;18;15","So the right so I mean, we could briefly talk about this, I guess. Is it useful to go over this? Yeah. You guys. Yeah. So read out the sentence or translate it or provide an example. Sure."
"Unknown","00;44;20;18","00;44;41;00","So, right. So I guess I'll start with just the Ramsay sentence and we'll talk about modified versions in a second. But so the first symbol here, as you guys discussed in point zero, was just an existential quantifier. It says there's some X such that whatever follows the second symbols, the universal quantifier over the variable Y. So it says there's some X such that for all Y, blah, blah, blah."
"Unknown","00;44;41;15","00;45;07;09","And here T, the predicate is just literally like so say that you had a collection of platitudes or they don't I don't want to complicate things, just the collection of statements like when I see when I see a cat, I'm happy. When I think about happiness, I tend to think about sunshine, things like that. Right. Just some examples and so you just conjoin all those."
"Unknown","00;45;07;09","00;45;30;15","Just put an end between all of the sentences of that type that you could think of in this domain. In this case, it's folk psychology and so then you'd have, you'd have a a a long sentence, right? It's a giant conjunction now that has some terms that refer to mental states like believe, arguably. See, although maybe some people would interpret that as a physical state."
"Unknown","00;45;30;15","00;45;55;09","There's definitely very blurriness here at the edges. But in any case, things like believe, desire, think, these are clearly mental state terms, right? So you have this long sentence that has those terms and also other terms. And so essentially you just you replace each of the terms in question, the mental state terms with a variable. And what's left over is the predicate that defines what the sentence is saying about those the values of those variables."
"Unknown","00;45;55;16","00;46;28;10","Right. And then you just append these quantifier the beginning just to to sort of spell out what your what kind of claim you're making about the states in question. Namely, there is such a there is something such that it relates to all of the things in this way. And so that's that's the basic Ramzy sentence. It's just it's an abstraction that allows you to just go out form informal logic and for sort of predicate logic, like what a collection of sentences says about something."
"Unknown","00;46;29;00","00;46;48;01","And the last piece here is the so there's the if and only if the three bars that's the resilient uniqueness condition. So this goes back to Russell's theory of definite descriptions. So like I mean, my start, by the way, was in sort of philosophy of language and stuff. So that's why this is in here. I came to the other sort of statistics and physics based stuff much later."
"Unknown","00;46;49;21","00;47;25;23","So so Russell had this, this theory of Definiteness frictions that he was trying to explain how you could have a meaningful expression like the present King of France, even though there is no such thing. So how does how to sell these figures of reference? How do we philosophically handle failures of reference and things like that? And so his his suggestion was that you can think of definite descriptions like the present king of France as of just saying, well, there is something such that it is a present king of France and there's only one of those things, right?"
"Unknown","00;47;25;23","00;47;54;17","So it's like a uniquely satisfying description. And so that's what this part does here. It says this predicate T, which encompasses all of the implicit folk knowledge about mental states in this case, holds holds of something only if that thing is equal to X. And so one last piece that's important here is that I took the bold letters here, X and Y to be like vectors and essentially."
"Unknown","00;47;54;17","00;48;17;14","Right. So like these are we're talking about many different mental states that in parallel we do this. But if you want to, you can just think of it simply as being about one mental state. Then you generalize to all of them. So I don't know where how clear is that? What, what, what it's it's let me try a little bit of a physical example."
"Unknown","00;48;17;14","00;48;51;04","It's like there's the stream of consciousness, the stream of statements, what you said, where there aren't I saw a cat or photons hit my eye and I perceived a cat. So one of those is more of a physical list claim and one of those is more on a mental side. And it's almost like we're going to draw a line around the mental claims just so that they can be definitely interface into a formal logic, even if the contents of that mental experience might not even have a reference in the real world."
"Unknown","00;48;51;12","00;49;14;11","Or it might not be something that exists in the same way that those photons hitting the eyes exist. But it allows us to interface with those kinds of statements by agents in a formal logical framework. Well, I mean, I guess one part I was back on a bit is I mean, this sentence here clearly states that that this X exists, whatever you take that to mean, right?"
"Unknown","00;49;14;11","00;49;37;13","So it could be that there's different criteria for existence, right? In different domains or something, but it definitely said that there exists something such that it's related to all the other things of this kind in the ways that are specified in the predicate. So like, yeah, I think I think that the main I guess the main point here, so I focused on the Ramsay sentence because people are interested in it."
"Unknown","00;49;37;13","00;50;02;11","But the main point is just that you can take all the things that people say about mental states as implicitly defining them in a sort of theory right. And that that's that's it. And so we use this explicitly in the context of trying to identify mental states with brain states. Right? So just to sort of just say a little bit more at this piece."
"Unknown","00;50;02;11","00;50;41;04","And then I'll shut up for a bit. But like if you have this network of relations that's described by a sentence like this, you can take that as implicitly defining the mental states by being neutral about their sort of ontological character. Right. So so it could be then that if you do some neuroscientific investigation and you find, hey, there are these, you know, states in the brain that are they seem to bear the same relations to one another, that these mental states that we were talking about bear to one another, you know, Lewis says, well, then because this the sentence says that the mental states really are just the things that uniquely realize this structure"
"Unknown","00;50;41;04","00;51;04;10","of relations. Well, you've just empirically discovered in the mental states. So it's a really cool way of theoretically bridging something like psychology, intuitive folk psychology and and neuroscience. And Lewis's point was, what, once you have this structure, if you could extract this structure from folk psychology, that's implicit in it. And if you made the empirical discovery, there'd be no further bells and whistles."
"Unknown","00;51;04;10","00;51;33;26","Whistles needed to say that there's an identity, because that's just what the sense says is that the mental states are whatever things satisfy this description. Hmm. Very interesting. So Dean, then Stephen, then Adam. Yeah. So, so Alex. I mean, as it's, as it's written out here, it's, it's really stable. And I'm really curious because I really don't know this do different time intervals, like really, really short time intervals or longer time intervals."
"Unknown","00;51;33;26","00;52;04;07","If I've got a day to go down the stairs versus I've got one second to decide whether the 96 inch drop is less harmful to me than the lion that's chasing me. Do time intervals affect the stability of this right yeah. So so I can walk up to that part of your comment earlier I think. No, as a short answer, I think that this is meant to be a static esthetic sort of description of a, of an implicit theory."
"Unknown","00;52;04;15","00;52;24;24","Right, which which will include statements about short timescales and long timescales. So I would say that that anything about time scales in theory should be captured by the folk psychology that you embody or that you have in mind at the moment. And that might change from one time moment to the next. Also, like this doesn't need to be a temporally static structure."
