"Speaker Name","Start Time","End Time","Transcript"
"Unknown","00;00;09;27","00;00;36;00","OK. Hello, everyone. We are live. Welcome to Active Flab live stream number 22.2. Nice repeating digits there. We're here with Alex Kieffer and others. We're going to be having our second follow up discussion on the paper. We've been discussing for the little last bit. Psychophysical identity and free energy. It's May 25th 20, 21. And this will be a great discussion."
"Unknown","00;00;36;02","00;00;57;26","So thanks again for everybody who's joining live as well as watching and replay. If you're watching live especially feel welcome to add a comment in the live chat that we can address Welcome to Active Lab, everyone. We're a participatory online lab that is communicating, learning and practicing applied active inference you can find us at the links that are listed here."
"Unknown","00;00;58;20","00;01;39;18","This is recorded and an archived live stream, so please provide us feedback so that we all can improve our work all backgrounds and perspectives are welcome here and we'll be following good video etiquette for live streams. We are here in the second of the two discussions in late May 21 and happy to have Alex joining us for both of these discussions which has been great today in 22.2 quick correction we will be just trying to learn and discuss enjoying these conversations, seeing where they go, enjoying what questions bring up and also carrying on with a few of the topics that we knew that we wanted to cover from last week."
"Unknown","00;01;40;14","00;02;07;05","And with that being said, we can jump right in so we can go to the introductions and we'll just maybe go around, introduce ourselves, say hello and then end with Alex and Alex would be happy to hear your thoughts or reflections in this past week. So I'm Daniel. I'm a post-doctoral researcher in California. And I'll pass to Dean Hi folks."
"Unknown","00;02;07;05","00;02;24;08","I'm Dean. I'm from Calgary. And yeah, I'll pass it to Adam I'm Adam. I'm a post-doctoral researcher at the Johns Hopkins Center for Psychedelic and Consciousness Science."
"Unknown","00;02;26;25","00;03;01;22","And Steven. Oh, hello. I mean, Steven, I'm in Toronto. I'm a community development practitioner owner and a flight suit artist, and I'm doing a practice based at the moment. And I'll pass over to Alex the Alex or other Alex. I think you're the only Alex right now. OK, OK. I wasn't sure there's a fellow jester. I want you to oh."
"Unknown","00;03;01;22","00;03;26;29","So I'm Alex Kieffer. Thanks for having me back and talk about this paper. I'm a philosopher. I'm currently affiliated with Monash University, and I'm also doing more applied work for Nested Mines Solutions, so a kind of active influence. I start up cool. There's a few ways we can start, but why don't you feel free to give any opening?"
"Unknown","00;03;26;29","00;03;53;08","Yes. And then we can ask questions. We have some other slides right. So you asked about my reflections over the past week. I haven't reflected a whole lot on deep themes. I did go through. So in the point zero discussion, there was a sort of a question about how we get from 2.1 equation two to one to 22 with the flipping of the PS and Qs."
"Unknown","00;03;53;17","00;04;12;01","So that strikes me as like not the most central theme we can spend time on, but I did just spend some time writing out the derivation if that's something we can get to at some point. But in general, like I guess my feeling is I think last week was really fun and we kind of it was very far ranging."
"Unknown","00;04;13;28","00;04;34;27","I I, I think it would be fun to like to drill down a bit more on some of the specifics this week. But, you know, it's kind of also whatever people want to say. So that's, that's what I'd be interested in doing. Thank you, Alex. Welcome. Lou, if you'd like to just say hi, we're having intros and then we'll sort of walk through some jokes and questions Good morning."
"Unknown","00;04;34;27","00;05;02;20","I'm Blue Knight. I'm an independent research consultant based out of New Mexico. Cool. So there's a bunch of places that we wrote down to jump in. Maybe actually we could go to Dean's three functions, walk into a bar. So it's Slide 11 and I'll have it up large on the stream. So, Dean, why don't you unpack what you were thinking here and let's get some initial reads to get the contrast of ball rolling."
"Unknown","00;05;03;26","00;05;40;18","Well, essentially what the the point two aspect of this process does is it takes basically what we've introduced as as the topic try to gain some interpretation around it. And then so what does that mean? What does that turn into? And so one of the products of that for me was I kind of went back and reviewed the the 22.1 and one of the things about what you mentioned, Alex, was the explanation of a simple idea."
"Unknown","00;05;41;08","00;06;02;21","And I thought that was really important. And so what can that what can that turn into that simple idea? That was the the three functions walk into a bar piece and essentially spoke to what Scott was talking about last time in terms of paradoxes and what do those mean and when do we model and when do we fall a little bit?"
"Unknown","00;06;02;21","00;06;31;20","I thought the bottom part was was an important piece in terms of you mentioning that you saw continuities and I wondered if you were referring to cynicism and that idea of how we take discontinuities and turn them into continuities. And that's that's really interesting. So I had never heard of cynicism. I keep trying to pierce through like strange avenues that were not planned."
"Unknown","00;06;32;12","00;06;56;11","I never consciously thought of it this way. But this kind of nicely summarizes, like, how I see things and the way I've just been sort of forced by experience to approach philosophy. It's like, like like I've found it difficult or impossible to draw, to draw boundaries that would create discontinuities between categories quite generally. So you know, that gets into things like the surrealist paradox."
"Unknown","00;06;56;11","00;07;15;22","There's plenty of examples of this, but I think it's for me, it's much harder to find a discontinuity than to yeah. Then the opposite. OK, can you maybe just walk us through these three functions walking into a bar? What what is the narrative here? And where does it sit in relation to the paper?"
"Unknown","00;07;17;24","00;07;50;19","You're asking me? Yeah, yeah, yeah. OK, so, so essentially if we're, if we're going to, if we're going to talk about contrast of Divergent, which I think is a critical path to understanding how we move down a gradient and arrive at some sort of generative model. I think that there are three functions that essentially exist in that it's an inversion process, which I again, I'm not going to go into the, the, the, the, the, the reads on that."
"Unknown","00;07;50;19","00;08;29;27","There's an identity piece which is spoken to explicitly in Alex's paper and then there's the contrast of diverse contrasts, the divergence piece, which enables a person to remain balanced despite the fact that they don't have a particular answer, that there are hidden states. And I think what a lot of what was being spoken to last time Scott mentioned some things Blue Stephen, was things like scale, which don't necessarily we don't come at it with with the same perception as to what we're looking at."
"Unknown","00;08;30;19","00;08;59;26","Some of us look at things a little bit on a grander model and some of this like it on a granular model. And I think that the part of being able to fit that into a form like the joke, the three, three guys walk into a bar or whatever kind of speaks to the fact that if you think that this is going to be about stability, you're going to get interrupted by the change aspect of it."
"Unknown","00;08;59;26","00;09;24;06","If you think it's going to be all about the change piece, you're not going to be able to realize any sort of conceptualizations because conceptualizations require stability. So you have to kind of be able to play. And both fields at the same time. And that's hard. And I think that's why Alex's paper probably knocked me down about five times when I first read it."
"Unknown","00;09;24;06","00;09;56;13","Because you actually did Alex, try to somehow pull together the ideal idea of stabilizing something, even though things were pretty choppy and and rather dynamic. So I don't know if this is an example of where the part two of us discussing your paper goes, but I think it's it's interesting, especially in the context of synergism and your idea that we're constantly trying to move from the unknown to the known as opposed to the traditional."
"Unknown","00;09;56;22","00;10;24;01","This is what I know. And I'm moving into these unknown spaces that reminds me of then anyone, Alex or anyone else reminds me of sort of two complimentary ways of thinking about education with the tabula rasa, the blank slate, the inscription is put into it's like filling the cup with knowledge or inscribing into something that's template lists. And then the alternative is to burn away ignorance."
"Unknown","00;10;24;14","00;10;51;06","And so it's almost like a move whether we're moving from the known into the unknown or the unknown towards the unknown. There are our left and on right hands of education, right yeah. Yeah. This is really cool. I mean, it it seems like a dream. Like you have a knack for like reading, reading things in a sort of very deeper, almost allegorical way."
"Unknown","00;10;51;08","00;11;21;17","We're talking about a version where. Yeah, yeah. I read Charles Saunders, Pierce two decades ago before it became popular. Right. So yeah. So so it's I think it's interesting and it's it's all these connections are really there. But I just, just to, to comment on this for a second. So, so, so I do think that there's something about just the how ubiquitous sort of dynamism is and all this and how there's in a sense, there's no stable process that we can latch on to here."
"Unknown","00;11;21;17","00;11;53;16","But when I was talking about contrastive divergence, my main point was just, well, look, that's I'm thinking of that very narrowly as a machine learning like an unsupervised learning algorithm. Right. Which I know you have that in mind, too, but you're also taking a broader picture so my point in contrasting contrast of divergence to simulated annealing was we can suppose that the brain is running something like contrast the divergence where it's trying to it's trying to reach a lower energy state."
"Unknown","00;11;54;26","00;12;32;05","But, you know, the way that algorithm works, of course, you don't need to actually run. Right. The basic idea is that you don't need to. So so OK, sorry that we take a step back for a second. Right. So like one way of doing this sort of unsupervised learning would be to to take the distribution over hidden states in a neural net that's induced by an input and try to lower the energy of those states while raising the energy of the fantasies that the network would produce top down."
"Unknown","00;12;32;06","00;12;55;23","Right and so the ideal way to do that would be to run run the network until it reaches its equilibrium distribution and sample from that. When you're doing a negative, the negative phase of this of increasing the energy of the or the therefore lowering the probability of this analysis contrast, the divergence just takes a shortcut and just runs this for like one step or two steps or whatever."
"Unknown","00;12;56;25","00;13;17;15","So I just want to make that clear. I don't know if it's clear for everyone in the audience who hasn't looked at this deeply that that that's the specific contrast that I want to draw. There was just was just between that and a process like simulated annealing where if you if you run it to the to the end of the process, you end up reaching the lowest possible energy state."
"Unknown","00;13;18;13","00;13;42;25","So the brain I guess my point is the brain doesn't necessarily need to be settling to and this does, I think, connect directly. Your point doesn't need to be settling to a completely stable state or even any particular like metastable state. It just has to be there has to be this gradient, right? Yeah. That is available. But I do think that there's a deeper point here, right?"
"Unknown","00;13;42;25","00;14;16;19","So the ness or the non equilibrium steady state that organisms are are approaching as they as they do this variational inference thing is not any kind of final you know, it's not a it's not an esthetic state like some kind of ultimate equilibrium. Right. Well, going down a set of stairs then what the one steady thing is that I remain balanced and not go tumbling to my right heights."
"Unknown","00;14;16;19","00;14;35;29","Right. That's the one steady thing. The one balance thing. And then there's the gradient itself. That's why the there's a next slide that kind of speaks to the that piece of it. And I that's that's all I basically wanted to bring up because I think and I think the cynic is in piece embrace it entails all of that."
"Unknown","00;14;36;06","00;15;16;22","There's there's a dynamic piece and there's a balancing piece and you and you want to be able to sort of address both. That's that's cool. Yep thank you Dean Stephen and then out of there's interesting questions here for pragmatism and social constructivism you know in terms of how these ideas roll out into how we might talk to other people in the world around projects and stuff because of this implication so I wonder how you would bring in this kind of embodiment of that."
"Unknown","00;15;17;23","00;15;46;11","So if the brain is an organ that is doing expected more than expected free energy with the nervous system to help to manage the movement of the organism and the organism overall has got that variation of free energy to maintain homeostasis. We we've got this he's got this energy balance piece, but you've also got that need for entropy."
"Unknown","00;15;46;29","00;16;10;15","So I wonder how we how this can inform this just like people when we do have, you know, about the Alexander technique, but it's when someone's when you think about the body in the skeleton, we think about it as just the bones. But actually it's really everything's held together in a muscular sort of watery soup and, and, and with attendants and everything."
"Unknown","00;16;10;15","00;16;36;22","So there needs to be some noise in there that that entropy piece needs to be there when you're going down. This thing is not you can't be frozen you're full yet. You need to have some of that energy equilibrium because again, you're fall. So this I wonder how if we were to talk to someone out there about their life and their world and walking down the stairs, what what would we translate this in their language?"
"Unknown","00;16;38;28","00;17;06;23","Alex, if you want to give a thought on that, I'm thinking about it. I'm not sure beyond saying that, I do think that there's a balance of two sort of forces or quantities here always. But this reminds me actually, I'm not going to try to put words in your mouth, but this reminds me of Adam, of your your remarks about free will and relation to degrees of freedom and entropy and stuff."
"Unknown","00;17;08;04","00;17;32;00","So that's a Segway, but it doesn't have to be taken up. Cool. Yeah, it reminds me of the stream of consciousness or walking down stairs. You can't just stop there statically can't stop anywhere along the staircase and you can't halt the stream of thought. So what is happening that's allowing time t plus one to be generated from time."
"Unknown","00;17;32;00","00;18;21;19","T The state only has to move by one moment at a time. It doesn't have to do the ultimate steady state to the lowest possible energy. So Adam and then anyone else raising their hand um, I reread your paper last night, and it's even better the second time I'd like to actually talk to you later. About getting into the weeds about different, uh, like mappings on the neural level of like between the thermodynamic and the informational, but the before we move on, I was wondering how you'd feel about like a multi phase or a multiple part description of neural architecture where like there's some aspects which might be more annealing like and some aspects that"
"Unknown","00;18;21;19","00;18;49;05","might be more contrastive like so like you could like for instance, tell a story of like some sort of predictive workspace where like you can think of it as like the model selection as like iterative annealing potentially in terms of some of its aspects. But then like it's just like a round like you you could think of like, like, like, like a dance style ignition event as you're generating this, this big high temperature complex but then settles down and selects the model."
"Unknown","00;18;49;16","00;19;17;08","But this would just be like one of the things that's happened, like something contrastive could be like the thalamus, like maybe like orchestrating different cycles and comparing them or hippocampal system. And that could be like junior contrasts. Would that be copacetic with that? Right, yeah. No, that sounds, that sounds awesome. I mean, in general, it seems consistent with like the way I've just I've learned to see these things, you know, just, just paying attention to all these different sources of evidence."
"Unknown","00;19;17;08","00;19;47;11","It seems like yeah. This kind of it sounds right to me. I guess my only uncertainty is like the reason I focus on on this contrast was in part because I wanted to argue for, as you know, for an identity between the, the energy free energy and the thermodynamic sense and in the variational sense relevant to the inference."
"Unknown","00;19;47;11","00;20;20;04","And so I needed to I needed to make explicit the argument that whatever is going on, even if if there's sort of a multiple timescales in which this is happening, or if there are different parts of the system that are in effect being anneal to different degrees, that the whole thing, it's not possible to think that the whole thing settles to like, you know, the lowest possible energy state while it's alive."
"Unknown","00;20;21;02","00;20;44;25","So anyway, I don't mean to like deflect I think what you just throw out I was really interesting and you probably know more about the relevant, you know, in Toronto mechanisms that I do. So I can't like critique that idea, but it sounds as you said, copacetic. Yeah. Adam, you want to add something there? I mean, yeah, I wouldn't want to like distract you like the point of like if we actually you have to not be at equilibrium."
"Unknown","00;20;44;25","00;21;09;15","You have to have this, like, open mindedness and dynamics to keep the process going. But and I don't know, like a productive like sometimes like I'll squinted like in different machine learning algorithms and like, you know, push them a little bit further. So like you could think of this iterative Bayesian selection as like a kind of annealing one that could not be productive potentially, even though aspects of it could be described that way."
"Unknown","00;21;10;03","00;21;27;20","Yeah, well, that's a good I mean, it's kind of a good way of framing it. Like, I think this goes back to this syncretism cynic schism thing. Like, I think you can probably always redescribe something in terms of something else, but it's a question of how useful it is. And, and I never exactly know where the boundary is, right?"
"Unknown","00;21;28;05","00;21;55;20","What becomes just kind of a fanciful like phosphorus trick versus what's useful but the thing that you're suggesting sounds like it would be a useful way of thinking about things. And, and when I contrast contrast of divergence and annealing, when I think of annealing, I think of DNA in the test tube as you turn the temperature down. So you come to a final frozen state, that's like a fixed crystal, essentially, whereas the idea of contrast of divergence, it's more like cybernetics."
"Unknown","00;21;55;20","00;22;15;18","It's like a guiding and a navigation on a flow already. And so even if you didn't have any divergence at all between your North Star and your head or where you're going and where you want to go, you still would be moving. And so in that sense, even if you're trying to minimize the divergence, there still is a sense of movements."
"Unknown","00;22;15;26","00;22;40;02","Whereas in simulated annealing, the idea that there's no difference is more associated with a crystalline or a static state. So they have very different sort of tliose almost and four dynamic systems that person going down the stairs, stream of consciousness action selection in an uncertain world that feels more like the cybernetic navigation rather than the DNA in a test tube."
"Unknown","00;22;40;12","00;23;13;17","So those are just some aspects. So Stephen and then Adam that that idea of how things keep going and the dynamics I'll be interested in your thoughts about how that might play out in in behavior or in the world. So I could imagine in the Elian being a little bit like if things are trying to hibernate, there may be a state where they can go closets is like like glass glass gets in."
"Unknown","00;23;13;17","00;23;47;19","You basically that's how you plunge into a water it holds that liquid state even though it's colder than liquid. But the the question I have is, is how do you reconcile some of these these these these questions around where we can get caught in loops for instance, you know, like Casper has talked about depression, but you're seeing a lack of affordance in the environment and that could be concern in your predictions."
"Unknown","00;23;47;26","00;24;22;15","You can get kind of caught in a loop. And some of those challenges in computational psychiatry are they're sort of low energy. I actually haven't gotten on this. It's made me think there's sort of low energy sex, but also like looping transformation, restates you know, where you get a reduction in free energy relative to some some sort of stick in the sand that is been established for the priors and the dynamics and then it kind of gets stuck in that, you know, be it, you know, high activity, something that's outside of where the organism want to be."
"Unknown","00;24;22;15","00;24;46;02","But it's still going there. And I don't know if that's quite the same as going into the sort of a low energy equilibrium. You're not going to it's not necessarily going down in energy. It's sort of getting caught in a loop. So of vibrational free energy. Yeah, that's that's really interesting, actually. I'm sorry. It was someone else wanted to know Alex OK, after your thoughts, we'll go to Adam."
"Unknown","00;24;46;27","00;25;07;05","Yeah. So I mean, my, my, my intuitive reaction is that is that. Yeah, something like that happens in depression. There's a sense in which it's a low energy state in my paper, which is kind of like a sophisticated argument for a really simple minded idea. I want to identify that those two things and say, yeah, it's physically a low energy state as well."
"Unknown","00;25;08;15","00;25;28;18","But it's a local one. So that, again, is my intuition at the moment. I don't know if it'll be borne out or if it'll work, but it seems like sometimes in depression maybe we reach like, yeah, like a local energy minimum in a certain part of the network or something, but it's not part of an overall optimal state for the organism when it comes to behavior and things like that."
"Unknown","00;25;30;03","00;25;34;25","It's really interesting to think about how that happens. Yep. Thanks, Adam."
"Unknown","00;25;39;12","00;26;03;22","Actually, despite what Steven just mentioned, there's a within like the psychedelic research community, there's interesting models based on therapy of change through annealing, where like Johnson of the Quality Research Institute has something called like the neural theory or theory of annealing, where it's the psychedelic state increases the temperature helps you to breakout, and then you can crystallize new regime."
"Unknown","00;26;03;22","00;26;30;01","And Robin Hood Harris is described in very similar terms. Yeah. One thing about like generalizations of kneeling that came to mind when Dan was talking was Doug Hofstetter and Melanie Mitchell with their copycat architecture, they said it's different from annealing, but it had something was kind of like ant colony optimization, annealing, where there would be a temperature parameter for when your analogies weren't fitting."
"Unknown","00;26;30;11","00;26;51;20","And so you can think of like some sort of contrasts of bits saying like how good is your like matches how good is like these analogical matching like the st comparisons? And then this parameter rises the temperature of a continuously adjusted annealing process. It doesn't settle and and more recently, really interestingly as well, from the beginning, the language was completely like workspace up."
