"Speaker Name","Start Time","End Time","Transcript""Unknown","00;26;11;27","00;26;59;00","Vision isn't just the ram, going back to the video card, back and forth with the processor. So how is it that brains and cells and all kinds of biological systems are able to act effectively when it's pretty clear that they're not doing it like our heat producing computers are doing it? So this is sort of where we're looking at how do biological organisms do good inference on the very complicated sensory environments and represents all of these wild stimuli in a way that allows for effective control of the inputs and do that without overheating or requiring just a ton of energy let's go to free energy I want to start here blue or I can start."
"Unknown","00;26;59;07","00;26;59;15","Yep."
"Unknown","00;27;03;23","00;27;48;13","Re energy in the context of Variational, Bayesian inference is a functional of a probability distribution or density. Cube used to approximate the in practice typically intractable joint posterior distribution p of h v of data v together with the unobserved causes of those data. H under a statistical model whose parameters may also be unknown and so I got just that Q is the one that we can control, and Q is sort of our guy, and then the one that we can't get at is the actual distribution P of two different things, the data, which is what we definitely have."
"Unknown","00;27;48;13","00;28;15;27","So that's good. But then the unobserved causes of the data H and sometimes H, his hypotheses like I hypothesize that it's raining and so what are the data that you get well, maybe it's visual or maybe it's tactile data, but you're going to be able to control your estimate of whether it's raining. Q And then what you're trying to get at is that total distribution P part of which you can get at with H and V."
"Unknown","00;28;16;16","00;28;47;23","So we're going to be trying to talk about a way to bring what we can control our internal generative model and align that distribution through optimization to really complicated distributions in the world that might have many more degrees of freedom or a lot more variability than we could possibly handle. And another a nice quote on the bottom and yellow is free energy captures the discrepancy between the organisms generative model of the world and the current environmental conditions."
"Unknown","00;28;48;26","00;29;15;06","So that's kind of cool. And we've seen that come into play in the context of the predictive processing or the hierarchical predictive processing framework, which is shown here from Ramstad at all. Answering Schrodinger's question, it's a figure that's showing how there's sort of a bottom up, which is sometimes associated with sensory input and a top down, sometimes associated with priors about the world, these two interacting streams."
"Unknown","00;29;15;22","00;29;49;03","And they're in a multilevel way so each level is only getting passed up or down one level. And what's going up are these sensory inputs and unaccounted for errors and what's coming down is expectations. So if the bottom up is exactly what you expect, it's almost like the system is resting. So in other words, if the model's perfect given the visual coming data coming up, everything is very chill and things are not chill to the extent that the bottom up information is surprising."
"Unknown","00;29;49;27","00;29;57;04","So what is getting passed up? And under the free energy principle, maybe it's free energy, but what is free energy?"
"Unknown","00;29;59;24","00;30;28;21","Another way to look at this question about the relationship between the observations in the world, which are called data in many cases, and the generative model of the world is with the paper that we discussed in active number six tale of two densities and variables and parameters. They're used often loosely because when you're dealing with programs, everything is a variable, everything's a parameter."
"Unknown","00;30;29;01","00;30;54;04","So it can be a little bit confusing to which kind of switch. But the data parameters are the observables and the recognition model in Bayesian statistics is the model that recognizes the data and forms hyper parameters about the data. For example, the hyper parameter might be like the location of an object and the data might be the actual retinal cells giving raw input."
"Unknown","00;30;54;18","00;31;31;25","And so the recognition model is going from that retinal input to a hyper parameter of where's the object located? And then that can be used in an invertible way with a generative model that goes from OK, given where it is in the estimated location, what kind of data would be generated from that? So this is a Bayesian model fitting approach that's related to expectation maximization, where you take what you have as far as data and you update what you think about the generative process of the data and then you crank it the other way and you ask, Given what we know about the world, what kind of data might it generate?"
"Unknown","00;31;33;01","00;31;58;18","And tale of two densities contrasted that sort of Bayesian approach with a lot of the theory of the inactive researchers who are interested in this relationship between agents in the world and seeing that incoming data as analogous to perception, and then the outgoing generative model as generative model of action so that's what we discussed in Tale of Two Densities then."
"Unknown","00;31;59;12","00;32;20;00","Yeah, I was there for that. But I'm just going to ask the two of you I really like the diagram, but one of the things I was curious about is I've had lots of conversations with people who are taking an activist stance or an activist perspective on things I'm wondering from from your guys perspective, is this ability to ask?"
"Unknown","00;32;20;00","00;32;52;23","And then what happens? Is it how is it fundamentally different on either side of that that that different fundamentally different so you're asking the ability to ask and then what happens? So the ability to ask a counterfactual. Yeah. How is it different between the statistical basis and the here I am in reality basis because I've asked this question and every time I ask it of people on either side of that of that diagram, they kind of go along."
"Unknown","00;32;52;23","00;33;28;26","I'm not really sure. Do you have any thoughts to yeah. I you know, I think that this paper kind of really tries to get at it actually, like getting at the the what's different, you know, in maybe not this an activist sense, but I yeah, I really don't have the the background. But I think, you know, a lot of times there are layers that seem like they should overlap but maybe don't have a direct correlate right."
"Unknown","00;33;29;06","00;33;52;18","And I think that that's what's happening here. And I think that that's what Alex tries to address in his paper in like a thermodynamic free energy, statistical thermodynamic kind of way. Right. There, I'll give another thought. So and then what happens in the context of Bayesian statistics? It's like a question about counterfactuals so if you're asking and then what happened differently with the data?"
"Unknown","00;33;53;05","00;34;18;10","Well, from the point of view of the hyper parameters, either the data would be better fitting or not if you ask. And then what happens to the hyper parameter? Well, it might generate a different kind of data. What would happen if the sun were in a different location? Well, the shadow would be different. So as opposed to that sort of cut and dry sense of counterfactual, either on the data or the generative side in the inactive frame perhaps."
"Unknown","00;34;18;10","00;34;40;16","And then what is more of an invitation to play? So just on a very first past, the an activist perspective gives more of a affordance for negotiating that counterfactual as play rather than just coercing it into a statistical crank. It's like, well, what happens if we jam this gear? It's like well, then the wheels are going to stop turning."
"Unknown","00;34;40;16","00;35;06;15","Next question. But in activism is a little bit more playful with that blue so I didn't see this in terms of counterfactual. I was looking at it in terms of a predictive standpoint. Right? And then what happens is in my mind, a prediction. And so making a statistical prediction versus making a prediction on the side of the organism or from like an an active standpoint to me, like, I don't know."
"Unknown","00;35;06;16","00;35;31;23","I mean, I still think like it just you predict and then either you're right or you're wrong and then you update your model accordingly. Yeah, yeah. So because I sort of come at this from, from the wayfaring in the way finding of how do I orient myself to this stuff. I wondered. I wondered. I don't even have the confidence to sort of put this out there and stand by it."
"Unknown","00;35;31;23","00;35;52;03","But I wondered if part of it is the statistical gives us a bit of an owl centric, a bit of a detached kind of back to what both of you said. And Daniel, you know, there is a personal piece and egocentric part on the inaction side that doesn't necessarily exist on the owl centric side, but that doesn't make one, one or the other more or less real."
"Unknown","00;35;52;18","00;36;29;23","But I think it's whether you can look down on something and see it in that kind of relationship because we're talking about relationship or relationships or whether you're seeing it from the egocentric, oh, that that snowball is now going to hit me duck. Right. So I don't know if that's the explanation that that Kieffer was going for here, but yeah, I think it's I think it's part of the conversation if we're going to quantify this, that's so perhaps the difference here really is and then what happens in my model and then what happens to me."
"Unknown","00;36;30;20","00;36;52;13","Right. Very nice. Very nice. It has to do with an agency and there's an eye in that inactive side. There's what happens to me and what happens to my model or how would I see it differently versus given this chessboard, how would it just play out, which is a little bit more like the impersonal Bayesian. So pretty cool."
"Unknown","00;36;52;13","00;37;15;16","And the reason why we showed this slide was first off to highlight that even when we're talking about the hard, the soft is there and maybe even vice versa. And also because this approximating distribution that the free energy is being discussed in the context of is the recognition model. So that's why we're showing this mapping OK, what is variational inference?"
"Unknown","00;37;16;04","00;37;46;03","Well, it's something that I'm sure we all had to do a little bit of a dig to find out about and early in my thinking last week, I came across a really helpful PDF and I started with this quote from what Alex wrote and then just started searching. And the quote that Alex wrote was that variational methods formalize statistical inference and learning in terms of the maximization of a lower bound on model evidence called the negative variational three energy."
"Unknown","00;37;46;18","00;38;10;09","He describes them as state of the art approaches and also notes that the variation in methods have a long history in unsupervised learning. So cool. It sounds state of the art, but there's a long history, and maybe it's a tractable way to get at some hard problems or what is it? And this PDF started pretty early on, said, If you haven't seen Jensen's inequality, spend 15 minutes to learn about it."
"Unknown","00;38;10;16","00;38;33;15","But again, this person has thought about how to teach variational inference. Maybe it's worthwhile thinking about Jensen's inequality, and one way of phrasing Jensen's inequality is a generalization of the statement that the secant line of a convex function so kind of like a chord on a circle, like a cut through a circle lies above the graph of the function."
"Unknown","00;38;35;03","00;38;58;02","So it sounds like it might be a little bit obvious graphically. And indeed there is a proof without words. So that's just flipping to this next slide. So yes, it's kind of like if there's a ball, any slice that you take through the ball, it's going to be able to have something of roll underneath the slice. That's really important."
"Unknown","00;38;59;06","00;39;24;06","And pulling a few quotes back from the variational inference by play PDF, what is written is that we can't minimize the scale divergence. Exactly. Now, maybe we'll talk more about L later, but we can't minimize the divergence between the data we're getting in. In the generative model, we want to minimize our divergence, so just we'll think about it at that level."
"Unknown","00;39;24;06","00;39;45;29","For now, it's hard to minimize that directly, but we can minimize a function that is equal to it up to a constant. This is the evidence lower bound or the elbow. So it's almost like I can't tell you where the bottom of that ball is. But if I can take a cut through the ball, then I know that it has to be lower than that."
"Unknown","00;39;46;13","00;40;07;11","But if I cut as low as I can to the bottom of the ball, maybe I'm going to be just infinitesimally cutting above the bottom. So if I have a really easy way to figure out how that cut gets minimized, then maybe we'll do all right. Maybe we don't need to find out the true single bottom, because we'll just make cuts that are lower and lower and we'll go from there."
"Unknown","00;40;08;15","00;40;36;22","And it turns out that Jensen's inequality really comes into play. And also part of the trick is that there's a choice of the investigator for which functions to use. And it turns out that some functions, it's easy to calculate them one way, but really hard to go the other way. And there's times where you want that, like when you're doing cryptography, but there's other times where you want functions that are very, very easy to go back and forth."
"Unknown","00;40;36;25","00;41;16;18","Like as easy to go from from the input to the output. It maps uniquely and quickly back. And so it turns out this loop thinking kind of primes the pump. But it turns out if you choose mathematical functions where it's really easy to go from input to output and back and you combine it with this idea that you can take a slice through a curve and find it attractive, a way to estimate basically the lower bound on the evidence, it's going to be possible to set up some optimization problems so that we can solve them straightforwardly."
"Unknown","00;41;17;14","00;41;50;25","And so in other words, highlighted here, minimizing the CL divergence is the same as maximizing the elbow. So maximizing the evidence lower bound means like we're pushing up the bottom bar. So we're getting more and more evidence. We're getting better optimization as we minimize the divergence between the data that we're getting and our generative model. But we picked a generative model that we can play really flexibly with and it also will continue on just that."
"Unknown","00;41;51;01","00;42;24;12","It goes back to solving the problem once you know the answer, solving the process of solving the problem, once you know the answer becomes like very constrained and simple, nice. And I just described this is then if then, which is exactly the same thing, then you have you have something that you already are aware of the F the unknown space below that line, and then you resurface to a new place and below that line on that next slide is what I would describe as learning's unholy triad, the triangle under there."
"Unknown","00;42;24;12","00;42;50;19","But I'll let you talk about that though. It's, it's really interesting because outside of the chord, you know, outside of that line, you have no guarantees. And in fact, often you increase the precision of your guarantee within the frame at the cost of losing the generality beyond it doesn't make any generalizations. So the metaphor that I don't know somebody with more math, please."
"Unknown","00;42;50;27","00;43;25;05","Correct. Or help us make this richer, but it's kind of like variational inferences doing inference on rails so the train operator can have a really complicated generative model of the world, like what time should I be home for dinner and what's my favorite color? Wild sensory input. So you can have a really rich system, but the oh, the operator can tell from the local speed of the train that the train is going in the right direction and maybe even how fast it's going in the right direction, given the structure of the problem, go to the desired location."
"Unknown","00;43;25;20","00;43;43;00","Now, there's other times where you don't want to go as fast as possible, but just taking it out of first pass, going from A to B, we want to structure the problem so that we're on rails. We know that all we have to do, no matter how much data we have in our generative model, we want to have like a forward and brake."
"Unknown","00;43;43;15","00;44;10;00","And so variational inference helps us structure the problem. So it's more like being a train on a track with a destination in mind, which is this minimization of the divergence which we will get to as opposed to sort of this like Hill characterizing and just mapping all the hills. That's like a map maker, but the train conductor is not mapmaking they have exactly their tools at hand and then they're just going as fast as they can in the right direction."
"Unknown","00;44;11;13","00;44;50;28","And this was just a tactical slide from the paper. Any remarks on this blue? Otherwise, I think we could. Yeah. OK, so this is for those who want to see the technical details read the paper, but this is equation 2.1, and it relates some of these terms that we're talking about, but we're just exploring today this was another useful blog post, and it plays into the fact that the K.L. divergence is asymmetric so the divergence between Q and P is not necessarily the same as P to Q."
"Unknown","00;44;51;20","00;45;36;15","And so it's almost like there's two different ways that we might optimize. It's kind of like finding a local minimum local maxima versus a more global maxima, but Q is a constrained type of distribution. So for example, here we might be picking Q to be a Gaussian. So we know that Q is going to be a bell curve, and we're only going to be trying to maximize one thing about Q, which is its mean and its variance as well in the easy case, what the author of this blog post writes as easy is just like find me the highest points in P, and then place Q right on top of the highest point in P."
"Unknown","00;45;37;04","00;46;02;05","So that gets you to a local max or it finds a local the global maxima, and it just lays down your average there. But it turns out that there's a hard direction as well, which is actually given the total distribution of P, I want the best overall fitting Q And the author writes, Well, why is this hard to compute?"
"Unknown","00;46;03;01","00;46;51;11","Well, for most interesting models, we can't compute a complex model, for example, the real world or really complicated graphs or very complicated Bayesian posteriors, because remember, a lot of this variational inference rested on the fact that we were choosing distributions that were easily reversible however, when we're optimizing functions where there isn't a really easy reversible way, it's harder to do inference and they also write down here on the bottom, the optimization problem is convex, so curved a hashtag Jensen's inequality when Q is an exponential family, i.e. for any P looking at this bottom graph, the optimization problem is easy."
"Unknown","00;46;51;26","00;47;21;09","So in other words, if we pick Q to be the right kind of distribution, then it'll be smooth sailing no matter what P looks like. But if we want you to be the same type of distribution as P and we don't know what kind of distribution P is, we're kind of setting up the problem to fail. However, if we say, Hey, whatever kind of problem P is, whatever is generating P, we're going to make Q part of the exponential family."
"Unknown","00;47;21;25","00;48;01;18","Then it becomes easy. And so you can think of maximum likelihood estimation as a method which minimizes the scale divergence based upon sampling P, but in this case, P is the true data distribution rather than a model of the generating function. Then yeah, it's it was interesting because when I first looked at that, I wondered, is this is this a good way of quantifying the difference between the guy in the train who's looking at the world through Deontological eyes and the another train conductor who's looking at it through utilitarian eyes because that that actually exists in those, those graphs."
"Unknown","00;48;02;05","00;48;28;04","It's kind of interesting I'm thinking of who, who those different kinds of people would be or what they might be in. OK, yeah. Which one? If I'm going to run over somebody on the tracks, do I run over if I do, I run over five people who I don't know where do I run over one person who I do versus I can't do anything that I wouldn't have something be done the equivalent to me."
"Unknown","00;48;28;04","00;48;57;27","But anyway, I just think it was interesting that the qual, the philosophical qualification ended up being visible in the representation of those of those graphs. There cool. And here is how Alex framed it, which is that if the free energy is useful as an optimization target, so just a little reminder, why are we going into all these details about statistics and about the scale divergence in the variational inference?"
"Unknown","00;48;58;06","00;49;20;23","Well, because we're talking about variational free energy and doing optimization on variation on free energy. So that's why we had to pull back to asking what variational means. And then when we think about where the energy comes in, it will return. So Alex writes again that F is useful as an optimization target for several reasons. That have been widely discussed."
"Unknown","00;49;21;18","00;50;01;01","And maybe those reasons are obvious to some or some people think that it's not enough of a good reason for F to be used, but there are reasons to choose F as a function that you want to minimize to point to gets at that. And it even uses the Q in the P. So if we look at 2.2 relative to 2.1 and 2.1, see how P is on top and then Q's on bottom and then here cuz on top and P is on bottom and there's this plus F if you want to unpack the equations, please do so and help teach to us."
"Unknown","00;50;01;10","00;50;32;28","But just note that things are flipping and it's being mirrored by what we saw here where on the top one, the easy one cuz on top right and then on the hard one cuz in the bottom. So also using that p v notation and then what does that mean? So let's just say that free energy is the thing that we're going to be optimizing on and variational free energy has a certain structure that's related to variational inference."
"Unknown","00;50;33;04","00;50;57;05","That means that maybe if we're trying to minimize variation of free energy, that's going to be like the right optimization path. OK, so we're going to be doing variation of free energy minimization to do model fitting. Where does real energy come into play? Where does thermodynamics come into play? And it's right here, as is often remarked in discussions of variational inference."
"Unknown","00;50;57;15","00;51;26;00","So in the statistics literature F free energy has almost precisely the form of a negative Helmholtz free energy from statistical mechanics. In fact, that's why we call it free energy, because it hasn't released similar form. And that free energy term or the energy term, I just call it F of T it's it has two parts to it. The first term on the right is the expectation."
"Unknown","00;51;26;00","00;51;52;05","So that's E is for expectation. Here of the energy stored in the system at a given temperature due to internal states. So really complicated molecules with a lot of order like DNA. They have a lot of internal energy locked up in their structure. And then the, the right term s is the temperature times the entropy. So that's what the term looks like for thermodynamics."
"Unknown","00;51;52;16","00;52;15;17","And that's how you can look at whether an equation is going to be like endothermic or exothermic. Like if it creates a long disorder in the environment, it can locally order some stuff. But, you know, you can't make or lose energy. And so to get to this more chemical freezing of F from variational inference, Alex writes, We rewrite equation to one using an energy term."
"Unknown","00;52;16;23","00;52;46;18","And so we get this two equation 23, which is analogous to this more statistical physics equation where we have basically V consists of the energy of the internal configuration minus the temperature times the entropy. So part of the question is going to be, OK, cool, it looks similar. Might those things be isomorphic? Might they be the same? That's the thesis."
"Unknown","00;52;47;04","00;53;19;22","That's the question. Is it actually that way or is it just that we can think of it similarly? And so this is where we got 26 bringing back the train choo choo. Could we take well-structured optimization problems and connect them by resonance in the structure of the equations to the ways that downhill trains navigate or burning candles? Or if you put a ball into a ball, it goes to the bottom every time and it only goes to the bottom."
