"Speaker Name","Start Time","End Time","Transcript"
"Unknown","00;00;06;28","00;00;41;04","Hello and welcome everyone to Acton Flat. This is Acton Slab live stream number Palindromic 22.0. It's May 13th, 2021. And this should be a really fun discussion just to introduce ourselves at the beginning. I'm Daniel. I'm a post-doctoral researcher in California, and I am joined by Dean Heller. Oh, I'm Dean. I'm from Calgary. I'm retired, and I'm kind of new to this active inference thing, but I'm try to keep up."
"Unknown","00;00;43;00","00;01;07;22","I'm Blue Knight. I'm an independent research consultant based out of New Mexico. Nice. So thanks to both of you so much for helping a lot on the slides and giving insights. And we're all going to be sort of working through this together because there's a lot of big ideas that are going to come up in this discussion. And then we're going to have the next two weeks with Alex Kieffer, the author and other participants on the DART, one and two streams."
"Unknown","00;01;08;02","00;01;29;20","So we're just going to be surfacing probably more questions than answers today. Welcome to Active Lab. We are a participatory online lab that is communicating, learning and practicing applied active inference. You can find more information at these links. This is a recorded in an archived live stream. So please provide us with feedback so that we can improve on our work."
"Unknown","00;01;30;10","00;02;00;15","All backgrounds and perspectives are welcome here and we'll be following good livestream etiquette. We're preparing and setting the context for the discussions on May 18th and May 25th 2021, where we'll be discussing the paper psychophysical identity and free energy which is a paper in 2020 by Alex Kieffer. And just like the other dot zeros, this is a context and a background and just an initial stab it's not a review paper, it's not authoritative."
"Unknown","00;02;00;21","00;02;24;23","This is us unpacking and exploring as we read the paper in preparation for the group discussions and similar to some of the other zeros we're going to start out with in the author's own words, what are the aims and claims as well as abstract and roadmap and then we're going to ask some big questions. We're going to talk about why it matters, which is hopefully a discussion that includes everyone."
"Unknown","00;02;25;03","00;02;48;03","And then we're going to meander through some quotes from the paper, some formalisms, some related reading, just a few ideas that we actually brought in during our learning process. To help connect the dots because the paper is really like the tip of an iceberg, and there's a long history of information and thermodynamics, and that's even before you get to everything with the free energy principle."
"Unknown","00;02;48;24","00;03;29;01","So we hope that this will be a educational experience, whether you're familiar with active inference and just learning about thermo or vice versa. Or not familiar with either. Any overarching thoughts that either of you would like to bring up before we jump in nope. All right. So I'll read the first aim of the paper, then either of you would welcome to give a thought the target thesis of the paper is the claim that biological systems whose internal states come to encode statistical models as a result of spontaneous self-organization in response to environmental pressures, learn and make use of these models by minimizing their physical free energies."
"Unknown","00;03;29;19","00;04;06;01","The identity thesis, which is that yellow highlighted section, does not specify precisely which approach to variational inference is thereby implemented or the minimum value the variation of free energy must take. It may be there may be for example, that biological systems run an algorithm closer to contrastive divergence than simulated annealing so a lot of terms, maybe first time hearing it or not, but what's something that draws either of you or made you curious to read about the paper well, for me it was it was contrasting the contrast to piece."
"Unknown","00;04;06;01","00;04;43;27","It was the idea that in order for this any at any kind of a modeling effort to work, you can't start out by knowing you have to kind of have a bit of a fuzzy idea before there's anything that's edgy cool. And the blue. Yeah. So the second piece of the aims and claims here and very timely. What is exciting about an identity thesis in 2020 and we also hope in 2021 and probably beyond is not so much its opposition to Cartesian dualism because many people are that way today."
"Unknown","00;04;43;27","00;05;07;02","But what does make it exciting. Well one the fact the connection between mind and body is drawn at a level of physics undercutting even neuroscience as a reduction base. So strength for some weakness for others probably too that the reasons for which and the precise way in which identity is realized can be discerned at least in broad strokes on the basis of current science."
"Unknown","00;05;07;25","00;05;37;18","And three that the theory is accordingly expressed in quantitative terms. So this is not your run of the mill anti Cartesian dualism, this is that 2020 flavor and it has more science now so this for me was really awesome. I mean, I'm always looking for the expansion of the mind brain duality to incorporate the body because I think that it's been overlooked for quite a long time."
"Unknown","00;05;37;18","00;06;10;20","And it's nice to see that incorporation in this thesis cool will definitely be able to return to that. All right, so let's turn to the abstract. It's three sentences long when either of you like to read it again. Yep, yep. An approach to implement a variation of Bayesian inference in biological systems is considered under which the thermodynamic free energy of a system directly encodes its variation of free energy."
"Unknown","00;06;12;13","00;06;46;29","In the case of the brain, this assumption like that places constraints on the neuronal encoding of generative and recognition densities, in particular requiring a stochastic population code. And some people may know what that means, but I'm sure we'll pass that in a minute. And the resulting relationship between thermodynamic and variation of free energies is prefigured in my brain identity pieces in philosophy and in the Gestapo ethicists of Psychophysical Isomorphism."
"Unknown","00;06;47;04","00;07;17;24","And I didn't know anything about Kickstart before I read this paper yet. This paper, it's like relating the relations because the little kernel down there at the root is mind brain identity thesis, and we'll return to this. But that's the relationship between mind and brain, between the physical and the mental. And then how is that as a kernel, the mind brain identity thesis related to on one hand, qualitative areas like the Gestalt theorizing, which we'll talk about."
"Unknown","00;07;18;04","00;07;47;01","And then on the other hand, more quantitative areas like the Formalisms related to information dynamics and thermodynamics, let's go to the road map. So the road map, it's nice because first off, there's only a few stops on the roadmap, but there's a lot of freeway between each stop on the right are the sections that were in the paper, and on the left is how Alex wrote out in a narrative way."
"Unknown","00;07;47;11","00;08;09;04","The road map. So we kind of have the turn by turn on the right side, and then we have a little bit of the experts giving you a guidebook on the left and it starts with an introduction and goes straight to formal equivalencies between what? Well, between free energy and a lot of other things. A transparent code, a little bit of an oxymoron there."
"Unknown","00;08;09;04","00;08;42;08","I thought codes were supposed to be oblique, but what is a transparent code? And eventually, how does it lead to this free energy identity thesis being proposed in 3.2 and then discussed more in Section four? Then there's a conclusion so it's a pretty dense paper. And what did anyone think about just the road map or just getting from A to Z can I speak to that for a second, please?"
"Unknown","00;08;42;24","00;09;27;08","Yeah. So the first reading of this when I saw Transparent Code, I wondered about that as well a lot because I didn't even see it as oxymoronic. I just wanted to know how that was going to get unpacked and the other thing I found really interesting on first reading and both of those sections three and four changed by the time I'd read through the paper a third time but then the whole idea of Isomorphism to identity, I came around to the idea that I think I think he was talking a little bit about the ability to be an identifier as one of those measures of the sort of quantitative measure of what an identity could"
"Unknown","00;09;27;08","00;09;51;19","look like. He doesn't really get it. He still throws possible in there quite often in the paper, which I think is really a good thing to do because he doesn't try to doesn't try to bring it down to absolutes, which I think is is smart, given, as you said, the density of the the stuff he's trying to look at Cool Blue, anything."
"Unknown","00;09;51;19","00;10;21;22","Otherwise we'll go to the big questions. So other than it was a really pretty rocky road to get from A to Z and it you know, I just kind of had no idea really where this was going. So it was nice to see it evolve as it unfolded. I just always keep in mind the paper's finite. I will get to the end if I just crunch line by line and somebody who knows way more than me on this topic thought way more than me on the paper."
"Unknown","00;10;21;22","00;11;00;24","So let's just trust the author, not in every single claim, but at least in the structure, and go from there well, why does it matter? Why are we spending our regime of attention reading this paper clearly multiple times each and digesting it and turning it around and having discussions on a chat forum? What is bringing us to the table from very different backgrounds and hopefully you as well to think about and be curious about this paper, the three things we wrote down here, and then either of you feel free to unpack one or any what does matter well, continuing existence depends on efficient energy use."
"Unknown","00;11;01;15","00;11;26;03","It's important to understand what life is as well as how we model it. And it's interesting to think about information, identity and physics. What brought any of you to the table? Well, so just to comment on the distinction between life and how we model it, I mean, I think that this is very relevant to the discussions that we've been having on realism and instrumental ism."
"Unknown","00;11;26;03","00;11;54;19","And really a fundamental way to clarify that distinction, I think, which was nice cool. And the big questions of the paper, which are sort of a little bit drawing from quotes from Alex, other times us linking the questions together one is how might models of psychology action and perception such as gestalt, but basically just psychological theories that might have no math involved at the first pass."
"Unknown","00;11;55;00","00;12;24;26","How could those math free ideas be connected to formal equations, potentially those related to certain kinds of statistical inference? So how are we going to connect psychology to equations? Big question two After realizing some of these resonances between certain types of statistical inference and information and thermodynamics, as well as potentially mind in the brain, is there any way to bring that all together?"
"Unknown","00;12;25;02","00;12;44;13","You know, we have apples and oranges, but maybe we can make a still life that has apples and oranges and they're each in their own place and it kind of makes sense. And then the third point here is the biggest question perhaps, which is where does identity come from or what is identity? How would we measure that or characterize it or determine it?"
"Unknown","00;12;45;08","00;13;14;04","And I think one hints perhaps from Dean was to start with identity formation. What what it is not. So then there was a quote there about comparing with neural networks and computers Any other thoughts here before we jump into keywords? So this quote, like the the difference between living systems and computers I think like it would have been nice to see that upfront."
"Unknown","00;13;14;25","00;13;38;23","I kind of had no idea where the paper was going and like that it was going to come to this like really solid kernel of meaning. Right. And so it would have been nice to have some hint of that, like foreshadowing, maybe like an introduction or the abstracts but I was like had no idea where this was going and actually pleasantly surprised, like wrapping a gift wrapped in, you know, ten different boxes at the end."
"Unknown","00;13;39;11","00;13;58;14","It went better than expected, you know, in active inference, what could we want other than that? But it does say that it provides a criterion for distinguishing minds from relatively crude simulations like Blues Alive and was just speaking. But if it was just the voice being played from a speaker, is that going to be counted as alive because it's making noise as well?"
"Unknown","00;13;58;27","00;14;21;11","Well, if not, we want something richer than just making noise. What is that going to be? How are we going to get there? We're going to start with some of the keywords. And just like there was only three sentences in the abstract and in the final paragraph there was only three given keywords. And so rather than do a keyword driven intro and then walk through the paper, we're going to kind of do a little bit of both."
"Unknown","00;14;21;11","00;14;49;01","We're going to give some background information and some frame setting on the paper, and then we're going to walk through the paper and where we need to introduce a formalism. We'll just kind of unpack it there and share resources. OK, so earlier we were talking about how it's kind of relating different relationships and this slide a little bit abstractly, a little bit provocatively, a little bit ambiguously is relating those relationships."
"Unknown","00;14;49;15","00;15;19;00","So let's talk yeah. Yeah, OK, this is the twist. And I think when I saw it, I mean, I didn't anticipate ads, which is which is cool to have. But but the fact that there's there's a twist in it, I actually think is is what we're talking about. It's I think I think that will I think that will again surface as we go deeper into today's conversation."
"Unknown","00;15;19;00","00;15;45;27","But actually I was like, whoa, very cool. Cool. So what we were trying to get at here is to link the topics and then see how those topics linkages are linked. So the mind and the brain are these two nodes on top. And the question is how are the mind and the brain related and you can check out the mind brain identity thesis to learn more about what a few previous perspectives have been."
"Unknown","00;15;46;02","00;16;05;22","But one can imagine there's all kinds of takes. They're the same thing. They're totally different. They're a little bit related. So that's how the mind and the brain are linked. And then on the bottom, we have these two nodes. One of them is actual thermo physics. So candles actually burning, balls actually rolling to the bottom of a hill."
"Unknown","00;16;06;05","00;16;31;13","And then on the right side, we have human models resembling patterns that we see in thermal physics. And the question of the linkage here is how are just like how are the mind in the brain related? How are actual thermodynamics? So instead of skin in the game, ATP in the game, actual thermo related to maybe some equations in other domains, that make us think about information dynamics."
"Unknown","00;16;31;29","00;17;21;16","So those are the level one linkages first between mind and brain and second between actual thermo and models that are akin to thermo. And then this next slide is a little bit of a multi play, but it's saying maybe by juxtaposing these relationships also with a nod to gestalt and illusions with the arrow illusion may be by us as the observer juxtaposing these relationships, we gain new insight and maybe FFP, which is sort of the little ants crawling all around the sides maybe the FFP is that permeable membrane, or it's the framework that's strong enough for us to build within and sub specify but it's also permeable in that it allows us to be open"
"Unknown","00;17;21;16","00;17;54;01","to new ideas coming in. And the psychophysical identity thesis is kind of smack dab in the middle. It's relating these relationships. So if there were four things that get brought together, I think it would be these four mind and brain. And then actual thermo and models of thermo. And the way to link them is to first make the pairs and connect the pairs and then see how those linkages are contrasting or similar Danny, would you say that part of this too, though, is the fact that they are parallel and apart?"
"Unknown","00;17;54;01","00;18;22;24","I mean, we build the relationship we've already sort of confirmed that. But is it is it is it a connection? And I'm not I'm not saying that in a questioning way. It's just I think it's a legitimate question. I'm not sure that the way that we quantify that confirms it or not that maybe I'm grasping at something that isn't there I agree that that that this relationship exists, but I'm not sure if it's a connection."
"Unknown","00;18;22;24","00;18;53;17","But that's just me wondering perhaps it's reflective of the instrumental ism versus realism debate. Right? So thermal physics is a model and the human system is like an alive system, but, you know, some kind of concrete existential purpose, right? So we assume. Yeah, it's almost like real on the left side and then more like an instrument on the right side because the brain does have thermodynamic constraints."
"Unknown","00;18;53;25","00;19;23;12","It generates heat. It takes in glucose, it's doing metabolism. If you cool it down, it stops. So that's like a candle. And then what is the mind, especially if the mind is kind of higher order and reflexively making a model of itself in an interesting way. But if the brain like a physical energy consuming object is like a candle, that's the left side, people might draw a link between those two, draw an edge between the brain and actual thermo."
"Unknown","00;19;23;12","00;19;46;06","And we're going to get to that in just a few slides. And then the question is, well, what's the relationship then between these thermo inspired models on the bottom right and the mind? Is it that the brain is actually minimizing free energy, or is it that we can model it as minimizing free energy? What is happening here? Let's go to the psychophysical isomorphism."
"Unknown","00;19;46;09","00;20;21;07","I'll play this video and blue, what made you interested in this video? So I saw the term psychophysical isomorphism in the abstract and I was like, what is that? It's the gestalt hypothesis of psychophysical isomorphism. And I was like, those were really big words. I just don't have the background. So I wanted to look up the concept and it's it comes from the expression that the properties of the mind in the consciousness are a direct consequence of the electrochemical interactions within the physical brain."
"Unknown","00;20;21;17","00;20;52;18","And so this, this is the, the five phenomena in the video. Did it work? It's something on my, on my end. So this five phenomenon is an example of where the patterning of a stimulus and the activity in the brain is similar. And that's why it makes this like illusion of motion cool. So it's almost like we're connecting the dots, but here it's shown with negative space, and that's a entry point into thinking about Gestalt more broadly, or is there anything else you want to add on this slide?"
"Unknown","00;20;53;02","00;21;27;03","OK, that's a what is just art? Well, people live their life teaching it, so we're not going to cover it in one slide, but we can cover some of the ways in which it was used in the paper, as well as just a few little tidbits which kind of on our active inference Foragers path were cool. So first, just as a design principle on the slide, you visually and it's a culturally scaffolded process, separate, for example, if you're not colorblind, the red shape out from the block text."
"Unknown","00;21;27;13","00;21;51;06","And so it's almost like there's this organization that arises when we're viewing material and that turns out to be patterns that we can study like Reification on the left side here we do see, quote, a triangle like a white triangle in a even though it's the negative space of these other Pac-Man type shapes, and so gestalt is this big area of theory."
"Unknown","00;21;51;20","00;22;20;26","So check out the word itself, terms like figure and ground and all these related fields and what are we getting at that's bigger than all of these examples? What does reification of shapes and both eye stability like illusions have to do with this notion of invariance? Like the idea that by looking at different angles of a shape, we can recognize that an object is variance, even though computers often have trouble with that."
"Unknown","00;22;21;13","00;23;02;14","So it's almost like if you're working towards grasping it or you're seeing that there's something bigger behind these examples, that's kind of just what it's hinting at the whole. And so it's very related to holism and relational thinking, but we can dig one more level into gestalt and just look at how Alex used it. And in the paper it says this work, the paper that we're reading and other work by Carl First and then collaborators confirms a systematic link between variation, free energy even if it's your first time hearing it, it's all good variation or free energy and thermodynamic potential energy."
"Unknown","00;23;03;05","00;23;29;20","Interestingly, this view is preceded not only by the identity theorist in philosophy, but also quite precisely by the Gestalt psychologists who suppose that the perceptual phenomena as subjective the experienced had structures isomorphic same shape to their underlying physiological correlates. And does that mean when you're looking at a triangle, that there is another triangle that's the same exact thing in your head?"
"Unknown","00;23;29;26","00;23;57;09","Well, not the same exact thing, but maybe something that's structurally isomorphic or the same shape and so to unpack that and to also evaluate the author's claim, is it really true that this area of science that we think is super awesome and advanced in 20, 21, was it really true that was pre staged so we can go to these situations like this 1935 citation and just copying out the contents and doing a little color coding."
"Unknown","00;23;57;23","00;24;23;04","Look at the titles of the sections. Chapter two has to do with behavior and sense of the problem. But chapter three through seven it's about the environmental field, the field of affordances. This is what we've been talking about with a lot of our different discussions and then action memory learning and at the end a little bit of a closing note on even society and personality and probably what it means to be a person and an individual."
"Unknown","00;24;23;17","00;24;55;21","So we are seeing a lot of these terms which should really bring us to slow down and think about how we can tie different knowledge, traditions and perspectives together in the way that Alex has done and hopefully in a way that we can also do when we come together to discuss any thoughts on Gestalt OK, now we're going to switch gears from the ecological field and psychology to thinking a little bit more quantitatively about statistical inference and metabolism."
"Unknown","00;24;57;01","00;25;28;15","Alix wrote that the argument at hand is meant to support a slightly less abstract isomorphism or identity directly between variational and thermodynamic free energy descriptions. This argument is consistent with a detailed treatment of metabolic efficiency, a variational inference given in 45, which is a sengupta at all paper with Carl Feresten in 2013. So for those who are interested in active inference, check out where active inference was in 2013 and think about how what has happened since then changes our understanding."
"Unknown","00;25;29;07","00;25;51;02","But just to pull one figure from this paper, which is thinking about energy use, in nervous systems, it's showing how the sensory environments, whatever's out there, is going to get encoded. This is where that transparent code is going to come into play. Into a format that allows control, gain control of the sensory input as well as action control."
"Unknown","00;25;51;21","00;26;11;12","And it has to be done in a way that's thermodynamically viable. So you'll often hear things like the brain processes this much information or it uses that much energy as if it were just like some sort of desktop computer. But it's pretty clear from just a first pass understanding that it's not just doing what my video card is doing."
