"Speaker Name","Start Time","End Time","Transcript""Unknown","01;32;17;13","01;32;44;16","There's no dialectic within a domain the claims are listed, but it goes immediately to the relationship. So it's like minimum to domains. OK, now it makes me think about the structure of scientific communication. So in the results section of the paper, what so the introduction might have a lot of general and empirical claims selection acts on ants and look at their mandibles."
"Unknown","01;32;44;26","01;33;06;06","And we know this about new construction and look at how they do it. So that is like a very introductory piece. There's not often formalisms in the introduction of the paper. So that sort of Blue Arrow General and empirical is very introductory in its scope. Then the results section of the paper is like Blue mentioned, it's about like empirical and math."
"Unknown","01;33;06;19","01;33;32;14","We saw it do it 11 times, and here's the P value. And then we did this and we calculated the model and so it's like it shouldn't generalize in some senses. And then in the discussion, there's probably all edges in play, but especially math to general, because it's now been generalized beyond the mere empirical, because we saw a P value in the difference between the estimates of this type and that type."
"Unknown","01;33;32;26","01;34;18;26","It does say something about evolution or because there's something happening at an evolutionary time scale, it's consistent or inconsistent with our mathematical summary statistics. Yes, that came from empirical, but that edge is more in play and that in simple, simple terms, that's how and when we fit out the rule and that almost it does return us to the third P, but I think it's so we'll kind of close this section on the two point of four or whatever it was with the links among the dialectical categories, active inference as a transgressive Flynn."
"Unknown","01;34;20;16","01;34;46;03","All of these are often in play, and it's almost like if the paper would have just been lists of empirical observations, there'd be nothing contentious because it wouldn't make any general claims that would just be called a data set. If it were just general claims it would be just philosophy. And that's not to say philosophy is easier or simpler."
"Unknown","01;34;46;03","01;35;19;18","It's like it doesn't trigger anyone's domain crossing alarm, but like mathematical biology that does raise people's alarms or generalized for math. You're saying that because of the free energy minimizing that there's a general imperative for information foraging or relationship between the general and the empirical of course, always fraught in empirical science. OK, you measured in that laboratory study with those undergrads and that stimuli, and you're going to say something about aggression."
"Unknown","01;35;21;01","01;35;59;20","So it's just very interesting because active inference does lay claim or at least they play to all these areas that it raises alarms on all sides. But how do we take that alarm, pheromones and attention and then just align it with something that's going to be a public good rather than just let it fizzle? Stephen That's very helpful."
"Unknown","01;35;59;20","01;36;43;17","And the nature of action and the idea that biology, soon as that comes in, I don't know if you can avoid being in in the general and maybe active vision that's just doing a thousand dimensional interpretation of a data set. You know, can stick with empirical math. You know, it's either recognizing a photo, it's not recognizing the photo, doing some deep the computational processes, but action and particularly then action policy and then take the other G and would you say that would you say this just general claims or is where where would Teleology fits in here?"
"Unknown","01;36;54;03","01;37;28;14","Teleology is never directly measured. Is that fair to say? So it can it can always it can be it can be in green, but it cannot be blue. One can say, I observed sorry blue, but I chose the colors for reason to one could observe the animal trying to swim to the surface. And you can say, well, the teleology is obviously not to drown or something like that, but that's actually structured as because I empirically observed the swimming behavior, I am going to make a claim about the teleology."
"Unknown","01;37;29;06","01;38;11;04","So I would say Teleology is in a general case, even another spin on this one would be empirical is like X. This is the data that we're actually observing. General is unobserved you can't observe things that are general. You're only observing what Blake calls the mind particular W Yeah. What is math math is in the examples that we looked at, it's like the process."
"Unknown","01;38;12;06","01;38;15;22","Oh, wait. Active inference. It's a mathematical process theory."
"Unknown","01;38;17;25","01;38;50;19","So math is a process or of inference that yes. Connects to generalities. And this is not hard and fast, I hope is not being interpreted in the most rigorous way. But it does generalize because it has to be like the intermediating blanket. So let's pull this W and X back in here. All right. So here we have the empirical states here being observed."
"Unknown","01;38;50;23","01;38;57;23","That's our data. OK, then here's the things that we would like to generalize on."
"Unknown","01;39;00;10","01;39;33;28","And then this gets to Dean's question about how do you go from this to equations and here's math as our sort of blanket in the middle that's when we actually do, whether it's variational, uh, base or whether it's exact or whether there's some other mathematical approach, it's how we're going to go from these generalized or hypothesized things that we didn't observe how are we going to connect that domain?"
"Unknown","01;39;34;22","01;40;07;04","And so it's almost like a little boomerang. So there's probably a lot more to explore here to Dean. I just like, I like how this has come together because math, as we said before, well, as I mentioned before, I think when the authors in the author's mind, the motivation moving forward on the paper was math could be a vehicle and it can move the process along because it is a process or it can be an impediment the other thing that's really interesting here is that because it's in the middle, isn't math got a lot of rules in it?"
"Unknown","01;40;07;06","01;40;48;06","I mean, man, right. So again, I don't think I don't think we're contradicting ourselves. I just think we're asking. So again, what do we allow to pass through the sieve and what do we hold back and then what assumptions do we make about the sophistication? What what's the minimum amount of sophistication around the math process that one must have talked to Karl first and said, you must have a you must have a good, grounded sense of what the math is if you're going to go forward like you didn't coach his words, you said, if you want this to become a vehicle and not an impediment, you're going to have to get familiar with the math."
"Unknown","01;40;49;08","01;41;13;22","So and sometimes, oh, the math is not the territory, you know, important contribution in means for sure. If the debate were about whether territories were maps, it would be the silver bullet to simply claim that the math is not the territory, but it's right. And we want the map so that we can take action and be on our road trip or whatever."
"Unknown","01;41;14;08","01;41;52;02","So it's the math is not the territory while it's the conclusion or the second part of the rhetoric for some, especially philosophers who might be interested in what is really out there because the math is not the territory, comma, then what that's like the dot two of active, which is instead of just debating. Well, yeah, well, because of homeostasis, what can you really say about Teleology and because of our status, does that contribute to a new understanding of new construction?"
"Unknown","01;41;52;12","01;41;53;27","They're all important questions."
"Unknown","01;41;56;07","01;42;25;03","But then where do we go when we put the math is not the territory as our antecedent rather than in our conclusion rhetorically. Stephen Yeah. And like when you put here, so first the math. I totally agree. I was thinking that vehicle was thinking it also takes in different. So for instance say I have $1,000,000, it gets picked up, is counted, is picked up in a car, taken somewhere and then it's counts as $1,000,000."
"Unknown","01;42;25;18","01;42;45;24","The bit in between. It's not math, it's just stuff. Right. But in this process theory, it's in a way in the what is the math is a nice evening and it could be an end topic process and it could be math thing. These may be some sort of virtual numbers way or noise way, but the math is the vehicle for the data."
"Unknown","01;42;46;21","01;43;08;10","Right. There is no data. There is no banknote. Right. There is only a process which enables the general to the empirical. And the empirical in this context is it is a model is empirical in a way. What we're saying is we're going to take most of the models that we see. There's a very simple general idea about behavior."
"Unknown","01;43;08;20","01;43;38;08","So Ryan Smith's idea about how the heart behaves, how the gut behaves, something about how access consciousness or access awareness is achieved, some general thing. And then we basically do what we might call the modeled empirical, but you could flip it around the other way and you could have, OK, well, the real world we could have high dimensional empirical upside there."
"Unknown","01;43;39;04","01;44;03;25","What's the general W? What's the general X? Internally, what's the general, which is what we use as our heuristics, you know, which could be kind of interesting as well. Which is may be more in the action because this is coming in on the century. Right. But I think this is quite helpful. Would you say that's true? It's that it's a model empirical."
"Unknown","01;44;03;25","01;44;46;12","What we get on the in terms of how we work with it in the in the active inference I mean, looking back on it, is there anyone who disagrees that empirical is always as modeled like it's kind of funny, like now I want to put a little red guy always intervening on this edge little blue guy, always talking about specific examples of math and generality and then, you know, the generalization is we use that, you know, in equal variance t test."
"Unknown","01;44;47;07","01;45;17;27","So he generalized to connect the empirical and the math. Then I really didn't want to go there here, but I have to like as a way too excited last week when I had a little thought bubble and said, wouldn't it be cool if my f Michael or sorry if Steven Mann and Connor Hines if we could get them in a room and instead of them talking about what they know, get them to go through this process."
"Unknown","01;45;18;11","01;45;40;28","Because that's essentially what we want to do is this we want to have that little guy pop out as opposed to the one who knows so much in a dense way about their math. There's so much in a dense way about their philosophical guide because that's when the that's when the true grasp of what the potential is. And it's not it's not about always having the right answer."
"Unknown","01;45;41;09","01;46;09;28","It's coming up with the best answer in that moment. Right. And if we could get more of those kind of situations, I think people would actually think people actually come away feeling even more confident because that's what this is about. It's about confidence developing. I think one a thought on that is like it's possible to stay purely internal to math, and that's the internal logic of proofs."
"Unknown","01;46;10;20","01;46;26;06","It's also possible to stay internal to general claims and do philosophy is it possible to stay purely within the realm of empiricism?"
"Unknown","01;46;29;03","01;47;10;01","In the trivial case, yes. If you're just aggregating data sets and never interpreting them, yes. But empirical in application must either connect to a general question like, you know, we observed the ants and now we're going to talk about evolution. So it's still qualitative but it's it's an edge. And then it rests on math when it's more statistical and on generalities, when it's more conceptual well, but it's just sort of interesting that the internal logic of empiricism is basically just data integrity, but it's like pre interpretation which is perfect for it being X."
"Unknown","01;47;10;24","01;47;36;12","Yeah. Whereas there's a whole guild structure and discipline around internal mathematics and internal generalizations and philosophy. And so it's like I and I also really agree with that, having them, I thought, you're going to say, just get them in the same room and then just talk about food or music or something like that. No, but I know what you mean."
"Unknown","01;47;36;22","01;48;19;18","Have them and just like we're all learning by doing in this space and to say that this is a lifelong journey, it would just be a total understatement. It's it's broader and deeper than that. So how do we recognize the complexity of this arrangement as well? As the adjacent possible, other ways that it could have been made, other end states that we could have reached, bringing in any number of fourth points to make a tetrahedra any other number of orders of paths that we could have done to reach this point, like if we had started with these little dots and then later added the arrows and how did we start this whole thing with examples"
"Unknown","01;48;19;18","01;49;01;26","of each edge? So getting to the super like fractal multi scale level where and we didn't even add any formalisms or mathematics here, but we could have done some pseudo code or some pseudo equations to really start to link this and to lean more on our mathematical leg. And that's the whole thing that you just said about confidence, which is like this is the space that we're going to be bouncing around and you can ignore statistics and you can just have an emotional response to values and stuff like that, but you will need that as part of the journey we can't just be like the post office vehicles that don't make left turns."
"Unknown","01;49;02;09","01;49;31;23","We have to make all of our tools available at the team level and then trust that with like distributed cognition and with guides and way finders and peer facilitation that like we can make it work despite how vast this area is. So, yes, Stephen, as we go for our final commentary. Yeah, I think you made a good point there with that Green Arrow."
"Unknown","01;49;31;23","01;49;56;24","Just one last thing with the Green Arrow you put there that be more incremental in fermentable and like it becomes more implementable as she comes that direction and away from the math with a mixture of genuine and empirical and just curious. So the arrows. Yeah, the arrows. I mean, again, they're open to interpretation other ways you could have been done."
"Unknown","01;49;57;06","01;50;24;04","I was thinking what links of math and empirical are? They're both more numerical. That's the bottom edge. OK, then, then what? Then what makes math in general similar there less example like and then what is the similarity between empirical and general? So what is not just pointing? What's the arrow that doesn't point to general, but what's the arrow that points between general and empirical?"
"Unknown","01;50;24;23","01;50;53;15","And what distinguishes mathematics from general empirical it might be it's formalism, but general, is it what I'm thinking? Implementation, or maybe this does get into teleology like it shows you more at Empirical what's actually happened. So like, like always this is an example. As the accountant said to us once, it always stuck in my mind is you know, I've said this before, what is an organization doing?"
"Unknown","01;50;53;15","01;51;26;29","What's they about? He said, Don't tell me your mission. Don't tell me your vision. Show me a budget show me what you're doing or show me where you spend your time. So in a way, it's like that. What's the empirical as well as the the goes to the general to show me? Well, that's that gives an idea then of something that can be done as opposed to words or even a mathematical words can be like a mathematical formula and many ways to help tell people what you want them to think, but maybe not."
"Unknown","01;51;26;29","01;51;51;20","What is going on. So anyway, I like those three arrow things very useful. Any final comments in the last one minute? Dean and then Blue. If you're a real quickly, I think that a lot of times conferences people go and they want to talk about what they know. But I think that this example today was an example of where you come in not necessarily knowing but discovering."
"Unknown","01;51;52;06","01;52;23;26","I think it's another fine example of what we're talking about when we're talking about active inference. If I can, if I got Stephen Mann and Connor in the same room, the place that I would want to begin is what don't you know? How would you guys attack this from not your strength, preferences, probabilities and fit, but from what you what you don't know but is still in the room and I think that's very complementary to the to the more traditional conference way of disseminating information."
"Unknown","01;52;23;29","01;52;58;29","There's my word for today and then even socially at the conference, people connect with the people who they do know, and that's the little click network. Instead of connecting with people who we don't know and so it also ties to hopefully some of our values, too. So blue. Any last thoughts? Just I'm just thought of complexity science and the interdisciplinarity and the real value that goes into co learning or working outside of your comfort zone because really that's where where the growth happens."
"Unknown","01;52;59;12","01;53;42;24","So I like those ideas a lot. Yep. Working with people, you know, can have amazing pragmatic utility and it must be balanced with the epistemic and with expanding our horizons and perspectives as well. So yeah, totally agreed. Well, another fun one. Can't say we prepared too much, but I think in the end it went just fine. So thank you all for joining and for participating and, and for participating and, and for participating and, and for participating and, and for participating and, and for participating and and for participating and and for participating and and for participating and and for participating and and for participating and and for purchasing."
