"Speaker Name","Start Time","End Time","Transcript"
"Unknown","00;00;12;28","00;00;41;01","All right. Hello, everyone. Welcome to act in Livestream number 37.2. It's February 9th. 2022. Welcome to the Active Inference Lab. We are a participatory online lab that is communicating, learning and practicing applied active inference. You can find us at the links here on this slide. This is a recorded and an archived live stream, so please provide us with feedback."
"Unknown","00;00;41;08","00;01;06;25","So that we can improve our work. All backgrounds and perspectives are welcome here and will be following good video etiquette for live streams. Feel free to officially raise your physical hand if you'd like or use any of our emoji affordances check out active inference dot org to get updates on what the lab is up to and also get more information on how to participate."
"Unknown","00;01;07;02","00;01;36;20","Or check out this code link if you'd like to see our past and upcoming streams we're here today in stream number 37.2. It's our third stream after the dot zero background video and the dot one group discussion we had on the paper. Free Energy A User's Guide by Man Pane and kickoff from 2021 and today we have a few things written."
"Unknown","00;01;36;20","00;02;03;09","There's a couple sections of the paper that we didn't get to last time, and I'm sure everyone has brought some interesting thoughts. And of course, if you're watching live, please feel free to add any questions or comments into the live chat because we'll definitely have time to address anything there. We'll start with an introduction and warm up so we'll say hi, mention anything that we're excited to talk about today."
"Unknown","00;02;03;23","00;02;32;09","Something that we liked or remembered or reviewed about the paper this past week, anything that we're wondering about. And as we just mentioned before we began, like what does a dot to for a guide look like? So I'm Daniel I'm a researcher in California, and I'm going to think while others are speaking and then return to what the data can be and I'll pass it to Steven."
"Unknown","00;02;33;04","00;03;02;11","Hmm. Hello, I'm Steven. I'm in Toronto. Steven so I, I'm doing a practice based page de around Social Topographies and how they can be used in community development and specific development. And yeah, I'm looking forward to looking at some of the implication of how this might be rolled out in different types of context. I'll pass this over I'm Dean."
"Unknown","00;03;02;11","00;03;34;09","I'm in British Columbia at the moment. And as with all things guide related, I'm always interested in how we translate from the word to the deed, getting it, getting from a place of of information that's curated to actions that are also maybe curated based on that bit of information. And I'll pass it to blue so that's my mute button."
"Unknown","00;03;34;24","00;04;06;11","I'm blue. I'm a research assistant or researcher consultant in New Mexico, transported back to my grad school days. I had like a mute button, lost the time warp all at the same time. I'm excited to get into the sections of the paper that we didn't really discuss, like in particular, like using mathematics to validate empirical claims or justify empirical claims and also kind of zooming out and evaluating this work from that perspective of a guide."
"Unknown","00;04;07;02","00;04;36;18","And like I think about The Hitchhiker's Guide and like, Don't Panic and what are the things that we really need? What are the essential components of the FIP and act of inference that that we need to communicate to others? And I'll pass it back to Daniel, who's going to tell us what a document really is well, what it really has been is the far side of the bathtub the dot zero."
"Unknown","00;04;36;18","00;05;12;11","We're kind of dropping in to the skating rink. And then in the dark one there's an opening and we explore and last week was an awesome discussion. We got to speak with the first author and now we continue. But also recollect some of the threads that we opened and build inertia towards where we take it next. And I think there's almost no genre more appropriate for a dot to than the guidebook like you put down in Dean's car manual metaphor."
"Unknown","00;05;12;11","00;05;49;10","Like you don't hold that up and you drive it. And so papers similarly, they engage our regime of attention transiently. You're not supposed to only be looking at the paper. So we're going to put this paper down. We're going to end this video eventually, and then what will be left with us? How will our generative model have been updated so that our policy selections are different, whether they're mental action policies related to attention or metacognition, or whether they're physical action policies?"
"Unknown","00;05;49;28","00;06;48;05","So I guess it relates to that quintessential DOT two question of moving from the word of the paper that we're engaging in in our discussions to the deeds and what are those deeds. And then it's almost like this is an action oriented framing of a dot two or of just what we're up to today. And then there's this asynchronous or not temporally binding elements of which is raised by the paper though, of what are the essential components of FFP and active, and also the differentiation perhaps between the conceptual and the pedagogical like are the pieces that are the minimal kernel of an active is that where we are?"
"Unknown","00;06;48;09","00;07;29;13","Is that page one on the guide? How does education, which is going to be the trajectory of a learner relate to the theoretical apparatus, which is kind of like a building or some sort of structure that doesn't necessarily have a trajectory like format so maybe just to return to this question of the word in the deed in the dot one, we heard about what the target audience was from the author's perspective for this paper which was it's a special issue."
"Unknown","00;07;30;07","00;08;06;06","It's a topical collection called the Free Energy Principle From Biology to Cognition. And we heard a little bit about how the editor made a request of the authors to write this special piece, and they also summarized it in their last aim. We aim to increase philosophical understanding of active inference so that it may be more readily evaluated so within the philosophical domain so that it can be evaluated."
"Unknown","00;08;06;26","00;08;55;23","But what other domains or ideas are important here, then what are these actions so philosophers might be interested in reading this so that they can better philosophically evaluate, but what are the idea to deed pipelines that we're interested in or opening up here? Stephen and then anyone else one of the aspects that this this paper talks about is how much things can be screened off, how much it gives us latitude to separate out realistic empirical interpretations from the modeling of and I think that's the feature they also talk about."
"Unknown","00;08;56;04","00;09;32;02","And I'd be interested in what others think about this, but they talk about the mark of blank. Is this opportunity to screen or screen out what's inside an outside? And I wonder how this idea of screening because screens are not the same as a wall it's not it's not rolling off. But as come up on the Twitter conversation with Casper has this week this idea of leakage like if I have a screen, I've got a blind date, as I described earlier, and there's some leakage through the blind."
"Unknown","00;09;32;07","00;10;02;17","Right. But is even that idea of screening off? I'm a little bit passive. I'm curious about that a little bit. That yeah. If there weren't statistical dependencies between internal and external states, like if there were two states that were just not even there was no path from here to there, there wouldn't even be able to be blanket states partitioned out."
"Unknown","00;10;04;11","00;10;32;25","So internal and external states are conditionally independent upon the blanket states using the narrow Perl 1988 sense of markup, blanket but there is a channel, there is a path from the internal to the external stage again, otherwise they wouldn't even be part of the same click in that part of the Bayesian graph and then also yes Stephen. Yeah."
"Unknown","00;10;32;25","00;11;05;00","So that this, this, this, this click this question of how much we need to find purchase through that blanket and the screening off and how much we can get away with more broadly thinking about the free energy principle in inference and how that can be stepped up and down depending on where we are in terms of empiricism and trying to make claims seems to feature a lot in this paper."
"Unknown","00;11;05;28","00;12;01;18","And I'm, I'm, I'm sensing that because the they're sort of arguing in a way that as long as you can get functional functional correlations then how you get them to be the approximate isn't necessarily about it being the real world. That gives you the maybe different ways to arrive at something that's approximately useful. And I think that speaks to dynamical systems over traditional systems in the sense that I can have a system which isn't the real system, but it might system flips or the regime shifts in similar ways to the target as opposed to actually being in and and having the right types of values in it."
"Unknown","00;12;02;02","00;12;42;21","In itself, it's more about what's the what's the way that I start to see my uncertainty flit from one belief to another. If the if the way that belief updating happens is still approximately useful enough for something to happen that's viable, then that is still okay. And I'm wondering if that is impossible. The normal systems work, which isn't dynamical systems work let's look at the order and kind of trace the trails of the authors."
"Unknown","00;12;42;21","00;13;14;23","So in the early example, we had just the case of perceptual inference, which was first introduced in the exact base context. Then we moved into the Variational Base Conference and we had two world states unobserved. That's the actual temperature in the room X observed data. That's the reading on the thermometer. So this is the simplest Bayesian latent or hidden state model."
"Unknown","00;13;15;15","00;13;47;14","So is there a marker blanket here asking for a friend no, because there's only two notes, so there cannot be a partitioning between internal and external states condition, not a third note. There's sort of it's kind of like the minimum two, but now we're taking two like minimum three. You can't have a blanket, an intervening or an intermediating or a state which makes two others conditionally independent."
"Unknown","00;13;49;00","00;14;20;07","Unless you have three three's a crowd throws a party now in FIG. three, there's the basic model of action. So we still have the same definitions and meanings of W unobserved world states and ex observations. Those observations are now being passed to the agent, and indeed they were implicitly being passed to the agent above. If there would have been a third node agent there, it could have been said that the X was a markup blanket."
"Unknown","00;14;20;07","00;14;58;00","But as it's exactly written there isn't. Now here, what are the blanketing states X and Z? If you are conditioning upon X and Z, it makes W and the agents conditionally independent. And this is sort of presaging the first in partition on the marquee blanket, which is to split up the notion of the total set of intermediating or conditionally independent ising states."
"Unknown","00;14;59;04","00;15;31;17","No Markov to Perl epoch and showing them in a way that's partitioned into incoming from the agents perspective, statistical dependencies which can be interpreted as sensory states or the observation of model data and then outgoing statistical dependencies, z, z, action you select. And then those can have some influence on world states. Yes. Steven. No, you say outgoing statistical dependencies."
"Unknown","00;15;31;17","00;16;01;19","And that's also interesting because at some point the outgoing cannot be statistical alone. Because you don't have the same kind of information availability. So it tends to be more using energy and sort of least action type approaches. So that would be so preemption that but that's where it starts to split out later. But they they don't get bogged down in that at this stage."
"Unknown","00;16;01;25","00;16;06;19","They they keep it all in the sort of Bayesian environment."
"Unknown","00;16;09;03","00;16;52;28","I'm not exactly sure what you mean, since these arrows represent not mechanistic or causal influence, but just statistical dependencies in the graph. Yeah, I was thinking more when that becomes action, when it's then translated to be action. So then rather than sensory, which has much more sort of informational content, action can be seen as being more about what is more energy efficient or starts to look at what the shape of the way that action happens."
"Unknown","00;16;54;04","00;17;36;18","So far. The and I'm wondering whether that is needed to be concerned about if it were a software agent then these are both informational, really. And no matter what type of agent we're modeling or it still is just physical dependance. OK, then you brought up questions about energy expenditure during action and that's one of the pieces that is sometimes challenging to parse out, which is like first looking at variational free energy minimization."
"Unknown","00;17;37;06","00;18;08;13","So this is on the perceptual side. We're looking at the instantaneous fitting of a variational model of ongoing sensory information. Given the priors, that doesn't mean that for, for example, an organism, it's the lowest energy possible interpretation of the sensory data. And then when we bring action into the picture and look at expected free energy, neither does this mean that the Z that is selected is the laziest."
"Unknown","00;18;09;19","00;18;37;11","It just means that this G is being minimized and so it's not the gives free energy or the calories that are being minimized. It's something information all that has to do with model fitting and yes. Go for it. Yeah. No, that certainly makes sense. And and one thing culprits and mentioned in the symposium we did is this this kind of two boundaries."
"Unknown","00;18;37;18","00;19;06;26","There is kind of two boundaries happening in terms of Markov and boundaries is one coming in and this one going out and the blank it's kind of got both of those boundaries happening. So like you said yeah it's the way that then the inference happens to know what actions to take is different. But the way that information is established is for sure different going through each of those."
"Unknown","00;19;07;04","00;19;30;21","I mean, as it is with every mode of sensory data that comes in because it could be vision, it could be here and it could be kinesthetic. So you've got different types of input and you've got different types of output with that. And this diagram model is keeping both of those. There's no idea of leakage or or those questions about how things lead to cross between."
"Unknown","00;19;31;02","00;19;44;08","It's like there's two distinct flows going on, but that and it simplifies in that sense yes."
"Unknown","00;19;47;04","00;20;19;24","We've seen other typologies of perception, cognition in action, like an edge connecting sense and action states or an arrow that's having a statistical dependency the other way. OK, but just to return here, Justine, go for it. So this is a question for everybody here. So Steven, the first author, talked about the fact that sort of the back story of this whole guide thing was to and I'm putting words into it, but I want to keep it reasonably short."
"Unknown","00;20;19;24","00;20;45;25","I talk too much. Last week, he basically wanted to be able to remove some of the impediments. And he pointed directly at some of the math that acted as a maybe a kind of a a bridge too far and so he wanted to make that a simpler maybe something that's more user friendly and therefore something that people will take up or adopt."
"Unknown","00;20;46;09","00;21;10;14","And when you're putting on this and putting up this slide here now, Daniel, I don't know whether I know what eventually will be translated into the math Formalisms you just pointed up a minute ago but I'm not really sure whether the evaluation aspect that philosophers are going to then decide whether something is worthy of their their continued attention or not."
"Unknown","00;21;10;23","00;21;35;25","I'm not sure of that. I don't know how does this critical path critical and evaluation being related in this context, how does this minimize or reduce the impediment nature of what the math is like if we're going to we're going to guide somebody through this and there and there, one of their hopes is to be able to say, OK, well, I'm not just making this stuff up."
"Unknown","00;21;35;25","00;22;04;03","There's actually some some way of being able to formalize this. How does that through this kind of first step, become become easier, I guess, in terms of what the actual formula says? Because I know that when I first actually touched on the formulas myself, it didn't go back to a critical path. Like there was no real physical example I could find in the world."
"Unknown","00;22;04;12","00;22;28;00","And I think maybe that's what helped me understand that maybe this this thinking or this ability to think statistically, sorry, to think statistically, maybe that requires, as Karl also said, our ability to do the math, we have to be able to do the math. And the math doesn't get simple. So I'm wondering what people think about that."
"Unknown","00;22;30;10","00;23;02;19","OK, Stephen, if you have a direct response. Yeah. Yeah. Well, I think that in some ways this goes back to a little bit before where the math it helps us see why the math was put in at certain points by going to even a stage earlier. So I think there is some use in that because I think like you say, there is a slight inflation in the way that the process theory then gets interpreted as and if it's already locked in too much in what's given to us with all the math stuff, well, where did that math come from?"
"Unknown","00;23;02;19","00;23;28;11","And and then that starts to get us involved in some of these earlier questions. Because what's interesting here is see the blanket, I think of a blanket often as as a method for transfer. It's a mode of transport just a bit like light lithographic blankets, transfer from an analog roller to a blanket, roll it to a printed image."
"Unknown","00;23;28;19","00;24;26;16","And so the paper is transferring. Now, it also does mean that there's no direct contact between paper and paper and print in play, right? So it's screened off as well, but it depends which way it's going to, you know, and in this case here with these red circles, it's useful to think about, OK, well, there's there's something that's been inferred word in the world but that inference isn't directly accessible is it's not that observed data isn't coming in as data is coming in is what's inferred to be about what's out there which isn't the same as a signal."
"Unknown","00;24;27;03","00;24;57;13","So it's like how much is the agent able to have the environment, transfer something onto them and transfer something onto the environment? And how much are they screened off from the environment? How much is the environment screened off from them? I suppose that's that's something that relates to that hey, thanks. So, Dean, just how does the. Yes, John, go for it first?"
"Unknown","00;24;58;16","00;25;23;09","No, go ahead and then I'll just follow up both you and Stephen. OK, so you asked how does the critical path, the linear pedagogical path that is traced by this version of this guide reduce the actual perceived impediments in an audience specific or in a general sense? So it definitely helps us see where math could or should or does or will enter the picture."
"Unknown","00;25;24;04","00;26;04;08","I think it sets up in about ness of the math, like what is perception about this is a graphical interpretation, graphical meaning visual, but also like a network pacing graph and so if you're concerned with a different connectedness of terms, this is not the math you're looking for, but on the perception side, if this is kind of how you're setting up the template for what you're wondering about, like what's out there, that's what this first image shows with W an X what's out there and how do I act or how does an agent act?"
"Unknown","00;26;04;21","00;26;27;14","That's the about this, which is not unique to active of inference. That's control theory, cybernetics, et cetera, the step wise guide elements. It reminds me, I hope it's not unrelated in high school cross-country. The coach would say something like, well, the race is going to start and you got to get out there faster. Then it's the middle is the part where you need to be running, going hard."
"Unknown","00;26;27;14","00;27;12;11","And at the end you got to push it and finish and run hard and everything. And I was like, you could have just said run the whole time. Was it not the same thing as saying run at the beginning, middle and end and so but run really hard during the whole race? I don't know, Coach. A whole race is a long time to run here by breaking it into really specific stepwise changes to the math, like a piece wise to find function there's an opportunity to pace and lead a learner and then to accumulate or pause for divergence or prediction error that they're experiencing."
"Unknown","00;27;13;01","00;27;47;16","Like maybe before this first train stop someone has a question about that, or maybe just graphically when action enters the picture, somebody has a question about that. Now, we could be talking about equations symbolic equations that describe the W to X relationship or the agent to Z to W relationship. And then this paper is going to propose just one symbolic expression or several symbolic expressions that today we call active inference approach to addressing that question."
"Unknown","00;27;47;16","00;28;15;16","But it builds up the about this in a stepwise way, that even though it is conceptually no different than just saying here's the action perception loop and the equations, which is pretty much what every paper does. But by starting somewhere a lot more atomic it allows the stepwise addition of the math in a way that's incremental rather than like here's the apparatus and that leaves much of it implied Dean."
"Unknown","00;28;16;18","00;29;07;06","Yeah, and I wouldn't disagree with anything you're saying there because I but I do think that there's a not too subtle difference between stepwise and then the kind of step function, the leaving of the critical path and now seeing a, seeing a set of mathematical formalisms around a statistical distribution. And I'm just wondering how that transition occurs, because it doesn't seem like there's a natural round from follow ing, something clockwise or counterclockwise to being able to change things into alpha alphanumeric ratios, which is essentially what the statistic when when it's written out statistically what that does right the sum and the and the and the ratio."
"Unknown","00;29;07;13","00;29;54;29","So if if if the impediment was some of the non frequent math and I'm not I'm not critiquing in any way what Stephen's written out here in his guide but it seems like there's still some assumption on the author's part authors plural part that you will be able to take enough from this critical path representation to see what it looks like when you're overfitting like I like that there was a lot of explanation of what overfitting is and then there was plunk and here's the formula that, that, that, that, that, that overfitting looks like in mathematical form."
"Unknown","00;29;55;05","00;30;32;18","So it's kind of a big assumption that the person who is reading this is going to be able to make that leap go from this level of walking clockwise or counterclockwise to now suddenly being able to understand what all of those different symbols in that formula means and not saying it can't be done. But I'm just wondering how, how, as people who are trying to layout something in a kind of step step progression, how they assume that they can just sort of put holes in that big wall and people still don't have a fear of heights right?"
"Unknown","00;30;32;18","00;30;58;06","Like it's still it's still better than not having a ladder. But but it doesn't mean I want to go up 40 feet without safety. Right. Just because it's there. And I kind of see that in terms of how the transition works between this kind of this this this form of representation and then what the representation looks like in the math, that's a big leap, I think, for a lot of people."
"Unknown","00;31;00;12","00;31;01;07","Thanks, Steven."
"Unknown","00;31;03;18","00;31;48;12","And one, I suppose one danger that's always present when naming things is they then move into this with with the predictive process in discussion, you know, how much can you name things as being data in these contexts? So it becomes statistical. But like you say, the there is effectively information coming in. But data in some ways may be a bit of a tricky word to use because data kind of implies an inherent representational nature."
