"Speaker Name","Start Time","End Time","Transcript""Unknown","00;31;48;12","00;32;17;22","And they talk about this in the paper, a little bit, and that tension between something that is coherent enough and can be represented and something where you can't ever quite get it, that the inference, the predictive processing has to then leverage something like generative models using the body, et cetera, to even get the that that that that that to allow that arrow to be something in a much more fuzzy way."
"Unknown","00;32;17;29","00;32;25;22","You know, and so there is always that risk of leading people astray even at this early stage."
"Unknown","00;32;29;22","00;33;01;12","So a few comments there, Gene, you asked like, how do we get from this graphical layout? So we've taken the first byte, which is this is roughly the correct topology for thinking about problems of perceptual inference. And action inference. That is, if someone re imagines this amazing, but this is just the approach to perception, cognition and action and impact."
"Unknown","00;33;01;28","00;33;39;14","That is a common kernel of a phrasing. Now, let's just think about it as an example rather than just the abstraction. Let's just say that we're interested in listening to a cat and then inferring what its location is. So we're only talking about this simpler W and X connection first. So here's what the empirical data are for two, one and three, you could have a model of decision making on it just says the cat is always in the kitchen."
"Unknown","00;33;40;08","00;34;03;21","Just I don't care. I'm OK with being wrong. The cat's in the kitchen. Or some could say the cat's always in the bedroom. Or I flip a coin or I go with what some other person told me. Like, there's many ways to make a decision about world states conditioned on data. One principled approach which they right here, one famous method for solving this problem."
"Unknown","00;34;04;00","00;34;41;09","Bayesian conditional position so that's the question which is framed normatively here about one. What one ought to do is integrate their beliefs which can be empirically grounded. That's parametric empirical based upon incoming data. So first, in this case, the next little tiny step is we can use Bayes theorem to look at inference on external states given incoming data again, if someone disagrees with using a Bayesian approach, an exact Bayesian approach, that's the time to speak their piece."
"Unknown","00;34;43;01","00;35;32;00","This is a very simple example with a kind of a minimum two by two matrix. If it was any thinner of a model on any dimension like if there was only a kitchen, then the question of location inference would be trivial. It's in the kitchen. If there was only one sound equally, it would be a trivial problem because the sound would then be uninformative from an information theory perspective, which they're not bringing up here yet about location then the next tiny step, an ending, is to go from the exact Bayesian approach, the parametric Bayesian approach to variational conference, which is imagine that this was not just two by two table, but there was a higher"
"Unknown","00;35;32;00","00;36;05;05","dimensional state space of observations. And so it's not going to be possible to just look at this in a spreadsheet or on a piece of paper, but it's actually a large model. And so we need tractable heuristics. And so that is the next tiny step from now. We're going to take not just a principled approach to treating the to X relationship, Bayesian perceptual inference, but we're going to go beyond that and ask what's a track table and reasonable approximation variation inference."
"Unknown","00;36;05;25","00;36;32;09","There's other situations where maybe there's another tractable approach like EMC EMC Markov chain Monte Carlo. That's another approach which we've talked about. In other cases. That's the pointillism sampling based approach. It works really well for certain problems. It doesn't work as well for other problems. And so that's the next little tiny step. We're going to go from this setup of perception to using Bayes Theorem you could do otherwise."
"Unknown","00;36;32;19","00;37;00;29","And then from using exact or parametric empirical Bayes to using Variational Bayesian approaches, and again, you could do otherwise, and that's do yeah. And again, all I, all I think I'm pointing out is that I for some it is a tiny little step, but I don't think it's a ramp going from one version of representation to four square version of representation to formulaic version of representation."
"Unknown","00;37;00;29","00;37;41;10","I think for people who see the math maybe as an impediment to their further continuation of using the the potential of the to the three energy principle, maybe they aren't such small steps. They certainly aren't ramps in terms of how we interpret each of those three particular ways of representing information. There's no ramp. There's actual an actual transition moving from from what you've got on the screen now to the 6040, 50, 50 way of being able to interpret that way of representing the information to the one that has an equal sign."
"Unknown","00;37;43;09","00;38;06;13","They're very, very different. Right. I mean, I understand the relativity piece and all that and I see that carrying throughout this is relatively relativity looks like this way and then this way and then this way. But I think, I think the struggle for people who are putting guides together is the assumption that what's little for you is little for me."
"Unknown","00;38;06;24","00;38;30;24","It isn't always that way. And I'm not I don't know if we can fix in that here in these labs, but I don't think it's something that we should assume is necessarily once one small step for humankind, because I think the reason why the authors were asked to put two years worth of work in this and in the first place was because the math is acting as an impediment."
"Unknown","00;38;31;10","00;39;05;26","Now, do you start with the math? Because I agreed with Steven last week when he said this is the direction we took. We decided to slow things down, not simplify, but slow things down. So I really appreciate why they've done what they've done. But if they knew going in that they were going to have to go slow, then they're probably going to see whether or not that bump as we change representations is actually relatable to the previous version or form that the relationship was was presented us."
"Unknown","00;39;06;13","00;40;01;11","And I don't know that people necessarily do like blue. Blue is going to have has 60 on this too. But she mentioned the arbitrariness of something that doesn't update right and so it doesn't retain its form. And should we just assume that we all saw the the morphology in the same way. It's, it's tricky. I'm just going to leave it at tricky because I'm not sure anybody that's putting a guide together necessarily has the the, the perfect way of being able deliver it OK thanks blue and then you so something that I think is interesting is that mathematical interpretations have like philosophical underpinnings almost or maybe it's the other way around."
"Unknown","00;40;01;20","00;40;27;05","So when you're looking at like for example, this difference between a probability distribution and a preference distribution, like if the cat is in the kitchen, 75% of the time, you can just assume there's like the underlying assumption that it prefers to be in the kitchen most of the time. Right. Like so because that's where the food is or whatever."
"Unknown","00;40;27;15","00;40;50;15","So and similarly, like in homeostasis, if I'm at 37 degrees Celsius that's my temperature. If I'm there 95% of the time, you can assume that I have a preference to have a body temperature of 37 degrees Celsius. I think that there's that underlying connection. But, but it gets really complicated when we try to extrapolate to something like cognition."
"Unknown","00;40;51;02","00;41;09;09","There's like, I prefer to be rich, I prefer to have 90% of the money in the world, for example, like you can say like I want all the money, like you think about something like that. But then there are so many complicated like, like, do I really want all the money? No, because then everyone else would be homeless and impoverished would be horrible."
"Unknown","00;41;09;09","00;41;28;01","Right. And so you don't really want all the money. Like there's and then if I say if I prefer to be rich, but I'm stuck in an impoverished situation, you can assume that there's like a learning gap between how do I earn money and being in the space where I don't have any money, I don't know how to have money."
"Unknown","00;41;28;01","00;41;45;11","Like there's a knowledge level. So when you when you bring cognition into it and like, you ask people like what their preferences are like, I prefer to live by the beach. But I live in New Mexico. I mean, we have lots of beach, but no water. So there's like, you know, there's there's I don't know, there's the preferences and then the probability."
"Unknown","00;41;45;11","00;42;05;16","But but is there some kind of like cognitive dissonance like you think? We think what our preferences are or maybe not where our probability distributions are. Like, I prefer to be by the beach, but 90% of the time I prefer to be by the ocean. But some of the time you find me in the desert, that there's like there's some cognitive dissonance going on there."
"Unknown","00;42;05;28","00;42;38;17","And so I think that the mathematical interpretations have a lot of philosophical implications that maybe, you know, we need to think about more like when is a preference distribution and a probability difference distributions different and why are they different? Like what is going on when the preferences are not the probabilities thanks. Blue. Yes. This will take us soon to the tale of three piece."
"Unknown","00;42;38;17","00;43;13;23","Steven, first yeah, very good points there. When you said ten, you there about the exact base on the world it goes into that so goes into the variational base, which in some ways is it starts to hit the mark blind blanket start to give time steps as it starts to go through into the generative model. You then go and as was useful for now and again the symposium with Carl Kristen we talked about you know the starting point often practice in person is the generative model."
"Unknown","00;43;14;00","00;43;38;11","How do you get at the generative model? So the general view is that in some ways this exact base is almost needed in the modeling sense to give you what we think we know the world is when we're setting up our model or experiment of people doing something, where are we going to see what the results are? So it's like the agent can't know what w is."
"Unknown","00;43;38;11","00;44;14;17","They can't know what the exact base is that like with the cat experiment. So you can matrix there and we could arbitrary put one in that we kind of can say we know as objective observers is going through goes the agent and then the agent does something OK and and as you said sometimes that that what they do isn't only in response to what's coming in in which is quite often not it's not just can I I've seen food can I eat food as much food as possible."
"Unknown","00;44;14;17","00;44;40;17","This is well what's the consequence of my actions going forward? Maybe a lot of times we then start to get into this higher dimensional stuff where the circle that you put in there going into w there's that red circle on the left which sort of goes into the W is what is really a concern you know, the humanities around what's, what's that about."
"Unknown","00;44;41;00","00;45;11;24","Right. And a lot normally the generative model work is done in active inference is is the circle on the right hand side eye? How do we predict the way beliefs are being updated and what's the way the beliefs because it's normally coming in that direction because you can sort of control you can do an exact basis. The one place you could theoretically set you experiment with an exact basis w it's kind of hard to put exact based on an agent unless of course it's a robot potentially."
"Unknown","00;45;13;16","00;45;49;28","So I think there's something quite interesting there about it how much is this and it it's a practical instrumental. So. All right, how much is this about the way that modeling happens and how much and the math to make that happen and the philosophies and how much then is this broader? And it may be that it gets recapitulated, depends on which parts we simplify or allow to be more complex or want to get a purchase so on out of those circles."
"Unknown","00;45;49;28","00;46;25;13","So maybe you just explain why you put the circles where you put them just to see if I'm getting your your rationale. But I think that was kind of useful to put them in. I'm just highlighting the direct oddness of these statistical dependance this circle of action policy influencing unobserved states. We've seen it in the partially observable Markov decision process as where that's b w changing through time is B."
"Unknown","00;46;26;06","00;47;04;02","That's how hidden states change over time. State one state at a time, one state at time to then Z influences here in this simple only four nodes. So if you only get four nodes, you draw the dependency that way. Like my action to change the thermostat in the future will change the temperature when we can unpack it a little bit more and move it from this sort of minimal cybernetics or control framing into some of the little bit more built up models we've looked at."
"Unknown","00;47;04;12","00;47;36;04","That is where policy selection influences be. And so, yes, there's enormous concern over how our actions influence things that we can't directly observe, say, for by proxy information in coming back to us. And that is not a unique problem to active inference. Dean, you think I'm going to circle back to what Blue is saying, because I think she's hit on something really critical."
"Unknown","00;47;36;23","00;48;02;28","Um, the weirdness of this, I think is what I won't say was the, was the thing that Karl started on when he took his First Nations steps into trying to put something that we can, we can hold on to, something that we can look at philosophically and mathematically I don't know if he was thinking about when this at that point when he started down that path."
"Unknown","00;48;03;01","00;48;51;02","But I think the more we talk about it, the more we we realize that as a for example, in a guide use, I think a person who reads Stephen and the other authors work have two questions. The first one is my use of time, the number of minutes I have to commit to reading the guide before I can then say whether or not certain impediments have been removed while at the same time and this is what I think active inference does, it also allows us to invert that first accounting of what we are doing with our time, invert it from use of time to time of use like."
"Unknown","00;48;51;18","00;49;15;08","So if I do commit to reading this guide what's the shelf life of that like? How long am I going to be able to take the my takeaways and actually be able to apply them to different concepts and then there's a fleshing it out part, which I think Stephen's kind of talking to, which is so when we take all of this information and we embody it what does that feel like?"
"Unknown","00;49;15;17","00;49;46;27","What does that what does that read out in terms of our behaviors, et cetera? Reactions are responses. So I think ultimately, if we're looking at the wellness of this, we have to start talking about heuristics. And Stephen specifically spoke about that. He said, I wasn't I think I'm paraphrasing him, but I think he said we were concerned about whether starting with simple doesn't also have a cost we know that it has a benefit because it doesn't overwhelm people."
"Unknown","00;49;47;15","00;50;09;06","But if if if we are going to look at simple rules like heuristics, does that also have a cost no, he didn't answer that. I was just rewatching the 37 one before we came on today. But I think that's something here the blue is now touched on and I think Stephen is touching on as well. If we're going to put a guide together, when did when did the rules fall out?"
"Unknown","00;50;09;24","00;50;35;21","Do we assume that they fall out just by picking the guide up, or do they are they something that that the reader or the user manufactures after having the experience that when this I think is what this act of inference stuff is touching on and and, and it's in some cases it feels pretty arbitrary. It's hard to tell the win of the heuristic."
"Unknown","00;50;35;21","00;51;03;10","Do I start with the rule as my prior my priority or am I really trying to update and I'm trying to come up with something that really applies at some point in the future that I haven't arrived at yet. And I know that sounds kind of not answering anything, but even even with the statistics, it's hard to figure out what each agent is going to do depending upon what their biases."
"Unknown","00;51;03;23","00;51;36;09","So they want to start with the rule or they want to develop one as they go along and as the bacillus accelerates in 34 Axios bacterium showed exact Bayes doesn't mean you get it exactly right. It means you're following a process. And with maladaptive tive priors, even accurate information coming in can result in a maladaptive decision making. So this is not panglossian or Pollyannish just because there's an approach doesn't mean that it succeeds."
"Unknown","00;51;37;01","00;52;11;13","Perfect, right? Yeah. So Steven then blew you know, so two points that sort of speak to that. Well, I'll say the second one first, because it was in mind is when we when we see the modeling, we often see say we talk about the bacillus. So we see the way that modeling happens. High order agents such as humans tend to find that the the w is fixed is like the, the cat is either purring or it's, it's meowing, it's in the kitchen."
"Unknown","00;52;11;26","00;52;44;16","It's, it's an exact oh it's in the bedroom. Right. So it's, it's a, it's a kind of defined exact Bayes kind of context and then that allows the, the other parts to kind of still find some very interesting and tractable useful trends. Right? So as it goes through now when it goes, then the other way is, OK, how do you get into something which is an exact phase and you tend to see it turning to the swarm of voxels there."
"Unknown","00;52;44;16","00;53;17;15","So, you know, Lorenzo Attractors or Bacillus. So very, very very simple, a gentle scenarios with very little degrees of freedom because it's in a way trying to address that challenge of, well, you know what, if you don't know if it's in the kitchen or the bedroom, it's in the doorway and it's it's wandering around and the time the time in between gets in sensory information."
"Unknown","00;53;18;19","00;54;04;04","And my the action is, you know, isn't in step there's a lot more bleed out, you know, and and that becomes this kind of how much is the temporal I saw this word from from Casper has leakage because there's a leakage out of that sensory input sensory I don't want to use the word input but the statistical dependencies coming in and the statistical dependencies going out there's a there's a leakage going on which makes the model even kind of challenging, though at some point it becomes OK, well, it's overwhelming that the we might philosophically say somehow we were able to do something like that."
"Unknown","00;54;04;04","00;54;32;11","And and our biology has enabled us to overcome that challenge. But to actually put it into a model like the one on the right top right there starts to become. And in a way, maybe that's where effect comes in as maybe OK, that that may be also true. For us. That's why we need something that affects the hold together, this sort of fuzzy kind of knowing which can't be resolved in that such a solid way."
"Unknown","00;54;32;11","00;55;07;01","So that's the first piece. The second piece very quickly is you put know these the red circle that you put next to the X. So in some ways is that that is what's what it's sort of inferring w what we're really doing is we're inferring we're either inferring the circle there that comes in to the X or maybe and that's assuming the arrow that's going into the agent is, is what's coming out of X or is coming from X."
"Unknown","00;55;07;17","00;55;34;06","So that's in a way the edge, isn't it? That's the kind of boundary that's being the beliefs. When you say B, the B is about that, not strictly about W there's a belief distribution on W and X W is latent modeled on observed states and X is modeled empirical observed states right."
"Unknown","00;55;36;21","00;56;11;25","OK, blue so just to kind of riff off of what both of you guys were saying, maybe this is tangential, but but when you talked about leakage, Steven, it reminds me of like the information partitioning that we discussed with Majid and how there kind of always has to be some kind of leakage if you have a complete information partitioning, you're actually like in a in a vacuum or a bubble like you're existing, there has to be some kind of leakage across the partition all the time."
"Unknown","00;56;12;29","00;56;31;04","Like and I've I've come to realize this like we have to be sharing information with people that are, you know, how do we form a markup like at how do the four of us come together and form this live stream today? Right. Like we're sharing information even though there's a markup blanket that exists between us. And for some of us, it's thicker and thinner."
"Unknown","00;56;31;11","00;56;53;09","Like Daniel and I will be often like doing the same thing at the same time, like, even like separately just because we work together so much. But there's this leakage, is there? And then it also made me think about the maladaptive behavior that Daniel was mentioning. And so when you have this, like, we always wonder what is the cause of this maladaptive behavior?"
"Unknown","00;56;53;09","00;57;14;26","And this is something that we were discussing maybe a couple weeks ago with Jason, you know, what is the explanation for maladaptive behavior? And it always makes me think about the scale, like in the situations that are utilitarian like, you know, maybe someone sacrifices themself for you know, they jump in front of a train to stop the train, to save the 300 people that are on the train."
"Unknown","00;57;15;03","00;57;42;22","And so there's this maladaptive decisions do occur, but perhaps it's not like a societal scale or, you know, like in a body you know, one piece will die off to save another piece. Like even in the brain, like the formation of like the little scar. I think of that like it's like essentially like an it puts a hole in your brain, but it's to protect the rest of the brain from the cell death that's happening in that in that spider hole."
"Unknown","00;57;43;10","00;58;20;17","And so, you know, it's there is this information leakage and and even maladaptive behavior that I think are scale dependent scale friendly slew dean. And then we'll move to another section, call yeah. I don't know if we're at an inflection point with this, but I do want to bring this up again. I think that the leakage speaks to another metaphor that I brought up way too many times last week, which is I mentioned in the point zero, which I think there is a filtering piece to this."
"Unknown","00;58;21;07","00;58;47;24","I mean, this morning I put the raspberries in the sieve and I assumed the raspberries would stay and the water would pass through. And there were parts that I didn't need, like I wasn't trying to make raspberry water. I just wanted to eat the raspberries. And I think that if we understand that there's to a minimum of two aspects to when we're talking about active inference, I think we do ourselves favor and I think we do ourselves a favor for writing guidebooks about active inference and free energy."
"Unknown","00;58;48;09","00;59;12;05","So I think I think the guidebook for the guidebook, if there was if there were, if were there are some pillars that we could put a guidebook on here would be my suggestions. First of all, there is going to be because we have a markup blanket, we have a separation. That differentiation and that integration are going to be inherent in however, we observe something and then respond to it."
"Unknown","00;59;12;17","00;59;42;05","Second thing that I would suggest is there's a certain blind spot removal piece to this. And I mean that in the in the context of, say, something like change blindness because of over attending or understanding. And we talked about overfitting or failing to explain that change blindness is now becoming a greater awareness availability because we don't necessarily have to lock in prematurely or wait too long."
"Unknown","00;59;42;12","01;00;04;28","There's kind of a sweet spot that active inference is, is trying to say exists not perfect, but it's better than not having a sweet spot. Third thing I would say is if we're ignoring the foraging aspect of this, if we expect that the framework is going to be another frozen meal, then you're going to get the quality of a frozen meal."
